14,gvbhnvf3,,104.52.25.66,2017-04-07 17:00:38.558674+00:00,1,A15XX0WDRG29E7,39K0FND3AHGRF18QXJ2AEVV7O4WAMH,3O2Y2UIUCQVPYKR2XK6KOZJCHPDFKU,1.25,3.25,bckyc7ef,,,3DGDV62G7OA68HC6MHWL0XBM2VEP2L,311HQEI8RSH78MBIF2BINMU8NA7Z7W,3O2Y2UIUCQVPYKR2XK6KOZJCHPDFKU,3TL87MO8CMQ0IQ9KIKIL3ZWR6PIFLX,3NMDE2OGHG0L1YTUQZWF1QB1KRTFGY,3NMDE2OGHG0L1YTUQZWF1QB1KRTFGY,,$2.00,13,A15XX0WDRG29E7,1,0.4,1,1,2,Anne,Anne,Vicky,,Marie,0,0,"marie, vicky, anne",0,0,11,1,2,Victoria,Victoria,Gina,,Marie,0,0,"gina, marie, victoria, vicky, anne",0,0,11,2,2,Gina,Gina,Gina,,Linda,1,0,"marie, linda, victoria, vicky, gina, anne",0,0.1,3,3,1,Vicky,Vicky,Gina,,Susan,0,0,"linda, victoria, marie, susan, anne, vicky, gina",0,-0.05,8,4,1,Gina,Gina,Michelle,,Shirley,0,0,"michelle, marie, vicky, shirley, gina, victoria, linda, susan, anne",0,-0.05,12,5,2,Michelle,Michelle,Linda,,Janet,0,0,"anne, vicky, susan, janet, michelle, gina, linda, victoria, marie, shirley",0,0,6,6,2,Linda,Linda,Linda,,Janet,1,0,"susan, shirley, michelle, janet, anne, marie, vicky, gina, linda, victoria",0,0.1,8,7,1,Anne,Anne,Gina,,Janet,0,0,"michelle, marie, vicky, shirley, gina, victoria, linda, janet, susan, anne",0,-0.05,11,8,2,Gina,Gina,Michelle,,Linda,0,0,"anne, vicky, susan, shirley, janet, michelle, gina, victoria, marie, linda",0,-0.05,6,9,2,Michelle,Michelle,Janet,,Michelle,0,0,"vicky, linda, marie, shirley, michelle, susan, anne, gina, janet, victoria",0,0,8,10,2,Janet,Janet,Michelle,,Janet,0,0,"victoria, marie, vicky, anne, linda, susan, shirley, gina, janet, michelle",0,0,3,11,1,Michelle,Michelle,Linda,,Michelle,0,0,"marie, susan, michelle, linda, victoria, janet, vicky, gina, shirley, anne",0,0,9,12,1,Linda,Linda,Michelle,,Michelle,0,0,"marie, shirley, susan, linda, anne, michelle, janet, gina, vicky, victoria",0,0,9,13,1,Michelle,Michelle,Linda,,Linda,0,0,"linda, victoria, shirley, marie, susan, anne, michelle, vicky, janet, gina",0,0,12,14,2,Linda,Linda,Michelle,,Linda,0,0,"linda, michelle, victoria, vicky, marie, susan, shirley, gina, janet, anne",0,0,5,15,1,Michelle,Michelle,Michelle,,Janet,1,0,"victoria, marie, vicky, anne, linda, susan, shirley, gina, janet, michelle",0,0.1,9,16,1,Michelle,Michelle,Michelle,,Michelle,1,0,"linda, anne, michelle, janet, susan, vicky, gina, marie, victoria, shirley",0,0.1,12,17,1,Michelle,Michelle,Michelle,,Linda,1,0,"linda, victoria, shirley, marie, susan, anne, michelle, vicky, janet, gina",0,0.1,12,18,1,Michelle,Michelle,Michelle,,Linda,1,0,"marie, susan, michelle, linda, victoria, janet, vicky, gina, shirley, anne",0,0.1,12,19,2,Michelle,Michelle,Michelle,,Michelle,1,0,"vicky, linda, marie, shirley, michelle, susan, anne, gina, janet, victoria",0,0.1,12,20,1,Michelle,Michelle,Michelle,,Linda,1,0,"marie, susan, michelle, linda, victoria, janet, vicky, gina, shirley, anne",0,0.1,10,21,2,Michelle,Michelle,Michelle,,Michelle,1,0,"marie, susan, michelle, linda, victoria, janet, vicky, gina, shirley, anne",0,0.1,11,22,1,Michelle,Michelle,Michelle,,Michelle,1,0,"marie, shirley, susan, linda, anne, michelle, janet, gina, vicky, victoria",0,0.1,3,23,2,Michelle,Michelle,Michelle,,Janet,1,0,"shirley, linda, vicky, susan, gina, anne, janet, victoria, marie, michelle",0,0.1,4,24,2,Michelle,Michelle,Linda,,Michelle,0,0,"gina, shirley, michelle, vicky, marie, janet, linda, victoria, susan, anne",0,-0.05,3,25,14,0,,0,3.25,0,1,115,ihxm0qkz,,173.173.36.148,2017-04-07 17:00:39.466480+00:00,1,A2W3QPD493MHEI,3VNL7UK1XFKQONFIHWPEEA1QFS5FT0,3DGDV62G7OA68HC6MHWL0XBM2VEP2L,1.64,3.64,bckyc7ef,,,3DGDV62G7OA68HC6MHWL0XBM2VEP2L,311HQEI8RSH78MBIF2BINMU8NA7Z7W,3O2Y2UIUCQVPYKR2XK6KOZJCHPDFKU,3TL87MO8CMQ0IQ9KIKIL3ZWR6PIFLX,3NMDE2OGHG0L1YTUQZWF1QB1KRTFGY,3NMDE2OGHG0L1YTUQZWF1QB1KRTFGY,,$2.00,14,A2W3QPD493MHEI,16,0.39,1,1,2,Janet,Janet,glenda,,Anne,0,0,"glenda, janet, anne",0,0,10,1,2,Janet,Janet,Mary,,Emily,0,0,"emily, janet, mary, glenda, anne",0,0,8,2,1,Janet,Janet,Janet,,Linda,1,0,"linda, mary, janet, emily, glenda, anne",0,0.1,12,3,2,Janet,Janet,janet,,Vicky,1,0,"linda, emily, glenda, anne, mary, vicky, janet",0,0.1,9,4,1,Janet,Janet,janet,,Gina,1,0,"vicky, gina, mary, emily, linda, janet, glenda, anne",0,0.1,9,5,2,Janet,Janet,janet,,Shirley,1,0,"anne, vicky, shirley, janet, emily, mary, gina, glenda, linda",0,0.1,4,6,1,Janet,Janet,janet,,Shirley,1,0,"shirley, janet, glenda, anne, vicky, gina, linda, emily, mary",0,0.1,5,7,1,Janet,Janet,janet,,Janet,1,0,"vicky, shirley, gina, mary, emily, linda, janet, glenda, anne",0,0.1,5,8,2,Janet,Janet,janet,,Anne,1,0,"anne, vicky, janet, emily, mary, gina, glenda, linda, shirley",0,0.1,1,9,1,Janet,Janet,Janet,,(none),1,0,"vicky, glenda, emily, linda, shirley, anne, mary, janet, gina, (none)",0,0.1,6,10,1,Janet,Janet,michelle,,Linda,0,0,"glenda, anne, vicky, linda, mary, shirley, gina, janet, michelle, emily, (none)",0,-0.05,2,11,2,Janet,Janet,janet,,Janet,1,0,"linda, michelle, (none), mary, janet, emily, glenda, vicky, gina, shirley, anne",0,0.1,11,12,1,Janet,Janet,janet,,Linda,1,0,"shirley, linda, anne, mary, glenda, michelle, janet, gina, emily, vicky, (none)",0,0.1,5,13,2,Janet,Janet,Janet,,Linda,1,0,"linda, shirley, emily, glenda, anne, (none), michelle, mary, vicky, gina, janet",0,0.1,7,14,2,Janet,Janet,Michelle,,Linda,0,0,"linda, glenda, michelle, gina, (none), mary, emily, shirley, vicky, janet, anne",0,-0.05,6,15,2,Janet,Janet,(none),,Carol,0,0,"vicky, linda, glenda, anne, mary, carol, shirley, gina, janet, michelle, emily, (none)",0,-0.05,6,16,1,Janet,Janet,michelle,,Michelle,0,0,"linda, anne, michelle, (none), carol, janet, vicky, glenda, gina, emily, mary, shirley",0,-0.05,3,17,1,Janet,Janet,Michelle,,Michelle,0,0,"linda, shirley, emily, glenda, anne, (none), michelle, mary, vicky, carol, gina, janet",0,-0.05,10,18,2,Michelle,Michelle,janet,,Janet,0,0,"linda, michelle, (none), carol, mary, janet, emily, glenda, vicky, gina, shirley, anne",0,-0.05,9,19,2,Janet,Janet,janet,,Janet,1,0,"vicky, carol, glenda, emily, linda, shirley, michelle, anne, mary, gina, janet, (none)",0,0.1,3,20,1,Janet,Janet,Michelle,,Linda,0,0,"linda, michelle, (none), carol, mary, janet, emily, glenda, vicky, gina, shirley, anne",0,-0.05,9,21,2,Janet,Janet,Janet,,Linda,1,0,"linda, michelle, (none), carol, mary, janet, emily, glenda, vicky, gina, shirley, anne",0,0.1,5,22,2,Michelle,Michelle,Michelle,,Linda,1,0,"shirley, linda, anne, mary, glenda, michelle, janet, gina, emily, vicky, (none), carol",0,0.1,7,23,1,Michelle,Michelle,Michelle,,Janet,1,0,"glenda, shirley, mary, (none), linda, carol, vicky, gina, anne, janet, emily, michelle",0,0.1,6,24,1,Janet,Janet,janet,,Linda,1,0,"shirley, gina, (none), michelle, vicky, linda, janet, carol, glenda, anne, mary, emily",0,0.1,2,25,15,0,,0,3.64,0,1,116,p0yvewc8,,98.19.238.235,2017-04-07 17:00:40.856315+00:00,1,A3J0IAI8AJBGKX,3J88R45B2GZ9WHDW09MGF700UUGPXW,3TL87MO8CMQ0IQ9KIKIL3ZWR6PIFLX,1.3,3.3,bckyc7ef,,,3DGDV62G7OA68HC6MHWL0XBM2VEP2L,311HQEI8RSH78MBIF2BINMU8NA7Z7W,3O2Y2UIUCQVPYKR2XK6KOZJCHPDFKU,3TL87MO8CMQ0IQ9KIKIL3ZWR6PIFLX,3NMDE2OGHG0L1YTUQZWF1QB1KRTFGY,3NMDE2OGHG0L1YTUQZWF1QB1KRTFGY,,$2.00,15,A3J0IAI8AJBGKX,21,0.35,1,1,2,Marie,Marie,Linda,,Michelle,0,0,"linda, michelle, marie",0,0,1,1,1,Marie,Marie,Janet,,Marie,0,0,"janet, marie, michelle, linda",0,0,9,2,1,Linda,Linda,Emily,,Michelle,0,0,"linda, emily, michelle, marie, janet",0,0,10,3,2,Linda,Linda,Linda,,Janet,1,0,"linda, emily, michelle, janet, marie",0,0.1,11,4,2,Linda,Linda,Janet,,Jane,0,0,"jane, michelle, marie, emily, linda, janet",0,-0.05,1,5,2,Linda,Linda,Susan,,Susan,0,0,"susan, jane, janet, michelle, emily, marie, linda",0,-0.05,1,6,1,Linda,Linda,Susan,,Janet,0,0,"susan, jane, michelle, janet, marie, linda, emily",0,0,11,7,2,Linda,Linda,Linda,,Susan,1,0,"jane, michelle, marie, emily, linda, janet, susan",0,0.1,2,8,2,Linda,Linda,Marie,,Janet,0,0,"susan, jane, janet, michelle, emily, marie, linda",0,-0.05,8,9,2,Linda,Linda,Janet,,Linda,0,0,"emily, linda, marie, susan, michelle, jane, janet",0,-0.05,12,10,2,Linda,Linda,Michelle,,Janet,0,0,"marie, linda, susan, jane, janet, michelle, emily",0,0,1,11,2,Linda,Linda,Linda,,Janet,1,0,"marie, susan, michelle, linda, janet, emily, jane",0,0.1,7,12,2,Linda,Linda,Michelle,,Michelle,0,0,"marie, susan, linda, michelle, janet, jane, emily",0,-0.05,7,13,2,Linda,Linda,Linda,,Linda,1,0,"linda, marie, emily, susan, jane, michelle, janet",0,0.1,10,14,1,Linda,Linda,Linda,,Michelle,1,0,"linda, michelle, marie, emily, susan, jane, janet",0,0.1,9,15,2,Linda,Linda,Linda,,Janet,1,0,"marie, linda, susan, jane, janet, michelle, emily",0,0.1,3,16,1,Linda,Linda,janet,,Michelle,0,0,"jane, linda, michelle, janet, susan, emily, marie",0,-0.05,5,17,1,Linda,Linda,Linda,,Michelle,1,0,"linda, marie, emily, susan, jane, michelle, janet",0,0.1,7,18,1,Linda,Linda,Linda,,Linda,1,0,"marie, susan, michelle, linda, janet, emily, jane",0,0.1,10,19,1,Linda,Linda,Linda,,Michelle,1,0,"emily, linda, marie, susan, michelle, jane, janet",0,0.1,8,20,1,Linda,Linda,Linda,,Linda,1,0,"marie, susan, michelle, linda, janet, emily, jane",0,0.1,11,21,1,Linda,Linda,Linda,,Michelle,1,0,"marie, susan, michelle, linda, janet, emily, jane",0,0.1,10,22,1,Linda,Linda,Janet,,Janet,0,0,"marie, susan, linda, michelle, janet, jane, emily",0,-0.05,5,23,1,Linda,Linda,Linda,,Michelle,1,0,"jane, linda, susan, janet, marie, emily, michelle",0,0.1,8,24,1,Linda,Linda,Linda,,Janet,1,0,"michelle, jane, marie, janet, linda, susan, emily",0,0.1,12,25,16,0,Cheers - Rick,0,3.3,0,1,117,4o0flyfm,,24.160.45.186,2017-04-07 17:00:41.857662+00:00,1,A13JDX06ZXN4KJ,3JPSL1DZ5S0XXJTQ9KHARAK7TU6ANH,3TL87MO8CMQ0IQ9KIKIL3ZWR6PIFLX,1.88,3.88,bckyc7ef,,,3DGDV62G7OA68HC6MHWL0XBM2VEP2L,311HQEI8RSH78MBIF2BINMU8NA7Z7W,3O2Y2UIUCQVPYKR2XK6KOZJCHPDFKU,3TL87MO8CMQ0IQ9KIKIL3ZWR6PIFLX,3NMDE2OGHG0L1YTUQZWF1QB1KRTFGY,3NMDE2OGHG0L1YTUQZWF1QB1KRTFGY,,$2.00,16,A13JDX06ZXN4KJ,5,0.38,1,1,2,Mary,Mary,jane,,Linda,0,0,"jane, linda, mary",0,0,3,1,2,jane,jane,Jane,,Michelle,1,0,"mary, linda, michelle, jane",0,0.1,10,2,2,jane,jane,Jane,,Janet,1,0,"jane, janet, linda, michelle, mary",0,0.1,2,3,1,Jane,Jane,Michelle,,Shirley,0,0,"linda, shirley, jane, michelle, mary, janet",0,-0.05,3,4,1,Jane,Jane,Linda,,Linda,0,0,"jane, michelle, shirley, mary, linda, janet",0,-0.05,2,5,2,linda,linda,Linda,,Michelle,1,0,"jane, janet, michelle, mary, linda, shirley",0,0.1,2,6,2,linda,linda,Linda,,Shirley,1,0,"shirley, jane, michelle, janet, linda, mary",0,0.1,12,7,2,linda,linda,Linda,,Janet,1,0,"jane, michelle, shirley, mary, linda, janet",0,0.1,3,8,2,Linda,Linda,Linda,,Linda,1,0,"jane, janet, michelle, mary, linda, shirley",0,0.1,12,9,2,Linda,Linda,Linda,,Michelle,1,0,"linda, shirley, michelle, mary, janet, jane",0,0.1,2,10,2,linda,linda,Michelle,,Michelle,0,0,"linda, mary, shirley, jane, janet, michelle",0,-0.05,11,11,1,linda,linda,Linda,,Janet,1,0,"michelle, linda, janet, mary, shirley, jane",0,0.1,3,12,1,linda,linda,Michelle,,Linda,0,0,"shirley, linda, mary, michelle, janet, jane",0,-0.05,2,13,2,linda,linda,Linda,,Michelle,1,0,"linda, shirley, jane, michelle, mary, janet",0,0.1,9,14,2,linda,linda,Linda,,Janet,1,0,"linda, michelle, mary, shirley, jane, janet",0,0.1,3,15,2,linda,linda,Linda,,Michelle,1,0,"linda, mary, shirley, jane, janet, michelle",0,0.1,12,16,2,Linda,Linda,Michelle,,Michelle,0,0,"jane, linda, michelle, janet, mary, shirley",0,-0.05,8,17,2,Linda,Linda,Linda,,Janet,1,0,"linda, shirley, jane, michelle, mary, janet",0,0.1,8,18,2,Linda,Linda,Linda,,Linda,1,0,"michelle, linda, janet, mary, shirley, jane",0,0.1,3,19,2,Linda,Linda,Linda,,Linda,1,0,"linda, shirley, michelle, mary, janet, jane",0,0.1,9,20,2,Linda,Linda,Linda,,Linda,1,0,"michelle, linda, janet, mary, shirley, jane",0,0.1,12,21,2,Linda,Linda,Linda,,Janet,1,0,"michelle, linda, janet, mary, shirley, jane",0,0.1,1,22,2,linda,linda,Linda,,Linda,1,0,"shirley, linda, mary, michelle, janet, jane",0,0.1,6,23,2,linda,linda,Linda,,Linda,1,0,"shirley, mary, jane, linda, janet, michelle",0,0.1,9,24,2,linda,linda,Michelle,,Linda,0,0,"shirley, michelle, jane, linda, janet, mary",0,-0.05,7,25,17,0,,0,3.88,0,1,118,93vzeppq,,71.128.246.129,2017-04-07 17:00:42.194879+00:00,1,A3N0QZ9ZKUCTCQ,3KRVW3HTZNMVFXUKEJO1ZVPDAA3SMV,311HQEI8RSH78MBIF2BINMU8NA7Z7W,1.24,3.24,bckyc7ef,,,3DGDV62G7OA68HC6MHWL0XBM2VEP2L,311HQEI8RSH78MBIF2BINMU8NA7Z7W,3O2Y2UIUCQVPYKR2XK6KOZJCHPDFKU,3TL87MO8CMQ0IQ9KIKIL3ZWR6PIFLX,3NMDE2OGHG0L1YTUQZWF1QB1KRTFGY,3NMDE2OGHG0L1YTUQZWF1QB1KRTFGY,,$2.00,17,A3N0QZ9ZKUCTCQ,2,0.29,1,1,2,Gina,Gina,(none),,Mary,0,0,"mary, (none), gina",0,0,12,1,1,Lucy,Lucy,Anne,,Linda,0,0,"anne, linda, mary, gina, lucy, (none)",0,0,12,2,1,Linda,Linda,Michelle,,Linda,0,0,"lucy, linda, (none), michelle, mary, gina, anne",0,0,5,3,1,Linda,Linda,Linda,,Shirley,1,0,"linda, shirley, anne, (none), michelle, mary, gina, lucy",0,0.1,2,4,2,Michelle,Michelle,Gina,,Shirley,0,0,"(none), michelle, shirley, gina, mary, linda, lucy, anne",0,-0.05,12,5,1,Shirley,Shirley,janet,,Susan,0,0,"anne, susan, janet, michelle, mary, lucy, gina, linda, (none), shirley",0,-0.05,11,6,1,Shirley,Shirley,Gina,,Michelle,0,0,"susan, shirley, michelle, janet, lucy, anne, (none), gina, linda, mary",0,0,9,7,1,Shirley,Shirley,Janet,,Janet,0,0,"(none), michelle, shirley, gina, mary, linda, janet, lucy, susan, anne",0,0,7,8,1,Shirley,Shirley,Anne,,Amanda,0,0,"anne, shirley, susan, janet, michelle, mary, lucy, gina, (none), amanda, linda",0,0,7,9,2,Shirley,Shirley,janet,,Michelle,0,0,"amanda, linda, shirley, susan, michelle, anne, mary, janet, gina, lucy, (none)",0,0,7,10,2,Michelle,Michelle,Anne,,Linda,0,0,"anne, linda, mary, susan, shirley, gina, janet, amanda, michelle, lucy, (none)",0,0,10,11,1,Michelle,Michelle,Michelle,,Michelle,1,0,"lucy, susan, michelle, (none), linda, mary, janet, amanda, gina, shirley, anne",0,0.1,1,12,1,Michelle,Michelle,Michelle,,Linda,1,0,"shirley, susan, linda, anne, mary, michelle, janet, amanda, lucy, gina, (none)",0,0.1,1,13,2,Michelle,Michelle,Michelle,,Michelle,1,0,"linda, shirley, amanda, susan, anne, (none), michelle, mary, janet, lucy, gina",0,0.1,11,14,1,Michelle,Michelle,janet,,Janet,0,0,"amanda, linda, michelle, lucy, (none), mary, susan, shirley, gina, janet, anne",0,-0.05,2,15,2,Michelle,Michelle,Michelle,,Carol,1,0,"anne, linda, mary, carol, susan, shirley, gina, janet, amanda, michelle, lucy, (none)",0,0.1,10,16,2,Michelle,Michelle,Michelle,,Janet,1,0,"linda, anne, michelle, lucy, (none), amanda, carol, janet, susan, gina, mary, shirley",0,0.1,11,17,2,Michelle,Michelle,Michelle,,Michelle,1,0,"linda, shirley, amanda, susan, anne, (none), michelle, mary, carol, gina, janet, lucy",0,0.1,12,18,2,Michelle,Michelle,Michelle,,Linda,1,0,"lucy, susan, linda, michelle, (none), carol, mary, janet, amanda, gina, shirley, anne",0,0.1,11,19,2,Michelle,Michelle,Michelle,,Janet,1,0,"carol, amanda, linda, shirley, susan, michelle, anne, mary, gina, janet, lucy, (none)",0,0.1,4,20,2,Michelle,Michelle,Michelle,,Michelle,1,0,"lucy, susan, linda, michelle, (none), carol, mary, janet, amanda, gina, shirley, anne",0,0.1,10,21,1,Michelle,Michelle,Janet,,Linda,0,0,"lucy, susan, linda, michelle, (none), carol, mary, janet, amanda, gina, shirley, anne",0,-0.05,12,22,2,Michelle,Michelle,Michelle,,Linda,1,0,"shirley, susan, linda, anne, mary, michelle, janet, amanda, lucy, gina, (none), carol",0,0.1,3,23,2,Michelle,Michelle,janet,,Michelle,0,0,"shirley, mary, (none), linda, carol, gina, anne, janet, lucy, amanda, michelle, susan",0,-0.05,2,24,2,Michelle,Michelle,Michelle,,Janet,1,0,"shirley, gina, (none), michelle, lucy, linda, janet, carol, susan, anne, mary, amanda",0,0.1,6,25,18,0,Thanks!,0,3.24,0,1,119,qakj33ep,,172.56.3.17,2017-04-07 17:00:42.233380+00:00,1,A2A07J1P6YEW6Z,3QY5DC2MXRL5O0U7H1FOJ6NSY6CFUR,3TL87MO8CMQ0IQ9KIKIL3ZWR6PIFLX,0.67,2.67,bckyc7ef,,,3DGDV62G7OA68HC6MHWL0XBM2VEP2L,311HQEI8RSH78MBIF2BINMU8NA7Z7W,3O2Y2UIUCQVPYKR2XK6KOZJCHPDFKU,3TL87MO8CMQ0IQ9KIKIL3ZWR6PIFLX,3NMDE2OGHG0L1YTUQZWF1QB1KRTFGY,3NMDE2OGHG0L1YTUQZWF1QB1KRTFGY,,$2.00,18,A2A07J1P6YEW6Z,3,0.27,1,1,1,Vicky,Vicky,Anne,,Cynthia,0,0,"vicky, cynthia, anne",0,0,11,1,2,Anne,Anne,Lucy,,Michelle,0,0,"anne, lucy, michelle, vicky, cynthia",0,0,12,2,2,Michelle,Michelle,Linda,,Linda,0,0,"lucy, cynthia, linda, michelle, vicky, anne",0,0,5,3,2,Linda,Linda,Linda,,Shirley,1,0,"linda, shirley, cynthia, anne, michelle, vicky, lucy",0,0.1,2,4,2,Linda,Linda,Jane,,Janet,0,0,"jane, michelle, vicky, shirley, linda, cynthia, janet, lucy, anne",0,-0.05,2,5,1,Linda,Linda,Michelle,,Linda,0,0,"anne, vicky, shirley, jane, janet, michelle, lucy, cynthia, linda",0,-0.05,6,6,1,Linda,Linda,Linda,,Janet,1,0,"shirley, jane, michelle, janet, lucy, anne, cynthia, vicky, linda",0,0.1,8,7,2,Janet,Janet,Shirley,,Michelle,0,0,"jane, michelle, vicky, shirley, linda, cynthia, janet, lucy, anne",0,-0.05,7,8,1,Michelle,Michelle,Gina,,Janet,0,0,"anne, vicky, shirley, jane, janet, michelle, lucy, gina, cynthia, linda",0,-0.05,6,9,1,Janet,Janet,Michelle,,Marie,0,0,"vicky, cynthia, linda, shirley, marie, michelle, anne, gina, janet, jane, lucy",0,0,8,10,1,Michelle,Michelle,linda,,Linda,0,0,"marie, vicky, linda, anne, shirley, cynthia, gina, jane, janet, michelle, lucy",0,0,11,11,2,Linda,Linda,Michelle,,Janet,0,0,"lucy, cynthia, marie, jane, michelle, linda, janet, vicky, gina, shirley, anne",0,0,9,12,2,Michelle,Michelle,linda,,Linda,0,0,"shirley, marie, linda, anne, cynthia, michelle, janet, lucy, jane, gina, vicky",0,0,2,13,2,Linda,Linda,Michelle,,Michelle,0,0,"linda, shirley, cynthia, marie, anne, jane, michelle, vicky, gina, janet, lucy",0,0,12,14,1,Michelle,Michelle,Janet,,Linda,0,0,"linda, michelle, janet, lucy, gina, marie, shirley, jane, vicky, cynthia, anne",0,0,6,15,2,Michelle,Michelle,Michelle,,Michelle,1,0,"marie, vicky, linda, anne, shirley, cynthia, gina, jane, janet, michelle, lucy",0,0.1,9,16,2,Michelle,Michelle,Michelle,,Michelle,1,0,"jane, linda, anne, michelle, lucy, janet, vicky, gina, marie, cynthia, shirley",0,0.1,12,17,2,Michelle,Michelle,Janet,,Linda,0,0,"linda, shirley, cynthia, marie, anne, jane, michelle, vicky, gina, janet, lucy",0,-0.05,10,18,2,Michelle,Michelle,Michelle,,Linda,1,0,"lucy, cynthia, marie, jane, michelle, linda, janet, vicky, gina, shirley, anne",0,0.1,12,19,1,Michelle,Michelle,Michelle,,Janet,1,0,"vicky, cynthia, linda, shirley, marie, michelle, anne, gina, janet, jane, lucy",0,0.1,4,20,2,Michelle,Michelle,Janet,,Janet,0,0,"lucy, cynthia, marie, jane, michelle, linda, janet, vicky, gina, shirley, anne",0,-0.05,9,21,2,Janet,Janet,Michelle,,Linda,0,0,"lucy, cynthia, marie, jane, michelle, linda, janet, vicky, gina, shirley, anne",0,-0.05,12,22,1,Michelle,Michelle,Michelle,,Michelle,1,0,"shirley, marie, linda, anne, cynthia, michelle, janet, lucy, jane, gina, vicky",0,0.1,7,23,2,Michelle,Michelle,Michelle,,Michelle,1,0,"shirley, jane, linda, vicky, gina, anne, janet, lucy, marie, cynthia, michelle",0,0.1,6,24,1,Michelle,Michelle,linda,,Michelle,0,0,"shirley, gina, cynthia, michelle, lucy, vicky, jane, marie, linda, janet, anne",0,-0.05,7,25,19,0,,0,2.67,0,1,120,c6lbpmqi,,67.186.29.207,2017-04-07 17:00:42.716082+00:00,1,A3I1W58P6SIV26,317HQ483I7TC31COL89N888Q62BNIY,3TL87MO8CMQ0IQ9KIKIL3ZWR6PIFLX,0.41,2.41,bckyc7ef,,,3DGDV62G7OA68HC6MHWL0XBM2VEP2L,311HQEI8RSH78MBIF2BINMU8NA7Z7W,3O2Y2UIUCQVPYKR2XK6KOZJCHPDFKU,3TL87MO8CMQ0IQ9KIKIL3ZWR6PIFLX,3NMDE2OGHG0L1YTUQZWF1QB1KRTFGY,3NMDE2OGHG0L1YTUQZWF1QB1KRTFGY,,$2.00,19,A3I1W58P6SIV26,20,0.36,1,1,1,shaquanda,shaquanda,Emily,,Janet,0,0,"shaquanda, emily, janet",0,0,8,1,2,kathy,kathy,Emily,,Susan,0,0,"emily, janet, kathy, susan, shaquanda",0,0,5,2,1,emily,emily,linda,,Linda,0,0,"susan, linda, janet, emily, kathy, shaquanda",0,0,11,3,1,kelly,kelly,linda,,Janet,0,0,"linda, kelly, emily, susan, shaquanda, kathy, janet",0,0,5,4,1,sandra,sandra,Linda,,Jane,0,0,"jane, sandra, emily, linda, kelly, janet, kathy, shaquanda, susan",0,0,10,5,1,linda,linda,Linda,,Susan,1,0,"shaquanda, jane, janet, susan, sandra, emily, kathy, kelly, linda",0,0.1,9,6,2,amanda,amanda,janet,,Michelle,0,0,"susan, jane, kelly, michelle, janet, kathy, shaquanda, amanda, linda, emily, sandra",0,-0.05,7,7,1,carol,carol,Michelle,,Linda,0,0,"jane, michelle, sandra, amanda, emily, linda, kelly, janet, kathy, carol, shaquanda, susan",0,-0.05,1,8,2,amanda,amanda,Linda,,Linda,0,0,"shaquanda, jane, janet, susan, sandra, michelle, carol, emily, kathy, kelly, amanda, linda",0,0,9,9,1,Linda,Linda,janet,,Janet,0,0,"amanda, carol, emily, linda, shaquanda, michelle, susan, sandra, jane, janet, kathy, kelly",0,0,11,10,1,Linda,Linda,Linda,,Janet,1,0,"linda, shaquanda, kathy, carol, susan, sandra, jane, amanda, janet, kelly, michelle, emily",0,0.1,9,11,1,janet,janet,Michelle,,Shirley,0,0,"susan, michelle, linda, sandra, janet, amanda, carol, emily, kathy, kelly, shaquanda, shirley, jane",0,-0.05,5,12,1,amanda,amanda,Michelle,,Susan,0,0,"kathy, shirley, linda, susan, michelle, janet, amanda, kelly, shaquanda, jane, emily, sandra, carol",0,-0.05,10,13,1,mary,mary,janet,,Michelle,0,0,"linda, shirley, kelly, emily, amanda, susan, jane, michelle, carol, shaquanda, janet, sandra, kathy",1,0,6,14,2,janet,janet,janet,,Linda,1,0,"amanda, carol, shaquanda, linda, michelle, sandra, kelly, emily, susan, shirley, kathy, jane, janet",0,0.1,8,15,1,carol,carol,Michelle,,Janet,0,0,"linda, shaquanda, kathy, carol, susan, shirley, sandra, jane, janet, amanda, kelly, michelle, emily",0,-0.05,8,16,1,janet,janet,Michelle,,Michelle,0,0,"jane, linda, sandra, michelle, kelly, amanda, janet, carol, susan, kathy, emily, shaquanda, shirley",0,-0.05,7,17,2,janet,janet,janet,,Janet,1,0,"linda, shirley, kelly, emily, amanda, susan, jane, michelle, carol, shaquanda, janet, sandra, kathy",0,0.1,3,18,2,michelle,michelle,Linda,,Michelle,0,0,"susan, linda, michelle, sandra, janet, amanda, carol, emily, kathy, kelly, shaquanda, shirley, jane",0,-0.05,8,19,2,Linda,Linda,Linda,,Linda,1,0,"amanda, carol, emily, linda, shaquanda, shirley, susan, michelle, sandra, janet, jane, kathy, kelly",0,0.1,2,20,1,michelle,michelle,Janet,,Michelle,0,0,"susan, linda, michelle, sandra, janet, amanda, carol, emily, kathy, kelly, shaquanda, shirley, jane",0,-0.05,7,21,1,janet,janet,Linda,,Michelle,0,0,"susan, linda, michelle, sandra, janet, amanda, carol, emily, kathy, kelly, shaquanda, shirley, jane",0,-0.05,9,22,1,janet,janet,(none),,Michelle,0,0,"kathy, shirley, linda, susan, michelle, janet, amanda, kelly, shaquanda, jane, emily, (none), sandra, carol",0,-0.05,2,23,1,janet,janet,Janet,,Janet,1,0,"shirley, (none), jane, linda, carol, susan, sandra, kathy, janet, shaquanda, amanda, emily, kelly, michelle",0,0.1,5,24,2,Linda,Linda,Janet,,Michelle,0,0,"shirley, kelly, (none), michelle, jane, linda, janet, carol, kathy, susan, sandra, shaquanda, amanda, emily",0,-0.05,10,25,20,0,,0,2.41,0,1,1