25,emq4bufa,,174.134.218.130,2017-02-16 18:02:24.144160+00:00,1,A1DJNUJZN8FE7N,324G5B4FB39CTL3L1B3S67M3F9U07Z,38G0E1M85M6SXDI4RDFQC8VW157UVM,1.28,3.28,fz05183z,,,3IZPORCT1FAVZKV3IU3HSWH3MRSHRF,3XWUWJ18TLRSKYT4MN5LGMTDNYYUUX,3IVKZBIBJ0A70ZVGXJ3MI6MZ8TBHS3,38G0E1M85M6SXDI4RDFQC8VW157UVM,3OR6S1RAB4JQ57CMFJANNP0AM9IAGD,3IE1FJZR9CZH2AY0D4H2PMHJN8K9K3,,$2.00,25,A1DJNUJZN8FE7N,22,0.48,1,1,1,gary,gary,(none given),,David,0,0,"(none given), gary, david",0,0.00,3,1,2,david,david,John,,Joe,0,0,"joe, (none given), john, gary, david",0,0.00,11,2,2,david,david,david,,Dan,1,0,"(none given), dan, joe, john, gary, david",0,0.10,3,3,1,david,david,david,,Mark,1,0,"john, joe, david, (none given), dan, mark, gary",0,0.10,6,4,1,david,david,david,,Joe,1,0,"dan, mark, (none given), john, david, joe, gary",0,0.10,2,5,1,david,david,david,,Michael,1,0,"john, joe, michael, david, (none given), dan, mark, gary",0,0.10,3,6,2,david,david,david,,Joe,1,0,"david, dan, gary, john, joe, michael, mark, (none given)",0,0.10,12,7,2,david,david,Bill,,Bill,0,0,"(none given), michael, dan, bill, joe, mark, gary, david, john",0,-0.05,8,8,1,david,david,David,,Matt,1,0,"david, dan, matt, gary, john, bill, joe, michael, mark, (none given)",0,0.10,6,9,1,david,david,Bill,,Edward,0,0,"matt, michael, dan, (none given), bill, joe, mark, gary, david, edward, john",0,-0.05,8,10,1,david,david,Bill,,John,0,0,"david, bill, (none given), gary, joe, dan, matt, mark, john, michael, edward",0,-0.05,4,11,2,BILL,BILL,david,,Bob,0,0,"(none given), bill, bob, john, michael, dan, david, joe, mark, gary, edward, matt",0,-0.05,6,12,2,Bill,Bill,david,,Seth,0,0,"michael, dan, mark, matt, seth, bill, (none given), john, david, joe, gary, edward, bob",0,-0.05,12,13,2,david,david,David,,Brian,1,0,"david, seth, bill, (none given), gary, dan, joe, brian, matt, mark, bob, john, michael, edward",0,0.10,9,14,1,david,david,Steven,,Bob,0,0,"brian, steven, michael, dan, mark, matt, seth, bill, (none given), john, david, joe, gary, edward, bob",0,-0.05,8,15,2,david,david,David,,Joe,1,0,"david, seth, bill, (none given), gary, dan, brian, joe, mark, matt, bob, john, michael, edward, steven",0,0.10,9,16,1,david,david,Bob,,Bob,0,0,"david, seth, bill, (none given), gary, dan, brian, joe, mark, matt, bob, john, michael, edward, steven",0,-0.05,5,17,2,david,david,david,,Matt,1,0,"michael, matt, dan, (none given), brian, bill, joe, bob, john, gary, seth, david, edward, mark, steven",0,0.10,5,18,1,david,david,David,,David,1,0,"(none given), bill, bob, john, steven, michael, brian, seth, dan, david, joe, mark, gary, edward, matt",0,0.10,1,19,2,david,david,David,,David,1,0,"(none given), bill, bob, john, steven, michael, brian, seth, dan, david, joe, mark, gary, edward, matt",0,0.10,8,20,1,david,david,David,,George,1,0,"david, seth, bill, (none given), gary, dan, brian, joe, mark, matt, bob, john, george, michael, edward, steven",0,0.10,3,21,1,david,david,john,,David,0,0,"edward, david, steven, dan, matt, john, george, michael, bill, seth, joe, gary, mark, bob, (none given), brian",0,-0.05,7,22,2,david,david,john,,Bob,0,0,"(none given), bill, bob, matt, george, john, steven, michael, brian, seth, dan, joe, mark, gary, edward, david",0,-0.05,12,23,2,david,david,Joe,,David,0,0,"david, seth, bill, (none given), gary, dan, brian, joe, mark, matt, bob, john, george, michael, edward, steven",0,-0.05,9,24,1,david,david,David,,David,1,0,"brian, steven, michael, dan, mark, matt, seth, bill, (none given), george, john, david, joe, gary, edward, bob",0,0.10,1,25,25,0,No,,0.00,1,1,25,0,"that was interesting but a bit frustrating, my partner and i landed on david pretty early so im not sure why they kept switching :\",1,3.28,0.00,1,1
26,f1ugewk3,,173.245.66.23,2017-02-16 18:02:43.823919+00:00,1,AT3C00TKZK13L,3R0T90IZ1SDFG6926U067L1XN1ACG7,3IZPORCT1FAVZKV3IU3HSWH3MRSHRF,0.58,2.58,fz05183z,,,3IZPORCT1FAVZKV3IU3HSWH3MRSHRF,3XWUWJ18TLRSKYT4MN5LGMTDNYYUUX,3IVKZBIBJ0A70ZVGXJ3MI6MZ8TBHS3,38G0E1M85M6SXDI4RDFQC8VW157UVM,3OR6S1RAB4JQ57CMFJANNP0AM9IAGD,3IE1FJZR9CZH2AY0D4H2PMHJN8K9K3,,$2.00,26,AT3C00TKZK13L,6,0.48,1,1,1,Michael,Michael,(none given),,(none given),0,0,"(none given), michael",0,0.00,9,1,1,John,John,david,,David,0,0,"david, (none given), john, michael",0,0.00,11,2,1,david,david,david,,Matt,1,0,"matt, (none given), john, michael, david",0,0.10,3,3,2,david,david,david,,Matt,1,0,"michael, john, david, matt, (none given)",0,0.10,6,4,2,(none given),david,david,,David,0,1,"michael, (none given), john, matt, david",1,-0.05,2,5,2,david,david,david,,Bill,1,0,"john, matt, bill, michael, david, (none given)",0,0.10,3,6,1,david,david,david,,Bob,1,0,"david, matt, john, bill, michael, bob, (none given)",0,0.10,12,7,2,david,david,james,,Matt,0,0,"james, michael, matt, (none given), bill, bob, david, john",0,-0.05,11,8,2,david,david,matt,,Bob,0,0,"david, matt, john, (none given), bill, michael, bob, james",0,-0.05,2,9,2,david,david,james,,Matt,0,0,"james, michael, matt, (none given), bill, bob, david, john",0,-0.05,7,10,2,david,david,matt,,Bob,0,0,"david, bill, (none given), james, matt, bob, john, michael",0,-0.05,2,11,1,david,david,BILL,,Joe,0,0,"(none given), bill, bob, michael, david, joe, john, james, matt",0,-0.05,6,12,1,david,david,Bill,,Bob,0,0,"james, michael, matt, bill, (none given), john, david, joe, bob",0,-0.05,12,13,1,david,david,matt,,James,0,0,"david, bill, (none given), joe, james, matt, bob, john, michael",0,-0.05,10,14,1,david,david,matt,,Matt,0,0,"james, michael, matt, bill, (none given), john, david, joe, bob",0,0.00,9,15,2,david,david,matt,,Bob,0,0,"david, bill, (none given), joe, james, matt, bob, john, michael",0,0.00,10,16,2,david,david,john,,Bob,0,0,"david, bill, (none given), joe, james, matt, bob, john, michael",0,0.00,4,17,1,david,david,david,,David,1,0,"james, michael, (none given), matt, bill, bob, joe, david, john",0,0.10,5,18,2,david,david,john,,David,0,0,"(none given), bill, bob, matt, michael, joe, john, james, david",0,-0.05,4,19,2,david,david,matt,,Matt,0,0,"(none given), bill, bob, matt, michael, joe, john, james, david",0,-0.05,3,20,1,david,david,john,,John,0,0,"david, bill, (none given), joe, james, matt, bob, john, michael",0,0.00,2,21,1,david,david,david,,Joe,1,0,"david, matt, john, james, bill, joe, michael, bob, (none given)",0,0.10,1,22,2,david,david,matt,,Joe,0,0,"(none given), bill, bob, matt, michael, joe, john, james, david",0,-0.05,3,23,1,david,david,matt,,David,0,0,"david, bill, (none given), joe, james, matt, bob, john, michael",0,-0.05,10,24,2,david,david,david,,Joe,1,0,"james, michael, matt, bill, (none given), john, david, joe, bob",0,0.10,4,25,26,0,No,,0.00,1,1,26,0,Thanks,1,2.58,0.00,1,1
27,h2xhnr95,,97.94.25.117,2017-02-16 18:03:14.338512+00:00,1,A3QSFE6GKO157S,336YQZE83VFU9VW92NBT6KFKR605M0,3IZPORCT1FAVZKV3IU3HSWH3MRSHRF,0.42,2.42,fz05183z,,,3IZPORCT1FAVZKV3IU3HSWH3MRSHRF,3XWUWJ18TLRSKYT4MN5LGMTDNYYUUX,3IVKZBIBJ0A70ZVGXJ3MI6MZ8TBHS3,38G0E1M85M6SXDI4RDFQC8VW157UVM,3OR6S1RAB4JQ57CMFJANNP0AM9IAGD,3IE1FJZR9CZH2AY0D4H2PMHJN8K9K3,,$2.00,27,A3QSFE6GKO157S,13,0.37,1,1,1,John,(none given),James,barred,(none given),0,0,"(none given), james",0,0.00,2,1,1,James,James,James,,Joe,1,0,"joe, (none given), james",0,0.10,12,2,2,James,James,david,,Matt,0,0,"joe, (none given), matt, david, james",0,-0.05,4,3,1,Joe,Joe,david,,John,0,0,"john, matt, james, joe, david, (none given)",0,-0.05,2,4,2,James,James,david,,David,0,0,"james, matt, (none given), john, david, joe",0,0.00,10,5,2,David,David,james,,Bob,0,0,"john, bob, matt, james, joe, david, (none given)",0,0.00,4,6,1,(none given),david,matt,,Bob,0,1,"david, matt, john, (none given), joe, bob, james",1,0.00,9,7,2,Bill,Bill,Bill,,Bob,1,0,"james, matt, (none given), bill, bob, joe, david, john",1,0.10,9,8,1,David,David,matt,,Matt,0,0,"david, matt, john, (none given), bill, joe, bob, james",0,-0.05,5,9,2,David,David,matt,,Matt,0,0,"james, matt, (none given), bill, bob, joe, david, john",0,-0.05,2,10,1,David,David,Chris,,David,0,0,"david, chris, bill, (none given), joe, james, matt, bob, john",0,0.00,5,11,1,Joe,Joe,james,,David,0,0,"(none given), bill, bob, chris, matt, david, joe, john, james",0,0.00,10,12,1,James,James,james,,Bob,1,0,"chris, james, matt, bill, (none given), john, david, joe, bob",0,0.10,11,13,1,David,David,matt,,Matt,0,0,"david, chris, bill, (none given), joe, james, matt, bob, john",0,-0.05,6,14,1,James,James,matt,,Joe,0,0,"chris, james, matt, bill, (none given), john, david, joe, bob",0,-0.05,7,15,2,Bill,Bill,Bob,,Bob,0,0,"david, chris, bill, (none given), joe, james, matt, bob, john",0,0.00,8,16,2,bill,bill,David,,David,0,0,"david, chris, bill, (none given), joe, james, matt, bob, john",0,0.00,2,17,2,David,David,matt,,John,0,0,"james, (none given), matt, bill, joe, bob, chris, david, john",0,0.00,3,18,1,bill,bill,matt,,Joe,0,0,"(none given), bill, bob, chris, matt, david, joe, john, james",0,0.00,5,19,2,david,david,Bob,,David,0,0,"(none given), bill, bob, chris, matt, david, joe, john, james",0,0.00,11,20,1,bob,bob,John,,Bob,0,0,"david, chris, bill, (none given), joe, james, matt, bob, john",0,0.00,9,21,1,joe,joe,bob,,David,0,0,"david, matt, john, bill, (none given), joe, chris, bob, james",0,0.00,8,22,2,bill,bill,david,,John,0,0,"(none given), bill, bob, chris, matt, david, joe, john, james",0,0.00,11,23,1,david,david,david,,David,1,0,"david, chris, bill, (none given), joe, james, matt, bob, john",0,0.10,4,24,1,bill,bill,david,,Joe,0,0,"chris, james, matt, bill, (none given), john, david, joe, bob",0,-0.05,5,25,27,0,No,,0.00,1,1,27,0,n/a,0,2.42,0.00,1,1
28,n0c3r1cw,,50.224.87.70,2017-02-16 18:04:04.199050+00:00,1,A1X04W4VU2I2CY,3Y5140Z9DXHC6MO11NMFCXDK1XHIPJ,3IVKZBIBJ0A70ZVGXJ3MI6MZ8TBHS3,0.26,2.26,fz05183z,,,3IZPORCT1FAVZKV3IU3HSWH3MRSHRF,3XWUWJ18TLRSKYT4MN5LGMTDNYYUUX,3IVKZBIBJ0A70ZVGXJ3MI6MZ8TBHS3,38G0E1M85M6SXDI4RDFQC8VW157UVM,3OR6S1RAB4JQ57CMFJANNP0AM9IAGD,3IE1FJZR9CZH2AY0D4H2PMHJN8K9K3,,$2.00,28,A1X04W4VU2I2CY,10,0.26,1,1,1,john,(none given),David,barred,David,0,0,david,0,0.00,11,1,1,Sam,Sam,Steve,,Brian,0,0,"brian, sam, steve, david",0,0.00,1,2,2,David,David,John,,David,0,0,"brian, john, sam, steve, david",0,0.00,2,3,1,John,John,John,,Bill,1,0,"john, bill, david, steve, brian, sam",0,0.10,3,4,1,Bruce,Bruce,Mike,,David,0,0,"mike, bill, bruce, steve, john, david, brian, sam",0,-0.05,11,5,2,Michael,Michael,Bill,,David,0,0,"john, mike, bill, david, steve, bruce, brian, sam",1,-0.05,6,6,1,Levi,Levi,Patrick,,David,0,0,"levi, bruce, sam, david, mike, john, patrick, bill, steve, brian",0,0.00,5,7,1,(none given),David,Chris,,Bob,0,1,"steve, mike, brian, bill, bob, patrick, david, levi, bruce, john, sam, chris",1,0.00,1,8,1,Joe,Joe,David,,Bob,0,0,"levi, bruce, sam, david, mike, john, patrick, bill, steve, chris, bob, brian",1,0.00,12,9,2,Edward,Edward,Chris,,Chris,0,0,"steve, mike, brian, bill, bob, patrick, david, levi, bruce, john, sam, chris, edward",0,0.00,9,10,2,Patrick,Patrick,Jason,,Jason,0,0,"david, mike, edward, levi, chris, bill, sam, jason, brian, patrick, bob, bruce, john, steve",0,0.00,8,11,2,Jason,Jason,Bob,,David,0,0,"bill, patrick, bob, jason, sam, bruce, levi, brian, mike, david, john, steve, edward, chris",0,0.00,2,12,1,Aaron,Aaron,matt,,David,0,0,"mike, levi, chris, bob, matt, bill, patrick, bruce, steve, john, david, jason, brian, edward, sam, aaron",0,0.00,8,13,1,James,James,Bob,,David,0,0,"david, mike, edward, chris, levi, bill, sam, jason, patrick, brian, matt, bob, bruce, john, aaron, steve",1,0.00,2,14,2,George,George,matt,,Joe,0,0,"mike, levi, chris, matt, bill, patrick, sam, bruce, steve, george, john, david, joe, jason, brian, edward, bob, aaron",0,0.00,3,15,1,Aaron,Aaron,matt,,Matt,0,0,"david, mike, edward, chris, levi, bill, sam, jason, joe, patrick, george, matt, brian, bruce, john, bob, aaron, steve",0,0.00,12,16,2,Kevin,Kevin,Bob,,Bob,0,0,"david, mike, edward, chris, levi, bill, sam, jason, joe, patrick, george, matt, brian, bruce, john, bob, aaron, steve",1,0.00,3,17,1,Richard,Richard,Bob,,Bob,0,0,"steve, mike, matt, jason, george, brian, richard, bill, joe, bob, chris, levi, patrick, bruce, john, sam, david, edward, aaron",0,0.00,6,18,2,Thomas,Thomas,John,,Matt,0,0,"bill, bob, chris, patrick, george, jason, thomas, sam, bruce, richard, brian, levi, aaron, mike, david, joe, john, steve, edward, matt",0,0.00,3,19,1,John,John,Bob,,Bob,0,0,"bill, patrick, bob, george, jason, thomas, sam, matt, bruce, richard, brian, levi, aaron, mike, david, joe, john, steve, edward, chris",0,0.00,10,20,1,John,John,John,,George,1,0,"david, mike, edward, chris, levi, bill, sam, jason, joe, george, patrick, brian, bob, bruce, richard, john, matt, aaron, steve, thomas",0,0.10,10,21,1,George,George,John,,Bob,0,0,"levi, edward, sam, bruce, aaron, david, mike, richard, matt, george, jason, john, patrick, bill, joe, steve, chris, bob, thomas, brian",0,-0.05,9,22,1,Bob,Bob,John,,David,0,0,"bill, patrick, bob, george, jason, thomas, sam, matt, bruce, richard, brian, levi, aaron, mike, david, joe, john, steve, edward, chris",0,-0.05,2,23,2,David,David,Kyle,,Joe,0,0,"david, mike, edward, chris, levi, kyle, bill, sam, jason, joe, george, patrick, brian, bob, bruce, richard, john, matt, aaron, steve, thomas",0,0.00,12,24,2,Kyle,Kyle,John,,David,0,0,"mike, levi, chris, bob, matt, kyle, bill, patrick, bruce, george, richard, john, david, joe, jason, brian, steve, edward, sam, thomas, aaron",0,0.00,3,25,28,0,Yes,,0.00,1,1,28,0,,1,2.26,0.00,1,1
29,cg47b7vx,,67.186.124.23,2017-02-16 18:05:10.529688+00:00,1,A1DNJ17PE2RYJZ,3X4MXAO0BGPFJUOL3WUJIJM7HQ3RWR,3IVKZBIBJ0A70ZVGXJ3MI6MZ8TBHS3,0.12,2.12,fz05183z,,,3IZPORCT1FAVZKV3IU3HSWH3MRSHRF,3XWUWJ18TLRSKYT4MN5LGMTDNYYUUX,3IVKZBIBJ0A70ZVGXJ3MI6MZ8TBHS3,38G0E1M85M6SXDI4RDFQC8VW157UVM,3OR6S1RAB4JQ57CMFJANNP0AM9IAGD,3IE1FJZR9CZH2AY0D4H2PMHJN8K9K3,,$2.00,29,A1DNJ17PE2RYJZ,8,0.12,1,1,1,joe,joe,(none given),,(none given),0,0,"(none given), joe",0,0.00,4,1,2,Joe,Joe,Mike,,James,0,0,"joe, (none given), mike, james",0,0.00,9,2,2,Mike,Mike,James,,David,0,0,"joe, (none given), david, james, mike",0,0.00,5,3,2,Mike,Mike,James,,Bob,0,0,"bob, mike, james, joe, david, (none given)",0,0.00,4,4,2,James,James,Joe,,Mike,0,0,"mike, james, (none given), david, joe, bob",0,0.00,3,5,2,Joe,Joe,Bruce,,Matt,0,0,"bob, matt, mike, james, joe, david, (none given), bruce",0,0.00,7,6,2,Joe,Joe,Chris,,Bill,0,0,"bruce, david, mike, matt, (none given), bill, joe, chris, bob, james",0,0.00,7,7,1,Bill,Bill,Bill,,David,1,0,"mike, james, (none given), matt, bill, joe, bob, chris, david, bruce",0,0.10,9,8,2,Bill,Bill,Joe,,David,0,0,"bruce, david, mike, matt, james, bill, joe, chris, bob, (none given)",0,-0.05,1,9,2,Bill,Bill,david,,Joe,0,0,"mike, james, (none given), matt, bill, joe, bob, chris, david, bruce",0,-0.05,8,10,2,Bill,Bill,david,,David,0,0,"david, mike, chris, bill, (none given), joe, james, matt, bob, bruce",0,0.00,4,11,2,David,David,Joe,,Bill,0,0,"(none given), bill, bob, chris, bruce, mike, david, joe, james, matt",0,0.00,9,12,2,David,David,Joe,,Bob,0,0,"mike, chris, james, matt, bill, bruce, (none given), david, joe, bob",0,0.00,6,13,1,David,David,david,,John,1,0,"david, mike, chris, bill, (none given), joe, james, matt, bob, bruce, john",0,0.10,9,14,1,David,David,Bob,,David,0,0,"mike, chris, james, matt, bill, (none given), bruce, john, david, joe, bob",0,-0.05,6,15,1,David,David,david,,Joe,1,0,"david, mike, chris, bill, (none given), joe, james, matt, bob, bruce, john",0,0.10,9,16,1,David,David,bill,,Joe,0,0,"david, mike, chris, bill, (none given), joe, james, matt, bob, bruce, john",0,-0.05,2,17,1,David,David,Joe,,Bob,0,0,"mike, james, (none given), matt, bill, joe, bob, chris, david, bruce, john",0,-0.05,7,18,2,David,David,Bob,,Bob,0,0,"(none given), bill, bob, matt, bruce, mike, david, joe, john, james, chris",0,-0.05,2,19,1,Bob,Bob,david,,Matt,0,0,"(none given), bill, bob, matt, bruce, mike, david, joe, john, james, chris",0,0.00,11,20,2,Bob,Bob,Joe,,John,0,0,"david, mike, chris, bill, (none given), joe, james, matt, bob, bruce, john",0,0.00,1,21,2,Joe,Joe,Joe,,David,1,0,"bruce, david, mike, matt, james, john, bill, joe, chris, bob, (none given)",0,0.10,3,22,2,Joe,Joe,bob,,Joe,0,0,"(none given), bill, bob, matt, bruce, mike, david, joe, john, james, chris",0,-0.05,8,23,2,Joe,Joe,Bob,,Joe,0,0,"david, mike, chris, bill, (none given), joe, james, matt, bob, bruce, john",0,-0.05,1,24,2,Joe,Joe,bob,,David,0,0,"mike, chris, james, matt, bill, (none given), bruce, john, david, joe, bob",0,0.00,2,25,29,0,Yes,,0.00,1,1,29,0,,1,2.12,0.00,1,1
30,102f5u2v,,174.96.181.131,2017-02-16 18:05:55.607870+00:00,1,AUQTHU5AOZVQC,3BQU611VFPLY3YFRG4K5DEE2D3D99X,3IVKZBIBJ0A70ZVGXJ3MI6MZ8TBHS3,0.08,2.08,fz05183z,,,3IZPORCT1FAVZKV3IU3HSWH3MRSHRF,3XWUWJ18TLRSKYT4MN5LGMTDNYYUUX,3IVKZBIBJ0A70ZVGXJ3MI6MZ8TBHS3,38G0E1M85M6SXDI4RDFQC8VW157UVM,3OR6S1RAB4JQ57CMFJANNP0AM9IAGD,3IE1FJZR9CZH2AY0D4H2PMHJN8K9K3,,$2.00,30,AUQTHU5AOZVQC,11,0.08,1,1,1,(none given),Tim,(none given),,Mark,0,1,"(none given), mark",1,0.00,8,1,1,Brian,Brian,Joe,,Bob,0,0,"joe, (none given), mark, bob, brian",0,0.00,5,2,2,Joe,Joe,matt,,Sternman,0,0,"(none given), bob, brian, sternman, joe, mark, matt",0,0.00,11,3,2,Bob,Bob,Bill,,Bill,0,0,"bob, matt, bill, joe, sternman, (none given), mark, brian",0,0.00,9,4,1,Mark,Mark,Mike,,Dan,0,0,"sternman, mike, dan, mark, matt, bill, (none given), joe, brian, bob",0,0.00,1,5,1,Mike,Mike,David,,Bruce,0,0,"bob, matt, mike, bill, sternman, joe, david, (none given), dan, mark, bruce, brian",0,0.00,9,6,2,Brian,Brian,Brian,,Brian,1,0,"bruce, david, mike, dan, matt, mark, bill, joe, sternman, bob, (none given), brian",0,0.10,6,7,1,Matt,Matt,Mike,,David,0,0,"mike, matt, (none given), dan, brian, bill, bob, joe, sternman, david, bruce, mark",0,-0.05,4,8,1,Bill,Bill,matt,,Brian,0,0,"bruce, david, mike, dan, matt, mark, bill, joe, sternman, bob, (none given), brian",0,-0.05,4,9,1,Bill,Bill,matt,,John,0,0,"mike, matt, (none given), dan, brian, bill, bob, joe, sternman, john, david, bruce, mark",0,0.00,5,10,2,Robert,Robert,David,,David,0,0,"david, mike, robert, bill, sternman, (none given), dan, brian, joe, matt, bob, bruce, john, mark",0,0.00,6,11,2,Dan,Dan,Matt,,Joe,0,0,"robert, (none given), bill, bob, matt, bruce, brian, dan, sternman, mike, joe, mark, john, david",0,0.00,3,12,1,John,John,Matt,,Seth,0,0,"sternman, mike, dan, mark, matt, seth, bill, (none given), bruce, john, david, joe, brian, bob, robert",0,0.00,1,13,1,John,John,Matt,,David,0,0,"david, mike, seth, robert, bill, sternman, (none given), dan, joe, brian, mark, matt, bruce, john, bob",0,0.00,12,14,1,Matt,Matt,Matt,,Matt,1,0,"sternman, mike, dan, mark, matt, seth, bill, (none given), bruce, john, david, joe, brian, bob, robert",0,0.10,10,15,1,Brian,Brian,matt,,Joe,0,0,"david, mike, seth, robert, bill, sternman, (none given), dan, joe, brian, mark, matt, bruce, john, bob",0,-0.05,6,16,1,Matt,Matt,John,,Bob,0,0,"david, mike, seth, robert, bill, sternman, (none given), dan, joe, brian, mark, matt, bruce, john, bob",0,-0.05,11,17,1,Bill,Bill,John,,David,0,0,"mike, matt, (none given), dan, brian, bill, joe, bob, robert, sternman, john, seth, bruce, david, mark",0,0.00,9,18,2,Mark,Mark,matt,,Thomas,0,0,"(none given), robert, bill, bob, thomas, john, bruce, joe, brian, seth, dan, mike, sternman, david, mark, matt",0,0.00,6,19,1,Tom,Tom,Bobby,,Joe,0,0,"(none given), robert, bill, bob, matt, thomas, bruce, brian, seth, dan, mike, sternman, joe, mark, john, bobby, david",1,0.00,7,20,2,Brian,Brian,matt,,David,0,0,"david, mike, bobby, seth, robert, bill, sternman, (none given), dan, brian, joe, matt, bob, bruce, mark, john, thomas",0,0.00,11,21,2,Brian,Brian,matt,,Alan,0,0,"bruce, david, mike, robert, dan, matt, john, mark, bobby, alan, (none given), bill, seth, joe, sternman, bob, thomas, brian",0,0.00,5,22,2,Matt,Matt,Joe,,Joe,0,0,"robert, (none given), bill, bob, thomas, bruce, alan, joe, seth, brian, dan, mike, david, bobby, mark, john, sternman, matt",0,0.00,1,23,1,Tim,Tim,Mathy,,Matt,0,0,"alan, david, mike, bobby, seth, robert, bill, sternman, (none given), dan, joe, brian, matt, mark, bruce, john, bob, mathy, thomas",1,0.00,7,24,2,Micheal,Micheal,matt,,Bob,0,0,"sternman, mike, mathy, bobby, dan, mark, matt, seth, bill, (none given), bruce, john, david, joe, thomas, brian, micheal, bob, alan, robert",0,0.00,6,25,30,0,No,,0.00,1,1,30,0,,1,2.08,0.00,1,1
31,5anxsd5o,Inactive,73.203.200.50,2017-02-16 18:06:15.324056+00:00,1,A2P065E9CYMYJL,36NEMU28XFEOMEBTYOY2WKSXB34WM8,38G0E1M85M6SXDI4RDFQC8VW157UVM,0.04,2.04,fz05183z,,,3IZPORCT1FAVZKV3IU3HSWH3MRSHRF,3XWUWJ18TLRSKYT4MN5LGMTDNYYUUX,3IVKZBIBJ0A70ZVGXJ3MI6MZ8TBHS3,38G0E1M85M6SXDI4RDFQC8VW157UVM,3OR6S1RAB4JQ57CMFJANNP0AM9IAGD,3IE1FJZR9CZH2AY0D4H2PMHJN8K9K3,,$2.00,31,A2P065E9CYMYJL,28,0.04,1,1,1,(none given),Chris,Paul,,(none given),0,1,"(none given), paul",1,0.00,15,1,1,(none given),Paul,Chris,,James,0,1,"(none given), paul, chris, james",1,0.00,15,2,1,(none given),(none given),(none given),,Bob,0,1,"(none given), paul, bob, james, chris",1,0.00,15,3,1,(none given),Chris,(none given),,James,0,1,"james, paul, bob, chris, (none given)",1,0.00,15,4,1,(none given),(none given),David,,Bob,0,1,"chris, james, (none given), david, paul, bob",1,0.00,15,5,1,(none given),James,Chris,,David,0,1,"bob, james, david, (none given), chris, paul",1,0.00,15,6,1,(none given),David,Bob,,David,0,1,"david, (none given), paul, chris, bob, james",1,0.00,15,7,1,(none given),David,James,,Bob,0,1,"james, (none given), paul, bob, chris, david",1,0.00,15,8,1,(none given),Bob,(none given),,John,0,1,"david, john, (none given), paul, chris, bob, james",1,0.00,15,9,1,(none given),John,David,,Bob,0,1,"james, (none given), paul, bob, chris, david, john",1,0.00,15,10,1,(none given),(none given),David,,John,0,1,"david, paul, chris, (none given), james, bob, john",1,0.00,15,11,1,(none given),David,David,,Dan,0,1,"(none given), paul, bob, dan, david, john, james, chris",1,0.00,15,12,1,(none given),David,Patrick,,David,0,1,"chris, james, dan, patrick, (none given), john, david, paul, bob",1,0.00,15,13,1,(none given),Patrick,James,,David,0,1,"david, paul, chris, (none given), dan, james, patrick, bob, john",1,0.00,15,14,2,(none given),David,Seth,,Matt,0,1,"chris, james, dan, matt, seth, patrick, (none given), john, david, paul, bob",1,0.00,15,15,1,(none given),James,Patrick,,Joe,0,1,"david, paul, chris, seth, (none given), dan, james, patrick, matt, bob, joe, john",1,0.00,15,16,1,(none given),Joe,George,,Peter,0,1,"david, paul, chris, seth, (none given), dan, james, patrick, matt, bob, joe, john, george, peter",1,0.00,15,17,2,(none given),George,Bob,,Bob,0,1,"james, (none given), paul, dan, matt, george, peter, bob, joe, chris, seth, david, patrick, john",1,0.00,15,18,2,(none given),Peter,George,,John,0,1,"(none given), paul, bob, patrick, george, peter, joe, seth, dan, david, matt, john, james, chris",1,0.00,15,19,1,(none given),George,Bill,,Matt,0,1,"(none given), paul, bob, patrick, bill, george, peter, joe, seth, dan, david, matt, john, james, chris",1,0.00,15,20,1,(none given),John,David,,John,0,1,"david, paul, chris, seth, bill, (none given), joe, patrick, george, dan, bob, matt, john, james, peter",1,0.00,15,21,2,(none given),John,David,,Alan,0,1,"peter, david, dan, matt, george, john, james, patrick, bill, seth, joe, paul, chris, alan, bob, (none given)",1,0.00,15,22,2,(none given),Alan,Bill,,Joe,0,1,"(none given), paul, bill, patrick, chris, bob, george, peter, seth, dan, david, alan, joe, john, james, matt",1,0.00,14,23,2,(none given),Bill,John,,David,0,1,"alan, david, paul, chris, seth, bill, (none given), dan, george, james, matt, patrick, joe, john, bob, peter",1,0.00,15,24,2,(none given),John,Alan,,Joe,0,1,"chris, james, dan, matt, seth, bill, patrick, (none given), george, peter, john, david, joe, paul, bob, alan",1,0.00,14,25,31,0,,,0.00,1,1,31,0,,,2.04,0.00,1,1
