5,qixlqy7n,,72.83.12.78,2017-03-15 17:00:27.093286+00:00,1,A1C59M3HPCO503,3GLB5JMZFXWPLYFG6QVHRRJFBUGGDU,3J94SKDEKIQPIHS3ZR7OYAX95AR5DM,2.58,4.58,ts44u31l,,,3J94SKDEKIQPIHS3ZR7OYAX95AR5DM,3O2Y2UIUCQVPYKR2XK6KOZJCED2KFX,337F8MIIMZEDNEN99A0JEB7CBPN04J,3KL228NDMVNVCKNX84C26KJOFS2KGW,33CY53T7YFR23AA9JZJ7YQKHNEPDHJ,36TBNKR908OQJ0J7TYB1DNN4VY1ED8,,$2.00,5,A1C59M3HPCO503,13,0.93,1,1,2,Lauren,Lauren,Lauren,,"Jill, Jill",1,0,"jill, lauren",0,0.1,1,1,2,lauren,lauren,mary,,"June, Karen",0,1,"june, karen, jill, lauren, mary",1,-0.05,5,2,2,(none),(none),kimberly,,"Rachel, Jill",0,1,"rachel, mary, jill, kimberly, lauren, karen, june",1,-0.05,5,3,2,kimberly,kimberly,Jen,,"Jill, Alice",0,0,"karen, kimberly, alice, jen, rachel, mary, june, lauren, jill",0,0,11,4,1,Jen,Jen,Jessica,,"Sue, Jill",0,0,"june, alice, rachel, karen, mary, jessica, lauren, jill, jen, sue, kimberly",0,0,9,5,2,Jill,Jill,jill,,"Karen, Karen",1,0,"lauren, alice, june, rachel, sue, kimberly, karen, jill, mary, jen, jessica",0,0.1,9,6,1,Karen,Karen,karen,,"Jill, Jill",1,0,"jill, sue, mary, jessica, alice, lauren, rachel, karen, kimberly, jen, june",0,0.1,6,7,1,jill,jill,Jill,,"Jill, Jill",1,0,"lauren, alice, june, rachel, sue, kimberly, karen, jill, mary, jen, jessica",0,0.1,8,8,2,karen,karen,Mary,,"Jill, Mary",0,0,"rachel, mary, jill, kimberly, lauren, jessica, alice, karen, june, sue, jen",0,-0.05,3,9,1,Mary,Mary,Karen,,"Jill, Jill",0,0,"rachel, mary, jill, kimberly, lauren, jessica, alice, karen, june, sue, jen",0,-0.05,2,10,1,Mary,Mary,Jill,,"Jill, Jill",0,0,"jill, sue, mary, jessica, alice, lauren, rachel, karen, kimberly, jen, june",0,-0.05,9,11,1,Jill,Jill,jill,,"Jill, Jill",1,0,"lauren, alice, june, rachel, sue, kimberly, karen, jill, mary, jen, jessica",0,0.1,5,12,2,Jill,Jill,Jill,,"Jill, Jill",1,0,"lauren, alice, june, rachel, sue, kimberly, karen, jill, mary, jen, jessica",0,0.1,5,13,2,Jill,jill,jill,,"Jill, Jill",1,0,"sue, jessica, mary, june, karen, rachel, jill, lauren, jen, alice, kimberly",0,0.1,8,14,2,Jill,Jill,jill,,"Jill, Jill",1,0,"sue, jessica, mary, june, karen, rachel, jill, lauren, jen, alice, kimberly",0,0.1,10,15,2,Jill,jill,jill,,"Jill, Jill",1,0,"june, alice, rachel, karen, jessica, mary, lauren, jill, jen, sue, kimberly",0,0.1,1,16,1,Jill,Jill,Jill,,"Jill, Jill",1,0,"jill, sue, mary, jessica, alice, lauren, rachel, karen, kimberly, jen, june",0,0.1,7,17,2,Jill,Jill,jill,,"Jill, Jill",1,0,"karen, kimberly, alice, jessica, sue, jen, rachel, mary, june, lauren, jill",0,0.1,8,18,1,Jill,Jill,Jill,,"Jill, Jill",1,0,"lauren, alice, june, rachel, sue, kimberly, karen, jill, mary, jen, jessica",0,0.1,5,19,1,Jill,Jill,Jill,,"Jill, Jill",1,0,"sue, jessica, mary, june, karen, rachel, jill, lauren, jen, alice, kimberly",0,0.1,12,20,2,Jill,Jill,Jill,,"Jill, Jill",1,0,"alice, jessica, jen, jill, karen, june, rachel, kimberly, mary, lauren, sue",0,0.1,6,21,1,Jill,Jill,Jill,,"Jill, Jill",1,0,"jill, sue, mary, jessica, alice, lauren, rachel, karen, kimberly, jen, june",0,0.1,10,22,1,Jill,Jill,Jill,,"Jill', Jill",1,0,"alice, jessica, sue, mary, kimberly, jill', rachel, jill, karen, jen, lauren, june",0,0.1,7,23,1,Jill,Jill,Jill,,"Jill, Jill",1,0,"sue, jill, mary, jessica, alice, lauren, jill', rachel, karen, june, jen, kimberly",0,0.1,8,24,1,Jill,Jill,Jill,,"Jill, Jill",1,0,"alice, jessica, sue, jill', mary, kimberly, rachel, jill, karen, june, lauren, jen",0,0.1,2,25,5,0,,,4.58,0,1,16,gmf8fcuw,,107.182.231.96,2017-03-15 17:00:27.857144+00:00,1,A3HESOWHVBQOEI,3QUO65DNQUPZUD70G4YE60W5OG2OUZ,337F8MIIMZEDNEN99A0JEB7CBPN04J,2.53,4.53,ts44u31l,,,3J94SKDEKIQPIHS3ZR7OYAX95AR5DM,3O2Y2UIUCQVPYKR2XK6KOZJCED2KFX,337F8MIIMZEDNEN99A0JEB7CBPN04J,3KL228NDMVNVCKNX84C26KJOFS2KGW,33CY53T7YFR23AA9JZJ7YQKHNEPDHJ,36TBNKR908OQJ0J7TYB1DNN4VY1ED8,,$2.00,6,A3HESOWHVBQOEI,1,0.93,1,1,1,Maria,(none),ann,barred,"(none), Jen",0,0,"ann, (none), jen",0,0,11,1,2,Jen,Jen,KAREN,,"Rachel, (none)",0,0,"ann, (none), karen, rachel, jen",0,0,3,2,2,Karen,Karen,Maria,,"Jill, Maria",0,0,"rachel, maria, jill, karen, (none), ann, jen",0,0,3,3,1,Maria,Maria,Maria,,"Rachel, Karen",1,0,"karen, (none), maria, ann, rachel, jen, jill",0,0.1,1,4,1,maria,maria,Maria,,"Karen, Sue",1,0,"maria, (none), ann, karen, rachel, jill, jen, sue",0,0.1,7,5,2,Maria,Maria,bernice,,"Rachel, Karen",0,0,"bernice, rachel, maria, (none), jill, karen, sue, ann, jen",0,-0.05,10,6,2,Karen,Karen,maya,,"Jill, Jill",0,0,"jill, sue, maya, rachel, karen, ann, maria, jen, bernice, (none)",0,-0.05,9,7,2,Jill,Jill,mary,,"Jill, Jill",0,0,"bernice, mary, rachel, maria, maya, karen, jill, sue, (none), ann, jen",0,-0.05,10,8,2,Jill,Jill,jill,,"Karen, Jill",1,0,"ann, rachel, maya, mary, maria, jill, bernice, karen, (none), sue, jen",0,0.1,2,9,1,Jill,Jill,Jill,,"Jill, Jill",1,0,"ann, rachel, maya, mary, maria, jill, bernice, karen, (none), sue, jen",0,0.1,6,10,2,Jill,Jill,jill,,"Jill, Jill",1,0,"jill, sue, mary, maya, rachel, karen, ann, maria, jen, bernice, (none)",0,0.1,5,11,1,Jill,Jill,Jill,,"Jill, Jill",1,0,"bernice, rachel, sue, maria, maya, karen, jill, mary, (none), ann, jen",0,0.1,6,12,1,Jill,Jill,Jill,,"Jill, Jill",1,0,"bernice, rachel, sue, maria, maya, karen, jill, mary, (none), ann, jen",0,0.1,9,13,2,Jill,Jill,Jill,,"Jill, Jill",1,0,"ann, sue, maria, (none), maya, mary, karen, rachel, jill, jen, bernice",0,0.1,3,14,2,Jill,Jill,JILL,,"Maria, Jill",1,0,"ann, sue, maria, (none), maya, mary, karen, rachel, jill, jen, bernice",0,0.1,8,15,1,Jill,Jill,JILL,,"Jill, Jill",1,0,"maria, rachel, karen, mary, (none), ann, jill, maya, sue, jen, bernice",0,0.1,5,16,1,Jill,Jill,Jill,,"Jill, Jill",1,0,"jill, sue, mary, maya, rachel, karen, ann, maria, jen, bernice, (none)",0,0.1,12,17,1,Jill,Jill,JILL,,"Jill, Jill",1,0,"karen, (none), maria, sue, maya, ann, rachel, bernice, mary, jen, jill",0,0.1,1,18,1,Jill,Jill,JILL,,"Jill, Jill",1,0,"bernice, rachel, sue, maria, maya, karen, jill, mary, (none), ann, jen",0,0.1,6,19,2,Jill,Jill,JILL,,"Jill, Jill",1,0,"ann, sue, maria, (none), maya, mary, karen, rachel, jill, jen, bernice",0,0.1,9,20,2,Jill,Jill,jill,,"Jill, Jill",1,0,"(none), ann, jen, maria, bernice, jill, karen, rachel, maya, mary, sue",0,0.1,9,21,1,jil,jil,Jill,,"Jill, Jill",0,0,"jill, sue, mary, maya, rachel, karen, jil, ann, maria, jen, bernice, (none)",0,-0.05,4,22,2,Jill,Jill,jill,,"Jill, Jill",1,0,"bernice, sue, (none), mary, maria, maya, rachel, jill, karen, jil, ann, jen",0,0.1,6,23,2,Jill,Jill,jill,,"Jill, Jill",1,0,"jill, sue, maria, mary, maya, rachel, karen, bernice, jil, jen, ann, (none)",0,0.1,3,24,1,Jill,Jill,JILL,,"Jill, Jill",1,0,"bernice, sue, (none), mary, maria, maya, rachel, jill, karen, jil, ann, jen",0,0.1,12,25,6,0,,0,4.53,0,1,17,ti908mw8,,97.82.192.242,2017-03-15 17:00:28.650340+00:00,1,AYFOAD75CRBKE,374TNBHA8BWJWY4L5IN7YQXIZ5VYQF,337F8MIIMZEDNEN99A0JEB7CBPN04J,2.64,4.64,ts44u31l,,,3J94SKDEKIQPIHS3ZR7OYAX95AR5DM,3O2Y2UIUCQVPYKR2XK6KOZJCED2KFX,337F8MIIMZEDNEN99A0JEB7CBPN04J,3KL228NDMVNVCKNX84C26KJOFS2KGW,33CY53T7YFR23AA9JZJ7YQKHNEPDHJ,36TBNKR908OQJ0J7TYB1DNN4VY1ED8,,$2.00,7,AYFOAD75CRBKE,16,0.94,1,1,2,Kate,Kate,amber,,"(none), Lauren",0,0,"amber, kate, (none), lauren",0,0,4,1,1,Amber,Amber,Jill,,"Jill, Rachel",0,0,"amber, lauren, rachel, (none), jill, kate",0,0,7,2,1,Rachel,Rachel,Rachel,,"Jill, Jen",1,0,"kate, rachel, jill, lauren, amber, (none), jen",0,0.1,11,3,2,Rachel,Rachel,Sue,,"Kimberly, Alice",0,0,"(none), kimberly, alice, sue, kate, jen, amber, rachel, lauren, jill",0,-0.05,7,4,1,Rachel,Rachel,Jill,,"Maria, Maria",0,0,"alice, rachel, (none), kate, maria, lauren, amber, jill, jen, sue, kimberly",0,-0.05,11,5,2,Rachel,Rachel,Sue,,"Karen, Jill",0,0,"amber, lauren, alice, rachel, kimberly, maria, (none), jill, karen, sue, kate, jen",0,0,5,6,1,Rachel,Rachel,(none),,"(none), Karen",0,0,"(none), jill, sue, alice, kate, lauren, amber, rachel, karen, maria, jen, kimberly",0,0,11,7,2,Rachel,Rachel,Karen,,"Jill, Jill",0,0,"amber, lauren, alice, rachel, kimberly, maria, (none), jill, karen, sue, kate, jen",0,0,3,8,1,Jill,Jill,Jill,,"Karen, Jill",1,0,"kate, rachel, maria, jill, kimberly, lauren, alice, karen, amber, (none), sue, jen",0,0.1,10,9,2,Jill,Jill,Jill,,"Karen, Jill",1,0,"kate, rachel, maria, jill, kimberly, lauren, alice, karen, amber, (none), sue, jen",0,0.1,8,10,2,Jill,Jill,Jill,,"Kristin, Jill",1,0,"(none), jill, sue, alice, kate, lauren, amber, rachel, karen, kristin, maria, jen, kimberly",0,0.1,4,11,1,Jill,Jill,Jill,,"Maria, Jill",1,0,"amber, kristin, lauren, alice, rachel, kimberly, maria, (none), jill, karen, sue, kate, jen",0,0.1,11,12,2,Jill,Jill,Jill,,"Karen, Jill",1,0,"amber, kristin, lauren, alice, rachel, kimberly, maria, (none), jill, karen, sue, kate, jen",0,0.1,12,13,2,Jill,Jill,Jill,,"Jill, Jill",1,0,"sue, kate, kristin, (none), maria, amber, karen, rachel, jill, lauren, jen, alice, kimberly",0,0.1,11,14,1,Jill,Jill,Jill,,"Jill, Jill",1,0,"sue, kate, kristin, (none), maria, amber, karen, rachel, jill, lauren, jen, alice, kimberly",0,0.1,2,15,2,Jill,Jill,Jill,,"Jill, Jill",1,0,"alice, rachel, (none), kate, karen, maria, lauren, jill, kristin, sue, jen, kimberly, amber",0,0.1,9,16,1,Jill,Jill,Jill,,"Jill, Jill",1,0,"jill, sue, alice, kate, lauren, amber, rachel, karen, kristin, kimberly, maria, jen, (none)",0,0.1,1,17,1,Jill,Jill,Jill,,"Jill, Jill",1,0,"karen, (none), kimberly, alice, maria, sue, kate, jen, amber, rachel, lauren, kristin, jill",0,0.1,4,18,1,jill,jill,Jill,,"Jill, Jill",1,0,"amber, kristin, lauren, alice, rachel, kimberly, maria, (none), jill, karen, sue, kate, jen",0,0.1,3,19,2,Jill,Jill,Jill,,"Jill, Jill",1,0,"sue, kate, kristin, (none), maria, amber, karen, rachel, jill, lauren, jen, alice, kimberly",0,0.1,1,20,2,Jill,Jill,Jill,,"Jill, Jill",1,0,"(none), alice, jen, kristin, jill, amber, maria, karen, rachel, kimberly, kate, lauren, sue",0,0.1,12,21,1,Jill,Jill,Jill,,"Jill, Jill",1,0,"jill, sue, alice, kate, lauren, amber, rachel, karen, kristin, kimberly, maria, jen, (none)",0,0.1,5,22,2,Jill,Jill,Jill,,"Jill, Jill",1,0,"alice, (none), sue, kristin, kimberly, maria, rachel, jill, karen, kate, amber, lauren, jen",0,0.1,11,23,2,Jill,Jill,Jill,,"Jill, Jill",1,0,"jill, sue, alice, kate, lauren, amber, rachel, karen, kristin, kimberly, maria, jen, (none)",0,0.1,5,24,1,Jill,Jill,Jill,,"Jill, Jill",1,0,"alice, (none), sue, kristin, kimberly, maria, rachel, jill, karen, kate, amber, lauren, jen",0,0.1,1,25,7,0,,0,4.64,0,1,18,cm74q8ab,,67.186.124.23,2017-03-15 17:00:29.326007+00:00,1,A1DNJ17PE2RYJZ,37U1UTWH9VN4TTS35TED43JL2CUR8V,3KL228NDMVNVCKNX84C26KJOFS2KGW,2.51,4.51,ts44u31l,,,3J94SKDEKIQPIHS3ZR7OYAX95AR5DM,3O2Y2UIUCQVPYKR2XK6KOZJCED2KFX,337F8MIIMZEDNEN99A0JEB7CBPN04J,3KL228NDMVNVCKNX84C26KJOFS2KGW,33CY53T7YFR23AA9JZJ7YQKHNEPDHJ,36TBNKR908OQJ0J7TYB1DNN4VY1ED8,,$2.00,8,A1DNJ17PE2RYJZ,7,0.86,1,1,2,sue,sue,(none),,"Lauren, Alice",0,0,"alice, (none), lauren, sue",0,0,9,1,1,Sue,Sue,sue,,"Jill, Jill",1,0,"alice, jill, (none), lauren, sue",0,0.1,12,2,2,Sue,Sue,Louisa,,"Jill, Karen",0,0,"jill, lauren, louisa, alice, karen, (none), sue",0,-0.05,8,3,1,Sue,Sue,Rachel,,"Jill, Jen",0,0,"karen, (none), alice, sue, jen, rachel, louisa, lauren, jill",0,-0.05,7,4,2,Sue,Sue,Maria,,"Jen, Maria",0,0,"alice, rachel, (none), karen, louisa, maria, lauren, jill, jen, sue",0,0,10,5,1,Sue,Sue,Rachel,,"Jill, Karen",0,0,"louisa, lauren, alice, rachel, maria, (none), karen, jill, sue, jen",0,0,5,6,2,Jill,Jill,Maria,,"Jill, (none)",0,0,"jill, sue, alice, lauren, rachel, karen, maria, jen, louisa, (none)",0,0,10,7,1,Jill,Jill,Jill,,"Jill, Jill",1,0,"louisa, lauren, alice, rachel, maria, (none), karen, jill, sue, jen",0,0.1,12,8,2,Jill,Jill,Jill,,"Maria, Jill",1,0,"rachel, maria, jill, lauren, louisa, alice, karen, (none), sue, jen",0,0.1,1,9,1,Jill,Jill,Jill,,"Jill, Jill",1,0,"rachel, maria, jill, lauren, louisa, alice, karen, (none), sue, jen",0,0.1,8,10,1,Jill,Jill,Kristin,,"Karen, Jill",0,0,"jill, sue, alice, lauren, rachel, karen, kristin, maria, jen, louisa, (none)",0,-0.05,8,11,2,Jill,Jill,Jill,,"Maria, Jill",1,0,"kristin, lauren, louisa, alice, rachel, maria, (none), karen, jill, sue, jen",0,0.1,11,12,1,Jill,Jill,Jill,,"Jill, Jill",1,0,"kristin, lauren, louisa, alice, rachel, maria, (none), karen, jill, sue, jen",0,0.1,3,13,2,Jill,Jill,Jill,,"Jill, Jill",1,0,"sue, kristin, maria, (none), louisa, karen, rachel, jill, lauren, jen, alice",0,0.1,9,14,2,Jill,Jill,Jill,,"Jill, Jill",1,0,"sue, kristin, maria, (none), louisa, karen, rachel, jill, lauren, jen, alice",0,0.1,6,15,1,Jill,Jill,Jill,,"Jill, Jill",1,0,"alice, rachel, maria, karen, louisa, (none), lauren, jill, kristin, sue, jen",0,0.1,9,16,2,Jill,Jill,Jill,,"Jill, Jill",1,0,"jill, sue, alice, lauren, rachel, karen, kristin, maria, jen, louisa, (none)",0,0.1,1,17,2,Jill,Jill,Jill,,"Jill, Jill",1,0,"karen, (none), alice, maria, sue, jen, rachel, louisa, lauren, kristin, jill",0,0.1,4,18,1,Jill,Jill,jill,,"Jill, Jill",1,0,"kristin, lauren, louisa, alice, rachel, maria, (none), karen, jill, sue, jen",0,0.1,9,19,1,Jill,Jill,Jill,,"Jill, Jill",1,0,"sue, kristin, maria, (none), louisa, karen, rachel, jill, lauren, jen, alice",0,0.1,1,20,1,Jill,Jill,Jill,,"Jill, Jill",1,0,"alice, (none), jen, kristin, jill, maria, karen, rachel, lauren, louisa, sue",0,0.1,4,21,2,Jill,Jill,jill,,"Jill, Jill",1,0,"jill, sue, alice, lauren, rachel, karen, kristin, maria, jen, louisa, (none)",0,0.1,12,22,1,Jill,Jill,Jill,,"Jill, Jill",1,0,"alice, louisa, sue, kristin, (none), maria, rachel, jill, karen, lauren, jen",0,0.1,12,23,2,Jill,Jill,Jill,,"Jill, Jill",1,0,"jill, sue, alice, lauren, rachel, karen, kristin, maria, jen, louisa, (none)",0,0.1,1,24,1,Jill,Jill,Jill,,"Jill, Jill",1,0,"alice, louisa, sue, kristin, (none), maria, rachel, jill, karen, lauren, jen",0,0.1,7,25,8,0,Consensus is a beautiful thing!  Last time I got zip.,0,4.51,0,1,19,p8g5ukhq,,71.217.101.106,2017-03-15 17:00:29.799947+00:00,1,A3RAQZNM5V6A2M,3T111IHZ5ER47YBDALKR4ZEWMICR9K,337F8MIIMZEDNEN99A0JEB7CBPN04J,2.82,4.82,ts44u31l,,,3J94SKDEKIQPIHS3ZR7OYAX95AR5DM,3O2Y2UIUCQVPYKR2XK6KOZJCED2KFX,337F8MIIMZEDNEN99A0JEB7CBPN04J,3KL228NDMVNVCKNX84C26KJOFS2KGW,33CY53T7YFR23AA9JZJ7YQKHNEPDHJ,36TBNKR908OQJ0J7TYB1DNN4VY1ED8,,$2.00,9,A3RAQZNM5V6A2M,6,0.92,1,1,1,becky,becky,Rachel,,"Amber, Jen",0,0,"amber, becky, jen, rachel",0,0,6,1,2,michelle,michelle,Rachel,,"June, Sue",0,0,"amber, michelle, june, rachel, sue, becky, jen",0,0,4,2,2,Rachel,Rachel,Rachel,,"Jen, Kimberly",1,0,"rachel, kimberly, michelle, amber, becky, june, sue, jen",0,0.1,11,3,2,Rachel,Rachel,Jill,,"Jill, Alice",0,0,"kimberly, alice, sue, becky, amber, rachel, june, michelle, jill, jen",0,-0.05,2,4,2,Rachel,Rachel,Karen,,"Rachel, Jill",0,0,"june, alice, rachel, michelle, karen, becky, jill, jen, sue, kimberly, amber",0,-0.05,8,5,1,Rachel,Rachel,jill,,"Karen, Jill",0,0,"amber, michelle, alice, june, rachel, kimberly, karen, jill, sue, becky, jen",0,0,7,6,2,Jill,Jill,Jill,,"Maria, Jill",1,0,"jill, becky, sue, alice, amber, rachel, karen, michelle, kimberly, maria, jen, june",0,0.1,2,7,1,Jill,Jill,Jill,,"Jill, Jill",1,0,"amber, michelle, alice, june, rachel, kimberly, maria, jill, karen, sue, becky, jen",0,0.1,5,8,2,Jill,Jill,Jill,,"June, Jill",1,0,"rachel, maria, jill, kimberly, michelle, june, alice, becky, karen, amber, sue, jen",0,0.1,8,9,2,Jill,Jill,Jill,,"Jill, Jill",1,0,"rachel, maria, jill, kimberly, michelle, june, alice, becky, karen, amber, sue, jen",0,0.1,10,10,1,Jill,Jill,Jill,,"Kristin, Jill",1,0,"jill, becky, sue, alice, amber, rachel, karen, june, michelle, kristin, maria, jen, kimberly",0,0.1,12,11,2,Jill,Jill,Jill,,"Maria, Jill",1,0,"amber, kristin, michelle, alice, june, rachel, kimberly, maria, jill, karen, sue, becky, jen",0,0.1,10,12,1,Jill,Jill,Jill,,"Jill, Jill",1,0,"amber, kristin, michelle, alice, june, rachel, kimberly, maria, jill, karen, sue, becky, jen",0,0.1,12,13,1,Jill,Jill,Jill,,"Jill, Jill",1,0,"sue, kristin, maria, june, amber, karen, rachel, jill, jen, alice, michelle, kimberly, becky",0,0.1,2,14,1,Jill,Jill,Jill,,"Jill, Jill",1,0,"sue, kristin, maria, june, amber, karen, rachel, jill, jen, alice, michelle, kimberly, becky",0,0.1,3,15,2,Jill,Jill,Jill,,"Jill, Jill",1,0,"june, alice, rachel, michelle, karen, maria, becky, jill, kristin, sue, jen, kimberly, amber",0,0.1,7,16,2,Jill,Jill,Jill,,"Jill, Jill",1,0,"jill, becky, sue, alice, amber, rachel, karen, michelle, kristin, kimberly, maria, jen, june",0,0.1,9,17,1,Jill,Jill,Jill,,"Jill, Jill",1,0,"karen, kimberly, alice, maria, sue, becky, amber, rachel, june, michelle, jen, kristin, jill",0,0.1,6,18,1,Jill,Jill,Jill,,"Jill, Jill",1,0,"amber, kristin, michelle, alice, june, rachel, kimberly, maria, jill, karen, sue, becky, jen",0,0.1,4,19,2,Jill,Jill,Jill,,"Jill, Jill",1,0,"sue, kristin, maria, june, amber, karen, rachel, jill, jen, alice, michelle, kimberly, becky",0,0.1,7,20,2,Jill,Jill,Jill,,"Jill, Jill",1,0,"alice, jen, kristin, jill, amber, maria, karen, june, rachel, kimberly, becky, michelle, sue",0,0.1,11,21,2,Jill,Jill,Jill,,"Jill, Jill",1,0,"jill, becky, sue, alice, amber, rachel, karen, michelle, kristin, kimberly, maria, jen, june",0,0.1,5,22,2,Jill,Jill,Jill,,"Jill, Jill",1,0,"alice, sue, kristin, kimberly, michelle, maria, rachel, jill, karen, becky, jen, amber, june",0,0.1,2,23,2,Jill,Jill,Jill,,"Jill, Jill",1,0,"jill, becky, sue, alice, amber, rachel, karen, michelle, kristin, kimberly, maria, jen, june",0,0.1,7,24,2,Jill,Jill,Jill,,"Jill, Jill",1,0,"alice, sue, kristin, kimberly, michelle, maria, rachel, jill, karen, becky, jen, amber, june",0,0.1,1,25,9,0,,0,4.82,0,1,110,xgm9imje,,50.136.166.130,2017-03-15 17:00:30.727795+00:00,1,A3PRZRK9IC5CBI,3FIUS151DV3SXIP78GWPXCMCOMWGG4,337F8MIIMZEDNEN99A0JEB7CBPN04J,2.14,4.14,ts44u31l,,,3J94SKDEKIQPIHS3ZR7OYAX95AR5DM,3O2Y2UIUCQVPYKR2XK6KOZJCED2KFX,337F8MIIMZEDNEN99A0JEB7CBPN04J,3KL228NDMVNVCKNX84C26KJOFS2KGW,33CY53T7YFR23AA9JZJ7YQKHNEPDHJ,36TBNKR908OQJ0J7TYB1DNN4VY1ED8,,$2.00,10,A3PRZRK9IC5CBI,21,0.94,1,1,2,Jen,Jen,(none),,"Lauren, Alice",0,0,"alice, (none), lauren, jen",0,0,12,1,1,Jen,Jen,Anna,,"Jane, Jill",0,0,"lauren, alice, anna, jane, (none), jill, jen",0,0,6,2,1,Jane,Jane,Jen,,"Sue, Rachel",0,0,"rachel, jill, lauren, jane, anna, alice, (none), sue, jen",0,0,1,3,1,Jen,Jen,kimberly,,"Maria, Maria",0,0,"(none), kimberly, alice, maria, sue, anna, jane, jen, rachel, lauren, jill",0,0,11,4,2,Jen,Jen,laura,,"Maria, Becky",0,0,"alice, maria, (none), rachel, laura, lauren, jane, becky, anna, jen, sue, jill, kimberly",0,0,6,5,2,Jen,Jen,Maria,,"Maria, Jill",0,0,"laura, lauren, alice, anna, jane, rachel, kimberly, maria, (none), jill, sue, becky, jen",0,0,12,6,1,Maria,Maria,Jill,,"Jill, Janice",0,0,"sue, becky, jill, laura, alice, lauren, rachel, anna, jen, janice, kimberly, maria, jane, (none)",0,0,1,7,2,Jill,Jill,jill,,"Rachel, Karen",1,0,"laura, lauren, alice, anna, jane, rachel, kimberly, janice, maria, jill, (none), sue, becky, karen, jen",0,0.1,8,8,1,Jill,Jill,Jill,,"Jill, Jill",1,0,"rachel, maria, jill, laura, janice, kimberly, lauren, jane, anna, alice, becky, karen, (none), sue, jen",0,0.1,4,9,1,Jill,Jill,Jill,,"Jill, Jill",1,0,"rachel, maria, jill, laura, janice, kimberly, lauren, jane, anna, alice, becky, karen, (none), sue, jen",0,0.1,5,10,2,Jill,Jill,Mary,,"Jill, Kristin",0,0,"jill, (none), sue, becky, mary, alice, laura, lauren, rachel, karen, anna, jen, kristin, janice, maria, jane, kimberly",0,-0.05,9,11,1,Jill,Jill,Jill,,"Jill, Jill",1,0,"laura, kristin, lauren, alice, anna, jane, rachel, sue, kimberly, janice, (none), jill, karen, mary, becky, maria, jen",0,0.1,7,12,1,Jill,Jill,karen,,"Jill, Jill",0,0,"laura, kristin, lauren, alice, anna, jane, rachel, sue, kimberly, janice, (none), jill, karen, mary, becky, maria, jen",0,-0.05,6,13,2,Jill,Jill,maria,,"Jill, Jill",0,0,"sue, kristin, (none), maria, mary, karen, rachel, jill, laura, lauren, jen, alice, janice, jane, anna, kimberly, becky",0,-0.05,7,14,2,Maria,Maria,Jill,,"Jill, Jill",0,0,"sue, kristin, (none), maria, mary, karen, rachel, jill, laura, lauren, jen, alice, janice, jane, anna, kimberly, becky",0,-0.05,7,15,2,Jill,Jill,Jill,,"Jill, Jill",1,0,"alice, rachel, (none), laura, mary, karen, lauren, maria, becky, jane, jill, anna, sue, jen, kristin, kimberly, janice",0,0.1,2,16,2,Jill,Jill,jill,,"Jill, Jill",1,0,"jill, sue, becky, mary, alice, laura, lauren, rachel, karen, anna, jane, kristin, kimberly, janice, maria, jen, (none)",0,0.1,5,17,1,Jill,Jill,Jill,,"Jill, Jill",1,0,"karen, (none), kimberly, alice, maria, sue, becky, anna, jen, janice, rachel, laura, mary, jane, lauren, kristin, jill",0,0.1,7,18,2,Jill,Jill,jill,,"Jill, Jill",1,0,"laura, kristin, lauren, alice, anna, jane, rachel, sue, kimberly, janice, (none), jill, karen, mary, becky, maria, jen",0,0.1,2,19,2,Jill,Jill,Jill,,"Jill, Jill",1,0,"sue, kristin, (none), maria, mary, karen, rachel, jill, laura, lauren, jen, alice, janice, jane, anna, kimberly, becky",0,0.1,3,20,2,Jill,Jill,jill,,"Jill, Jill",1,0,"(none), alice, laura, jen, kristin, jill, maria, janice, anna, karen, rachel, kimberly, becky, jane, mary, lauren, sue",0,0.1,2,21,2,Jill,Jill,JILL,,"Jill, Jill",1,0,"jill, sue, becky, mary, alice, laura, lauren, rachel, karen, anna, jane, kristin, kimberly, janice, maria, jen, (none)",0,0.1,1,22,1,Jill,Jill,jill,,"Jill, Jill",1,0,"jane, alice, (none), sue, mary, laura, kristin, maria, janice, rachel, kimberly, jill, karen, becky, jen, lauren, anna",0,0.1,1,23,2,Jill,Jill,Jill,,"Jill, Jill",1,0,"jill, sue, becky, mary, alice, laura, lauren, rachel, karen, anna, jane, kristin, kimberly, janice, maria, jen, (none)",0,0.1,2,24,2,Jill,Jill,Jill,,"Jill, Jill",1,0,"jane, alice, (none), sue, mary, laura, kristin, maria, janice, rachel, kimberly, jill, karen, becky, jen, lauren, anna",0,0.1,2,25,10,0,Thank you,0,4.14,0,1,1