5,xof6kipe,,66.91.209.94,2017-04-07 17:00:16.802079+00:00,1,AV22FQTJNBUZT,3QAVNHZ3EM579JQ5X71VEIGIOZ6ALF,3DGDV62G7OA68HC6MHWL0XBM2VEP2L,0.74,2.74,bckyc7ef,,,3DGDV62G7OA68HC6MHWL0XBM2VEP2L,311HQEI8RSH78MBIF2BINMU8NA7Z7W,3O2Y2UIUCQVPYKR2XK6KOZJCHPDFKU,3TL87MO8CMQ0IQ9KIKIL3ZWR6PIFLX,3NMDE2OGHG0L1YTUQZWF1QB1KRTFGY,3NMDE2OGHG0L1YTUQZWF1QB1KRTFGY,,$2.00,5,AV22FQTJNBUZT,23,0.44,1,1,1,Linda,Linda,Marie,,(none),0,0,"marie, linda, (none)",0,0,1,1,2,Marie,Marie,Susan,,Susan,0,0,"marie, susan, (none), linda",0,0,4,2,2,Susan,Susan,Marie,,Emily,0,0,"emily, susan, linda, (none), marie",0,0,9,3,2,Marie,Marie,Emily,,Linda,0,0,"linda, emily, (none), susan, marie",0,0,12,4,1,Marie,Marie,Gina,,Jane,0,0,"jane, (none), marie, gina, emily, linda, susan",0,0,11,5,1,Marie,Marie,Gina,,Michelle,0,0,"susan, jane, michelle, emily, gina, (none), marie, linda",0,0,10,6,1,Marie,Marie,Linda,,Janet,0,0,"susan, jane, michelle, janet, (none), marie, gina, linda, emily",0,0,10,7,2,Marie,Marie,Linda,,Carol,0,0,"jane, (none), michelle, marie, gina, emily, linda, janet, carol, susan",0,0,12,8,1,Marie,Marie,Linda,,Janet,0,0,"susan, jane, janet, michelle, emily, gina, (none), carol, marie, linda",0,0,8,9,2,Marie,Marie,Michelle,,Michelle,0,0,"carol, emily, linda, marie, michelle, susan, gina, jane, janet, (none)",0,0,4,10,1,Michelle,Michelle,Janet,,Michelle,0,0,"marie, linda, carol, susan, gina, jane, janet, michelle, emily, (none)",0,0,3,11,2,Michelle,Michelle,Linda,,Linda,0,0,"marie, susan, michelle, (none), linda, carol, janet, emily, gina, jane",0,0,8,12,2,Michelle,Michelle,Linda,,Linda,0,0,"marie, linda, susan, michelle, janet, jane, gina, emily, (none), carol",0,0,9,13,2,Linda,Linda,Linda,,Michelle,1,0,"linda, marie, emily, susan, jane, (none), michelle, carol, gina, janet",0,0.1,1,14,2,Linda,Linda,Michelle,,Janet,0,0,"carol, linda, michelle, marie, (none), emily, susan, jane, gina, janet",0,-0.05,1,15,2,Linda,Linda,Michelle,,Carol,0,0,"marie, linda, carol, susan, gina, jane, janet, michelle, emily, (none)",0,-0.05,5,16,2,Linda,Linda,Linda,,Linda,1,0,"jane, linda, michelle, (none), janet, carol, susan, gina, emily, marie",0,0.1,4,17,2,Linda,Linda,Michelle,,Linda,0,0,"linda, marie, emily, susan, jane, (none), michelle, carol, gina, janet",0,-0.05,6,18,2,Linda,Linda,Linda,,Michelle,1,0,"marie, susan, michelle, (none), linda, carol, janet, emily, gina, jane",0,0.1,10,19,2,Linda,Linda,Michelle,,Linda,0,0,"carol, emily, linda, marie, michelle, susan, gina, jane, janet, (none)",0,-0.05,11,20,2,Linda,Linda,Michelle,,Linda,0,0,"marie, susan, michelle, (none), linda, carol, janet, emily, gina, jane",0,-0.05,1,21,2,Linda,Linda,Linda,,Michelle,1,0,"marie, susan, michelle, (none), linda, carol, janet, emily, gina, jane",0,0.1,10,22,1,Linda,Linda,Linda,,Michelle,1,0,"marie, linda, susan, michelle, janet, jane, gina, emily, (none), carol",0,0.1,1,23,1,Linda,Linda,Linda,,Linda,1,0,"(none), jane, linda, carol, susan, gina, janet, marie, emily, michelle",0,0.1,3,24,1,Linda,Linda,Michelle,,Michelle,0,0,"gina, (none), michelle, jane, marie, linda, janet, carol, susan, emily",0,-0.05,3,25,5,0,,0,2.74,0,1,16,vnkh00ti,,67.173.208.33,2017-04-07 17:00:16.809673+00:00,1,A3A58JLUEA04PK,3K2755HG5S4J7YJLV6PZ96J4C6HDFF,3O2Y2UIUCQVPYKR2XK6KOZJCHPDFKU,0.86,2.86,bckyc7ef,,,3DGDV62G7OA68HC6MHWL0XBM2VEP2L,311HQEI8RSH78MBIF2BINMU8NA7Z7W,3O2Y2UIUCQVPYKR2XK6KOZJCHPDFKU,3TL87MO8CMQ0IQ9KIKIL3ZWR6PIFLX,3NMDE2OGHG0L1YTUQZWF1QB1KRTFGY,3NMDE2OGHG0L1YTUQZWF1QB1KRTFGY,,$2.00,6,A3A58JLUEA04PK,22,0.41,1,1,2,Emily,Emily,shaquanda,,(none),0,0,"shaquanda, (none), emily",0,0,8,1,1,Emily,Emily,kathy,,Jane,0,0,"emily, kathy, jane, (none), shaquanda",0,0,5,2,2,Emily,Emily,Linda,,Janet,0,0,"linda, (none), janet, emily, kathy, shaquanda, jane",0,0,10,3,1,Emily,Emily,Marie,,Linda,0,0,"linda, marie, emily, jane, (none), shaquanda, kathy, janet",0,0,12,4,2,Linda,Linda,sandra,,Susan,0,0,"jane, (none), sandra, marie, emily, linda, janet, kathy, shaquanda, susan",0,0,10,5,2,Linda,Linda,linda,,Susan,1,0,"shaquanda, jane, janet, susan, sandra, emily, kathy, (none), marie, linda",0,0.1,9,6,2,Linda,Linda,Marie,,Shirley,0,0,"susan, shirley, jane, janet, kathy, shaquanda, (none), marie, linda, emily, sandra",0,-0.05,10,7,1,Linda,Linda,Marie,,Susan,0,0,"jane, (none), sandra, marie, shirley, emily, linda, janet, kathy, shaquanda, susan",0,-0.05,12,8,1,Linda,Linda,amanda,,Janet,0,0,"shaquanda, susan, jane, janet, sandra, emily, kathy, linda, (none), amanda, marie, shirley",0,0,9,9,2,Linda,Linda,Anne,,Linda,0,0,"amanda, emily, shaquanda, linda, marie, shirley, susan, sandra, anne, jane, janet, kathy, (none)",0,0,9,10,2,Linda,Linda,Linda,,Michelle,1,0,"marie, linda, shaquanda, anne, kathy, susan, shirley, sandra, jane, amanda, janet, michelle, emily, (none)",0,0.1,9,11,1,Linda,Linda,Michelle,,Janet,0,0,"marie, jane, susan, linda, michelle, (none), sandra, janet, amanda, kathy, emily, shaquanda, shirley, anne",0,-0.05,8,12,1,Linda,Linda,Michelle,,Janet,0,0,"kathy, marie, shirley, susan, linda, anne, michelle, amanda, janet, shaquanda, jane, emily, (none), sandra",0,-0.05,8,13,1,Linda,Linda,Linda,,Michelle,1,0,"linda, shirley, marie, emily, amanda, susan, anne, jane, (none), michelle, shaquanda, kathy, sandra, janet",0,0.1,1,14,2,Linda,Linda,Linda,,Michelle,1,0,"amanda, shaquanda, linda, sandra, michelle, marie, (none), emily, susan, shirley, kathy, jane, janet, anne",0,0.1,9,15,1,Linda,Linda,Linda,,Michelle,1,0,"marie, shaquanda, anne, linda, kathy, susan, shirley, sandra, jane, amanda, janet, michelle, emily, (none)",0,0.1,3,16,1,Linda,Linda,Linda,,Janet,1,0,"jane, linda, anne, sandra, michelle, (none), amanda, kathy, janet, susan, emily, marie, shaquanda, shirley",0,0.1,4,17,1,Linda,Linda,Michelle,,Linda,0,0,"linda, shirley, marie, emily, amanda, susan, anne, jane, (none), michelle, shaquanda, kathy, sandra, janet",0,-0.05,11,18,1,Linda,Linda,michelle,,Linda,0,0,"marie, jane, susan, linda, michelle, (none), sandra, janet, amanda, kathy, emily, shaquanda, shirley, anne",0,-0.05,8,19,1,Linda,Linda,Linda,,Michelle,1,0,"amanda, emily, shaquanda, linda, marie, shirley, susan, michelle, anne, sandra, jane, janet, kathy, (none)",0,0.1,2,20,2,Linda,Linda,Michelle,,Michelle,0,0,"marie, jane, susan, linda, michelle, (none), sandra, janet, amanda, kathy, emily, shaquanda, shirley, anne",0,-0.05,2,21,2,Linda,Linda,janet,,Janet,0,0,"marie, jane, susan, linda, michelle, (none), sandra, janet, amanda, kathy, emily, shaquanda, shirley, anne",0,-0.05,9,22,2,Linda,Linda,Michelle,,Michelle,0,0,"kathy, marie, shirley, susan, linda, anne, michelle, amanda, janet, shaquanda, jane, emily, (none), sandra",0,-0.05,4,23,2,Linda,Linda,Linda,,Janet,1,0,"shirley, (none), jane, linda, sandra, kathy, anne, janet, shaquanda, marie, amanda, emily, michelle, susan",0,0.1,3,24,2,Linda,Linda,Linda,,Michelle,1,0,"shirley, (none), michelle, jane, marie, linda, janet, anne, susan, kathy, sandra, shaquanda, amanda, emily",0,0.1,12,25,6,0,,0,2.86,0,1,17,sy8g7ko1,,68.231.244.17,2017-04-07 17:00:20.075234+00:00,1,A20O44S26VN11P,3IFS6Q0HJIK9JE4TT4Q972IWT1JSIF,3O2Y2UIUCQVPYKR2XK6KOZJCHPDFKU,1.26,3.26,bckyc7ef,,,3DGDV62G7OA68HC6MHWL0XBM2VEP2L,311HQEI8RSH78MBIF2BINMU8NA7Z7W,3O2Y2UIUCQVPYKR2XK6KOZJCHPDFKU,3TL87MO8CMQ0IQ9KIKIL3ZWR6PIFLX,3NMDE2OGHG0L1YTUQZWF1QB1KRTFGY,3NMDE2OGHG0L1YTUQZWF1QB1KRTFGY,,$2.00,7,A20O44S26VN11P,10,0.41,1,1,1,Cynthia,Cynthia,michelle,,Michelle,0,0,"michelle, cynthia",0,0,7,1,2,Michelle,Michelle,susan,,Anne,0,0,"anne, susan, michelle, cynthia",0,0,3,2,2,michelle,michelle,Shirley,,Michelle,0,0,"susan, michelle, shirley, cynthia, anne",0,0,8,3,1,michelle,michelle,Susan,,Gina,0,0,"shirley, cynthia, susan, anne, michelle, gina",0,0,7,4,1,susan,susan,michelle,,Janet,0,0,"michelle, shirley, gina, cynthia, janet, susan, anne",0,0,7,5,1,susan,susan,Shirley,,Linda,0,0,"anne, susan, janet, michelle, gina, linda, cynthia, shirley",0,0,7,6,2,shirley,shirley,michelle,,Becky,0,0,"susan, shirley, becky, michelle, janet, anne, cynthia, gina, linda",0,0,1,7,2,michelle,michelle,Susan,,Gina,0,0,"michelle, shirley, gina, becky, linda, cynthia, janet, susan, anne",0,0,8,8,1,susan,susan,Michelle,,Janet,0,0,"anne, susan, janet, michelle, gina, linda, becky, cynthia, shirley",0,0,2,9,2,michelle,michelle,michelle,,Linda,1,0,"becky, cynthia, linda, shirley, susan, michelle, anne, gina, janet",0,0.1,3,10,1,michelle,michelle,Michelle,,Linda,1,0,"anne, linda, becky, susan, shirley, cynthia, gina, janet, michelle",0,0.1,4,11,2,michelle,michelle,michelle,,Linda,1,0,"cynthia, susan, michelle, becky, linda, janet, gina, shirley, anne",0,0.1,2,12,1,michelle,michelle,Susan,,Janet,0,0,"shirley, susan, linda, anne, becky, cynthia, michelle, janet, gina",0,-0.05,12,13,1,susan,susan,Michelle,,Michelle,0,0,"linda, shirley, cynthia, susan, anne, michelle, janet, gina, becky",0,-0.05,5,14,2,susan,susan,michelle,,Michelle,0,0,"becky, linda, michelle, cynthia, susan, shirley, gina, janet, anne",0,-0.05,11,15,2,michelle,michelle,michelle,,Linda,1,0,"anne, linda, becky, susan, shirley, cynthia, gina, janet, michelle",0,0.1,4,16,1,michelle,michelle,michelle,,Linda,1,0,"linda, anne, michelle, janet, susan, gina, cynthia, becky, shirley",0,0.1,9,17,1,michelle,michelle,michelle,,Janet,1,0,"linda, shirley, cynthia, susan, anne, michelle, janet, gina, becky",0,0.1,4,18,1,michelle,michelle,Michelle,,Michelle,1,0,"cynthia, susan, michelle, becky, linda, janet, gina, shirley, anne",0,0.1,6,19,2,michelle,michelle,Michelle,,Linda,1,0,"becky, cynthia, linda, shirley, susan, michelle, anne, gina, janet",0,0.1,7,20,1,michelle,michelle,Michelle,,Michelle,1,0,"cynthia, susan, michelle, becky, linda, janet, gina, shirley, anne",0,0.1,6,21,1,michelle,michelle,Linda,,Michelle,0,0,"cynthia, susan, michelle, becky, linda, janet, gina, shirley, anne",0,-0.05,7,22,1,linda,linda,michelle,,Linda,0,0,"shirley, susan, linda, anne, becky, cynthia, michelle, janet, gina",0,-0.05,11,23,2,michelle,michelle,Michelle,,Janet,1,0,"shirley, becky, linda, susan, gina, anne, janet, cynthia, michelle",0,0.1,1,24,2,michelle,michelle,michelle,,Linda,1,0,"shirley, gina, cynthia, michelle, becky, janet, linda, susan, anne",0,0.1,5,25,7,0,,0,3.26,0,1,18,jbp9lpgp,,50.103.110.105,2017-04-07 17:00:20.303305+00:00,1,A9HQ3E0F2AGVO,3VNXK88KKCJW05SUJ5P15W309FQV94,3O2Y2UIUCQVPYKR2XK6KOZJCHPDFKU,0.92,2.92,bckyc7ef,,,3DGDV62G7OA68HC6MHWL0XBM2VEP2L,311HQEI8RSH78MBIF2BINMU8NA7Z7W,3O2Y2UIUCQVPYKR2XK6KOZJCHPDFKU,3TL87MO8CMQ0IQ9KIKIL3ZWR6PIFLX,3NMDE2OGHG0L1YTUQZWF1QB1KRTFGY,3NMDE2OGHG0L1YTUQZWF1QB1KRTFGY,,$2.00,8,A9HQ3E0F2AGVO,19,0.22,1,1,1,Janet,Janet,(none),,(none),0,0,"(none), janet",0,0,5,1,1,Janet,Janet,Linda,,Marie,0,0,"janet, marie, (none), linda",0,0,7,2,1,Linda,Linda,Marie,,Shirley,0,0,"shirley, linda, (none), marie, janet",0,0,1,3,1,Linda,Linda,Linda,,Janet,1,0,"linda, shirley, (none), janet, marie",0,0.1,11,4,1,Janet,Janet,Linda,,Michelle,0,0,"(none), michelle, marie, shirley, linda, janet",0,-0.05,1,5,1,Janet,Janet,Janet,,Jane,1,0,"jane, janet, michelle, linda, (none), marie, shirley",0,0.1,5,6,2,Michelle,Michelle,Janet,,Janet,0,0,"shirley, jane, michelle, janet, (none), marie, linda",0,-0.05,6,7,1,Janet,Janet,Janet,,Janet,1,0,"jane, (none), michelle, marie, shirley, linda, janet",0,0.1,6,8,2,Janet,Janet,Janet,,Janet,1,0,"shirley, jane, janet, michelle, (none), marie, linda",0,0.1,5,9,1,Janet,Janet,Linda,,Michelle,0,0,"linda, marie, shirley, michelle, jane, janet, (none)",0,-0.05,12,10,1,Michelle,Michelle,Linda,,Linda,0,0,"marie, linda, shirley, jane, janet, michelle, (none)",0,-0.05,1,11,1,Linda,Linda,Linda,,Michelle,1,0,"marie, linda, michelle, (none), janet, shirley, jane",0,0.1,7,12,1,Michelle,Michelle,Linda,,Michelle,0,0,"marie, shirley, linda, michelle, janet, jane, (none)",0,-0.05,7,13,1,Linda,Linda,Linda,,Linda,1,0,"linda, shirley, marie, jane, (none), michelle, janet",0,0.1,10,14,2,Linda,Linda,Janet,,Linda,0,0,"linda, michelle, marie, (none), shirley, jane, janet",0,-0.05,7,15,2,Linda,Linda,Janet,,Michelle,0,0,"marie, linda, shirley, jane, janet, michelle, (none)",0,-0.05,7,16,2,janet,janet,Linda,,Michelle,0,0,"jane, linda, michelle, (none), janet, marie, shirley",0,-0.05,5,17,1,Janet,Janet,Janet,,Janet,1,0,"linda, shirley, marie, jane, (none), michelle, janet",0,0.1,9,18,1,Linda,Linda,Janet,,Michelle,0,0,"marie, linda, michelle, (none), janet, shirley, jane",0,-0.05,1,19,2,Janet,Janet,Janet,,Michelle,1,0,"linda, marie, shirley, michelle, jane, janet, (none)",0,0.1,1,20,2,Janet,Janet,Janet,,Michelle,1,0,"marie, linda, michelle, (none), janet, shirley, jane",0,0.1,8,21,1,Janet,Janet,Janet,,Michelle,1,0,"marie, linda, michelle, (none), janet, shirley, jane",0,0.1,2,22,2,Janet,Janet,Linda,,Michelle,0,0,"marie, shirley, linda, michelle, janet, jane, (none)",0,-0.05,5,23,2,Janet,Janet,Janet,,Linda,1,0,"shirley, (none), jane, linda, janet, marie, michelle",0,0.1,7,24,2,Janet,Janet,Janet,,Linda,1,0,"shirley, (none), michelle, jane, marie, janet, linda",0,0.1,11,25,8,0,,0,2.92,0,1,19,ipmli4a9,,24.24.131.40,2017-04-07 17:00:20.907976+00:00,1,A2SJC9VRBGNC58,3GLB5JMZFXWPLYFG6QVHRRJGDLHDGE,3O2Y2UIUCQVPYKR2XK6KOZJCHPDFKU,1.29,3.29,bckyc7ef,,,3DGDV62G7OA68HC6MHWL0XBM2VEP2L,311HQEI8RSH78MBIF2BINMU8NA7Z7W,3O2Y2UIUCQVPYKR2XK6KOZJCHPDFKU,3TL87MO8CMQ0IQ9KIKIL3ZWR6PIFLX,3NMDE2OGHG0L1YTUQZWF1QB1KRTFGY,3NMDE2OGHG0L1YTUQZWF1QB1KRTFGY,,$2.00,9,A2SJC9VRBGNC58,6,0.29,1,1,2,(none),(none),Janet,,Michelle,0,1,"michelle, janet",1,0,5,1,2,Janet,Janet,Marie,,Michelle,0,0,"janet, marie, michelle",0,0,9,2,2,Marie,Marie,Linda,,Linda,0,0,"linda, michelle, marie, janet",0,0,1,3,2,Linda,Linda,Jane,,Linda,0,0,"linda, michelle, jane, janet, marie",0,0,4,4,2,Linda,Linda,Jane,,Susan,0,0,"jane, michelle, marie, linda, janet, susan",0,0,3,5,1,Susan,Susan,Linda,,Janet,0,0,"susan, jane, janet, michelle, marie, linda",0,0,1,6,2,Susan,Susan,Linda,,Michelle,0,0,"susan, jane, michelle, janet, marie, linda",0,0,11,7,1,Linda,Linda,Linda,,Anne,1,0,"jane, michelle, marie, linda, janet, susan, anne",0,0.1,2,8,2,Linda,Linda,Shirley,,Janet,0,0,"anne, shirley, susan, jane, janet, michelle, marie, linda",0,-0.05,11,9,1,Linda,Linda,Shirley,,Shirley,0,0,"linda, shirley, marie, susan, michelle, anne, janet, jane",0,-0.05,1,10,2,Shirley,Shirley,Linda,,Michelle,0,0,"marie, anne, linda, susan, shirley, jane, janet, michelle",0,0,12,11,2,Linda,Linda,Shirley,,Janet,0,0,"marie, susan, michelle, linda, janet, anne, shirley, jane",0,0,4,12,2,Linda,Linda,Linda,,Janet,1,0,"shirley, marie, susan, linda, anne, michelle, janet, jane",0,0.1,3,13,2,Linda,Linda,Michelle,,Mary,0,0,"linda, shirley, marie, susan, jane, anne, michelle, mary, janet",0,-0.05,8,14,2,Linda,Linda,Linda,,Susan,1,0,"linda, michelle, marie, mary, susan, shirley, jane, janet, anne",0,0.1,4,15,1,Linda,Linda,Linda,,Michelle,1,0,"marie, anne, linda, mary, susan, shirley, jane, janet, michelle",0,0.1,11,16,2,Linda,Linda,Linda,,Michelle,1,0,"jane, linda, anne, michelle, janet, susan, mary, marie, shirley",0,0.1,1,17,2,Linda,Linda,Linda,,Linda,1,0,"linda, shirley, marie, susan, anne, jane, michelle, mary, janet",0,0.1,7,18,2,Linda,Linda,Linda,,Michelle,1,0,"marie, susan, linda, michelle, mary, janet, anne, shirley, jane",0,0.1,4,19,2,Linda,Linda,Linda,,Janet,1,0,"linda, marie, shirley, susan, michelle, anne, mary, jane, janet",0,0.1,8,20,2,Linda,Linda,Linda,,Janet,1,0,"marie, susan, linda, michelle, mary, janet, anne, shirley, jane",0,0.1,11,21,2,Linda,Linda,Linda,,Janet,1,0,"marie, susan, linda, michelle, mary, janet, anne, shirley, jane",0,0.1,6,22,1,Linda,Linda,Michelle,,Janet,0,0,"shirley, marie, susan, linda, anne, mary, michelle, janet, jane",0,-0.05,8,23,2,Linda,Linda,Linda,,Linda,1,0,"shirley, mary, jane, linda, anne, janet, marie, michelle, susan",0,0.1,8,24,2,Linda,Linda,Linda,,Michelle,1,0,"shirley, michelle, jane, marie, linda, janet, susan, anne, mary",0,0.1,8,25,9,0,thank you,0,3.29,0,1,110,l804er2h,,184.156.237.146,2017-04-07 17:00:22.049051+00:00,1,A1D36KAPWAUPTJ,3QL2OFSM96JLQYQOTYD1X5AVTXRNCW,3TL87MO8CMQ0IQ9KIKIL3ZWR6PIFLX,1.29,3.29,bckyc7ef,,,3DGDV62G7OA68HC6MHWL0XBM2VEP2L,311HQEI8RSH78MBIF2BINMU8NA7Z7W,3O2Y2UIUCQVPYKR2XK6KOZJCHPDFKU,3TL87MO8CMQ0IQ9KIKIL3ZWR6PIFLX,3NMDE2OGHG0L1YTUQZWF1QB1KRTFGY,3NMDE2OGHG0L1YTUQZWF1QB1KRTFGY,,$2.00,10,A1D36KAPWAUPTJ,18,0.39,1,1,1,Particia,Particia,Janice,,Linda,0,0,"linda, janice, particia",0,0,4,1,2,Linda,Linda,Janet,,Gina,0,0,"particia, janet, janice, gina, linda",0,0,7,2,2,linda,linda,emily,,Michelle,0,0,"janice, linda, michelle, janet, particia, emily, gina",0,0,11,3,2,linda,linda,kelly,,Janet,0,0,"linda, kelly, emily, particia, michelle, janet, gina, janice",0,0,5,4,2,janet,janet,Janet,,Michelle,1,0,"michelle, gina, emily, linda, janice, kelly, janet, particia",0,0.1,9,5,1,janet,janet,Janet,,Michelle,1,0,"janet, michelle, emily, gina, kelly, particia, janice, linda",0,0.1,4,6,1,janet,janet,amanda,,Linda,0,0,"janice, kelly, michelle, janet, particia, amanda, gina, linda, emily",0,-0.05,7,7,2,janet,janet,Janet,,Janet,1,0,"michelle, gina, amanda, janice, linda, emily, kelly, janet, particia",0,0.1,5,8,1,janet,janet,Janet,,Linda,1,0,"janet, michelle, emily, gina, kelly, particia, janice, amanda, linda",0,0.1,1,9,2,janet,janet,Linda,,Linda,0,0,"amanda, emily, linda, michelle, gina, janet, particia, janice, kelly",0,-0.05,11,10,2,janet,janet,Janet,,Linda,1,0,"linda, gina, particia, janet, amanda, kelly, michelle, emily, janice",0,0.1,8,11,2,janet,janet,Janet,,Janet,1,0,"janice, michelle, linda, janet, amanda, particia, emily, kelly, gina",0,0.1,12,12,1,janet,janet,Janet,,Michelle,1,0,"particia, linda, michelle, janet, amanda, kelly, gina, emily, janice",0,0.1,4,13,2,janet,janet,mary,,Susan,0,0,"linda, kelly, emily, amanda, particia, susan, michelle, mary, janet, gina, janice",0,-0.05,6,14,1,janet,janet,janet,,Michelle,1,0,"amanda, linda, michelle, janice, kelly, particia, mary, emily, susan, gina, janet",0,0.1,8,15,1,(none),(none),Janet,,Linda,0,1,"linda, mary, susan, gina, particia, amanda, janet, kelly, michelle, emily, janice",1,-0.05,6,16,1,janet,janet,Janet,,Janet,1,0,"linda, michelle, janice, kelly, amanda, janet, susan, gina, particia, emily, mary",0,0.1,6,17,1,janet,janet,janet,,Michelle,1,0,"linda, kelly, emily, amanda, susan, particia, michelle, mary, janet, gina, janice",0,0.1,3,18,1,janet,janet,Michelle,,Michelle,0,0,"janice, susan, linda, michelle, mary, amanda, janet, emily, particia, kelly, gina",0,-0.05,9,19,1,janet,janet,Janet,,Michelle,1,0,"amanda, emily, linda, susan, michelle, mary, janet, gina, particia, janice, kelly",0,0.1,3,20,2,Janet,Janet,michelle,,Michelle,0,0,"janice, susan, linda, michelle, mary, amanda, janet, emily, particia, kelly, gina",0,-0.05,7,21,2,Janet,Janet,Janet,,Michelle,1,0,"janice, susan, linda, michelle, mary, amanda, janet, emily, particia, kelly, gina",0,0.1,2,22,2,(none),(none),janet,,Michelle,0,1,"particia, susan, linda, mary, michelle, amanda, janet, kelly, gina, emily, janice",1,-0.05,2,23,2,Janet,Janet,janet,,Janet,1,0,"mary, linda, gina, janet, janice, amanda, emily, kelly, michelle, susan, particia",0,0.1,5,24,1,Janet,Janet,Linda,,Michelle,0,0,"particia, gina, kelly, janice, michelle, linda, janet, susan, mary, amanda, emily",0,-0.05,10,25,10,0,Thank you! nice hit as always.,0,3.29,0,1,112,6ecnd5ku,,24.216.117.178,2017-04-07 17:00:32.472627+00:00,1,AMPMTF5IAAMK8,3634BBTX0OV0F9Z7NKQA03ZH4BPIFM,3DGDV62G7OA68HC6MHWL0XBM2VEP2L,1.03,3.03,bckyc7ef,,,3DGDV62G7OA68HC6MHWL0XBM2VEP2L,311HQEI8RSH78MBIF2BINMU8NA7Z7W,3O2Y2UIUCQVPYKR2XK6KOZJCHPDFKU,3TL87MO8CMQ0IQ9KIKIL3ZWR6PIFLX,3NMDE2OGHG0L1YTUQZWF1QB1KRTFGY,3NMDE2OGHG0L1YTUQZWF1QB1KRTFGY,,$2.00,11,AMPMTF5IAAMK8,0,0.38,1,1,1,(none),(none),Gina,,Linda,0,1,"linda, gina",1,0,12,1,1,Gina,Gina,Victoria,,Susan,0,0,"gina, susan, victoria, linda",0,0,11,2,1,Gina,Gina,Gina,,Michelle,1,0,"linda, michelle, susan, gina, victoria",0,0.1,3,3,2,Gina,Gina,Vicky,,Linda,0,0,"linda, victoria, susan, michelle, vicky, gina",0,-0.05,8,4,2,Gina,Gina,Marie,,Jane,0,0,"jane, michelle, marie, vicky, gina, victoria, linda, susan",0,-0.05,11,5,2,Gina,Gina,Marie,,Michelle,0,0,"vicky, susan, jane, michelle, gina, victoria, marie, linda",0,0,10,6,2,Gina,Gina,Shirley,,Linda,0,0,"susan, shirley, jane, michelle, marie, vicky, gina, linda, victoria",0,0,9,7,2,Gina,Gina,Anne,,Marie,0,0,"jane, michelle, marie, vicky, shirley, gina, victoria, linda, susan, anne",0,0,11,8,2,Anne,Anne,Shirley,,Janet,0,0,"anne, vicky, susan, jane, janet, michelle, gina, linda, victoria, marie, shirley",0,0,7,9,1,Anne,Anne,Linda,,Linda,0,0,"vicky, linda, marie, shirley, michelle, susan, anne, gina, janet, jane, victoria",0,0,9,10,1,Anne,Anne,Michelle,,Michelle,0,0,"victoria, marie, vicky, anne, linda, susan, shirley, jane, gina, janet, michelle",0,0,10,11,2,Michelle,Michelle,Michelle,,Shirley,1,0,"marie, susan, michelle, linda, victoria, janet, anne, vicky, gina, shirley, jane",0,0.1,1,12,2,Michelle,Michelle,Linda,,Michelle,0,0,"marie, shirley, susan, linda, anne, michelle, janet, jane, gina, vicky, victoria",0,-0.05,8,13,1,Michelle,Michelle,Michelle,,Linda,1,0,"linda, victoria, shirley, marie, susan, jane, anne, michelle, vicky, janet, gina",0,0.1,11,14,1,Michelle,Michelle,Linda,,Janet,0,0,"linda, michelle, victoria, gina, marie, susan, shirley, jane, vicky, janet, anne",0,-0.05,5,15,1,Michelle,Michelle,Michelle,,Linda,1,0,"victoria, marie, vicky, anne, linda, susan, shirley, jane, gina, janet, michelle",0,0.1,10,16,1,Michelle,Michelle,Michelle,,Michelle,1,0,"jane, linda, anne, michelle, janet, susan, vicky, gina, marie, victoria, shirley",0,0.1,11,17,2,Michelle,Michelle,Linda,,Linda,0,0,"linda, victoria, shirley, marie, susan, jane, anne, michelle, vicky, janet, gina",0,-0.05,11,18,1,Michelle,Michelle,Michelle,,Michelle,1,0,"marie, susan, michelle, linda, victoria, janet, anne, vicky, gina, shirley, jane",0,0.1,11,19,1,Michelle,Michelle,Michelle,,Michelle,1,0,"vicky, linda, marie, shirley, michelle, susan, anne, gina, janet, jane, victoria",0,0.1,12,20,1,Michelle,Michelle,Linda,,Michelle,0,0,"marie, susan, michelle, linda, victoria, janet, anne, vicky, gina, shirley, jane",0,-0.05,2,21,1,Michelle,Michelle,Michelle,,Linda,1,0,"marie, susan, michelle, linda, victoria, janet, anne, vicky, gina, shirley, jane",0,0.1,11,22,1,Michelle,Michelle,Linda,,Linda,0,0,"marie, shirley, susan, linda, anne, michelle, janet, jane, gina, vicky, victoria",0,-0.05,4,23,1,Michelle,Michelle,Michelle,,Linda,1,0,"shirley, jane, linda, vicky, susan, gina, anne, janet, victoria, marie, michelle",0,0.1,4,24,1,Michelle,Michelle,Michelle,,Michelle,1,0,"gina, shirley, michelle, vicky, jane, marie, janet, linda, victoria, susan, anne",0,0.1,6,25,12,0,,0,3.03,0,1,113,0sr8v9ja,,65.101.254.170,2017-04-07 17:00:34.842369+00:00,1,A3JP7DIFRS0ZBY,32M8BPYGATN6T9V2Y4WSIOZT5QPIGL,311HQEI8RSH78MBIF2BINMU8NA7Z7W,1.02,3.02,bckyc7ef,,,3DGDV62G7OA68HC6MHWL0XBM2VEP2L,311HQEI8RSH78MBIF2BINMU8NA7Z7W,3O2Y2UIUCQVPYKR2XK6KOZJCHPDFKU,3TL87MO8CMQ0IQ9KIKIL3ZWR6PIFLX,3NMDE2OGHG0L1YTUQZWF1QB1KRTFGY,3NMDE2OGHG0L1YTUQZWF1QB1KRTFGY,,$2.00,12,A3JP7DIFRS0ZBY,12,0.27,1,1,2,michelle,michelle,Cynthia,,Emily,0,0,"michelle, cynthia, emily",0,0,7,1,2,michelle,michelle,Linda,,Jane,0,0,"emily, jane, linda, michelle, cynthia",0,0,2,2,2,michelle,michelle,Linda,,Rebecca,0,0,"rebecca, cynthia, michelle, linda, emily, jane",0,0,6,3,2,michelle,michelle,Linda,,Susan,0,0,"linda, cynthia, rebecca, emily, susan, jane, michelle",0,0,6,4,2,michelle,michelle,susan,,Janet,0,0,"jane, michelle, emily, linda, cynthia, janet, susan, rebecca",0,0,7,5,1,michelle,michelle,Susan,,Michelle,0,0,"susan, jane, janet, michelle, emily, rebecca, cynthia, linda",0,0,3,6,1,michelle,michelle,shirley,,Michelle,0,0,"susan, shirley, jane, michelle, janet, rebecca, cynthia, linda, emily",0,0,1,7,2,michelle,michelle,Michelle,,Janet,1,0,"jane, michelle, shirley, emily, linda, cynthia, janet, susan, rebecca",0,0.1,9,8,1,michelle,michelle,janet,,Michelle,0,0,"susan, jane, janet, michelle, emily, linda, rebecca, cynthia, shirley",0,-0.05,3,9,1,michelle,michelle,michelle,,Janet,1,0,"rebecca, cynthia, emily, linda, shirley, susan, michelle, janet, jane",0,0.1,3,10,2,michelle,michelle,Michelle,,Michelle,1,0,"linda, rebecca, susan, shirley, jane, cynthia, janet, michelle, emily",0,0.1,6,11,1,michelle,michelle,michelle,,Linda,1,0,"rebecca, cynthia, susan, michelle, linda, janet, emily, shirley, jane",0,0.1,2,12,2,michelle,michelle,Michelle,,Janet,1,0,"shirley, susan, linda, rebecca, cynthia, michelle, janet, jane, emily",0,0.1,6,13,2,michelle,michelle,Michelle,,Janet,1,0,"linda, shirley, cynthia, rebecca, emily, susan, jane, michelle, janet",0,0.1,3,14,1,michelle,michelle,susan,,Michelle,0,0,"linda, michelle, cynthia, emily, susan, shirley, jane, janet, rebecca",0,-0.05,11,15,2,michelle,michelle,michelle,,Michelle,1,0,"linda, rebecca, susan, shirley, jane, cynthia, janet, michelle, emily",0,0.1,1,16,2,michelle,michelle,michelle,,Linda,1,0,"jane, linda, michelle, janet, cynthia, susan, emily, rebecca, shirley",0,0.1,9,17,1,michelle,michelle,janet,,Michelle,0,0,"linda, shirley, cynthia, rebecca, emily, susan, jane, michelle, janet",0,-0.05,1,18,2,michelle,michelle,janet,,Michelle,0,0,"rebecca, cynthia, susan, michelle, linda, janet, emily, shirley, jane",0,-0.05,5,19,2,michelle,michelle,Michelle,,Linda,1,0,"rebecca, cynthia, emily, linda, shirley, susan, michelle, janet, jane",0,0.1,6,20,2,michelle,michelle,Michelle,,Linda,1,0,"rebecca, cynthia, susan, michelle, linda, janet, emily, shirley, jane",0,0.1,4,21,1,michelle,michelle,janet,,Linda,0,0,"rebecca, cynthia, susan, michelle, linda, janet, emily, shirley, jane",0,-0.05,3,22,2,michelle,michelle,linda,,Michelle,0,0,"shirley, susan, linda, rebecca, cynthia, michelle, janet, jane, emily",0,-0.05,11,23,2,m,m,Linda,,Michelle,0,0,"shirley, jane, linda, susan, m, janet, emily, cynthia, rebecca, michelle",0,-0.05,11,24,1,michelle,michelle,michelle,,Linda,1,0,"shirley, cynthia, michelle, jane, linda, m, janet, rebecca, susan, emily",0,0.1,5,25,13,0,,0,3.02,0,1,1