13,7z6sw0uj,,74.67.164.166,2017-04-14 17:00:11.578656+00:00,1,A36QWTX7JIIDT9,3M0NZ3JDP1ZU82VSHC1NEMBUCGNZ50,3D7VY91L65YUBRFPDUX4KMKVY84BMW,2.45,4.45,fzx5k4m4,,,3D7VY91L65YUBRFPDUX4KMKVY84BMW,3S4TINXCC0OIBU01QACHCQ90T8JBOB,31MCUE39BKNPGMFQNYK3PY2MEUFG32,34KYK9TV2R9X9MSUXRTQWVJ1QXMBS8,3NMDE2OGHG0L1YTUQZWF1QB1KRTFGY,3NMDE2OGHG0L1YTUQZWF1QB1KRTFGY,,$2.00,13,A36QWTX7JIIDT9,5,0.65,1,1,1,Sue,Sue,susan,,,0,0,"susan, sue",0,0,7,1,1,Sue,Sue,sue,,,1,0,"sue, susan",0,0.1,12,2,2,sue,sue,Jessica,,,0,0,"sue, jessica, susan",0,-0.05,9,3,2,Sue,Sue,Linda,,,0,0,"linda, susan, sue, jessica",0,-0.05,10,4,2,Sue,Sue,Amanda,,,0,0,"sue, jessica, linda, amanda, susan",0,0,5,5,1,Sue,Sue,Jessica,,,0,0,"jessica, linda, susan, sue, amanda",0,0,12,6,2,jessica,jessica,Mary,,,0,0,"sue, jessica, susan, linda, amanda, mary",0,0,2,7,1,jessica,jessica,jessica,,,1,0,"jessica, mary, linda, susan, sue, amanda",0,0.1,9,8,2,jessica,jessica,Jessica,,,1,0,"linda, susan, amanda, mary, jessica, sue",0,0.1,9,9,2,jessica,jessica,Sue,,,0,0,"susan, amanda, linda, sue, jessica, mary",0,-0.05,4,10,2,jessica,jessica,Jessica,,,1,0,"susan, amanda, linda, sue, jessica, mary",0,0.1,9,11,1,jessica,jessica,Jessica,,,1,0,"jessica, mary, linda, susan, sue, amanda",0,0.1,8,12,1,jessica,jessica,Anne,,,0,0,"susan, mary, anne, jessica, linda, sue, amanda",0,-0.05,5,13,2,jessica,jessica,Jessica,,,1,0,"susan, amanda, linda, sue, jessica, anne, mary",0,0.1,3,14,1,jessica,jessica,Jessica,,,1,0,"sue, susan, anne, jessica, mary, amanda, linda",0,0.1,7,15,2,jessica,jessica,Jessica,,,1,0,"susan, amanda, linda, sue, jessica, anne, mary",0,0.1,4,16,2,jessica,jessica,Jessica,,,1,0,"sue, linda, susan, jessica, amanda, mary, anne",0,0.1,10,17,1,jessica,jessica,jessica,,,1,0,"susan, amanda, linda, sue, jessica, anne, mary",0,0.1,2,18,2,jessica,jessica,Jessica,,,1,0,"anne, jessica, mary, amanda, susan, sue, linda",0,0.1,2,19,2,jessica,jessica,Jessica,,,1,0,"linda, anne, sue, amanda, jessica, mary, susan",0,0.1,8,20,1,jessica,jessica,jessica,,,1,0,"linda, mary, jessica, sue, susan, anne, amanda",0,0.1,2,21,2,jessica,jessica,Jessica,,,1,0,"linda, anne, sue, amanda, jessica, mary, susan",0,0.1,8,22,2,jessica,jessica,Jessica,,,1,0,"anne, susan, linda, sue, jessica, amanda, mary",0,0.1,4,23,2,jessica,jessica,Jessica,,,1,0,"anne, susan, linda, sue, jessica, amanda, mary",0,0.1,5,24,1,jessica,jessica,Jessica,,,1,0,"linda, anne, sue, amanda, jessica, mary, susan",0,0.1,11,25,2,jessica,jessica,Jessica,,,1,0,"jessica, mary, anne, linda, sue, susan, amanda",0,0.1,7,26,1,jessica,jessica,Jessica,,,1,0,"sue, jessica, susan, linda, amanda, anne, mary",0,0.1,8,27,1,jessica,jessica,jessica,,,1,0,"linda, susan, amanda, anne, mary, jessica, sue",0,0.1,4,28,13,0,,0,4.45,0,1,114,i6wbaos2,,192.67.88.5,2017-04-14 17:00:14.107404+00:00,1,A2ZJAEL03VTZ8,3137ONMDKG6UD4TG2L61X911EJTEGS,34KYK9TV2R9X9MSUXRTQWVJ1QXMBS8,2.4,4.4,fzx5k4m4,,,3D7VY91L65YUBRFPDUX4KMKVY84BMW,3S4TINXCC0OIBU01QACHCQ90T8JBOB,31MCUE39BKNPGMFQNYK3PY2MEUFG32,34KYK9TV2R9X9MSUXRTQWVJ1QXMBS8,3NMDE2OGHG0L1YTUQZWF1QB1KRTFGY,3NMDE2OGHG0L1YTUQZWF1QB1KRTFGY,,$2.00,14,A2ZJAEL03VTZ8,20,0.65,1,1,2,rebecca,rebecca,Anne,,,0,0,"rebecca, anne",0,0,8,1,2,anne,anne,Stephanie,,,0,0,"anne, rebecca, stephanie",0,0,9,2,2,stephanie,stephanie,Stephanie,,,1,0,"rebecca, anne, stephanie",0,0.1,8,3,1,stephanie,stephanie,Lori,,,0,0,"rebecca, anne, lori, stephanie",0,-0.05,5,4,2,lori,lori,Emily,,,0,0,"anne, stephanie, rebecca, lori, emily",0,-0.05,2,5,2,emily,emily,Jessica,,,0,0,"stephanie, jessica, rebecca, lori, anne, emily",0,0,11,6,2,jessica,jessica,jessica,,,1,0,"rebecca, jessica, lori, emily, stephanie, anne",0,0.1,4,7,2,jessica,jessica,Jessica,,,1,0,"anne, jessica, lori, emily, rebecca, stephanie",0,0.1,7,8,2,jessica,jessica,Jessica,,,1,0,"emily, anne, stephanie, jessica, lori, rebecca",0,0.1,6,9,2,jessica,jessica,Jessica,,,1,0,"lori, emily, rebecca, jessica, stephanie, anne",0,0.1,2,10,1,jessica,jessica,Emily,,,0,0,"lori, emily, rebecca, jessica, stephanie, anne",0,-0.05,1,11,1,emily,emily,jessica,,,0,0,"anne, jessica, lori, emily, rebecca, stephanie",0,-0.05,5,12,2,jessica,jessica,Jessica,,,1,0,"emily, jessica, stephanie, anne, lori, rebecca",0,0.1,2,13,2,jessica,jessica,Jessica,,,1,0,"lori, emily, rebecca, jessica, stephanie, anne",0,0.1,6,14,1,jessica,jessica,jessica,,,1,0,"rebecca, emily, anne, jessica, stephanie, lori",0,0.1,8,15,2,jessica,jessica,jessica,,,1,0,"lori, emily, rebecca, jessica, stephanie, anne",0,0.1,6,16,1,jessica,jessica,Jessica,,,1,0,"emily, rebecca, lori, jessica, anne, stephanie",0,0.1,1,17,2,jessica,jessica,Anne,,,0,0,"lori, emily, rebecca, jessica, stephanie, anne",0,-0.05,3,18,1,jessica,jessica,Jessica,,,1,0,"anne, jessica, lori, emily, rebecca, stephanie",0,0.1,4,19,1,jessica,jessica,Jessica,,,1,0,"rebecca, stephanie, anne, emily, jessica, lori",0,0.1,7,20,2,jessica,jessica,Jessica,,,1,0,"lori, jessica, anne, emily, rebecca, stephanie",0,0.1,9,21,2,jessica,jessica,Jessica,,,1,0,"rebecca, stephanie, anne, emily, jessica, lori",0,0.1,2,22,2,jessica,jessica,Jessica,,,1,0,"stephanie, anne, emily, lori, rebecca, jessica",0,0.1,7,23,1,jessica,jessica,Jessica,,,1,0,"stephanie, anne, emily, lori, rebecca, jessica",0,0.1,2,24,1,jessica,jessica,Jessica,,,1,0,"rebecca, stephanie, anne, emily, jessica, lori",0,0.1,7,25,1,jessica,jessica,Jessica,,,1,0,"jessica, anne, emily, rebecca, stephanie, lori",0,0.1,1,26,2,jessica,jessica,Jessica,,,1,0,"rebecca, jessica, lori, emily, stephanie, anne",0,0.1,4,27,2,jessica,jessica,jessica,,,1,0,"emily, anne, stephanie, jessica, lori, rebecca",0,0.1,4,28,14,0,,0,4.4,0,1,115,cpn5don9,,107.4.50.69,2017-04-14 17:00:16.872972+00:00,1,A2I4A4WGWII18Z,3JWH6J9I9SE2GTYIFYH6ML4DCY2BNX,34KYK9TV2R9X9MSUXRTQWVJ1QXMBS8,2.03,4.03,fzx5k4m4,,,3D7VY91L65YUBRFPDUX4KMKVY84BMW,3S4TINXCC0OIBU01QACHCQ90T8JBOB,31MCUE39BKNPGMFQNYK3PY2MEUFG32,34KYK9TV2R9X9MSUXRTQWVJ1QXMBS8,3NMDE2OGHG0L1YTUQZWF1QB1KRTFGY,3NMDE2OGHG0L1YTUQZWF1QB1KRTFGY,,$2.00,15,A2I4A4WGWII18Z,12,0.63,1,1,1,Mary,Mary,Mandy,,,0,0,"mandy, mary",0,0,12,1,2,Mandy,Mandy,Mary,,,0,0,"mary, mandy",0,0,3,2,2,Mary,Mary,Mandy,,,0,0,"mary, mandy",0,0,3,3,2,Mary,Mary,Jessica,,,0,0,"jessica, mandy, mary",0,0,12,4,1,Mandy,Mandy,Mandy,,,1,0,"mary, jessica, mandy",0,0.1,3,5,1,Mandy,Mandy,Mandy,,,1,0,"jessica, mandy, mary",0,0.1,2,6,2,Mandy,Mandy,Sue,,,0,0,"sue, jessica, mandy, mary",0,-0.05,6,7,2,Mandy,Mandy,Jessica,,,0,0,"jessica, sue, mary, mandy",0,-0.05,5,8,2,Jessica,Jessica,Emily,,,0,0,"mary, jessica, sue, emily, mandy",0,-0.05,12,9,2,Mandy,Mandy,Jessica,,,0,0,"sue, mary, emily, jessica, mandy",0,-0.05,8,10,2,Jessica,Jessica,Emily,,,0,0,"sue, mary, emily, jessica, mandy",0,0,4,11,2,Jessica,Jessica,Jessica,,,1,0,"jessica, sue, mary, mandy, emily",0,0.1,2,12,1,Jessica,Jessica,Anne,,,0,0,"emily, mary, jessica, sue, mandy, anne",0,-0.05,10,13,2,Jessica,Jessica,Anne,,,0,0,"emily, mandy, sue, jessica, anne, mary",0,-0.05,9,14,2,Jessica,Jessica,Jessica,,,1,0,"sue, mandy, emily, anne, jessica, mary",0,0.1,4,15,2,Jessica,Jessica,Jessica,,,1,0,"emily, mandy, sue, jessica, anne, mary",0,0.1,12,16,1,Jessica,Jessica,Jessica,,,1,0,"emily, sue, mandy, jessica, mary, anne",0,0.1,2,17,2,Jessica,Jessica,Jessica,,,1,0,"emily, mandy, sue, jessica, anne, mary",0,0.1,5,18,1,Jessica,Jessica,Jessica,,,1,0,"anne, jessica, mary, mandy, emily, sue",0,0.1,8,19,2,Jessica,Jessica,Jessica,,,1,0,"anne, sue, emily, jessica, mandy, mary",0,0.1,11,20,2,Jessica,Jessica,Jessica,,,1,0,"mary, jessica, sue, anne, emily, mandy",0,0.1,7,21,2,Jessica,Jessica,Jessica,,,1,0,"anne, sue, emily, jessica, mandy, mary",0,0.1,1,22,1,Jessica,Jessica,Jessica,,,1,0,"emily, anne, sue, jessica, mandy, mary",0,0.1,5,23,2,Jessica,Jessica,jessica,,,1,0,"emily, anne, sue, jessica, mandy, mary",0,0.1,2,24,1,Jessica,Jessica,Jessica,,,1,0,"anne, sue, emily, jessica, mandy, mary",0,0.1,9,25,2,Jessica,Jessica,jessica,,,1,0,"jessica, mary, anne, emily, sue, mandy",0,0.1,1,26,2,Jessica,Jessica,jessica,,,1,0,"sue, jessica, emily, mandy, anne, mary",0,0.1,9,27,1,Jessica,Jessica,Jessica,,,1,0,"mandy, emily, anne, mary, jessica, sue",0,0.1,7,28,15,0,,0,4.03,0,1,116,aasriqy6,,72.199.209.202,2017-04-14 17:00:18.533689+00:00,1,A2VRDE2FHCBMF8,3CCZ6YKWR7KF2BDFDE7O1Y91XDZ95V,34KYK9TV2R9X9MSUXRTQWVJ1QXMBS8,2.11,4.11,fzx5k4m4,,,3D7VY91L65YUBRFPDUX4KMKVY84BMW,3S4TINXCC0OIBU01QACHCQ90T8JBOB,31MCUE39BKNPGMFQNYK3PY2MEUFG32,34KYK9TV2R9X9MSUXRTQWVJ1QXMBS8,3NMDE2OGHG0L1YTUQZWF1QB1KRTFGY,3NMDE2OGHG0L1YTUQZWF1QB1KRTFGY,,$2.00,16,A2VRDE2FHCBMF8,18,0.56,1,1,1,Maria,Maria,Stephanie,,,0,0,"stephanie, maria",0,0,3,1,1,Stephanie,Stephanie,anne,,,0,0,"anne, stephanie, maria",0,0,9,2,1,Stephanie,Stephanie,Jessica,,,0,0,"maria, jessica, anne, stephanie",0,0,4,3,2,Stephanie,Stephanie,Jessica,,,0,0,"anne, jessica, maria, stephanie",0,0,9,4,1,Jessica,Jessica,Mary,,,0,0,"anne, mary, jessica, stephanie, maria",0,0,12,5,2,Jessica,Jessica,Anne,,,0,0,"jessica, mary, stephanie, anne, maria",0,0,9,6,2,Jessica,Jessica,Sue,,,0,0,"maria, sue, jessica, stephanie, anne, mary",0,0,8,7,1,Jessica,Jessica,Mandy,,,0,0,"anne, maria, jessica, mary, mandy, sue, stephanie",0,0,5,8,2,Jessica,Jessica,Jessica,,,1,0,"mandy, maria, anne, stephanie, mary, jessica, sue",0,0.1,2,9,2,Jessica,Jessica,Lori,,,0,0,"lori, maria, mandy, sue, jessica, stephanie, anne, mary",0,-0.05,1,10,1,Jessica,Jessica,Linda,,,0,0,"lori, maria, linda, mandy, sue, jessica, stephanie, anne, mary",0,-0.05,3,11,2,Jessica,Jessica,Jessica,,,1,0,"anne, maria, jessica, mary, lori, mandy, sue, stephanie, linda",0,0.1,1,12,2,Jessica,Jessica,Mandy,,,0,0,"maria, mary, anne, jessica, mandy, linda, sue, stephanie, lori",0,-0.05,1,13,2,Jessica,Jessica,Jessica,,,1,0,"lori, maria, linda, mandy, sue, jessica, stephanie, anne, mary",0,0.1,12,14,2,Jessica,Jessica,Jessica,,,1,0,"sue, mandy, maria, anne, jessica, mary, lori, stephanie, linda",0,0.1,10,15,1,Jessica,Jessica,Jessica,,,1,0,"lori, maria, linda, mandy, sue, jessica, stephanie, anne, mary",0,0.1,5,16,2,Jessica,Jessica,Jessica,,,1,0,"sue, linda, lori, maria, mandy, jessica, mary, anne, stephanie",0,0.1,12,17,2,Jessica,Jessica,Jessica,,,1,0,"lori, maria, linda, mandy, sue, jessica, stephanie, anne, mary",0,0.1,6,18,1,Jessica,Jessica,jessica,,,1,0,"anne, maria, jessica, mary, lori, mandy, sue, stephanie, linda",0,0.1,2,19,2,Jessica,Jessica,jessica,,,1,0,"linda, stephanie, anne, mary, maria, jessica, mandy, lori, sue",0,0.1,7,20,1,Jessica,Jessica,Jessica,,,1,0,"linda, mary, maria, lori, jessica, sue, anne, mandy, stephanie",0,0.1,4,21,2,Jessica,Jessica,Jessica,,,1,0,"linda, stephanie, anne, mary, maria, jessica, mandy, lori, sue",0,0.1,11,22,1,Jessica,Jessica,Jessica,,,1,0,"maria, stephanie, anne, lori, linda, sue, jessica, mandy, mary",0,0.1,3,23,1,Jessica,Jessica,Jessica,,,1,0,"maria, stephanie, anne, lori, linda, sue, jessica, mandy, mary",0,0.1,6,24,2,Jessica,Jessica,jessica,,,1,0,"linda, stephanie, anne, mary, maria, jessica, mandy, lori, sue",0,0.1,4,25,2,Jessica,Jessica,Jessica,,,1,0,"jessica, mary, anne, linda, stephanie, sue, maria, mandy, lori",0,0.1,3,26,1,Jessica,Jessica,Jessica,,,1,0,"maria, sue, jessica, lori, linda, stephanie, mandy, anne, mary",0,0.1,2,27,1,Jessica,Jessica,jessica,,,1,0,"linda, mandy, maria, anne, stephanie, jessica, mary, sue, lori",0,0.1,5,28,16,0,"It has been nice participating once again, thank you very much! :)",0,4.11,0,1,117,6m41s7dg,,98.213.21.48,2017-04-14 17:00:18.284715+00:00,1,A2BZY06YRWGEDL,3GU1KF0O4I22JEAVVDUYQA98CD3BPT,3S4TINXCC0OIBU01QACHCQ90T8JBOB,1.65,3.65,fzx5k4m4,,,3D7VY91L65YUBRFPDUX4KMKVY84BMW,3S4TINXCC0OIBU01QACHCQ90T8JBOB,31MCUE39BKNPGMFQNYK3PY2MEUFG32,34KYK9TV2R9X9MSUXRTQWVJ1QXMBS8,3NMDE2OGHG0L1YTUQZWF1QB1KRTFGY,3NMDE2OGHG0L1YTUQZWF1QB1KRTFGY,,$2.00,17,A2BZY06YRWGEDL,7,0.55,1,1,2,susan,susan,Sue,,,0,0,"susan, sue",0,0,7,1,2,sue,sue,Sue,,,1,0,"sue, susan",0,0.1,12,2,2,Britney,Britney,Jessica,,,0,0,"sue, britney, jessica, susan",0,-0.05,12,3,1,Jessica,Jessica,Stephanie,,,0,0,"susan, sue, jessica, britney, stephanie",0,-0.05,9,4,2,Jessica,Jessica,jessica,,,1,0,"britney, sue, jessica, stephanie, susan",0,0.1,7,5,1,Emily,Emily,Jessica,,,0,0,"jessica, britney, susan, stephanie, sue",1,-0.05,1,6,1,jessica,jessica,jessica,,,1,0,"sue, jessica, britney, stephanie, susan",0,0.1,4,7,2,emily,emily,Lori,,,0,0,"britney, jessica, lori, susan, sue, stephanie",1,-0.05,4,8,1,Lori,Lori,Anne,,,0,0,"susan, anne, stephanie, britney, jessica, sue, lori",0,-0.05,10,9,1,Anne,Anne,Mandy,,,0,0,"lori, susan, mandy, sue, jessica, stephanie, britney, anne",0,-0.05,5,10,1,Mandy,Mandy,Jessica,,,0,0,"lori, susan, mandy, sue, jessica, stephanie, britney, anne",0,0,6,11,2,Jessica,Jessica,jessica,,,1,0,"britney, anne, jessica, lori, mandy, susan, sue, stephanie",0,0.1,8,12,1,Mandy,Mandy,Jessica,,,0,0,"susan, anne, jessica, mandy, stephanie, sue, lori, britney",0,-0.05,1,13,1,Jessica,Jessica,jessica,,,1,0,"lori, susan, mandy, sue, jessica, stephanie, britney, anne",0,0.1,3,14,2,Mandy,Mandy,jessica,,,0,0,"sue, mandy, susan, anne, jessica, britney, stephanie, lori",0,-0.05,3,15,1,jessica,jessica,jessica,,,1,0,"lori, susan, mandy, sue, jessica, stephanie, britney, anne",0,0.1,6,16,1,Mandy,Mandy,Jessica,,,0,0,"sue, lori, susan, britney, mandy, jessica, anne, stephanie",0,-0.05,9,17,2,Jessica,Jessica,Jessica,,,1,0,"lori, susan, mandy, sue, jessica, stephanie, britney, anne",0,0.1,12,18,1,Mandy,Mandy,Jessica,,,0,0,"britney, anne, jessica, lori, mandy, susan, sue, stephanie",0,-0.05,5,19,2,Jessica,Jessica,Jessica,,,1,0,"stephanie, anne, britney, jessica, mandy, lori, sue, susan",0,0.1,2,20,2,jessica,jessica,jessica,,,1,0,"lori, jessica, britney, sue, susan, anne, mandy, stephanie",0,0.1,2,21,2,jessica,jessica,Jessica,,,1,0,"stephanie, anne, britney, jessica, mandy, lori, sue, susan",0,0.1,4,22,1,Jessica,Jessica,jessica,,,1,0,"stephanie, anne, susan, lori, sue, jessica, mandy, britney",0,0.1,7,23,1,Jessica,Jessica,Jessica,,,1,0,"stephanie, anne, susan, lori, sue, jessica, mandy, britney",0,0.1,7,24,2,jessica,jessica,Jessica,,,1,0,"stephanie, anne, britney, jessica, mandy, lori, sue, susan",0,0.1,12,25,2,Jessica,Jessica,jessica,,,1,0,"jessica, anne, stephanie, sue, susan, mandy, britney, lori",0,0.1,8,26,2,Jessica,Jessica,Jessica,,,1,0,"sue, jessica, lori, stephanie, mandy, britney, anne, susan",0,0.1,3,27,2,Jessica,Jessica,Jessica,,,1,0,"susan, mandy, anne, stephanie, britney, jessica, sue, lori",0,0.1,8,28,17,0,,0,3.65,0,1,118,t3s4kjuz,,172.91.192.214,2017-04-14 17:00:20.817263+00:00,1,AYDILOZLKOAS8,3QXNC7EIPIWG74REG81CK3DAG5O90A,3S4TINXCC0OIBU01QACHCQ90T8JBOB,2.2,4.2,fzx5k4m4,,,3D7VY91L65YUBRFPDUX4KMKVY84BMW,3S4TINXCC0OIBU01QACHCQ90T8JBOB,31MCUE39BKNPGMFQNYK3PY2MEUFG32,34KYK9TV2R9X9MSUXRTQWVJ1QXMBS8,3NMDE2OGHG0L1YTUQZWF1QB1KRTFGY,3NMDE2OGHG0L1YTUQZWF1QB1KRTFGY,,$2.00,18,AYDILOZLKOAS8,8,0.6,1,1,2,Linda,Linda,(none),,,0,0,"(none), linda",0,0,9,1,2,Linda,Linda,Emily,,,0,0,"linda, (none), emily",0,0,10,2,2,Emily,Emily,Jessica,,,0,0,"linda, (none), jessica, emily",0,0,7,3,2,Jessica,Jessica,jessica,,,1,0,"(none), linda, jessica, emily",0,0.1,6,4,1,Jessica,Jessica,Lori,,,0,0,"lori, jessica, linda, (none), emily",0,-0.05,11,5,2,Jessica,Jessica,Mandy,,,0,0,"(none), jessica, linda, mandy, lori, emily",0,-0.05,4,6,1,Jessica,Jessica,Linda,,,0,0,"jessica, lori, linda, (none), emily, mandy",0,0,12,7,1,Jessica,Jessica,Mandy,,,0,0,"jessica, mandy, lori, emily, (none), linda",0,0,10,8,2,Mandy,Mandy,Linda,,,0,0,"linda, mandy, emily, (none), jessica, lori",0,0,11,9,2,Linda,Linda,Jessica,,,0,0,"lori, emily, linda, mandy, jessica, (none)",0,0,9,10,2,Jessica,Jessica,Lori,,,0,0,"lori, emily, linda, mandy, jessica, (none)",0,0,8,11,1,Jessica,Jessica,Sue,,,0,0,"jessica, mandy, lori, emily, (none), sue, linda",0,0,11,12,1,Jessica,Jessica,jessica,,,1,0,"emily, jessica, mandy, linda, sue, lori, (none)",0,0.1,11,13,1,Jessica,Jessica,Jessica,,,1,0,"lori, emily, linda, mandy, sue, jessica, (none)",0,0.1,12,14,1,Jessica,Jessica,Jessica,,,1,0,"sue, mandy, emily, jessica, lori, (none), linda",0,0.1,1,15,2,Jessica,Jessica,Jessica,,,1,0,"lori, emily, linda, mandy, sue, jessica, (none)",0,0.1,11,16,1,Jessica,Jessica,Jessica,,,1,0,"emily, sue, linda, lori, (none), mandy, jessica",0,0.1,4,17,1,Jessica,Jessica,Jessica,,,1,0,"lori, emily, linda, mandy, sue, jessica, (none)",0,0.1,7,18,1,Jessica,Jessica,Jessica,,,1,0,"jessica, lori, mandy, emily, (none), sue, linda",0,0.1,12,19,2,Jessica,Jessica,Jessica,,,1,0,"linda, (none), emily, jessica, lori, mandy, sue",0,0.1,4,20,2,Jessica,Jessica,jessica,,,1,0,"linda, lori, jessica, sue, (none), emily, mandy",0,0.1,5,21,1,Jessica,Jessica,Jessica,,,1,0,"linda, (none), emily, jessica, lori, mandy, sue",0,0.1,7,22,2,Jessica,Jessica,Jessica,,,1,0,"emily, lori, sue, linda, (none), jessica, mandy",0,0.1,5,23,2,Jessica,Jessica,Jessica,,,1,0,"emily, lori, sue, linda, (none), jessica, mandy",0,0.1,9,24,1,Jessica,Jessica,Jessica,,,1,0,"linda, (none), emily, jessica, lori, mandy, sue",0,0.1,8,25,1,Jessica,Jessica,Jessica,,,1,0,"jessica, emily, linda, (none), sue, mandy, lori",0,0.1,12,26,1,Jessica,Jessica,Jessica,,,1,0,"sue, jessica, lori, linda, (none), emily, mandy",0,0.1,11,27,1,Jessica,Jessica,Jessica,,,1,0,"linda, mandy, emily, (none), jessica, sue, lori",0,0.1,11,28,18,0,i am consistently amazed by the variance of the quality of players from these HITs. Is this the first time that we were set up with multiple people per round? The game seems very straightforward and you'd have to actively not want to get the bonus.....IONO man!,0,4.2,0,1,119,454ny1or,,71.12.87.120,2017-04-14 17:00:41.102257+00:00,1,A2B6WQG0A9CKXQ,3XUHV3NRVKZ8HHVYBQVGEF7PGQ7H5T,3D7VY91L65YUBRFPDUX4KMKVY84BMW,2.29,4.29,fzx5k4m4,,,3D7VY91L65YUBRFPDUX4KMKVY84BMW,3S4TINXCC0OIBU01QACHCQ90T8JBOB,31MCUE39BKNPGMFQNYK3PY2MEUFG32,34KYK9TV2R9X9MSUXRTQWVJ1QXMBS8,3NMDE2OGHG0L1YTUQZWF1QB1KRTFGY,3NMDE2OGHG0L1YTUQZWF1QB1KRTFGY,,$2.00,19,A2B6WQG0A9CKXQ,19,0.59,1,1,2,sue,sue,Anne,,,0,0,"sue, anne",0,0,1,1,1,Mary,Mary,jessica,,,0,0,"anne, sue, jessica",1,0,2,2,2,Mary,Mary,Lori,,,0,0,"sue, jessica, anne, lori",1,0,6,3,1,Lori,Lori,Emily,,,0,0,"anne, lori, sue, jessica, emily",0,0,8,4,2,Lori,Lori,Jessica,,,0,0,"anne, sue, jessica, lori, emily",0,0,11,5,2,Mary,Mary,Linda,,,0,0,"jessica, linda, lori, anne, sue, emily",1,0,10,6,2,Linda,Linda,Amanda,,,0,0,"sue, jessica, lori, linda, emily, amanda, anne",0,0,7,7,1,Linda,Linda,Anne,,,0,0,"anne, jessica, linda, lori, emily, sue, amanda",0,0,6,8,2,Anne,Anne,Lori,,,0,0,"linda, emily, amanda, anne, jessica, sue, lori",0,0,10,9,1,Lori,Lori,Jessica,,,0,0,"lori, emily, amanda, linda, sue, jessica, anne",0,0,1,10,1,Lori,Lori,Jessica,,,0,0,"lori, emily, amanda, linda, sue, jessica, anne",0,0,8,11,2,Jessica,Jessica,Jessica,,,1,0,"anne, jessica, linda, lori, emily, sue, amanda",0,0.1,3,12,2,Jessica,Jessica,Jessica,,,1,0,"emily, anne, jessica, linda, sue, amanda, lori",0,0.1,12,13,1,Jessica,Jessica,jessica,,,1,0,"lori, emily, amanda, linda, sue, jessica, anne",0,0.1,2,14,2,Jessica,Jessica,Jessica,,,1,0,"sue, emily, anne, jessica, linda, lori, amanda",0,0.1,2,15,2,Jessica,Jessica,Jessica,,,1,0,"lori, emily, amanda, linda, sue, jessica, anne",0,0.1,5,16,2,Jessica,Jessica,Jessica,,,1,0,"emily, sue, linda, lori, jessica, amanda, anne",0,0.1,2,17,2,Jessica,Jessica,Jessica,,,1,0,"lori, emily, amanda, linda, sue, jessica, anne",0,0.1,1,18,1,Jessica,Jessica,Jessica,,,1,0,"anne, jessica, linda, lori, emily, sue, amanda",0,0.1,1,19,2,Jessica,Jessica,Jessica,,,1,0,"linda, anne, amanda, emily, jessica, lori, sue",0,0.1,6,20,1,Jessica,Jessica,Jessica,,,1,0,"linda, lori, jessica, sue, anne, amanda, emily",0,0.1,10,21,1,Jessica,Jessica,Jessica,,,1,0,"linda, anne, amanda, emily, jessica, lori, sue",0,0.1,9,22,1,Jessica,Jessica,Jessica,,,1,0,"emily, anne, lori, linda, sue, jessica, amanda",0,0.1,6,23,1,Jessica,Jessica,Jessica,,,1,0,"emily, anne, lori, linda, sue, jessica, amanda",0,0.1,10,24,2,Jessica,Jessica,Jessica,,,1,0,"linda, anne, amanda, emily, jessica, lori, sue",0,0.1,1,25,2,Jessica,Jessica,Jessica,,,1,0,"jessica, anne, emily, linda, amanda, sue, lori",0,0.1,6,26,1,Jessica,Jessica,Jessica,,,1,0,"sue, jessica, lori, linda, emily, amanda, anne",0,0.1,6,27,2,Jessica,Jessica,Jessica,,,1,0,"linda, emily, amanda, anne, jessica, sue, lori",0,0.1,11,28,19,0,Much better this time!,0,4.29,0,1,120,y6as1tav,,24.98.180.9,2017-04-14 17:01:11.597147+00:00,1,A2DWQF4ZHHBLOW,3M0BCWMB8VXS3N7W7Z8TI4H45A6BWO,34KYK9TV2R9X9MSUXRTQWVJ1QXMBS8,1.96,3.96,fzx5k4m4,,,3D7VY91L65YUBRFPDUX4KMKVY84BMW,3S4TINXCC0OIBU01QACHCQ90T8JBOB,31MCUE39BKNPGMFQNYK3PY2MEUFG32,34KYK9TV2R9X9MSUXRTQWVJ1QXMBS8,3NMDE2OGHG0L1YTUQZWF1QB1KRTFGY,3NMDE2OGHG0L1YTUQZWF1QB1KRTFGY,,$2.00,20,A2DWQF4ZHHBLOW,15,0.51,1,1,2,Mandy,Mandy,Mary,,,0,0,"mandy, mary",0,0,12,1,1,Mary,Mary,Mandy,,,0,0,"mary, mandy",0,0,3,2,1,Mandy,Mandy,Mary,,,0,0,"mary, mandy",0,0,3,3,2,Mandy,Mandy,Linda,,,0,0,"linda, mandy, mary",0,0,3,4,2,Mandy,Mandy,Stephanie,,,0,0,"stephanie, mary, mandy, linda",0,0,6,5,1,Mandy,Mandy,Jessica,,,0,0,"mandy, mary, linda, stephanie, jessica",0,0,4,6,2,Mandy,Mandy,Mandy,,,1,0,"stephanie, mandy, jessica, linda, mary",0,0.1,5,7,2,Mandy,Mandy,Jessica,,,0,0,"jessica, mary, mandy, stephanie, linda",0,-0.05,10,8,2,Mandy,Mandy,jessica,,,0,0,"linda, mary, mandy, stephanie, jessica",0,-0.05,4,9,2,Mandy,Mandy,jessica,,,0,0,"mandy, mary, stephanie, jessica, linda",0,0,7,10,2,Mandy,Mandy,Jessica,,,0,0,"mandy, mary, stephanie, jessica, linda",0,0,5,11,2,Jessica,Jessica,Amanda,,,0,0,"jessica, mary, linda, mandy, stephanie, amanda",0,0,12,12,1,Jessica,Jessica,Jessica,,,1,0,"mary, jessica, mandy, stephanie, linda, amanda",0,0.1,12,13,1,Jessica,Jessica,Anne,,,0,0,"amanda, linda, mandy, jessica, stephanie, anne, mary",0,-0.05,1,14,1,Jessica,Jessica,Jessica,,,1,0,"mandy, anne, jessica, mary, amanda, stephanie, linda",0,0.1,10,15,1,Jessica,Jessica,Jessica,,,1,0,"amanda, linda, mandy, jessica, stephanie, anne, mary",0,0.1,9,16,1,Jessica,Jessica,Jessica,,,1,0,"linda, mandy, jessica, amanda, mary, anne, stephanie",0,0.1,5,17,1,Jessica,Jessica,jessica,,,1,0,"amanda, linda, mandy, jessica, stephanie, anne, mary",0,0.1,10,18,2,Jessica,Jessica,jessica,,,1,0,"anne, jessica, mary, mandy, amanda, stephanie, linda",0,0.1,10,19,2,Jessica,Jessica,Jessica,,,1,0,"linda, stephanie, anne, amanda, jessica, mandy, mary",0,0.1,10,20,1,Jessica,Jessica,Jessica,,,1,0,"linda, mary, jessica, anne, amanda, mandy, stephanie",0,0.1,8,21,1,Jessica,Jessica,Jessica,,,1,0,"linda, stephanie, anne, amanda, jessica, mandy, mary",0,0.1,5,22,2,Jessica,Jessica,jessica,,,1,0,"stephanie, anne, linda, jessica, amanda, mandy, mary",0,0.1,10,23,2,Jessica,Jessica,Jessica,,,1,0,"stephanie, anne, linda, jessica, amanda, mandy, mary",0,0.1,4,24,1,Jessica,Jessica,jessica,,,1,0,"linda, stephanie, anne, amanda, jessica, mandy, mary",0,0.1,3,25,1,Jessica,Jessica,jessica,,,1,0,"jessica, mary, anne, linda, stephanie, amanda, mandy",0,0.1,7,26,2,Jessica,Jessica,Jessica,,,1,0,"jessica, linda, stephanie, amanda, mandy, anne, mary",0,0.1,1,27,1,Jessica,Jessica,Jessica,,,1,0,"linda, mandy, amanda, anne, stephanie, jessica, mary",0,0.1,1,28,20,0,,0,3.96,0,1,1