23,6pgmfsdm,,73.194.189.44,2017-03-27 17:00:38.746077+00:00,1,A3L0DCUXI7X3A9,3VFJCI1K4Z0JM8YLORQ1WG0JRA6GRU,3UOMW19E6D7FDPMPZVCDE4FRMBX5C8,0.94,2.94,1re06q0k,,,3DTJ4WT8BDGSH1QS2APOTWMP8MIEZH,3UOMW19E6D7FDPMPZVCDE4FRMBX5C8,37PGLWGSJT798BTSYSC5RWW4W6CKIA,391FPZIE4CNNFCNKMOYMX74NYKVHUB,3NMDE2OGHG0L1YTUQZWF1QB1KRTFGY,3NMDE2OGHG0L1YTUQZWF1QB1KRTFGY,,$2.00,20,A3L0DCUXI7X3A9,12,0.34,1,1,2,(none),(none),Sally,,Jackie,0,1,"jackie, sally",1,0,6,1,2,Sally,Sally,Sally,,(none),1,0,"(none), jackie, sally",0,0.1,3,2,2,Sally,Sally,Julie,,Sally,0,0,"sally, jackie, julie, (none)",0,-0.05,10,3,2,Sally,Sally,Sally,,Mary,1,0,"jackie, (none), julie, sally, mary",0,0.1,4,4,1,Sally,Sally,Jane,,Valerie,0,0,"jackie, mary, julie, (none), jane, valerie, sally",0,-0.05,6,5,1,Sally,Sally,Julie,,Jackie,0,0,"jane, mary, valerie, jackie, sally, julie, (none)",0,-0.05,1,6,1,Sally,Sally,Sally,,Carolyn,1,0,"jackie, mary, carolyn, julie, jane, (none), valerie, sally",0,0.1,10,7,2,Sally,Sally,Sally,,Jane,1,0,"mary, carolyn, sally, (none), julie, jane, jackie, valerie",0,0.1,4,8,2,Sally,Sally,Sally,,Lily,1,0,"jane, mary, valerie, jackie, sally, lily, julie, (none), carolyn",0,0.1,2,9,2,Sally,Sally,(none),,Mary,0,0,"lily, julie, valerie, mary, jackie, sally, jane, (none), carolyn",0,-0.05,7,10,2,Sally,Sally,jackie,,Christina,0,0,"jane, julie, sally, valerie, mary, carolyn, christina, (none), lily, jackie",0,-0.05,1,11,1,Sally,Sally,Sally,,Jane,1,0,"(none), lily, julie, valerie, jane, mary, christina, sally, carolyn, jackie",0,0.1,5,12,1,Sally,Sally,Sally,,Mary,1,0,"julie, jane, carolyn, valerie, mary, (none), sally, lily, jackie, christina",0,0.1,11,13,2,Sally,Sally,Jane,,Christina,0,0,"jackie, jane, christina, (none), mary, lily, valerie, julie, carolyn, sally",0,-0.05,5,14,2,Sally,Sally,jackie,,Maria,0,0,"lily, julie, valerie, mary, jackie, maria, sally, jane, (none), carolyn, christina",0,-0.05,6,15,1,Sally,Sally,Sally,,Christina,1,0,"jackie, christina, mary, carolyn, julie, valerie, jane, (none), lily, sally, maria",0,0.1,10,16,2,Sally,Sally,Jane,,Maria,0,0,"jackie, christina, mary, carolyn, julie, valerie, jane, (none), lily, sally, maria",0,-0.05,3,17,2,Sally,Sally,Jane,,Lily,0,0,"mary, lily, christina, maria, sally, carolyn, (none), julie, jane, jackie, valerie",0,-0.05,8,18,2,Sally,Sally,Sally,,Jackie,1,0,"jane, julie, sally, valerie, mary, carolyn, christina, (none), maria, lily, jackie",0,0.1,5,19,1,Sally,Sally,Sally,,Jackie,1,0,"jane, jackie, mary, christina, julie, lily, valerie, (none), sally, maria, carolyn",0,0.1,9,20,2,Sally,Sally,jackie,,Mary,0,0,"maria, julie, jane, valerie, carolyn, mary, (none), sally, lily, jackie, christina",0,-0.05,8,21,1,Sally,Sally,Sally,,Jackie,1,0,"jane, julie, sally, valerie, mary, carolyn, christina, (none), maria, lily, jackie",0,0.1,12,22,1,Sally,Sally,Sally,,Mary,1,0,"jackie, christina, mary, carolyn, julie, valerie, jane, (none), lily, sally, maria",0,0.1,12,23,2,Sally,Sally,jackie,,Mary,0,0,"mary, lily, christina, maria, sally, carolyn, (none), julie, jane, jackie, valerie",0,-0.05,8,24,2,Sally,Sally,Jane,,Lily,0,0,"lily, julie, mary, valerie, jackie, maria, sally, jane, (none), carolyn, christina",0,-0.05,2,25,23,0,no problems,0,2.94,0,1,125,6ljuyj3c,,209.6.92.102,2017-03-27 17:00:44.139435+00:00,1,A3OXSIR9YH1FT6,30ZX6P7VF8WC9Q71H7W3SLKR7A7J2M,3DTJ4WT8BDGSH1QS2APOTWMP8MIEZH,1.5,3.5,1re06q0k,,,3DTJ4WT8BDGSH1QS2APOTWMP8MIEZH,3UOMW19E6D7FDPMPZVCDE4FRMBX5C8,37PGLWGSJT798BTSYSC5RWW4W6CKIA,391FPZIE4CNNFCNKMOYMX74NYKVHUB,3NMDE2OGHG0L1YTUQZWF1QB1KRTFGY,3NMDE2OGHG0L1YTUQZWF1QB1KRTFGY,,$2.00,21,A3OXSIR9YH1FT6,16,0.4,1,1,1,(none),(none),(none),,(none),0,1,(none),1,0,12,1,1,jane,(none),Christina,barred,Julie,0,0,"(none), julie, christina",1,0,2,2,1,christina,christina,Lynn,,Jane,0,0,"jane, julie, lynn, (none), christina",0,0,12,3,1,christina,christina,Mary,,Jane,0,0,"julie, mary, (none), jane, lynn, christina",0,0,10,4,2,christina,christina,Jane,,Carol,0,0,"christina, mary, julie, jane, (none), carol, lynn",0,0,7,5,1,christina,christina,Alice,,Lily,0,0,"jane, mary, lynn, carol, christina, lily, julie, (none), alice",0,0,11,6,1,christina,christina,Alice,,Sally,0,0,"christina, mary, sally, julie, alice, jane, (none), lily, carol, lynn",0,0,7,7,1,christina,christina,Alice,,Lily,0,0,"mary, lily, alice, christina, (none), carol, julie, jane, lynn, sally",0,0,7,8,1,christina,christina,Jane,,Lily,0,0,"jane, mary, sally, lynn, carol, christina, lily, julie, alice, (none)",0,0,4,9,1,Christina,Christina,Alice,,Lily,0,0,"lily, julie, mary, sally, jane, (none), carol, lynn, christina, alice",0,0,12,10,1,Christina,Christina,Lily,,Jane,0,0,"lynn, jane, julie, sally, carol, mary, alice, christina, (none), lily",0,0,5,11,1,Christina,Christina,christina,,Jane,1,0,"(none), lily, julie, jane, mary, lynn, christina, carol, sally, alice",0,0.1,12,12,2,Christina,Christina,Christina,,Jane,1,0,"lynn, julie, jane, carol, mary, (none), sally, lily, alice, christina",0,0.1,5,13,1,Christina,Christina,Christina,,Diana,1,0,"jane, lynn, christina, diana, (none), mary, lily, carol, julie, alice, sally",0,0.1,3,14,1,Christina,Christina,Christina,,Jackie,1,0,"lily, julie, mary, jackie, diana, (none), jane, sally, carol, lynn, christina, alice",0,0.1,11,15,2,Christina,Christina,Christina,,Jane,1,0,"jackie, christina, diana, mary, julie, alice, (none), jane, lily, sally, lynn, carol",0,0.1,8,16,1,Christina,Christina,Christina,,Christina,1,0,"jackie, christina, diana, mary, julie, alice, (none), jane, lily, sally, lynn, carol",0,0.1,10,17,1,Christina,Christina,Jane,,Jane,0,0,"mary, lily, alice, diana, christina, (none), carol, julie, jane, jackie, lynn, sally",0,-0.05,7,18,2,Christina,Christina,Christina,,Maria,1,0,"lynn, jane, julie, sally, carol, diana, mary, alice, christina, (none), maria, lily, jackie",0,0.1,1,19,2,Christina,Christina,Christina,,Jane,1,0,"jane, mary, jackie, christina, julie, alice, lily, (none), carol, sally, maria, lynn, diana",0,0.1,8,20,2,Christina,Christina,Jane,,Mary,0,0,"maria, lynn, julie, jackie, jane, carol, mary, (none), diana, sally, lily, alice, christina",0,-0.05,2,21,2,Christina,Christina,Christina,,Jane,1,0,"lynn, jane, julie, sally, carol, diana, mary, alice, christina, (none), maria, lily, jackie",0,0.1,4,22,2,Christina,Christina,Christina,,Jane,1,0,"christina, jackie, diana, mary, julie, alice, jane, (none), maria, lily, sally, lynn, carol",0,0.1,7,23,1,Christina,Christina,Christina,,Mary,1,0,"mary, lily, alice, diana, christina, maria, (none), carol, julie, jane, jackie, lynn, sally",0,0.1,6,24,2,Christina,Christina,Christina,,Mary,1,0,"lily, julie, mary, jackie, diana, maria, sally, jane, (none), carol, lynn, christina, alice",0,0.1,10,25,25,0,Thank you.,0,3.5,0,1,126,cjupo7wf,,173.250.239.55,2017-03-27 17:00:44.430700+00:00,1,A3CFBT2CBQQIZY,3T111IHZ5ER47YBDALKR4ZEWNXB9RW,3UOMW19E6D7FDPMPZVCDE4FRMBX5C8,1.81,3.81,1re06q0k,,,3DTJ4WT8BDGSH1QS2APOTWMP8MIEZH,3UOMW19E6D7FDPMPZVCDE4FRMBX5C8,37PGLWGSJT798BTSYSC5RWW4W6CKIA,391FPZIE4CNNFCNKMOYMX74NYKVHUB,3NMDE2OGHG0L1YTUQZWF1QB1KRTFGY,3NMDE2OGHG0L1YTUQZWF1QB1KRTFGY,,$2.00,22,A3CFBT2CBQQIZY,2,0.31,1,1,2,Julie,Julie,mary,,Jackie,0,0,"jackie, julie, mary",0,0,7,1,2,Mary,Mary,Mary,,Mary,1,0,"jackie, julie, mary",0,0.1,5,2,2,Mary,Mary,Mary,,Julie,1,0,"jackie, julie, mary",0,0.1,8,3,2,Mary,Mary,Mary,,Jane,1,0,"jackie, julie, jane, mary",0,0.1,2,4,1,Mary,Mary,Julie,,Mary,0,0,"jackie, jane, mary, julie",0,-0.05,4,5,1,Mary,Mary,Mary,,Julie,1,0,"jane, jackie, mary, julie",0,0.1,8,6,2,Mary,Mary,jane,,Mary,0,0,"jackie, jane, mary, julie",0,-0.05,12,7,1,Mary,Mary,Mary,,Jane,1,0,"jackie, julie, jane, mary",0,0.1,1,8,1,Mary,Mary,Mary,,Mary,1,0,"jane, jackie, mary, julie",0,0.1,8,9,1,Mary,Mary,Mary,,Lily,1,0,"jackie, mary, julie, lily, jane",0,0.1,3,10,1,Mary,Mary,jane,,Mary,0,0,"jane, julie, mary, lily, jackie",0,-0.05,11,11,2,Mary,Mary,jane,,Jane,0,0,"jane, mary, lily, julie, jackie",0,-0.05,6,12,1,Jane,Jane,Mary,,Maria,0,0,"maria, julie, jane, mary, lily, jackie",0,-0.05,2,13,1,Mary,Mary,Mary,,Maria,1,0,"jackie, jane, mary, maria, lily, julie",0,0.1,8,14,2,Mary,Mary,jane,,Tina,0,0,"lily, julie, mary, jackie, maria, jane, tina",0,-0.05,2,15,2,Mary,Mary,mary,,Mary,1,0,"jackie, mary, tina, julie, jane, lily, maria",0,0.1,11,16,1,Mary,Mary,Mary,,Lily,1,0,"jackie, mary, tina, julie, jane, lily, maria",0,0.1,6,17,1,Mary,Mary,Mary,,Sally,1,0,"mary, lily, maria, julie, jane, tina, jackie, sally",0,0.1,10,18,2,Mary,Mary,mary,,Mary,1,0,"jane, julie, sally, mary, tina, maria, lily, jackie",0,0.1,9,19,2,Mary,Mary,Mary,,Sally,1,0,"jane, mary, jackie, julie, lily, tina, sally, maria",0,0.1,10,20,1,Mary,Mary,mary,,Jane,1,0,"maria, tina, julie, jane, mary, sally, lily, jackie",0,0.1,7,21,2,Mary,Mary,Mary,,Christina,1,0,"jane, julie, sally, mary, tina, christina, maria, lily, jackie",0,0.1,1,22,1,Mary,Mary,Mary,,Jane,1,0,"christina, jackie, mary, tina, julie, jane, lily, sally, maria",0,0.1,9,23,2,Mary,Mary,mary,,Jackie,1,0,"mary, lily, christina, maria, julie, jane, tina, jackie, sally",0,0.1,10,24,1,Mary,Mary,Mary,,Alice,1,0,"lily, julie, mary, jackie, maria, sally, jane, christina, alice, tina",0,0.1,11,25,26,0,Great game!,0,3.81,0,1,127,exdpaa7o,,73.99.34.61,2017-03-27 17:01:43.316274+00:00,1,A3RVYJNYREMTAH,39DD6S19JPCU4LOLSDUQIGH6NB9ZEO,391FPZIE4CNNFCNKMOYMX74NYKVHUB,1.51,3.51,1re06q0k,,,3DTJ4WT8BDGSH1QS2APOTWMP8MIEZH,3UOMW19E6D7FDPMPZVCDE4FRMBX5C8,37PGLWGSJT798BTSYSC5RWW4W6CKIA,391FPZIE4CNNFCNKMOYMX74NYKVHUB,3NMDE2OGHG0L1YTUQZWF1QB1KRTFGY,3NMDE2OGHG0L1YTUQZWF1QB1KRTFGY,,$2.00,23,A3RVYJNYREMTAH,17,0.16,1,1,2,(none),(none),Lynn,,Laura,0,1,"lynn, laura",1,0,11,1,2,Lynn,Lynn,(none),,Mary,0,0,"lynn, mary, (none), laura",0,0,1,2,2,Lynn,Lynn,lily,,Mary,0,0,"lily, mary, (none), laura, lynn",0,0,11,3,2,Mary,Mary,christina,,Lynn,0,0,"lily, laura, mary, (none), lynn, christina",0,0,10,4,1,Lynn,Lynn,Lily,,Jane,0,0,"christina, mary, laura, (none), jane, lily, lynn",0,0,11,5,1,Lily,Lily,Lynn,,Sally,0,0,"jane, mary, sally, lynn, christina, lily, (none), laura",0,0,12,6,2,Lily,Lily,Julie,,Jane,0,0,"christina, mary, laura, julie, jane, (none), lily, sally, lynn",0,0,6,7,1,Lily,Lily,Lily,,Jane,1,0,"mary, lily, christina, laura, (none), julie, jane, lynn, sally",0,0.1,2,8,1,Lily,Lily,christina,,Lily,0,0,"jane, mary, sally, lynn, christina, lily, julie, (none), laura",0,-0.05,3,9,2,Lily,Lily,Lily,,Mary,1,0,"lily, julie, laura, mary, (none), jane, sally, lynn, christina",0,0.1,11,10,2,Lily,Lily,Christina,,Sally,0,0,"laura, jane, lynn, julie, sally, mary, christina, (none), lily",0,-0.05,5,11,2,Lily,Lily,Lily,,Jane,1,0,"(none), lily, julie, jane, mary, lynn, christina, laura, sally",0,0.1,11,12,2,Lily,Lily,Maria,,Karen,0,0,"maria, lynn, karen, julie, jane, laura, mary, (none), sally, lily, christina",0,-0.05,1,13,1,Lily,Lily,Lily,,Kate,1,0,"karen, jane, christina, kate, (none), laura, maria, mary, lily, julie, sally, lynn",0,0.1,4,14,2,Lily,Lily,Lily,,Tina,1,0,"lily, julie, laura, mary, karen, maria, (none), jane, sally, kate, lynn, christina, tina",0,0.1,10,15,2,Lily,Lily,Lily,,Christina,1,0,"christina, mary, laura, sally, tina, julie, kate, (none), jane, lily, karen, lynn, maria",0,0.1,7,16,1,Lily,Lily,Lily,,Mary,1,0,"christina, mary, laura, sally, tina, julie, kate, (none), jane, lily, karen, lynn, maria",0,0.1,1,17,2,Lily,Lily,Lily,,Christina,1,0,"mary, lily, christina, laura, maria, sally, kate, (none), julie, jane, tina, lynn, karen",0,0.1,6,18,2,Lily,Lily,Lily,,Jane,1,0,"karen, laura, jane, lynn, julie, sally, kate, mary, christina, tina, (none), maria, lily",0,0.1,2,19,2,Lily,Lily,Lily,,Sally,1,0,"jane, mary, christina, julie, lily, tina, (none), sally, karen, kate, maria, laura, lynn",0,0.1,7,20,2,Lily,Lily,Lily,,Jane,1,0,"maria, tina, lynn, karen, julie, jane, laura, mary, (none), sally, lily, kate, christina",0,0.1,11,21,2,Lily,Lily,Lily,,Maria,1,0,"karen, laura, jane, lynn, julie, sally, kate, mary, christina, tina, (none), maria, lily",0,0.1,3,22,1,Lily,Lily,Lily,,Mary,1,0,"christina, mary, laura, sally, tina, julie, kate, (none), jane, lily, karen, lynn, maria",0,0.1,3,23,1,Lily,Lily,Lily,,Jane,1,0,"mary, lily, christina, laura, maria, sally, kate, (none), julie, jane, tina, lynn, karen",0,0.1,7,24,2,Lily,Lily,Lily,,Lily,1,0,"lily, julie, laura, mary, karen, maria, (none), jane, sally, kate, lynn, christina, tina",0,0.1,9,25,27,0,I like cookies.,0,3.51,0,1,128,hq38h1p1,,69.167.0.195,2017-03-27 17:02:36.301370+00:00,1,AHT8HA3JRWVGV,3GU1KF0O4I22JEAVVDUYQA97AFQPBU,391FPZIE4CNNFCNKMOYMX74NYKVHUB,0.63,2.63,1re06q0k,,,3DTJ4WT8BDGSH1QS2APOTWMP8MIEZH,3UOMW19E6D7FDPMPZVCDE4FRMBX5C8,37PGLWGSJT798BTSYSC5RWW4W6CKIA,391FPZIE4CNNFCNKMOYMX74NYKVHUB,3NMDE2OGHG0L1YTUQZWF1QB1KRTFGY,3NMDE2OGHG0L1YTUQZWF1QB1KRTFGY,,$2.00,24,AHT8HA3JRWVGV,7,0.13,1,1,2,laura,laura,jane,,(none),0,0,"(none), laura, jane",0,0,3,1,1,jane,jane,Linda,,Maria,0,0,"(none), jane, linda, maria, laura",0,0,11,2,1,jane,jane,jane,,Mary,1,0,"linda, mary, laura, (none), jane, maria",0,0.1,4,3,2,jane,jane,Jane,,Jane,1,0,"laura, mary, maria, (none), jane, linda",0,0.1,5,4,2,jane,jane,Jane,,Jackie,1,0,"jackie, linda, mary, laura, jane, (none), maria",0,0.1,5,5,1,jane,jane,Susan,,Mary,0,0,"jane, mary, jackie, maria, linda, (none), susan, laura",0,-0.05,6,6,2,jane,jane,Jane,,Jane,1,0,"jackie, mary, laura, (none), jane, maria, susan, linda",0,0.1,3,7,2,jane,jane,maria,,Alice,0,0,"mary, susan, alice, laura, linda, maria, (none), jane, jackie",0,-0.05,5,8,2,jane,jane,Jane,,Jackie,1,0,"jane, mary, jackie, maria, linda, alice, (none), susan, laura",0,0.1,11,9,1,jane,jane,maria,,Sally,0,0,"susan, laura, mary, jackie, maria, (none), jane, sally, alice, linda",0,-0.05,4,10,2,jane,jane,maria,,Lily,0,0,"laura, jane, sally, susan, mary, alice, (none), maria, linda, lily, jackie",0,-0.05,8,11,2,jane,jane,Jane,,Jane,1,0,"(none), linda, maria, lily, jane, mary, susan, laura, sally, alice, jackie",0,0.1,4,12,2,jane,jane,maria,,Jane,0,0,"maria, jackie, jane, laura, linda, mary, susan, (none), sally, lily, alice",0,-0.05,6,13,2,jane,jane,maria,,Mary,0,0,"jackie, jane, linda, (none), mary, laura, susan, maria, lily, alice, sally",0,-0.05,10,14,2,jane,jane,Jane,,Jane,1,0,"lily, susan, laura, mary, linda, jackie, maria, sally, jane, (none), alice",0,0.1,8,15,1,jane,jane,Lily,,Jane,0,0,"jackie, linda, mary, laura, alice, jane, (none), susan, lily, sally, maria",0,-0.05,6,16,2,jane,jane,Jane,,Mary,1,0,"jackie, linda, mary, laura, alice, jane, (none), susan, lily, sally, maria",0,0.1,12,17,2,jane,jane,Jackie,,Alice,0,0,"mary, lily, alice, susan, laura, maria, linda, (none), jane, jackie, sally",0,-0.05,3,18,2,jane,jane,Jane,,Lily,1,0,"laura, jane, sally, mary, alice, (none), susan, maria, linda, lily, jackie",0,0.1,4,19,2,jane,jane,mariah,,Mary,0,0,"mariah, jane, mary, jackie, susan, alice, linda, lily, (none), sally, maria, laura",0,-0.05,2,20,2,jane,jane,Jane,,Mary,1,0,"maria, jackie, jane, laura, linda, mariah, susan, mary, (none), sally, lily, alice",0,0.1,4,21,1,jane,jane,Jackie,,Jane,0,0,"laura, jane, sally, mary, alice, mariah, (none), susan, maria, linda, lily, jackie",0,-0.05,5,22,1,jane,jane,Jackie,,Maria,0,0,"jackie, mariah, mary, laura, alice, jane, (none), maria, susan, lily, sally, linda",0,-0.05,5,23,2,jane,jane,Jane,,Christina,1,0,"mary, lily, alice, susan, christina, mariah, laura, linda, maria, (none), jane, jackie, sally",0,0.1,1,24,2,jane,jane,maria,,Sally,0,0,"lily, susan, laura, mary, linda, jackie, maria, mariah, (none), jane, sally, christina, alice",0,-0.05,1,25,28,0,,0,2.63,0,1,129,5qsln90i,,72.237.48.105,2017-03-27 17:02:39.375912+00:00,1,A8ZOAQ5DHGY16,3MX2NQ3YC9V537VDGUD2H1VI2IDX5P,3UOMW19E6D7FDPMPZVCDE4FRMBX5C8,0.14,2.14,1re06q0k,,,3DTJ4WT8BDGSH1QS2APOTWMP8MIEZH,3UOMW19E6D7FDPMPZVCDE4FRMBX5C8,37PGLWGSJT798BTSYSC5RWW4W6CKIA,391FPZIE4CNNFCNKMOYMX74NYKVHUB,3NMDE2OGHG0L1YTUQZWF1QB1KRTFGY,3NMDE2OGHG0L1YTUQZWF1QB1KRTFGY,,$2.00,25,A8ZOAQ5DHGY16,6,0.14,1,1,2,(none),(none),(none),,Sally,0,1,"(none), sally",1,0,4,1,1,Julie,Julie,Mary,,Maria,0,0,"(none), mary, sally, maria",1,0,8,2,1,Tibna,Tibna,Pam,,Jane,0,0,"sally, pam, mary, tibna, (none), jane, maria",0,0,2,3,1,Pam,Pam,Julie,,Sally,0,0,"julie, mary, tibna, maria, (none), jane, sally, pam",0,0,1,4,1,Julie,Julie,Valerie,,Jane,0,0,"mary, tibna, julie, jane, (none), valerie, sally, pam, maria",0,0,10,5,2,(none),(none),jackie,,Jane,0,1,"tibna, jane, mary, valerie, sally, maria, jackie, julie, (none), pam",1,0,3,6,1,Sue,Sue,Jackie,,Maria,0,0,"jackie, mary, tibna, julie, sue, jane, (none), valerie, sally, pam, maria",0,0,1,7,2,Julie,Julie,Lily,,Sally,0,0,"mary, tibna, lily, maria, sally, (none), julie, jane, sue, jackie, valerie, pam",0,0,10,8,2,Karen,Karen,Jane,,Jackie,0,0,"tibna, jane, mary, sally, jackie, maria, valerie, karen, lily, sue, (none), julie, pam",0,0,6,9,1,Tammy,Tammy,Lily,,Jackie,0,0,"lily, julie, mary, valerie, jackie, karen, sue, tammy, maria, tibna, sally, jane, (none), pam",0,0,10,10,2,Lily,Lily,Mary,,Jane,0,0,"karen, jane, julie, sally, valerie, pam, mary, sue, (none), maria, tibna, tammy, lily, jackie",0,0,4,11,1,Tara,Tara,(none),,Alice,0,0,"karen, (none), lily, julie, sue, tammy, valerie, maria, tibna, mary, jane, tara, sally, pam, alice, jackie",0,0,9,12,1,Karen,Karen,jackie,,Alice,0,0,"maria, karen, julie, jackie, jane, valerie, pam, tammy, tara, tibna, mary, sue, (none), sally, lily, alice",0,0,9,13,1,Kate,Kate,Mary,,Alice,0,0,"karen, jane, jackie, kate, (none), mary, maria, pam, lily, valerie, tibna, julie, sue, tara, tammy, alice, sally",0,0,12,14,1,tina,tina,jane,,Lily,0,0,"lily, julie, pam, mary, karen, jackie, valerie, sue, tammy, maria, tibna, (none), jane, tara, sally, kate, alice, tina",0,0,3,15,1,Julie,Julie,Mary,,Maria,0,0,"jackie, tammy, mary, sally, tibna, tina, julie, kate, sue, alice, valerie, tara, (none), jane, lily, karen, pam, maria",0,0,4,16,1,Tina,Tina,jackie,,Christina,0,0,"jackie, tammy, christina, mary, sally, tibna, tina, julie, kate, sue, alice, valerie, tara, (none), jane, lily, karen, pam, maria",0,0,8,17,2,Kara,Kara,dane,,Christina,0,0,"mary, tibna, lily, tammy, alice, dane, christina, maria, valerie, kate, (none), tara, julie, sue, tina, jane, jackie, kara, sally, karen, pam",0,0,12,18,1,Gretchen,Gretchen,jackie,,Jackie,0,0,"karen, kara, valerie, alice, sue, maria, tibna, lily, jane, tina, julie, sally, gretchen, pam, christina, tara, (none), jackie, dane, mary, kate, tammy",0,0,11,19,1,Sue,Sue,Maria,,Mary,0,0,"pam, tammy, lily, valerie, tina, tibna, (none), sue, kate, maria, jane, christina, alice, tara, julie, karen, gretchen, jackie, dane, kara, mary, sally",0,0,5,20,1,Tina,Tina,Maria,,Jane,0,0,"maria, karen, jane, valerie, sue, kate, tina, (none), jackie, kara, julie, tara, mary, lily, christina, gretchen, dane, tibna, pam, sally, tammy, alice",0,0,5,21,1,Jan,Jan,Mary,,Mary,0,0,"karen, kara, valerie, alice, sue, maria, tibna, lily, jane, tina, jan, julie, sally, gretchen, pam, christina, tara, (none), jackie, dane, mary, kate, tammy",0,0,9,22,1,Jenny,Jenny,Maria,,Sally,0,0,"jane, lily, maria, mary, tibna, alice, kara, valerie, christina, jackie, tammy, jan, tina, gretchen, sue, tara, jenny, sally, pam, julie, kate, dane, (none), karen",0,0,8,23,2,Jan,Jan,Mary,,Maria,0,0,"(none), sally, valerie, karen, tibna, jan, tammy, maria, sue, pam, kara, mary, dane, gretchen, christina, jane, jenny, lily, alice, kate, tara, julie, tina, jackie",0,0,4,24,1,Helen,Helen,Maria,,Sally,0,0,"lily, gretchen, sue, sally, kate, pam, christina, valerie, karen, tibna, kara, tara, julie, mary, jackie, helen, tammy, maria, dane, alice, tina, jan, (none), jane, jenny",0,0,8,25,29,0,,0,2.14,0,1,1