5,oxddnsyv,,67.149.230.40,2017-04-14 17:00:06.632012+00:00,1,A3J2UG22S8BIW4,3NAPMVF0ZWGJPV6ZGY76PVFJIDK27B,3D7VY91L65YUBRFPDUX4KMKVY84BMW,2,4,fzx5k4m4,,,3D7VY91L65YUBRFPDUX4KMKVY84BMW,3S4TINXCC0OIBU01QACHCQ90T8JBOB,31MCUE39BKNPGMFQNYK3PY2MEUFG32,34KYK9TV2R9X9MSUXRTQWVJ1QXMBS8,3NMDE2OGHG0L1YTUQZWF1QB1KRTFGY,3NMDE2OGHG0L1YTUQZWF1QB1KRTFGY,,$2.00,5,A3J2UG22S8BIW4,21,0.65,1,1,1,(none),(none),Linda,,,0,1,linda,1,0,9,1,1,Linda,Linda,millie,,,0,0,"millie, linda",0,0,8,2,1,Linda,Linda,Anne,,,0,0,"linda, millie, anne",0,0,1,3,2,Anne,Anne,Lorelai,,,0,0,"anne, millie, linda, lorelai",0,0,1,4,2,Anne,Anne,Sue,,,0,0,"anne, sue, lorelai, linda, millie",0,0,1,5,1,Anne,Anne,Jessica,,,0,0,"jessica, linda, millie, sue, anne, lorelai",0,0,9,6,2,Anne,Anne,Anne,,,1,0,"millie, sue, jessica, lorelai, linda, anne",0,0.1,10,7,2,Anne,Anne,Sue,,,0,0,"anne, jessica, millie, lorelai, sue, linda",0,-0.05,3,8,2,Anne,Anne,Emily,,,0,0,"linda, emily, lorelai, anne, millie, jessica, sue",0,-0.05,1,9,2,Anne,Anne,Amanda,,,0,0,"lorelai, emily, amanda, linda, sue, millie, jessica, anne",0,0,12,10,2,Anne,Anne,Mandy,,,0,0,"lorelai, emily, amanda, linda, mandy, sue, millie, jessica, anne",0,0,10,11,1,Anne,Anne,Jessica,,,0,0,"anne, jessica, millie, mandy, lorelai, emily, amanda, sue, linda",0,0,10,12,2,Anne,Anne,jessica,,,0,0,"emily, anne, jessica, mandy, millie, linda, sue, lorelai, amanda",0,0,5,13,2,jessica,jessica,Jessica,,,1,0,"lorelai, emily, amanda, linda, mandy, sue, millie, jessica, anne",0,0.1,2,14,1,jessica,jessica,Mandy,,,0,0,"sue, millie, mandy, emily, anne, jessica, amanda, lorelai, linda",0,-0.05,3,15,1,jessica,jessica,Jessica,,,1,0,"lorelai, emily, amanda, linda, mandy, sue, millie, jessica, anne",0,0.1,2,16,1,jessica,jessica,jessica,,,1,0,"emily, sue, linda, lorelai, mandy, jessica, amanda, anne, millie",0,0.1,3,17,2,jessica,jessica,Jessica,,,1,0,"lorelai, emily, amanda, linda, mandy, sue, millie, jessica, anne",0,0.1,10,18,1,jessica,jessica,Jessica,,,1,0,"anne, jessica, millie, mandy, lorelai, emily, amanda, sue, linda",0,0.1,9,19,2,jessica,jessica,Jessica,,,1,0,"linda, anne, lorelai, amanda, emily, millie, jessica, mandy, sue",0,0.1,3,20,1,jessica,jessica,Jessica,,,1,0,"linda, jessica, sue, lorelai, anne, amanda, emily, mandy, millie",0,0.1,5,21,2,jessica,jessica,jessica,,,1,0,"linda, anne, lorelai, amanda, emily, millie, jessica, mandy, sue",0,0.1,10,22,1,jessica,jessica,Jessica,,,1,0,"lorelai, emily, millie, anne, sue, linda, jessica, amanda, mandy",0,0.1,11,23,2,jessica,jessica,Jessica,,,1,0,"lorelai, emily, millie, anne, sue, linda, jessica, amanda, mandy",0,0.1,3,24,2,jessica,jessica,Jessica,,,1,0,"linda, anne, lorelai, amanda, emily, millie, jessica, mandy, sue",0,0.1,3,25,1,jessica,jessica,Jessica,,,1,0,"jessica, anne, emily, linda, millie, sue, amanda, mandy, lorelai",0,0.1,8,26,1,jessica,jessica,Jessica,,,1,0,"millie, sue, jessica, lorelai, linda, emily, amanda, mandy, anne",0,0.1,9,27,1,jessica,jessica,Jessica,,,1,0,"linda, mandy, emily, amanda, lorelai, anne, millie, jessica, sue",0,0.1,6,28,5,0,,0,4,0,1,16,wtsqdcb2,,71.31.233.241,2017-04-14 17:00:07.300994+00:00,1,A3J0IAI8AJBGKX,3TE22NPXPBDW9M33IESNFYS7BPQ44P,3S4TINXCC0OIBU01QACHCQ90T8JBOB,1.65,3.65,fzx5k4m4,,,3D7VY91L65YUBRFPDUX4KMKVY84BMW,3S4TINXCC0OIBU01QACHCQ90T8JBOB,31MCUE39BKNPGMFQNYK3PY2MEUFG32,34KYK9TV2R9X9MSUXRTQWVJ1QXMBS8,3NMDE2OGHG0L1YTUQZWF1QB1KRTFGY,3NMDE2OGHG0L1YTUQZWF1QB1KRTFGY,,$2.00,6,A3J0IAI8AJBGKX,17,0.65,1,1,1,Anne,Anne,rebecca,,,0,0,"anne, rebecca",0,0,8,1,1,Anne,Anne,Sam,,,0,0,"anne, rebecca, sam",0,0,5,2,2,Anne,Anne,Linda,,,0,0,"rebecca, linda, sam, anne",0,0,1,3,2,Anne,Anne,Mary,,,0,0,"rebecca, anne, linda, sam, mary",0,0,11,4,1,Linda,Linda,Jessica,,,0,0,"sam, rebecca, anne, mary, jessica, linda",0,0,4,5,1,Linda,Linda,Emily,,,0,0,"sam, jessica, rebecca, mary, linda, anne, emily",0,0,3,6,2,Linda,Linda,Jessica,,,0,0,"sam, rebecca, jessica, linda, emily, anne, mary",0,0,12,7,1,Linda,Linda,Mandy,,,0,0,"anne, jessica, mary, sam, mandy, emily, rebecca, linda",0,0,1,8,1,Linda,Linda,Mandy,,,0,0,"linda, mandy, emily, anne, mary, jessica, sam, rebecca",0,0,11,9,2,Linda,Linda,Anne,,,0,0,"emily, sam, linda, mandy, rebecca, jessica, anne, mary",0,0,3,10,2,Linda,Linda,Jessica,,,0,0,"emily, sam, linda, mandy, rebecca, jessica, anne, mary",0,0,3,11,2,Linda,Linda,Jessica,,,0,0,"anne, jessica, mary, sam, mandy, emily, rebecca, linda",0,0,6,12,2,Linda,Linda,Anne,,,0,0,"sam, emily, mary, jessica, mandy, linda, anne, rebecca",0,0,3,13,1,Anne,Anne,Jessica,,,0,0,"emily, sam, linda, mandy, rebecca, jessica, anne, mary",0,0,11,14,1,Anne,Anne,Jessica,,,0,0,"sam, rebecca, mandy, emily, anne, mary, jessica, linda",0,0,6,15,1,Anne,Anne,Jessica,,,0,0,"emily, sam, linda, mandy, rebecca, jessica, anne, mary",0,0,7,16,1,Anne,Anne,Jessica,,,0,0,"emily, sam, rebecca, linda, mandy, jessica, mary, anne",0,0,6,17,1,Anne,Anne,jessica,,,0,0,"emily, sam, linda, mandy, rebecca, jessica, anne, mary",0,0,3,18,2,Jessica,Jessica,Jessica,,,1,0,"anne, jessica, mary, sam, mandy, emily, rebecca, linda",0,0.1,6,19,2,Jessica,Jessica,Jessica,,,1,0,"rebecca, linda, anne, sam, jessica, emily, mandy, mary",0,0.1,9,20,2,Jessica,Jessica,Jessica,,,1,0,"linda, mary, jessica, anne, emily, mandy, rebecca, sam",0,0.1,10,21,1,Jessica,Jessica,Jessica,,,1,0,"rebecca, linda, anne, sam, jessica, emily, mandy, mary",0,0.1,11,22,1,Jessica,Jessica,Jessica,,,1,0,"anne, emily, linda, sam, rebecca, jessica, mandy, mary",0,0.1,2,23,2,Jessica,Jessica,Jessica,,,1,0,"anne, emily, linda, sam, rebecca, jessica, mandy, mary",0,0.1,12,24,2,Jessica,Jessica,jessica,,,1,0,"rebecca, linda, anne, sam, jessica, emily, mandy, mary",0,0.1,11,25,1,Jessica,Jessica,Jessica,,,1,0,"jessica, mary, anne, emily, rebecca, linda, mandy, sam",0,0.1,10,26,2,Jessica,Jessica,Jessica,,,1,0,"sam, rebecca, jessica, linda, emily, mandy, anne, mary",0,0.1,2,27,2,Jessica,Jessica,Jessica,,,1,0,"linda, mandy, emily, anne, mary, jessica, sam, rebecca",0,0.1,2,28,6,0,Worked perfect today......,0,3.65,0,1,17,og9ad1ud,,173.112.27.153,2017-04-14 17:00:08.311780+00:00,1,AFU00NU09CFXE,3KKG4CDWKIZX6S9FZ9OEW63NXH494Q,3S4TINXCC0OIBU01QACHCQ90T8JBOB,1.71,3.71,fzx5k4m4,,,3D7VY91L65YUBRFPDUX4KMKVY84BMW,3S4TINXCC0OIBU01QACHCQ90T8JBOB,31MCUE39BKNPGMFQNYK3PY2MEUFG32,34KYK9TV2R9X9MSUXRTQWVJ1QXMBS8,3NMDE2OGHG0L1YTUQZWF1QB1KRTFGY,3NMDE2OGHG0L1YTUQZWF1QB1KRTFGY,,$2.00,7,AFU00NU09CFXE,11,0.56,1,1,1,Emily,Emily,Sam,,,0,0,"sam, emily",0,0,6,1,1,Emily,Emily,Linda,,,0,0,"sam, linda, emily",0,0,10,2,1,Emily,Emily,Anne,,,0,0,"linda, sam, anne, emily",0,0,10,3,2,Anne,Anne,Stephanie,,,0,0,"stephanie, anne, linda, sam, emily",0,0,2,4,1,Stephanie,Stephanie,Mandy,,,0,0,"sam, mandy, emily, anne, stephanie, linda",0,0,6,5,2,Mandy,Mandy,Mandy,,,1,0,"sam, stephanie, linda, mandy, anne, emily",0,0.1,2,6,1,Mandy,Mandy,Mandy,,,1,0,"sam, linda, emily, stephanie, mandy, anne",0,0.1,5,7,2,Mandy,Mandy,Linda,,,0,0,"anne, sam, mandy, emily, stephanie, linda",0,-0.05,1,8,2,Mandy,Mandy,jessica,,,0,0,"linda, mandy, emily, anne, stephanie, jessica, sam",0,-0.05,3,9,2,Mandy,Mandy,Anne,,,0,0,"emily, sam, linda, mandy, jessica, stephanie, anne",0,-0.05,5,10,1,Mandy,Mandy,Anne,,,0,0,"emily, sam, linda, mandy, jessica, stephanie, anne",0,-0.05,10,11,1,Anne,Anne,Jessica,,,0,0,"anne, jessica, sam, mandy, emily, stephanie, linda",0,0,9,12,2,Anne,Anne,(none),,,0,0,"sam, emily, anne, jessica, mandy, stephanie, linda, (none)",0,0,9,13,2,Anne,Anne,Jessica,,,0,0,"emily, sam, linda, mandy, jessica, stephanie, anne, (none)",0,0,1,14,2,Anne,Anne,Jessica,,,0,0,"sam, mandy, emily, anne, jessica, stephanie, (none), linda",0,0,5,15,1,Jessica,Jessica,Jessica,,,1,0,"emily, sam, linda, mandy, jessica, stephanie, anne, (none)",0,0.1,12,16,1,Jessica,Jessica,Jessica,,,1,0,"emily, sam, linda, (none), mandy, jessica, anne, stephanie",0,0.1,11,17,2,Jessica,Jessica,Jessica,,,1,0,"emily, sam, linda, mandy, jessica, stephanie, anne, (none)",0,0.1,11,18,2,Jessica,Jessica,Mandy,,,0,0,"anne, jessica, sam, mandy, emily, (none), stephanie, linda",0,-0.05,5,19,1,Jessica,Jessica,Jessica,,,1,0,"linda, anne, stephanie, (none), sam, jessica, emily, mandy",0,0.1,6,20,2,Jessica,Jessica,Jessica,,,1,0,"sam, linda, jessica, (none), anne, emily, mandy, stephanie",0,0.1,3,21,1,Jessica,Jessica,Jessica,,,1,0,"linda, anne, stephanie, (none), sam, jessica, emily, mandy",0,0.1,3,22,1,Jessica,Jessica,Jessica,,,1,0,"stephanie, anne, emily, linda, sam, (none), jessica, mandy",0,0.1,8,23,1,Jessica,Jessica,Jessica,,,1,0,"stephanie, anne, emily, linda, sam, (none), jessica, mandy",0,0.1,12,24,1,Jessica,Jessica,Jessica,,,1,0,"linda, anne, stephanie, (none), sam, jessica, emily, mandy",0,0.1,10,25,2,Jessica,Jessica,Jessica,,,1,0,"jessica, anne, emily, linda, stephanie, (none), mandy, sam",0,0.1,11,26,1,Jessica,Jessica,Jessica,,,1,0,"sam, jessica, linda, (none), emily, stephanie, mandy, anne",0,0.1,3,27,1,Jessica,Jessica,Jessica,,,1,0,"linda, mandy, emily, (none), anne, stephanie, jessica, sam",0,0.1,9,28,7,0,Love this game. Thanks!,0,3.71,0,1,18,mfbgg25l,,24.176.163.101,2017-04-14 17:00:08.432448+00:00,1,A192MH226Q1NT4,3PWWM24LHSZNP9BIQ3ZC3VBETXQ28Y,34KYK9TV2R9X9MSUXRTQWVJ1QXMBS8,2.38,4.38,fzx5k4m4,,,3D7VY91L65YUBRFPDUX4KMKVY84BMW,3S4TINXCC0OIBU01QACHCQ90T8JBOB,31MCUE39BKNPGMFQNYK3PY2MEUFG32,34KYK9TV2R9X9MSUXRTQWVJ1QXMBS8,3NMDE2OGHG0L1YTUQZWF1QB1KRTFGY,3NMDE2OGHG0L1YTUQZWF1QB1KRTFGY,,$2.00,8,A192MH226Q1NT4,4,0.63,1,1,1,jessica,jessica,Millie,,,0,0,"millie, jessica",0,0,4,1,2,jessica,jessica,Mary,,,0,0,"mary, jessica, millie",0,0,2,2,2,jessica,jessica,Lori,,,0,0,"mary, millie, jessica, lori",0,0,2,3,1,jessica,jessica,Jessica,,,1,0,"millie, lori, jessica, mary",0,0.1,6,4,1,jessica,jessica,Jessica,,,1,0,"jessica, mary, millie, lori",0,0.1,7,5,1,jessica,jessica,Sue,,,0,0,"jessica, mary, millie, lori, sue",0,-0.05,7,6,2,jessica,jessica,Jessica,,,1,0,"sue, jessica, lori, millie, mary",0,0.1,3,7,2,jessica,jessica,jessica,,,1,0,"sue, jessica, millie, mary, lori",0,0.1,9,8,1,jessica,jessica,Mandy,,,0,0,"mandy, millie, mary, jessica, sue, lori",0,-0.05,3,9,1,jessica,jessica,Mandy,,,0,0,"lori, mandy, sue, millie, jessica, mary",0,-0.05,7,10,1,jessica,jessica,Linda,,,0,0,"lori, linda, mandy, sue, millie, jessica, mary",0,-0.05,2,11,2,jessica,jessica,emily,,,0,0,"jessica, millie, mary, lori, mandy, emily, sue, linda",0,-0.05,5,12,2,jessica,jessica,Jessica,,,1,0,"emily, mary, jessica, millie, mandy, linda, sue, lori",0,0.1,11,13,1,jessica,jessica,Jessica,,,1,0,"emily, lori, linda, mandy, sue, millie, jessica, mary",0,0.1,4,14,2,jessica,jessica,jessica,,,1,0,"sue, mandy, emily, mary, jessica, linda, lori, millie",0,0.1,8,15,2,jessica,jessica,Jessica,,,1,0,"emily, lori, linda, mandy, sue, millie, jessica, mary",0,0.1,10,16,2,jessica,jessica,jessica,,,1,0,"emily, sue, linda, lori, mandy, jessica, mary, millie",0,0.1,3,17,2,jessica,jessica,jessica,,,1,0,"emily, lori, linda, mandy, sue, millie, jessica, mary",0,0.1,2,18,1,jessica,jessica,Jessica,,,1,0,"jessica, millie, mary, lori, mandy, emily, sue, linda",0,0.1,10,19,1,jessica,jessica,Jessica,,,1,0,"linda, sue, millie, jessica, emily, mandy, lori, mary",0,0.1,5,20,1,jessica,jessica,Jessica,,,1,0,"linda, mary, lori, jessica, sue, emily, mandy, millie",0,0.1,12,21,1,jessica,jessica,jessica,,,1,0,"linda, sue, millie, jessica, emily, mandy, lori, mary",0,0.1,10,22,1,jessica,jessica,Jessica,,,1,0,"millie, emily, lori, sue, linda, jessica, mandy, mary",0,0.1,10,23,1,jessica,jessica,Jessica,,,1,0,"millie, emily, lori, sue, linda, jessica, mandy, mary",0,0.1,11,24,1,jessica,jessica,Jessica,,,1,0,"linda, sue, millie, jessica, emily, mandy, lori, mary",0,0.1,4,25,2,jessica,jessica,Jessica,,,1,0,"jessica, mary, emily, linda, millie, sue, mandy, lori",0,0.1,4,26,2,jessica,jessica,Jessica,,,1,0,"millie, sue, jessica, lori, linda, emily, mandy, mary",0,0.1,10,27,2,jessica,jessica,Jessica,,,1,0,"linda, mandy, emily, millie, mary, jessica, sue, lori",0,0.1,5,28,8,0,thanks!,0,4.38,0,1,19,xln1jejh,,67.240.16.20,2017-04-14 17:00:09.203397+00:00,1,AJD3JOWNVDZD1,3Z7ISHFUH0WDVKEUFA8QQ6LLE6OZ82,3S4TINXCC0OIBU01QACHCQ90T8JBOB,2.02,4.02,fzx5k4m4,,,3D7VY91L65YUBRFPDUX4KMKVY84BMW,3S4TINXCC0OIBU01QACHCQ90T8JBOB,31MCUE39BKNPGMFQNYK3PY2MEUFG32,34KYK9TV2R9X9MSUXRTQWVJ1QXMBS8,3NMDE2OGHG0L1YTUQZWF1QB1KRTFGY,3NMDE2OGHG0L1YTUQZWF1QB1KRTFGY,,$2.00,9,AJD3JOWNVDZD1,10,0.57,1,1,2,Millie,Millie,jessica,,,0,0,"millie, jessica",0,0,4,1,2,millie,millie,Linda,,,0,0,"jessica, millie, linda",0,0,8,2,1,linda,linda,Sue,,,0,0,"sue, linda, millie, jessica",0,0,11,3,1,Linda,Linda,Sue,,,0,0,"millie, linda, sue, jessica",0,0,10,4,1,Sue,Sue,Anne,,,0,0,"anne, sue, jessica, linda, millie",0,0,1,5,2,Sue,Sue,jessica,,,0,0,"jessica, linda, sue, anne, millie",0,0,7,6,1,Sue,Sue,Mandy,,,0,0,"millie, sue, jessica, linda, mandy, anne",0,0,6,7,1,Sue,Sue,Anne,,,0,0,"anne, jessica, millie, mandy, sue, linda",0,0,3,8,1,Sue,Sue,Anne,,,0,0,"linda, mandy, anne, millie, jessica, sue",0,0,8,9,1,Sue,Sue,jessica,,,0,0,"linda, mandy, sue, millie, jessica, anne",0,0,4,10,1,Sue,Sue,Jessica,,,0,0,"linda, mandy, sue, millie, jessica, anne",0,0,7,11,2,Sue,Sue,Jessica,,,0,0,"anne, jessica, millie, mandy, sue, linda",0,0,11,12,2,Jessica,Jessica,Jessica,,,1,0,"jessica, sue, mandy, millie, linda, anne",0,0.1,4,13,2,Jessica,Jessica,Anne,,,0,0,"linda, mandy, sue, millie, jessica, anne",0,-0.05,11,14,2,Jessica,Jessica,Jessica,,,1,0,"sue, mandy, anne, jessica, linda, millie",0,0.1,11,15,1,Jessica,Jessica,jessica,,,1,0,"linda, mandy, sue, millie, jessica, anne",0,0.1,10,16,2,Jessica,Jessica,Jessica,,,1,0,"sue, linda, mandy, jessica, anne, millie",0,0.1,5,17,1,Jessica,Jessica,Jessica,,,1,0,"linda, mandy, sue, millie, jessica, anne",0,0.1,5,18,2,Jessica,Jessica,Jessica,,,1,0,"anne, jessica, millie, mandy, sue, linda",0,0.1,1,19,1,Jessica,Jessica,Jessica,,,1,0,"linda, anne, millie, jessica, mandy, sue",0,0.1,2,20,1,Jessica,Jessica,Jessica,,,1,0,"linda, jessica, sue, anne, mandy, millie",0,0.1,3,21,2,Jessica,Jessica,Jessica,,,1,0,"linda, anne, millie, jessica, mandy, sue",0,0.1,6,22,1,Jessica,Jessica,Jessica,,,1,0,"millie, anne, linda, sue, jessica, mandy",0,0.1,12,23,2,Jessica,Jessica,Jessica,,,1,0,"millie, anne, linda, sue, jessica, mandy",0,0.1,1,24,1,Jessica,Jessica,Jessica,,,1,0,"linda, anne, millie, jessica, mandy, sue",0,0.1,6,25,2,Jessica,Jessica,Jessica,,,1,0,"jessica, anne, linda, millie, sue, mandy",0,0.1,10,26,1,Jessica,Jessica,Jessica,,,1,0,"millie, sue, jessica, linda, mandy, anne",0,0.1,5,27,1,Jessica,Jessica,Jessica,,,1,0,"linda, mandy, anne, millie, jessica, sue",0,0.1,3,28,9,0,,0,4.02,0,1,110,h8y5g6z2,,74.74.116.228,2017-04-14 17:00:10.361322+00:00,1,A2NJ7N8INZOB00,3M81GAB8A0KNJQBAVQ9NQFZIH9PBQK,34KYK9TV2R9X9MSUXRTQWVJ1QXMBS8,2.16,4.16,fzx5k4m4,,,3D7VY91L65YUBRFPDUX4KMKVY84BMW,3S4TINXCC0OIBU01QACHCQ90T8JBOB,31MCUE39BKNPGMFQNYK3PY2MEUFG32,34KYK9TV2R9X9MSUXRTQWVJ1QXMBS8,3NMDE2OGHG0L1YTUQZWF1QB1KRTFGY,3NMDE2OGHG0L1YTUQZWF1QB1KRTFGY,,$2.00,10,A2NJ7N8INZOB00,2,0.66,1,1,2,Lori,Lori,Barbara,,,0,0,"barbara, lori",0,0,5,1,1,Lori,Lori,(none),,,0,0,"lori, (none), barbara",0,0,7,2,1,Lori,Lori,jessica,,,0,0,"(none), barbara, lori, jessica",0,0,2,3,2,Lori,Lori,stephanie,,,0,0,"(none), lori, jessica, barbara, stephanie",0,0,5,4,2,Ann,Ann,Jessica,,,0,0,"stephanie, jessica, lori, (none), barbara",1,0,9,5,2,Jessica,Jessica,Emily,,,0,0,"stephanie, (none), jessica, lori, barbara, emily",0,0,1,6,2,Jessica,Jessica,Linda,,,0,0,"barbara, jessica, lori, linda, (none), emily, stephanie",0,0,11,7,1,Jessica,Jessica,Jessica,,,1,0,"jessica, lori, emily, barbara, (none), stephanie, linda",0,0.1,2,8,1,Jessica,Jessica,Jessica,,,1,0,"linda, barbara, emily, (none), stephanie, jessica, lori",0,0.1,2,9,1,Jessica,Jessica,jessica,,,1,0,"lori, emily, barbara, linda, jessica, stephanie, (none)",0,0.1,2,10,1,Jessica,Jessica,Amanda,,,0,0,"lori, emily, barbara, amanda, linda, jessica, stephanie, (none)",0,-0.05,11,11,1,Jessica,Jessica,Jessica,,,1,0,"amanda, jessica, lori, barbara, emily, (none), stephanie, linda",0,0.1,1,12,1,(none),(none),Anne,,,0,1,"emily, anne, jessica, barbara, linda, stephanie, amanda, lori, (none)",1,-0.05,9,13,1,Jessica,Jessica,Jessica,,,1,0,"emily, lori, barbara, amanda, linda, jessica, stephanie, anne, (none)",0,0.1,8,14,1,Jessica,Jessica,Anne,,,0,0,"barbara, anne, emily, jessica, amanda, stephanie, lori, (none), linda",0,-0.05,5,15,2,Jessica,Jessica,Anne,,,0,0,"emily, lori, barbara, amanda, linda, jessica, stephanie, anne, (none)",0,-0.05,7,16,2,Jessica,Jessica,Jessica,,,1,0,"emily, linda, lori, (none), jessica, amanda, anne, barbara, stephanie",0,0.1,11,17,1,Jessica,Jessica,Jessica,,,1,0,"emily, lori, barbara, amanda, linda, jessica, stephanie, anne, (none)",0,0.1,12,18,2,Jessica,Jessica,jessica,,,1,0,"amanda, anne, jessica, lori, barbara, emily, (none), stephanie, linda",0,0.1,4,19,1,Jessica,Jessica,Jessica,,,1,0,"linda, anne, stephanie, (none), amanda, emily, jessica, barbara, lori",0,0.1,1,20,1,Jessica,Jessica,Jessica,,,1,0,"linda, lori, jessica, (none), barbara, anne, amanda, emily, stephanie",0,0.1,11,21,1,Jessica,Jessica,Jessica,,,1,0,"linda, anne, stephanie, (none), amanda, emily, jessica, barbara, lori",0,0.1,12,22,2,Jessica,Jessica,Jessica,,,1,0,"stephanie, anne, emily, lori, linda, barbara, (none), jessica, amanda",0,0.1,9,23,1,Jessica,Jessica,jessica,,,1,0,"stephanie, anne, emily, lori, linda, barbara, (none), jessica, amanda",0,0.1,5,24,2,Jessica,Jessica,Jessica,,,1,0,"linda, anne, stephanie, (none), amanda, emily, jessica, barbara, lori",0,0.1,2,25,1,Jessica,Jessica,Jessica,,,1,0,"jessica, anne, emily, linda, stephanie, (none), amanda, barbara, lori",0,0.1,3,26,1,Jessica,Jessica,Jessica,,,1,0,"barbara, jessica, lori, amanda, linda, (none), emily, stephanie, anne",0,0.1,1,27,2,Jessica,Jessica,Jessica,,,1,0,"linda, barbara, emily, amanda, (none), anne, stephanie, jessica, lori",0,0.1,12,28,10,0,,0,4.16,0,1,111,cheu6j8a,,69.141.198.1,2017-04-14 17:00:10.513872+00:00,1,A3U761PEG7MFKT,3LEIZ60CDJ0D9PX4K2E4Q2GWYC6Z9R,3D7VY91L65YUBRFPDUX4KMKVY84BMW,2.12,4.12,fzx5k4m4,,,3D7VY91L65YUBRFPDUX4KMKVY84BMW,3S4TINXCC0OIBU01QACHCQ90T8JBOB,31MCUE39BKNPGMFQNYK3PY2MEUFG32,34KYK9TV2R9X9MSUXRTQWVJ1QXMBS8,3NMDE2OGHG0L1YTUQZWF1QB1KRTFGY,3NMDE2OGHG0L1YTUQZWF1QB1KRTFGY,,$2.00,11,A3U761PEG7MFKT,1,0.52,1,1,1,Jessica,Jessica,Leah,,,0,0,"leah, jessica",0,0,10,1,2,Jessica,Jessica,ann,,,0,0,"leah, jessica, ann",0,0,1,2,1,Jessica,Jessica,Britney,,,0,0,"britney, jessica, leah, ann",0,0,12,3,2,Jessica,Jessica,Sue,,,0,0,"ann, sue, jessica, britney, leah",0,0,7,4,1,Jessica,Jessica,Ann,,,0,0,"britney, sue, jessica, ann, leah",0,0,9,5,1,Jessica,Jessica,Anne,,,0,0,"jessica, britney, leah, sue, anne, ann",0,0,5,6,1,Anne,Anne,Anne,,,1,0,"sue, jessica, ann, britney, anne, leah",0,0.1,10,7,2,Anne,Anne,Linda,,,0,0,"britney, anne, jessica, leah, sue, ann, linda",0,-0.05,6,8,2,Anne,Anne,Sue,,,0,0,"linda, leah, anne, britney, jessica, sue, ann",0,-0.05,8,9,2,Anne,Anne,Jessica,,,0,0,"ann, linda, sue, jessica, britney, anne, leah",0,0,10,10,2,Jessica,Jessica,Mandy,,,0,0,"ann, linda, mandy, sue, jessica, britney, anne, leah",0,0,6,11,1,Anne,Anne,jessica,,,0,0,"britney, anne, jessica, leah, mandy, sue, ann, linda",0,0,4,12,2,Jessica,Jessica,Jessica,,,1,0,"anne, jessica, mandy, linda, sue, ann, leah, britney",0,0.1,6,13,2,Jessica,Jessica,Jessica,,,1,0,"ann, linda, mandy, sue, jessica, britney, anne, leah",0,0.1,8,14,2,Jessica,Jessica,jessica,,,1,0,"sue, mandy, anne, jessica, ann, britney, leah, linda",0,0.1,7,15,2,Jessica,Jessica,jessica,,,1,0,"ann, linda, mandy, sue, jessica, britney, anne, leah",0,0.1,2,16,1,Jessica,Jessica,jessica,,,1,0,"sue, linda, britney, mandy, jessica, anne, leah, ann",0,0.1,10,17,1,Jessica,Jessica,Jessica,,,1,0,"ann, linda, mandy, sue, jessica, britney, anne, leah",0,0.1,9,18,2,Jessica,Jessica,jessica,,,1,0,"britney, anne, jessica, leah, mandy, sue, ann, linda",0,0.1,9,19,1,Jessica,Jessica,Jessica,,,1,0,"linda, anne, leah, britney, jessica, ann, mandy, sue",0,0.1,12,20,1,Jessica,Jessica,Jessica,,,1,0,"linda, ann, jessica, britney, sue, anne, leah, mandy",0,0.1,1,21,2,Jessica,Jessica,Jessica,,,1,0,"linda, anne, leah, britney, jessica, ann, mandy, sue",0,0.1,3,22,1,Jessica,Jessica,Jessica,,,1,0,"ann, anne, sue, linda, leah, jessica, mandy, britney",0,0.1,9,23,2,Jessica,Jessica,jessica,,,1,0,"ann, anne, sue, linda, leah, jessica, mandy, britney",0,0.1,8,24,2,Jessica,Jessica,jessica,,,1,0,"linda, anne, leah, britney, jessica, ann, mandy, sue",0,0.1,7,25,1,Jessica,Jessica,Jessica,,,1,0,"jessica, anne, linda, leah, sue, ann, mandy, britney",0,0.1,6,26,2,Jessica,Jessica,Jessica,,,1,0,"sue, jessica, ann, linda, mandy, britney, anne, leah",0,0.1,5,27,1,Jessica,Jessica,Jessica,,,1,0,"linda, mandy, anne, leah, britney, jessica, sue, ann",0,0.1,12,28,11,0,ty!!,0,4.12,0,1,112,8wwp8brb,,72.224.204.211,2017-04-14 17:00:11.305897+00:00,1,AEI5USUUPBU2G,3B3WTRP3DB3N3EUSVV5Q3R6PD3829N,3S4TINXCC0OIBU01QACHCQ90T8JBOB,2.4,4.4,fzx5k4m4,,,3D7VY91L65YUBRFPDUX4KMKVY84BMW,3S4TINXCC0OIBU01QACHCQ90T8JBOB,31MCUE39BKNPGMFQNYK3PY2MEUFG32,34KYK9TV2R9X9MSUXRTQWVJ1QXMBS8,3NMDE2OGHG0L1YTUQZWF1QB1KRTFGY,3NMDE2OGHG0L1YTUQZWF1QB1KRTFGY,,$2.00,12,AEI5USUUPBU2G,13,0.65,1,1,1,Anne,Anne,sue,,,0,0,"anne, sue",0,0,1,1,1,Sue,Sue,Lori,,,0,0,"anne, sue, lori",0,0,11,2,2,Sue,Sue,Maria,,,0,0,"sue, maria, anne, lori",0,0,5,3,1,Sue,Sue,Jessica,,,0,0,"anne, jessica, lori, sue, maria",0,0,7,4,2,Sue,Sue,Jessica,,,0,0,"anne, sue, jessica, lori, maria",0,0,8,5,1,Sue,Sue,Lori,,,0,0,"jessica, lori, anne, maria, sue",0,0,8,6,2,Jessica,Jessica,Jessica,,,1,0,"sue, maria, jessica, lori, anne",0,0.1,1,7,2,Jessica,Jessica,Jessica,,,1,0,"maria, jessica, sue, lori, anne",0,0.1,2,8,1,Jessica,Jessica,jessica,,,1,0,"anne, lori, sue, jessica, maria",0,0.1,9,9,1,Jessica,Jessica,Linda,,,0,0,"lori, maria, linda, sue, jessica, anne",0,-0.05,9,10,1,Jessica,Jessica,Mandy,,,0,0,"lori, maria, linda, mandy, sue, jessica, anne",0,-0.05,5,11,1,Jessica,Jessica,Linda,,,0,0,"anne, maria, jessica, lori, mandy, sue, linda",0,-0.05,6,12,1,Jessica,Jessica,Jessica,,,1,0,"maria, anne, jessica, mandy, linda, sue, lori",0,0.1,6,13,2,Jessica,Jessica,Jessica,,,1,0,"lori, maria, linda, mandy, sue, jessica, anne",0,0.1,7,14,1,Jessica,Jessica,Jessica,,,1,0,"sue, mandy, maria, anne, jessica, lori, linda",0,0.1,11,15,2,Jessica,Jessica,Jessica,,,1,0,"lori, maria, linda, mandy, sue, jessica, anne",0,0.1,9,16,1,Jessica,Jessica,Jessica,,,1,0,"sue, linda, lori, maria, mandy, jessica, anne",0,0.1,8,17,1,Jessica,Jessica,Jessica,,,1,0,"lori, maria, linda, mandy, sue, jessica, anne",0,0.1,8,18,2,Jessica,Jessica,Jessica,,,1,0,"anne, maria, jessica, lori, mandy, sue, linda",0,0.1,8,19,2,Jessica,Jessica,jessica,,,1,0,"linda, anne, maria, jessica, mandy, lori, sue",0,0.1,5,20,2,Jessica,Jessica,jessica,,,1,0,"linda, maria, lori, jessica, sue, anne, mandy",0,0.1,12,21,1,Jessica,Jessica,Jessica,,,1,0,"linda, anne, maria, jessica, mandy, lori, sue",0,0.1,6,22,2,Jessica,Jessica,Jessica,,,1,0,"maria, anne, lori, linda, sue, jessica, mandy",0,0.1,12,23,2,Jessica,Jessica,Jessica,,,1,0,"maria, anne, lori, linda, sue, jessica, mandy",0,0.1,10,24,2,Jessica,Jessica,Jessica,,,1,0,"linda, anne, maria, jessica, mandy, lori, sue",0,0.1,8,25,1,Jessica,Jessica,Jessica,,,1,0,"jessica, anne, linda, sue, maria, mandy, lori",0,0.1,2,26,1,Jessica,Jessica,Jessica,,,1,0,"maria, sue, jessica, lori, linda, mandy, anne",0,0.1,7,27,2,Jessica,Jessica,Jessica,,,1,0,"linda, mandy, maria, anne, jessica, sue, lori",0,0.1,7,28,12,0,,0,4.4,0,1,1