18,1f1x8jhj,,76.99.191.1,2017-02-16 18:00:59.902939+00:00,1,A3HIRLDYDLBYDQ,3FE2ERCCZX9M28Z4ZIZKWU96D6FOPJ,3IVKZBIBJ0A70ZVGXJ3MI6MZ8TBHS3,0.73,2.73,fz05183z,,,3IZPORCT1FAVZKV3IU3HSWH3MRSHRF,3XWUWJ18TLRSKYT4MN5LGMTDNYYUUX,3IVKZBIBJ0A70ZVGXJ3MI6MZ8TBHS3,38G0E1M85M6SXDI4RDFQC8VW157UVM,3OR6S1RAB4JQ57CMFJANNP0AM9IAGD,3IE1FJZR9CZH2AY0D4H2PMHJN8K9K3,,$2.00,18,A3HIRLDYDLBYDQ,39,0.53,1,1,2,bob,bob,(none given),,James,0,0,"(none given), bob, james",0,0.00,20,1,2,mark,mark,Bob,,Bob,0,0,"(none given), bob, james",1,0.00,20,2,2,dan,dan,Bob,,Kevin,0,0,"(none given), kevin, bob, dan, james",0,0.00,20,3,2,john,(none given),Mark,barred,Matt,0,0,"bob, matt, kevin, james, (none given), dan, mark",1,0.00,20,4,2,ted,ted,Dan,,Chris,0,0,"chris, james, ted, dan, mark, matt, (none given), kevin, bob",0,0.00,20,5,2,rick,rick,Dan,,Michael,0,0,"bob, matt, kevin, james, michael, (none given), rick, ted, dan, chris, mark",0,0.00,20,6,2,bill,bill,David,,David,0,0,"kevin, rick, david, ted, dan, matt, mark, (none given), michael, chris, bob, james",1,0.00,20,7,2,don,don,David,,David,0,0,"james, matt, (none given), dan, ted, rick, michael, don, bob, chris, david, mark, kevin",0,0.00,20,8,2,(none given),David,bill,,Matt,0,1,"kevin, rick, david, ted, dan, matt, don, mark, (none given), bill, michael, chris, bob, james",1,0.00,20,9,2,tom,tom,David,,Matt,0,0,"james, matt, (none given), dan, ted, rick, michael, don, bill, bob, chris, david, tom, mark, kevin",0,0.00,20,10,2,matt,matt,David,,Joe,0,0,"joe, david, chris, ted, bill, (none given), dan, james, rick, matt, bob, tom, mark, don, kevin, michael",0,0.00,20,11,2,rob,rob,David,,Dan,0,0,"(none given), bill, bob, rob, matt, kevin, michael, rick, don, dan, david, ted, joe, tom, mark, james, chris",0,0.00,20,12,2,mike,mike,David,,Joe,0,0,"rick, chris, james, ted, michael, dan, mark, matt, don, bill, tom, (none given), david, joe, kevin, bob, rob",1,0.00,20,13,2,charlie,charlie,David,,Brian,0,0,"david, rob, chris, ted, bill, (none given), rick, dan, kevin, matt, bob, joe, tom, don, mark, michael, james, brian, charlie",0,0.00,20,14,2,jim,jim,Bill,,Bill,0,0,"rick, chris, james, ted, michael, dan, mark, matt, tom, bill, don, (none given), david, joe, brian, kevin, bob, rob, charlie",1,0.00,20,15,2,aaron,aaron,Bill,,Matt,0,0,"david, rob, chris, ted, bill, (none given), rick, dan, kevin, matt, bob, joe, tom, don, mark, michael, james, brian, charlie",1,0.00,20,16,2,ed,ed,Aaron,,Kevin,0,0,"david, rob, ed, chris, ted, bill, (none given), aaron, rick, dan, kevin, matt, bob, joe, tom, don, mark, michael, james, brian, charlie",0,0.00,20,17,2,jake,jake,David,,Matt,0,0,"ed, rick, brian, james, michael, don, bill, charlie, david, kevin, jake, (none given), dan, bob, joe, chris, tom, mark, matt, ted, rob, aaron",0,0.00,20,18,2,fred,fred,David,,Bob,0,0,"fred, ted, rob, don, aaron, tom, matt, bill, michael, rick, charlie, jake, mark, chris, james, ed, (none given), bob, kevin, brian, dan, joe, david",0,0.00,20,19,2,chris,chris,David,,Joe,0,0,"fred, ted, rob, don, aaron, tom, matt, bill, michael, rick, charlie, jake, mark, chris, james, ed, (none given), bob, kevin, brian, dan, joe, david",0,0.00,20,20,2,george,george,David,,Bob,0,0,"(none given), mark, david, bill, joe, rick, james, bob, aaron, ed, chris, jake, fred, brian, tom, charlie, kevin, don, michael, rob, ted, dan, matt",1,0.00,20,21,2,luke,luke,David,,Joe,0,0,"aaron, charlie, ted, matt, joe, mark, (none given), james, jake, kevin, rick, dan, luke, david, tom, rob, bill, chris, brian, ed, don, fred, michael, bob",0,0.00,20,22,2,tim,tim,David,,Bob,0,0,"luke, fred, ted, rob, don, aaron, tom, matt, bill, charlie, rick, jake, michael, mark, chris, james, ed, (none given), bob, kevin, brian, dan, joe, david",1,0.00,20,23,2,david,david,David,,Joe,1,0,"(none given), mark, david, bill, joe, james, rick, bob, aaron, ed, chris, jake, fred, brian, kevin, charlie, tom, don, michael, luke, rob, ted, dan, matt",0,0.10,20,24,2,david,david,David,,Joe,1,0,"rick, michael, (none given), david, charlie, chris, mark, kevin, bob, aaron, fred, james, jake, luke, ted, dan, matt, tom, bill, ed, don, joe, brian, rob",0,0.10,20,25,18,0,No,,0.00,1,1,18,0,,1,2.73,0.00,1,1
19,o7umu069,,75.97.156.47,2017-02-16 18:01:00.433441+00:00,1,A1945USNZHTROX,3VJ40NV2QIOKU0SBGZ8414A3290TOT,3XWUWJ18TLRSKYT4MN5LGMTDNYYUUX,1.21,3.21,fz05183z,,,3IZPORCT1FAVZKV3IU3HSWH3MRSHRF,3XWUWJ18TLRSKYT4MN5LGMTDNYYUUX,3IVKZBIBJ0A70ZVGXJ3MI6MZ8TBHS3,38G0E1M85M6SXDI4RDFQC8VW157UVM,3OR6S1RAB4JQ57CMFJANNP0AM9IAGD,3IE1FJZR9CZH2AY0D4H2PMHJN8K9K3,,$2.00,19,A1945USNZHTROX,19,0.56,1,1,1,joe,joe,(none given),,Brandon,0,0,"(none given), brandon, joe",0,0.00,6,1,1,joe,joe,Joe,,Brandon,1,0,"joe, (none given), brandon",0,0.10,7,2,1,joe,joe,Joe,,David,1,0,"joe, (none given), david, brandon",0,0.10,1,3,2,joe,joe,Brian,,James,0,0,"james, joe, david, (none given), brandon, brian",0,-0.05,12,4,2,(none given),Brian,Bill,,Brian,0,1,"james, bill, (none given), david, joe, brian, brandon",1,-0.05,6,5,2,joe,joe,Joe,,David,1,0,"james, joe, bill, david, (none given), brandon, brian",0,0.10,12,6,1,joe,joe,Bill,,David,0,0,"david, brandon, bill, (none given), joe, james, brian",0,-0.05,2,7,2,joe,joe,Bill,,Brian,0,0,"james, (none given), brian, bill, joe, brandon, david",0,-0.05,5,8,1,joe,joe,Bill,,Bob,0,0,"david, brandon, bill, (none given), joe, bob, james, brian",0,-0.05,3,9,1,joe,joe,Bill,,Bill,0,0,"james, (none given), brian, bill, joe, bob, brandon, david",0,-0.05,11,10,2,bill,bill,bob,,Jason,0,0,"david, bill, (none given), jason, joe, james, brian, bob, brandon",0,0.00,12,11,1,joe,joe,Joe,,Frank,1,0,"(none given), bill, bob, frank, brandon, jason, brian, david, joe, james",0,0.10,1,12,1,joe,joe,Joe,,Seth,1,0,"frank, james, seth, bill, (none given), david, joe, jason, brian, bob, brandon",0,0.10,3,13,1,joe,joe,Brian,,David,0,0,"frank, david, seth, bill, (none given), jason, joe, james, brian, bob, brandon",0,-0.05,11,14,1,joe,joe,Joe,,Joe,1,0,"james, frank, seth, bill, (none given), david, joe, jason, brian, bob, brandon",0,0.10,5,15,1,joe,joe,Joe,,Joe,1,0,"frank, david, seth, bill, (none given), jason, joe, james, brian, bob, brandon",0,0.10,4,16,2,joe,joe,Joe,,Peter,1,0,"frank, david, seth, bill, (none given), jason, joe, james, brian, bob, peter, brandon",0,0.10,7,17,1,joe,joe,bob,,David,0,0,"james, (none given), jason, frank, peter, brian, bill, joe, bob, brandon, seth, david",0,-0.05,11,18,1,joe,joe,John,,Bob,0,0,"(none given), frank, bill, bob, brandon, jason, peter, brian, seth, joe, john, james, david",0,-0.05,11,19,1,joe,joe,Joe,,David,1,0,"(none given), bill, frank, bob, brandon, jason, peter, brian, seth, david, joe, john, james",0,0.10,6,20,2,joe,joe,John,,Bob,0,0,"frank, david, seth, bill, (none given), jason, joe, brian, james, bob, john, peter, brandon",0,-0.05,12,21,2,joe,joe,Joe,,David,1,0,"peter, brandon, david, frank, john, jason, james, bill, seth, joe, bob, (none given), brian",0,0.10,12,22,1,joe,joe,Joe,,Bob,1,0,"(none given), bill, frank, bob, brandon, jason, peter, brian, seth, david, joe, john, james",0,0.10,7,23,2,joe,joe,bob,,David,0,0,"frank, david, seth, bill, (none given), jason, joe, brian, james, bob, john, peter, brandon",0,-0.05,6,24,1,joe,joe,Joe,,Jack,1,0,"frank, james, seth, bill, (none given), jack, peter, john, david, joe, jason, brian, bob, brandon",0,0.10,11,25,19,0,Yes,,0.00,1,1,19,0,,1,3.21,0.00,1,1
20,m7mhjxya,Inactive,71.87.66.31,2017-02-16 18:01:03.682974+00:00,1,A1NM7ZPZ3NH412,3ERMJ6L4DYT9WZASQGQQ44TGICUM7V,3IZPORCT1FAVZKV3IU3HSWH3MRSHRF,0.10,2.10,fz05183z,,,3IZPORCT1FAVZKV3IU3HSWH3MRSHRF,3XWUWJ18TLRSKYT4MN5LGMTDNYYUUX,3IVKZBIBJ0A70ZVGXJ3MI6MZ8TBHS3,38G0E1M85M6SXDI4RDFQC8VW157UVM,3OR6S1RAB4JQ57CMFJANNP0AM9IAGD,3IE1FJZR9CZH2AY0D4H2PMHJN8K9K3,,$2.00,20,A1NM7ZPZ3NH412,27,0.10,1,1,2,(none given),Keith,Carl,,Mike,0,1,"carl, mike",1,0.00,14,1,2,(none given),Carl,Keith,,David,0,1,"david, carl, mike, keith",1,0.00,14,2,1,(none given),Mike,Dan,,David,0,1,"mike, carl, dan, david, keith",1,0.00,13,3,1,(none given),Dan,George,,Matt,0,1,"carl, matt, mike, keith, david, dan, george",1,0.00,13,4,2,(none given),George,Dan,,Mark,0,1,"mike, dan, mark, matt, carl, keith, george, david",1,0.00,14,5,1,(none given),Dan,Dan,,Joe,0,1,"carl, matt, mike, keith, joe, david, dan, mark, george",1,0.00,13,6,2,(none given),Dan,Jim,,Mike,0,1,"david, mike, dan, matt, keith, george, jim, joe, mark, carl",1,0.00,14,7,1,(none given),Jim,Jim,,Bob,0,1,"mike, matt, dan, george, jim, carl, keith, joe, bob, david, mark",1,0.00,13,8,1,(none given),Jim,Joe,,Bob,0,1,"david, bob, mike, dan, matt, george, jim, keith, joe, mark, carl",1,0.00,13,9,1,(none given),Jim,Jim,,Bob,0,1,"mike, matt, george, dan, carl, jim, keith, joe, bob, david, mark",1,0.00,13,10,2,(none given),Joe,Dan,,Jason,0,1,"david, mike, carl, keith, jason, dan, george, joe, matt, bob, mark, jim",1,0.00,14,11,1,(none given),Dan,Brian,,James,0,1,"bob, jim, george, jason, matt, keith, brian, dan, mike, joe, mark, carl, james, david",1,0.00,13,12,2,(none given),Dan,Bill,,James,0,1,"jim, mike, james, dan, mark, matt, bill, keith, carl, george, david, joe, jason, brian, bob",1,0.00,14,13,2,(none given),James,Patrick,,David,0,1,"david, mike, bill, carl, keith, jason, dan, james, george, mark, matt, joe, brian, bob, patrick, jim",1,0.00,15,14,2,(none given),David,David,,George,0,1,"jim, mike, james, dan, mark, matt, bill, patrick, carl, keith, george, david, joe, jason, brian, bob",1,0.00,14,15,2,(none given),Patrick,James,,David,0,1,"david, mike, bill, carl, keith, jason, dan, james, george, mark, matt, joe, brian, bob, patrick, jim",1,0.00,15,16,2,(none given),George,Joe,,John,0,1,"david, mike, bill, carl, keith, jason, dan, james, george, mark, matt, joe, brian, bob, patrick, jim, john",1,0.00,15,17,2,(none given),John,David,,Bill,0,1,"mike, james, matt, jason, carl, dan, george, brian, jim, bill, keith, joe, bob, john, patrick, david, mark",1,0.00,14,18,2,(none given),David,David,,David,0,1,"bill, bob, patrick, jim, george, jason, john, keith, joe, brian, dan, mike, matt, mark, carl, james, david",1,0.00,14,19,2,(none given),Bill,George,,John,0,1,"bill, bob, patrick, jim, george, jason, john, keith, joe, brian, dan, mike, matt, mark, carl, james, david",1,0.00,15,20,2,(none given),David,John,,Joe,0,1,"david, mike, bill, carl, keith, jason, dan, james, george, mark, matt, joe, brian, bob, patrick, jim, john",1,0.00,15,21,2,(none given),George,George,,Joe,0,1,"david, bob, mike, dan, matt, keith, jason, george, jim, john, patrick, bill, joe, mark, carl, james, brian",1,0.00,14,22,2,(none given),John,John,,Bob,0,1,"bill, bob, patrick, jim, george, jason, john, keith, joe, brian, dan, mike, matt, mark, carl, james, david",1,0.00,15,23,2,(none given),George,George,,Joe,0,1,"david, mike, bill, carl, keith, jason, dan, james, george, mark, matt, joe, brian, bob, patrick, jim, john",1,0.00,14,24,2,(none given),George,David,,Joe,0,1,"jim, mike, james, dan, mark, matt, bill, patrick, carl, keith, george, john, david, joe, jason, brian, bob",1,0.00,15,25,20,0,,,0.00,1,1,20,0,,,2.1,0.00,1,1
21,f137a7kd,,70.15.189.80,2017-02-16 18:01:08.434991+00:00,1,AGFYWCPRQIB6O,3SPJ03342142AB08AS3Y1PLWIH8YJ4,38G0E1M85M6SXDI4RDFQC8VW157UVM,0.44,2.44,fz05183z,,,3IZPORCT1FAVZKV3IU3HSWH3MRSHRF,3XWUWJ18TLRSKYT4MN5LGMTDNYYUUX,3IVKZBIBJ0A70ZVGXJ3MI6MZ8TBHS3,38G0E1M85M6SXDI4RDFQC8VW157UVM,3OR6S1RAB4JQ57CMFJANNP0AM9IAGD,3IE1FJZR9CZH2AY0D4H2PMHJN8K9K3,,$2.00,21,AGFYWCPRQIB6O,17,0.14,1,1,2,(none given),Jeff,(none given),,Bob,0,1,"(none given), bob",1,0.00,10,1,2,Stern,Stern,michael,,Bob,0,0,"(none given), bob, stern, michael",0,0.00,6,2,1,SternMan,SternMan,bob,,David,0,0,"(none given), bob, michael, stern, sternman, david",0,0.00,10,3,1,bob,bob,Joe,,Bob,0,0,"bob, michael, stern, david, sternman, (none given), joe",0,0.00,1,4,2,bob,bob,Bob,,Bill,1,0,"sternman, michael, stern, bill, (none given), david, joe, bob",0,0.10,7,5,1,bob,bob,bob,,David,1,0,"bob, bill, sternman, stern, david, michael, (none given), joe",0,0.10,1,6,1,bob,bob,Bill,,Patrick,0,0,"david, stern, patrick, bill, joe, michael, sternman, bob, (none given)",0,-0.05,10,7,1,bob,bob,Bob,,Bob,1,0,"stern, michael, (none given), bill, joe, bob, sternman, patrick, david",0,0.10,3,8,1,bob,bob,matt,,Joe,0,0,"david, matt, stern, patrick, bill, joe, michael, sternman, bob, (none given)",0,-0.05,9,9,1,bob,bob,bob,,Matt,1,0,"stern, matt, michael, (none given), bill, joe, bob, sternman, patrick, david",0,0.10,4,10,2,bob,bob,Bob,,David,1,0,"david, bill, sternman, (none given), joe, patrick, matt, bob, michael, stern",0,0.10,1,11,2,bob,bob,Bill,,Bill,0,0,"(none given), bill, patrick, bob, michael, stern, david, sternman, joe, matt",0,-0.05,7,12,2,bob,bob,Bill,,John,0,0,"sternman, michael, stern, matt, bill, patrick, (none given), john, david, joe, bob",0,-0.05,9,13,1,bob,bob,bob,,Bob,1,0,"david, bill, sternman, (none given), joe, patrick, matt, bob, john, michael, stern",0,0.10,5,14,2,bob,bob,bob,,James,1,0,"sternman, james, michael, stern, matt, bill, patrick, (none given), john, david, joe, bob",0,0.10,2,15,2,bob,bob,bob,,Bill,1,0,"david, bill, sternman, (none given), joe, james, patrick, matt, bob, john, michael, stern",0,0.10,2,16,1,bob,bob,Peter,,Bob,0,0,"david, bill, sternman, (none given), joe, james, patrick, matt, bob, john, peter, michael, stern",0,-0.05,10,17,1,bob,bob,Nick,,Joe,0,0,"stern, james, (none given), matt, peter, michael, bill, joe, bob, sternman, nick, patrick, david, john",0,-0.05,2,18,1,bob,bob,joe,,Joe,0,0,"(none given), bill, bob, nick, patrick, michael, peter, stern, sternman, david, joe, john, james, matt",0,-0.05,8,19,1,bob,bob,Danny,,Joe,0,0,"(none given), bill, bob, nick, patrick, danny, michael, peter, stern, sternman, david, joe, john, james, matt",0,-0.05,2,20,1,bob,bob,david,,Matt,0,0,"david, bill, peter, (none given), sternman, joe, patrick, james, matt, bob, john, nick, michael, stern, danny",0,-0.05,8,21,1,bob,bob,David,,Brian,0,0,"peter, david, matt, john, james, stern, danny, bill, patrick, nick, michael, sternman, joe, bob, (none given), brian",0,-0.05,6,22,2,bob,bob,joe,,Joe,0,0,"(none given), bill, patrick, danny, nick, bob, peter, michael, stern, brian, david, sternman, joe, john, james, matt",0,-0.05,10,23,2,bob,bob,david,,Joe,0,0,"david, michael, bill, sternman, (none given), joe, james, patrick, matt, bob, brian, john, peter, nick, stern, danny",0,-0.05,3,24,1,bob,bob,bob,,David,1,0,"sternman, james, michael, stern, matt, nick, bill, danny, patrick, (none given), peter, john, david, joe, brian, bob",0,0.10,8,25,21,0,No,,0.00,1,1,21,0,,1,2.44,0.00,1,1
22,18z79vm3,,50.108.176.100,2017-02-16 18:01:15.061152+00:00,1,A1EI4NMV2EHSIY,3G0WWMR1UVLPKZ07YGEWHAZBSSWQNX,3IZPORCT1FAVZKV3IU3HSWH3MRSHRF,0.63,2.63,fz05183z,,,3IZPORCT1FAVZKV3IU3HSWH3MRSHRF,3XWUWJ18TLRSKYT4MN5LGMTDNYYUUX,3IVKZBIBJ0A70ZVGXJ3MI6MZ8TBHS3,38G0E1M85M6SXDI4RDFQC8VW157UVM,3OR6S1RAB4JQ57CMFJANNP0AM9IAGD,3IE1FJZR9CZH2AY0D4H2PMHJN8K9K3,,$2.00,22,A1EI4NMV2EHSIY,20,0.63,1,1,2,john,(none given),Michael,barred,(none given),0,0,"(none given), michael",0,0.00,9,1,1,michael,michael,Stern,,Steve,0,0,"(none given), steve, stern, michael",0,0.00,6,2,2,bob,bob,SternMan,,Matt,0,0,"(none given), michael, stern, sternman, steve, matt",1,0.00,10,3,1,matt,matt,matt,,Bob,1,0,"bob, matt, michael, stern, sternman, steve, (none given)",0,0.10,7,4,2,matt,matt,matt,,Mike,1,0,"sternman, mike, michael, stern, matt, (none given), steve, bob",0,0.10,12,5,1,matt,matt,matt,,Bob,1,0,"bob, matt, mike, sternman, stern, michael, steve, (none given)",0,0.10,5,6,2,matt,matt,david,,Levi,0,0,"levi, david, mike, steve, matt, stern, michael, sternman, bob, (none given)",0,-0.05,9,7,2,matt,matt,matt,,David,1,0,"steve, mike, stern, matt, michael, (none given), bob, sternman, david, levi",0,0.10,12,8,1,matt,matt,david,,Joe,0,0,"levi, david, mike, matt, stern, michael, joe, steve, sternman, bob, (none given)",0,-0.05,2,9,1,matt,matt,David,,Matt,0,0,"steve, mike, stern, michael, matt, (none given), joe, bob, sternman, david, levi",0,-0.05,2,10,1,matt,matt,david,,John,0,0,"david, mike, levi, sternman, (none given), joe, matt, bob, steve, john, michael, stern",0,-0.05,2,11,2,david,david,Bill,,Matt,0,0,"(none given), bob, bill, matt, michael, levi, stern, mike, sternman, joe, john, steve, david",0,-0.05,12,12,1,matt,matt,Bill,,Brian,0,0,"sternman, levi, mike, michael, stern, matt, bill, (none given), steve, john, david, joe, brian, bob",0,-0.05,10,13,2,matt,matt,David,,John,0,0,"david, mike, levi, bill, sternman, (none given), joe, brian, matt, bob, steve, john, michael, stern",0,-0.05,6,14,2,matt,matt,James,,Matt,0,0,"sternman, levi, mike, james, michael, stern, matt, bill, (none given), steve, john, david, joe, brian, bob",0,-0.05,7,15,1,matt,matt,david,,James,0,0,"david, mike, levi, bill, sternman, (none given), joe, james, brian, matt, bob, steve, john, michael, stern",0,0.00,10,16,2,matt,matt,matt,,Bob,1,0,"david, mike, levi, bill, sternman, (none given), joe, james, brian, matt, bob, steve, john, michael, stern",0,0.10,9,17,1,matt,matt,David,,Joe,0,0,"steve, mike, james, michael, stern, matt, (none given), brian, bill, joe, bob, sternman, levi, david, john",0,-0.05,3,18,2,matt,matt,bill,,Joe,0,0,"(none given), bill, bob, michael, levi, stern, joe, brian, mike, sternman, matt, david, john, steve, james",0,-0.05,5,19,1,matt,matt,david,,John,0,0,"(none given), bill, bob, michael, levi, stern, joe, brian, mike, sternman, matt, david, john, steve, james",0,0.00,3,20,2,david,david,bob,,Charlie,0,0,"david, mike, levi, bill, sternman, (none given), joe, james, brian, matt, bob, steve, john, charlie, michael, stern",0,0.00,8,21,2,david,david,david,,Bob,1,0,"levi, david, charlie, mike, matt, james, john, stern, michael, bill, joe, steve, sternman, bob, (none given), brian",0,0.10,1,22,1,david,david,bill,,David,0,0,"(none given), bill, bob, matt, charlie, michael, levi, brian, stern, mike, sternman, joe, john, steve, james, david",0,-0.05,11,23,1,david,david,bob,,Bob,0,0,"david, mike, levi, bill, sternman, (none given), stern, joe, james, brian, matt, bob, charlie, john, michael, steve",0,-0.05,3,24,2,david,david,bill,,Jack,0,0,"sternman, mike, levi, james, michael, stern, matt, bill, (none given), steve, john, david, joe, jack, brian, bob, charlie",0,0.00,5,25,22,0,Yes,,0.00,1,1,22,0,"My first choice was a blacklisted name, maybe have a list before so we don't pick them? Also a couple rounds someone didn't even use a name, they used Stern? It was easier when you could see more of the random people who had picked",1,2.63,0.00,1,1
23,cbin7qmd,,50.25.55.68,2017-02-16 18:01:17.829588+00:00,1,A1VW8Y7XCV3DRW,3X87C8JFV6CM0CSC6CVIG49HFR4QS9,3IZPORCT1FAVZKV3IU3HSWH3MRSHRF,0.90,2.90,fz05183z,,,3IZPORCT1FAVZKV3IU3HSWH3MRSHRF,3XWUWJ18TLRSKYT4MN5LGMTDNYYUUX,3IVKZBIBJ0A70ZVGXJ3MI6MZ8TBHS3,38G0E1M85M6SXDI4RDFQC8VW157UVM,3OR6S1RAB4JQ57CMFJANNP0AM9IAGD,3IE1FJZR9CZH2AY0D4H2PMHJN8K9K3,,$2.00,23,A1VW8Y7XCV3DRW,15,0.65,1,1,1,John,(none given),Jeff,barred,(none given),0,0,"(none given), jeff",0,0.00,10,1,2,Jeff,Jeff,bill,,Steve,0,0,"(none given), jeff, bill, steve",0,0.00,3,2,1,Bill,Bill,Tim,,David,0,0,"(none given), bill, jeff, tim, steve, david",0,0.00,7,3,2,Jeff,Jeff,Kevin,,Joe,0,0,"tim, kevin, bill, jeff, joe, david, steve, (none given)",0,0.00,5,4,2,Jim,Jim,Bill,,Matt,0,0,"jim, matt, bill, (none given), steve, david, joe, kevin, tim, jeff",0,0.00,4,5,1,Jim,Jim,Bill,,Bob,0,0,"tim, bob, matt, kevin, bill, joe, jeff, jim, steve, (none given), david",0,0.00,10,6,2,Bill,Bill,bob,,David,0,0,"kevin, david, matt, jim, tim, jeff, bill, joe, steve, bob, (none given)",0,0.00,10,7,1,Bill,Bill,david,,David,0,0,"steve, matt, (none given), jim, bill, bob, joe, tim, david, jeff, kevin",0,0.00,8,8,2,David,David,david,,Matt,1,0,"kevin, david, matt, jim, tim, jeff, bill, joe, steve, bob, (none given)",0,0.10,6,9,2,David,David,Brian,,Bob,0,0,"steve, matt, (none given), jim, brian, bill, bob, joe, tim, david, jeff, kevin",0,-0.05,1,10,1,Bob,Bob,bob,,Matt,1,0,"david, bill, (none given), jeff, joe, brian, kevin, matt, bob, jim, steve, tim",0,0.10,1,11,1,Bill,Bill,bob,,Joe,0,0,"(none given), bill, bob, jim, jeff, kevin, tim, brian, david, joe, steve, matt",0,-0.05,7,12,1,Bill,Bill,bob,,David,0,0,"jim, matt, bill, kevin, (none given), steve, david, joe, brian, tim, bob, jeff",0,-0.05,9,13,2,Bill,Bill,Joe,,Steven,0,0,"david, bill, (none given), jeff, joe, brian, kevin, matt, bob, jim, steve, steven, tim",0,-0.05,4,14,2,Steven,Steven,david,,Bob,0,0,"jim, tim, steven, matt, bill, (none given), steve, david, joe, brian, kevin, bob, jeff",0,0.00,8,15,2,Bob,Bob,David,,Bob,0,0,"david, bill, (none given), jeff, joe, brian, kevin, matt, bob, jim, steve, steven, tim",0,0.00,7,16,2,Bob,Bob,david,,Matt,0,0,"david, bill, (none given), jeff, joe, brian, kevin, matt, bob, jim, steve, steven, tim",0,0.00,5,17,1,David,David,Joe,,Matt,0,0,"steve, (none given), matt, steven, brian, jim, bill, joe, bob, tim, david, jeff, kevin",0,0.00,10,18,2,David,David,david,,Joe,1,0,"(none given), bill, bob, jim, matt, jeff, kevin, tim, steven, brian, joe, steve, david",0,0.10,1,19,1,David,David,david,,David,1,0,"(none given), bill, bob, jim, matt, jeff, kevin, tim, steven, brian, joe, steve, david",0,0.10,8,20,2,David,David,david,,Joe,1,0,"david, bill, (none given), jeff, joe, brian, kevin, matt, bob, jim, steve, steven, tim",0,0.10,3,21,2,David,David,bob,,Joe,0,0,"kevin, david, steven, matt, jim, tim, jeff, bill, joe, steve, bob, (none given), brian",0,-0.05,6,22,1,Joe,Joe,Tyson,,Joe,0,0,"(none given), bill, bob, jim, matt, jeff, kevin, tim, steven, brian, tyson, joe, steve, david",0,-0.05,5,23,1,Joe,Joe,david,,David,0,0,"david, tyson, bill, (none given), jeff, joe, brian, kevin, matt, bob, jim, steve, steven, tim",0,-0.05,9,24,2,David,David,david,,Bill,1,0,"jim, tim, steven, tyson, matt, bill, (none given), steve, david, joe, brian, kevin, bob, jeff",0,0.10,1,25,23,0,Yes,,0.00,1,1,23,0,Great game :) thanks for the invitation.,1,2.9,0.00,1,1
24,s0kjk2m3,,99.29.6.106,2017-02-16 18:02:10.460767+00:00,1,A258MR1IS96JEP,3UOUJI6MTDFMOMLSHVLAPDNYXRCUXQ,3XWUWJ18TLRSKYT4MN5LGMTDNYYUUX,0.99,2.99,fz05183z,,,3IZPORCT1FAVZKV3IU3HSWH3MRSHRF,3XWUWJ18TLRSKYT4MN5LGMTDNYYUUX,3IVKZBIBJ0A70ZVGXJ3MI6MZ8TBHS3,38G0E1M85M6SXDI4RDFQC8VW157UVM,3OR6S1RAB4JQ57CMFJANNP0AM9IAGD,3IE1FJZR9CZH2AY0D4H2PMHJN8K9K3,,$2.00,24,A258MR1IS96JEP,3,0.49,1,1,1,(none given),Mike,bill,,Mathew,0,1,"mathew, bill",1,0.00,1,1,1,bill,bill,Jeff,,David,0,0,"mathew, jeff, bill, david",0,0.00,3,2,1,dick,dick,Kevin,,James,0,0,"mathew, bill, kevin, jeff, dick, david, james",0,0.00,9,3,1,(none given),Kevin,Jeff,,Brian,0,1,"kevin, bill, jeff, james, david, dick, mathew, brian",1,0.00,5,4,1,Bill,Bill,Brian,,James,0,0,"james, mathew, bill, david, brian, kevin, dick, jeff",0,0.00,6,5,2,Bill,Bill,Jim,,David,0,0,"kevin, bill, james, jeff, david, jim, dick, mathew, brian",0,0.00,10,6,2,Bill,Bill,joe,,Matt,0,0,"kevin, david, dick, matt, jim, jeff, bill, mathew, joe, james, brian",0,0.00,2,7,1,Bill,Bill,joe,,Brian,0,0,"dick, matt, james, jim, brian, bill, joe, david, mathew, jeff, kevin",0,0.00,5,8,2,Bill,Bill,joe,,Matt,0,0,"kevin, david, dick, matt, jim, jeff, bill, mathew, joe, james, brian",0,0.00,3,9,2,Bill,Bill,joe,,David,0,0,"dick, matt, james, jim, brian, bill, joe, david, mathew, jeff, kevin",0,0.00,11,10,1,Bill,Bill,Joe,,Matt,0,0,"david, dick, bill, jeff, joe, james, kevin, matt, brian, mathew, jim",0,0.00,9,11,2,Joe,Joe,joe,,Frank,1,0,"mathew, bill, frank, jim, kevin, dick, jeff, brian, david, joe, james, matt",0,0.10,1,12,2,Joe,Joe,joe,,David,1,0,"jim, jeff, frank, james, mathew, matt, bill, david, joe, brian, kevin, dick",0,0.10,3,13,1,Joe,Joe,Bill,,Joe,0,0,"frank, david, dick, bill, jeff, joe, brian, kevin, james, matt, mathew, jim",0,-0.05,4,14,2,Joe,Joe,Bob,,David,0,0,"jim, jeff, frank, james, mathew, matt, bill, david, joe, brian, kevin, bob, dick",0,-0.05,12,15,2,Joe,Joe,joe,,John,1,0,"frank, david, dick, bill, jeff, joe, james, brian, matt, kevin, bob, john, mathew, jim",0,0.10,4,16,1,Joe,Joe,Bob,,Kevin,0,0,"frank, david, dick, bill, jeff, joe, james, brian, matt, kevin, bob, john, mathew, jim",0,-0.05,6,17,2,Joe,Joe,David,,Joe,0,0,"dick, james, matt, frank, brian, jim, bill, joe, bob, david, john, mathew, jeff, kevin",0,-0.05,10,18,1,Joe,Joe,Joe,,Joe,1,0,"mathew, bill, frank, bob, jim, matt, jeff, dick, kevin, brian, joe, john, james, david",0,0.10,9,19,2,Joe,Joe,Joe,,Tom,1,0,"mathew, bill, frank, bob, jim, matt, jeff, dick, kevin, brian, tom, joe, john, james, david",0,0.10,1,20,2,Joe,Joe,Bob,,David,0,0,"frank, david, dick, bill, jeff, joe, brian, kevin, matt, bob, tom, john, james, mathew, jim",0,-0.05,6,21,2,Joe,Joe,Bob,,Joe,0,0,"kevin, david, dick, frank, tom, matt, jim, john, jeff, bill, mathew, joe, bob, james, brian",0,-0.05,11,22,2,Joe,Joe,joe,,Joe,1,0,"mathew, bill, frank, bob, jim, jeff, dick, kevin, brian, tom, david, joe, john, james, matt",0,0.10,7,23,1,Joe,Joe,Joe,,David,1,0,"frank, david, dick, bill, jeff, joe, brian, kevin, matt, bob, tom, john, james, mathew, jim",0,0.10,2,24,1,Joe,Joe,Joe,,Joe,1,0,"jim, frank, james, mathew, matt, tom, bill, john, david, joe, brian, kevin, bob, dick, jeff",0,0.10,9,25,24,0,Unsure,,0.00,1,1,24,0,seems almost impossible to predict,1,2.99,0.00,1,1
