11,nzo5346j,,73.24.157.202,2017-03-15 17:00:30.820275+00:00,1,A610SH5RY1NG1,3XC1O3LBOSNCOFPE37SC9N69AXQLTO,337F8MIIMZEDNEN99A0JEB7CBPN04J,1.84,3.84,ts44u31l,,,3J94SKDEKIQPIHS3ZR7OYAX95AR5DM,3O2Y2UIUCQVPYKR2XK6KOZJCED2KFX,337F8MIIMZEDNEN99A0JEB7CBPN04J,3KL228NDMVNVCKNX84C26KJOFS2KGW,33CY53T7YFR23AA9JZJ7YQKHNEPDHJ,36TBNKR908OQJ0J7TYB1DNN4VY1ED8,,$2.00,11,A610SH5RY1NG1,3,0.84,1,1,2,(none),(none),Laura,,"(none), Jen",0,1,"laura, (none), jen",1,0,10,1,1,june,june,Jane,,"Amber, Michelle",0,0,"laura, amber, michelle, june, jane, (none), jen",0,0,11,2,2,jill,jill,Rebecca,,"Becky, Rachel",0,0,"rachel, rebecca, laura, michelle, june, jane, becky, amber, (none), jen",1,0,2,3,1,sasha,sasha,Alice,,"Karen, Jill",0,0,"karen, (none), alice, becky, rebecca, jane, rachel, laura, june, michelle, amber, jill, sasha, jen",0,0,4,4,1,laura,laura,Jen,,"Jen, Sue",0,0,"june, alice, rachel, (none), karen, laura, michelle, jane, becky, sasha, rebecca, jill, jen, sue, amber",0,0,6,5,1,bernice,bernice,Maria,,"Karen, Karen",0,0,"laura, amber, bernice, michelle, alice, june, jane, sasha, rachel, maria, (none), karen, jill, sue, becky, rebecca, jen",0,0,10,6,1,maya,maya,Karen,,"Becky, Jill",0,0,"(none), jill, sue, becky, alice, laura, sasha, maya, amber, rachel, karen, rebecca, michelle, jen, maria, jane, bernice, june",0,0,9,7,1,becky,becky,maria,,"Jill, Maria",0,0,"laura, amber, bernice, michelle, alice, june, sasha, jane, rachel, maria, (none), jill, maya, sue, becky, karen, rebecca, jen",0,0,11,8,2,laura,laura,Maria,,"Jill, Mary",0,0,"maya, rachel, rebecca, jill, maria, mary, laura, bernice, michelle, june, jane, sasha, alice, becky, karen, amber, (none), sue, jen",0,0,7,9,2,misha,misha,Maria,,"Jill, Jill",0,0,"misha, mary, maria, rachel, maya, rebecca, jill, laura, amber, bernice, michelle, jane, sasha, alice, becky, karen, june, (none), sue, jen",0,0,4,10,1,maria,maria,Karen,,"Jill, Jill",0,0,"jill, misha, becky, mary, (none), maya, laura, sasha, alice, sue, amber, rachel, karen, rebecca, michelle, jen, maria, jane, bernice, june",0,0,10,11,2,maria,maria,Karen,,"Maria, Jill",0,0,"laura, amber, bernice, michelle, misha, alice, june, jane, sasha, rachel, sue, maria, maya, jill, karen, mary, becky, (none), rebecca, jen",0,0,4,12,2,karen,karen,Jill,,"Jill, Maria",0,0,"laura, amber, bernice, michelle, misha, alice, june, jane, sasha, rachel, sue, maria, maya, jill, karen, mary, becky, (none), rebecca, jen",0,0,6,13,1,maria,maria,Jill,,"Jill, Jill",0,0,"sue, maria, (none), sasha, maya, becky, mary, june, karen, rachel, jill, laura, rebecca, michelle, jane, amber, misha, jen, bernice, alice",0,0,7,14,2,karen,karen,JILL,,"Jill, Jill",0,0,"sue, maria, (none), sasha, maya, becky, mary, june, karen, rachel, jill, laura, rebecca, michelle, jane, amber, misha, jen, bernice, alice",0,0,11,15,2,JILL,JILL,Jill,,"Jill, Jill",1,0,"june, misha, alice, rachel, maria, laura, mary, michelle, karen, (none), jane, becky, sasha, rebecca, maya, jill, sue, bernice, jen, amber",0,0.1,5,16,1,jill,jill,Jill,,"Jill, Maria",1,0,"jill, misha, becky, mary, (none), maya, laura, sasha, alice, sue, amber, rachel, karen, rebecca, michelle, jen, maria, jane, bernice, june",0,0.1,5,17,1,jill,jill,Jill,,"Jill, Jill",1,0,"karen, misha, (none), alice, maria, sue, maya, rebecca, becky, michelle, jane, rachel, laura, mary, amber, bernice, sasha, june, jen, jill",0,0.1,11,18,1,jill,jill,Jill,,"Jill, Jill",1,0,"laura, amber, bernice, michelle, misha, alice, june, jane, sasha, rachel, sue, maria, maya, jill, karen, mary, becky, (none), rebecca, jen",0,0.1,2,19,1,jill,jill,Jill,,"Jill, Jill",1,0,"sue, maria, (none), sasha, maya, becky, mary, june, karen, rachel, jill, laura, rebecca, michelle, jane, amber, misha, jen, bernice, alice",0,0.1,5,20,1,jill,jill,Jill,,"Jill, Jill",1,0,"alice, (none), laura, rebecca, sasha, maria, jill, amber, bernice, jen, karen, june, rachel, misha, jane, maya, mary, becky, michelle, sue",0,0.1,2,21,2,jill,jill,Jill,,"Jill, Jill",1,0,"jill, misha, becky, mary, (none), maya, laura, sasha, alice, sue, amber, rachel, karen, rebecca, michelle, jen, maria, jane, bernice, june",0,0.1,7,22,2,jill,jill,Jill,,"Jill, Jill",1,0,"bernice, jane, alice, (none), laura, mary, rebecca, maria, michelle, sue, rachel, maya, jill, sasha, becky, karen, amber, jen, misha, june",0,0.1,1,23,1,jill,jill,Jill,,"Jill, Jill",1,0,"jill, misha, becky, mary, (none), maya, laura, sasha, alice, sue, amber, rachel, karen, rebecca, michelle, jen, maria, jane, bernice, june",0,0.1,3,24,2,jill,jill,jill,,"Jill, Jill",1,0,"bernice, jane, alice, (none), laura, mary, rebecca, maria, michelle, sue, rachel, maya, jill, sasha, becky, karen, amber, jen, misha, june",0,0.1,8,25,11,0,Thanks for the fair wages :),0,3.84,0,1,113,oyg3ht26,,45.36.242.127,2017-03-15 17:00:34.797125+00:00,1,A150GMV1YQWWB3,3H0W84IWBK3L2U2UIW0DWDF7DFSERH,3O2Y2UIUCQVPYKR2XK6KOZJCED2KFX,2.53,4.53,ts44u31l,,,3J94SKDEKIQPIHS3ZR7OYAX95AR5DM,3O2Y2UIUCQVPYKR2XK6KOZJCED2KFX,337F8MIIMZEDNEN99A0JEB7CBPN04J,3KL228NDMVNVCKNX84C26KJOFS2KGW,33CY53T7YFR23AA9JZJ7YQKHNEPDHJ,36TBNKR908OQJ0J7TYB1DNN4VY1ED8,,$2.00,12,A150GMV1YQWWB3,15,0.83,1,1,2,Jill,Jill,(none),,"Becky, (none)",0,0,"becky, (none), jill",0,0,3,1,1,Jill,Jill,Amy,,"Becky, Karen",0,0,"becky, amy, (none), jill, karen",0,0,9,2,2,Jill,Jill,jill,,"Jill, Sue",1,0,"jill, amy, becky, karen, (none), sue",0,0.1,6,3,1,Jill,Jill,Rachel,,"Jill, Sue",0,0,"karen, (none), sue, becky, rachel, jill, amy",0,-0.05,2,4,2,Jill,Jill,jill,,"Maria, Maria",1,0,"rachel, (none), karen, maria, becky, jill, sue, amy",0,0.1,1,5,2,jill,jill,Rachel,,"(none), Bernice",0,0,"bernice, amy, rachel, maria, (none), jill, karen, sue, becky",0,-0.05,7,6,1,Jill,Jill,Sue,,"Jill, Jill",0,0,"jill, sue, becky, amy, rachel, karen, maria, bernice, (none)",0,-0.05,8,7,2,Jill,Jill,Jill,,"Maria, Becky",1,0,"bernice, amy, rachel, maria, (none), jill, karen, sue, becky",0,0.1,5,8,1,Jill,Jill,Sue,,"Laura, Jill",0,0,"rachel, maria, jill, laura, bernice, amy, becky, karen, (none), sue",0,-0.05,12,9,2,Jill,Jill,Jill,,"Jill, Jill",1,0,"rachel, maria, jill, laura, bernice, amy, becky, karen, (none), sue",0,0.1,11,10,2,Jill,Jill,Jill,,"Jill, Jill",1,0,"jill, becky, sue, amy, laura, rachel, karen, maria, bernice, (none)",0,0.1,3,11,1,Jill,Jill,Jill,,"Jill, Jill",1,0,"laura, bernice, amy, rachel, maria, (none), jill, karen, sue, becky",0,0.1,10,12,2,Jill,Jill,Jill,,"Jill, Karen",1,0,"laura, bernice, amy, rachel, maria, (none), jill, karen, sue, becky",0,0.1,11,13,1,Jill,Jill,Jill,,"Jill, Jill",1,0,"sue, maria, (none), karen, rachel, jill, laura, amy, bernice, becky",0,0.1,10,14,1,Jill,Jill,Jill,,"Jill, Jill",1,0,"sue, maria, (none), karen, rachel, jill, laura, amy, bernice, becky",0,0.1,5,15,2,Jill,Jill,Jill,,"Jill, Jill",1,0,"maria, rachel, laura, karen, (none), becky, jill, sue, amy, bernice",0,0.1,11,16,1,Jill,Jill,Jill,,"Jill, Jill",1,0,"jill, becky, sue, amy, laura, rachel, karen, maria, bernice, (none)",0,0.1,9,17,2,Jill,Jill,Jill,,"Jill, Jill",1,0,"karen, (none), maria, sue, becky, rachel, bernice, laura, jill, amy",0,0.1,3,18,2,Jill,Jill,Jill,,"Jill, Jill",1,0,"laura, bernice, amy, rachel, maria, (none), jill, karen, sue, becky",0,0.1,4,19,1,Jill,Jill,Jill,,"Jill, Jill",1,0,"sue, maria, (none), karen, rachel, jill, laura, amy, bernice, becky",0,0.1,8,20,2,Jill,Jill,jill,,"Jill, Jill",1,0,"(none), laura, jill, amy, bernice, maria, karen, rachel, becky, sue",0,0.1,7,21,1,Jill,Jill,Jill,,"Jill, Jill",1,0,"jill, becky, sue, amy, laura, rachel, karen, maria, bernice, (none)",0,0.1,9,22,1,Jill,Jill,Jill,,"Jill, Jill",1,0,"bernice, (none), laura, sue, maria, rachel, jill, karen, becky, amy",0,0.1,10,23,2,Jill,Jill,Jill,,"Jill, Jill",1,0,"jill, becky, sue, amy, laura, rachel, karen, maria, bernice, (none)",0,0.1,11,24,2,Jill,Jill,Jill,,"Jill, Jill",1,0,"bernice, (none), laura, sue, maria, rachel, jill, karen, becky, amy",0,0.1,3,25,13,0,,0,4.53,0,1,114,m5m1h02i,,73.114.222.76,2017-03-15 17:00:36.987062+00:00,1,A1M682B2WUSYJP,3EICBYG644XP78Z3E0L94YTDIMLJC1,3O2Y2UIUCQVPYKR2XK6KOZJCED2KFX,1.84,3.84,ts44u31l,,,3J94SKDEKIQPIHS3ZR7OYAX95AR5DM,3O2Y2UIUCQVPYKR2XK6KOZJCED2KFX,337F8MIIMZEDNEN99A0JEB7CBPN04J,3KL228NDMVNVCKNX84C26KJOFS2KGW,33CY53T7YFR23AA9JZJ7YQKHNEPDHJ,36TBNKR908OQJ0J7TYB1DNN4VY1ED8,,$2.00,13,A1M682B2WUSYJP,22,0.94,1,1,2,Alice,Alice,Jane,,"Jill, (none)",0,0,"alice, jane, (none), jill",0,0,7,1,2,Jane,Jane,june,,"Amber, Amy",0,0,"amber, amy, alice, june, jane, (none), jill",0,0,11,2,2,June,June,JANE,,"Jill, Jane",0,0,"jill, amber, jane, amy, alice, june, (none)",0,0,7,3,2,Alice,Alice,sasha,,"Karen, Maria",0,0,"karen, (none), alice, maria, jane, amber, sasha, june, jill, amy",0,0,4,4,1,Alice,Alice,Karen,,"Jessica, Jill",0,0,"june, alice, maria, (none), karen, jessica, jane, sasha, jill, amy, amber",0,0,2,5,1,Karen,Karen,Becky,,"Rachel, Jill",0,0,"amber, amy, alice, june, jane, sasha, rachel, maria, (none), karen, jill, becky, jessica",0,0,4,6,1,June,June,Becky,,"Jill, Maya",0,0,"(none), jill, becky, amy, sasha, alice, jessica, maya, amber, rachel, karen, maria, jane, june",0,0,4,7,2,Jill,Jill,June,,"Maria, Jill",0,0,"amber, amy, alice, june, sasha, jane, rachel, maria, (none), jill, maya, karen, becky, jessica",0,0,2,8,1,June,June,Karen,,"Jill, Jill",0,0,"maya, rachel, maria, jill, jessica, june, jane, sasha, amy, alice, becky, karen, amber, (none)",0,0,9,9,1,June,June,Karen,,"Jill, Jill",0,0,"maya, rachel, maria, jill, jessica, june, jane, sasha, amy, alice, becky, karen, amber, (none)",0,0,9,10,2,Karen,Karen,maria,,"Jill, Jill",0,0,"jill, becky, amy, alice, sasha, jessica, maya, amber, rachel, karen, june, maria, jane, (none)",0,0,10,11,1,Karen,Karen,maria,,"Jill, Jill",0,0,"amber, amy, alice, june, sasha, jane, rachel, maria, (none), jill, maya, karen, becky, jessica",0,0,4,12,1,karen,karen,Jill,,"Karen, Jill",0,0,"amber, amy, alice, june, sasha, jane, rachel, maria, (none), jill, maya, karen, becky, jessica",0,0,8,13,2,Jill,Jill,JILL,,"Jill, Jill",1,0,"(none), maria, sasha, maya, jessica, june, amber, karen, rachel, jill, amy, jane, alice, becky",0,0.1,1,14,1,JILL,JILL,karen,,"Jill, Jill",0,0,"(none), maria, sasha, maya, jessica, june, amber, karen, rachel, jill, amy, jane, alice, becky",0,-0.05,11,15,1,JILL,JILL,Jill,,"Jill, Jill",1,0,"june, alice, rachel, (none), jessica, karen, maria, becky, jane, sasha, jill, maya, amy, amber",0,0.1,8,16,1,Jill,Jill,Jill,,"Jill, Jill",1,0,"jill, becky, amy, alice, sasha, jessica, maya, amber, rachel, karen, june, maria, jane, (none)",0,0.1,10,17,2,Jill,Jill,jill,,"Jill, Jill",1,0,"karen, (none), alice, maria, jessica, becky, maya, jane, sasha, amber, rachel, june, jill, amy",0,0.1,11,18,1,Jill,Jill,Jill,,"Jill, Jill",1,0,"amber, amy, alice, june, sasha, jane, rachel, maria, (none), jill, maya, karen, becky, jessica",0,0.1,8,19,2,Jill,Jill,jill,,"Jill, Jill",1,0,"(none), maria, sasha, maya, jessica, june, amber, karen, rachel, jill, amy, jane, alice, becky",0,0.1,5,20,2,Jill,Jill,JILL,,"Jill, Jill",1,0,"(none), alice, jessica, sasha, jill, amy, amber, maria, karen, june, rachel, becky, maya, jane",0,0.1,5,21,1,Jill,Jill,jill,,"Jill, Jill",1,0,"jill, becky, amy, alice, sasha, jessica, maya, amber, rachel, karen, june, maria, jane, (none)",0,0.1,7,22,2,(none),(none),JILL,,"Jill, Jill",0,1,"jane, alice, jessica, (none), maria, maya, rachel, jill, sasha, becky, karen, amber, amy, june",1,-0.05,8,23,1,Jill,Jill,JILL,,"Jill, Jill",1,0,"jill, becky, amy, alice, sasha, jessica, maya, amber, rachel, karen, june, maria, jane, (none)",0,0.1,6,24,1,Jill,Jill,Jill,,"Jill, Jill",1,0,"jane, alice, jessica, (none), maria, maya, rachel, jill, sasha, becky, karen, amber, amy, june",0,0.1,9,25,14,0,"Hi Jon,    I just wanted to give you a heads up that I ran into some lag on a few rounds. In...round 24 (I think,) I entered a name and pressed the button, which just sat there until the time was up. On a few other rounds I submitted a name, but never got to see what my partner submitted, as it would lag and just go right to the next round. Anyways, just wanted to let you know.     Thanks!  ",0,3.84,0,1,115,4a6yeok3,,174.71.60.245,2017-03-15 17:00:37.840024+00:00,1,A3B7TNVOISSZ2O,30MVJZJNHMEN9AS02GBI28S5C1IJ9K,3J94SKDEKIQPIHS3ZR7OYAX95AR5DM,2.91,4.91,ts44u31l,,,3J94SKDEKIQPIHS3ZR7OYAX95AR5DM,3O2Y2UIUCQVPYKR2XK6KOZJCED2KFX,337F8MIIMZEDNEN99A0JEB7CBPN04J,3KL228NDMVNVCKNX84C26KJOFS2KGW,33CY53T7YFR23AA9JZJ7YQKHNEPDHJ,36TBNKR908OQJ0J7TYB1DNN4VY1ED8,,$2.00,14,A3B7TNVOISSZ2O,12,0.91,1,1,1,Jill,Jill,(none),,"(none), Mary",0,0,"(none), jill, mary",0,0,2,1,1,Jill,Jill,JANE,,"Jill, (none)",0,0,"jane, (none), jill, mary",0,0,2,2,1,Jill,Jill,Jill,,"Jen, June",1,0,"mary, jill, jane, june, (none), jen",0,0.1,4,3,1,Jill,Jill,jill,,"Jill, Rachel",1,0,"(none), jane, rachel, june, mary, jill, jen",0,0.1,10,4,1,Jill,Jill,Jill,,"Jill, Becky",1,0,"june, rachel, (none), mary, jane, becky, jill, jen",0,0.1,4,5,1,Jill,Jill,Jill,,"Jill, Becky",1,0,"june, jane, rachel, (none), jill, mary, becky, jen",0,0.1,3,6,2,Jill,Jill,Jill,,"Janice, Jill",1,0,"jill, becky, mary, rachel, jen, janice, june, jane, (none)",0,0.1,3,7,2,Jill,Jill,Jill,,"Jill, Rachel",1,0,"june, jane, rachel, janice, (none), jill, mary, becky, jen",0,0.1,9,8,2,Jill,Jill,JILL,,"Jill, Jill",1,0,"rachel, mary, jill, janice, jane, becky, june, (none), jen",0,0.1,6,9,1,Jill,Jill,JILL,,"Jill, Jill",1,0,"rachel, mary, jill, janice, jane, becky, june, (none), jen",0,0.1,3,10,1,Jill,Jill,Laura,,"Karen, Jill",0,0,"jill, becky, (none), mary, laura, rachel, karen, jane, janice, jen, june",0,-0.05,7,11,2,Jill,Jill,JILL,,"Jill, Jill",1,0,"laura, june, jane, rachel, janice, (none), jill, karen, mary, becky, jen",0,0.1,2,12,2,Jill,Jill,JILL,,"Jill, Jill",1,0,"laura, june, jane, rachel, janice, (none), jill, karen, mary, becky, jen",0,0.1,1,13,1,Jill,Jill,Maria,,"Jill, Jill",0,0,"(none), maria, mary, june, karen, rachel, jill, laura, jane, jen, janice, becky",0,-0.05,6,14,2,Jill,Jill,Jill,,"Karen, Jill",1,0,"maria, (none), mary, june, karen, rachel, jill, laura, jane, jen, janice, becky",0,0.1,4,15,2,Jill,Jill,Jill,,"Jill, Jill",1,0,"june, rachel, (none), karen, mary, maria, laura, jane, becky, jill, jen, janice",0,0.1,10,16,2,Jill,Jill,jill,,"Jill, Jill",1,0,"(none), jill, becky, mary, laura, rachel, karen, jen, janice, maria, jane, june",0,0.1,6,17,2,Jill,Jill,Jill,,"Jill, Jill",1,0,"karen, (none), maria, becky, jane, janice, rachel, laura, june, mary, jen, jill",0,0.1,9,18,1,Jill,Jill,Jill,,"Jill, Jill",1,0,"laura, becky, june, jane, rachel, maria, (none), karen, jill, mary, janice, jen",0,0.1,10,19,2,Jill,Jill,jill,,"Jill, Jill",1,0,"maria, (none), mary, june, karen, rachel, jill, laura, jane, jen, janice, becky",0,0.1,10,20,2,Jill,Jill,jill,,"Jill, Jill",1,0,"(none), laura, jen, maria, jill, janice, karen, june, rachel, jane, becky, mary",0,0.1,3,21,2,Jill,Jill,JILL,,"Jill, Jil",1,0,"(none), jill, becky, mary, laura, rachel, karen, jen, jil, janice, maria, jane, june",0,0.1,11,22,1,Jill,Jill,jill,,"Jill, Jill",1,0,"jane, (none), laura, mary, maria, janice, rachel, jill, karen, becky, jil, june, jen",0,0.1,3,23,2,Jill,Jill,jill,,"Jill, Jill",1,0,"jill, becky, maria, mary, laura, june, rachel, karen, jane, janice, jil, jen, (none)",0,0.1,9,24,2,Jill,Jill,Jill,,"Jill, Jill",1,0,"jane, (none), laura, mary, maria, janice, rachel, jill, karen, becky, jil, june, jen",0,0.1,5,25,15,0,,0,4.91,0,1,116,ezzpo166,,173.112.98.15,2017-03-15 17:00:38.633649+00:00,1,AFU00NU09CFXE,3HFNH7HEMHFJA7JLBC11RQQEU95GQZ,3O2Y2UIUCQVPYKR2XK6KOZJCED2KFX,2.5,4.5,ts44u31l,,,3J94SKDEKIQPIHS3ZR7OYAX95AR5DM,3O2Y2UIUCQVPYKR2XK6KOZJCED2KFX,337F8MIIMZEDNEN99A0JEB7CBPN04J,3KL228NDMVNVCKNX84C26KJOFS2KGW,33CY53T7YFR23AA9JZJ7YQKHNEPDHJ,36TBNKR908OQJ0J7TYB1DNN4VY1ED8,,$2.00,15,AFU00NU09CFXE,18,0.85,1,1,2,Amy,Amy,(none),,"Becky, Jane",0,0,"becky, jane, amy, (none)",0,0,5,1,2,Amy,Amy,Jill,,"Jill, (none)",0,0,"becky, jane, amy, jill, (none)",0,0,9,2,1,Jill,Jill,Jill,,"(none), Kimberly",1,0,"jill, kimberly, jane, amy, becky, (none)",0,0.1,10,3,1,Jill,Jill,Becky,,"Sue, Maria",0,0,"(none), kimberly, maria, sue, becky, jane, jill, amy",0,-0.05,6,4,2,Becky,Becky,Sue,,"Sue, Sue",0,0,"maria, (none), jane, becky, jill, sue, amy, kimberly",0,-0.05,12,5,2,Sue,Sue,Jill,,"Bernice, Sue",0,0,"bernice, amy, jane, kimberly, maria, (none), jill, sue, becky",0,0,8,6,2,Sue,Sue,Jill,,"Jill, Becky",0,0,"jill, sue, becky, amy, kimberly, maria, jane, bernice, (none)",0,0,8,7,1,Jill,Jill,Jill,,"Jill, Jill",1,0,"bernice, amy, jane, kimberly, maria, (none), jill, sue, becky",0,0.1,7,8,2,Sue,Sue,Jill,,"Jill, Jill",0,0,"maria, jill, bernice, kimberly, jane, amy, becky, (none), sue",0,-0.05,12,9,1,Jill,Jill,Jill,,"Karen, Jill",1,0,"maria, jill, bernice, kimberly, jane, amy, becky, karen, (none), sue",0,0.1,7,10,1,Jill,Jill,Jill,,"Jill, Jill",1,0,"jill, becky, (none), sue, amy, karen, maria, jane, bernice, kimberly",0,0.1,3,11,2,Jill,Jill,Jill,,"Jill, Jill",1,0,"bernice, amy, jane, kimberly, maria, (none), jill, karen, sue, becky",0,0.1,8,12,2,Jill,Jill,Jill,,"Karen, Jill",1,0,"bernice, amy, jane, kimberly, maria, (none), jill, karen, sue, becky",0,0.1,2,13,2,Jill,Jill,Jill,,"Jill, Jill",1,0,"sue, maria, (none), karen, jill, amy, jane, bernice, kimberly, becky",0,0.1,10,14,2,Jill,Jill,Jill,,"Jill, Jill",1,0,"sue, maria, (none), karen, jill, amy, jane, bernice, kimberly, becky",0,0.1,5,15,1,Jill,Jill,Jill,,"Jill, Jill",1,0,"maria, (none), karen, jane, becky, jill, sue, bernice, amy, kimberly",0,0.1,4,16,1,Jill,Jill,Jill,,"Jill, Jill",1,0,"jill, becky, (none), sue, amy, karen, maria, jane, bernice, kimberly",0,0.1,2,17,1,Jill,Jill,Jill,,"Jill, Jill",1,0,"karen, kimberly, (none), maria, sue, becky, jane, bernice, jill, amy",0,0.1,3,18,2,Jill,Jill,Jill,,"Jill, Jill",1,0,"bernice, amy, jane, kimberly, maria, (none), jill, karen, sue, becky",0,0.1,11,19,2,Jill,Jill,Jill,,"Jill, Jill",1,0,"sue, maria, (none), karen, jill, amy, jane, bernice, kimberly, becky",0,0.1,4,20,1,Jill,Jill,Jill,,"Jill, Jill",1,0,"(none), jill, amy, maria, bernice, karen, kimberly, jane, becky, sue",0,0.1,8,21,1,Jill,Jill,Jill,,"Jill, Jill",1,0,"jill, becky, (none), sue, amy, karen, maria, jane, bernice, kimberly",0,0.1,2,22,2,Jill,Jill,Jill,,"Jill, Jill",1,0,"bernice, jane, (none), sue, kimberly, maria, jill, karen, becky, amy",0,0.1,10,23,2,Jill,Jill,Jill,,"Jill, Jill",1,0,"jill, becky, (none), sue, amy, karen, maria, jane, bernice, kimberly",0,0.1,12,24,1,Jill,Jill,Jill,,"Jill, Jill",1,0,"bernice, jane, (none), sue, kimberly, maria, jill, karen, becky, amy",0,0.1,3,25,16,0,"This was so cool! I always get the email notifications, but I can never seem to grab the survey when they come up. I'm glad I finally got to play. :)",0,4.5,0,1,117,gv7orms7,,70.178.157.227,2017-03-15 17:00:38.823326+00:00,1,A1W2AXHN5R2J91,3HWRJOOET53X3927XL0IMNK3ZHBES5,337F8MIIMZEDNEN99A0JEB7CBPN04J,2.58,4.58,ts44u31l,,,3J94SKDEKIQPIHS3ZR7OYAX95AR5DM,3O2Y2UIUCQVPYKR2XK6KOZJCED2KFX,337F8MIIMZEDNEN99A0JEB7CBPN04J,3KL228NDMVNVCKNX84C26KJOFS2KGW,33CY53T7YFR23AA9JZJ7YQKHNEPDHJ,36TBNKR908OQJ0J7TYB1DNN4VY1ED8,,$2.00,16,A1W2AXHN5R2J91,4,0.93,1,1,1,Jane,Jane,Alice,,"Lauren, Sue",0,0,"alice, jane, lauren, sue",0,0,7,1,2,JANE,JANE,Jill,,"(none), Karen",0,0,"lauren, alice, jane, (none), karen, jill, sue",0,0,2,2,1,JANE,JANE,June,,"Jill, Louisa",0,0,"jill, lauren, jane, louisa, alice, karen, june, (none), sue",0,0,7,3,2,JILL,JILL,Rachel,,"Jane, Jill",0,0,"karen, (none), alice, sue, jane, rachel, june, louisa, lauren, jill",0,0,9,4,2,JILL,JILL,Jill,,"Alice, Maria",1,0,"june, alice, rachel, (none), karen, louisa, maria, lauren, jane, jill, sue",0,0.1,3,5,2,JILL,JILL,Jill,,"Sue, Bernice",1,0,"bernice, louisa, lauren, alice, june, jane, rachel, maria, (none), karen, jill, sue",0,0.1,1,6,1,JILL,JILL,Janice,,"Jill, Jill",0,0,"(none), jill, sue, alice, lauren, rachel, karen, janice, maria, jane, bernice, louisa, june",0,-0.05,5,7,2,JILL,JILL,Jill,,"Jill, Jill",1,0,"bernice, lauren, louisa, alice, june, jane, rachel, janice, (none), jill, karen, sue, maria",0,0.1,4,8,1,JILL,JILL,Jill,,"Jill, Jill",1,0,"rachel, maria, jill, bernice, janice, lauren, jane, louisa, alice, karen, june, (none), sue",0,0.1,6,9,2,JILL,JILL,Jill,,"Jill, Jill",1,0,"rachel, maria, jill, bernice, janice, lauren, jane, louisa, alice, karen, june, (none), sue",0,0.1,3,10,1,JILL,JILL,Jill,,"Jill, Jill",1,0,"jill, sue, alice, lauren, june, rachel, karen, janice, maria, jane, bernice, louisa, (none)",0,0.1,11,11,1,JILL,JILL,Jill,,"Jill, Jill",1,0,"bernice, lauren, louisa, alice, june, jane, rachel, janice, (none), jill, karen, sue, maria",0,0.1,2,12,1,JILL,JILL,Jill,,"Karen, Maria",1,0,"bernice, lauren, louisa, alice, june, jane, rachel, janice, (none), jill, karen, sue, maria",0,0.1,1,13,1,JILL,JILL,Jill,,"Jill, Jill",1,0,"sue, (none), maria, louisa, june, karen, rachel, jill, lauren, jane, alice, janice, bernice",0,0.1,1,14,2,JILL,JILL,Jill,,"Maria, Jill",1,0,"sue, (none), maria, louisa, june, karen, rachel, jill, lauren, jane, alice, janice, bernice",0,0.1,9,15,2,JILL,JILL,Jill,,"Jill, Jill",1,0,"june, alice, rachel, (none), karen, maria, louisa, lauren, jane, jill, sue, bernice, janice",0,0.1,3,16,2,JILL,JILL,Maria,,"Maria, Jill",0,0,"jill, sue, alice, lauren, june, rachel, karen, janice, maria, jane, bernice, louisa, (none)",0,-0.05,4,17,2,JILL,JILL,Jill,,"Jill, Jill",1,0,"karen, (none), alice, maria, sue, janice, jane, rachel, bernice, june, louisa, lauren, jill",0,0.1,2,18,1,JILL,JILL,Jill,,"Jill, Jill",1,0,"bernice, lauren, louisa, alice, june, jane, rachel, janice, (none), jill, karen, sue, maria",0,0.1,7,19,1,JILL,JILL,Jill,,"Jill, Jill",1,0,"sue, (none), maria, louisa, june, karen, rachel, jill, lauren, jane, alice, janice, bernice",0,0.1,2,20,1,JILL,JILL,Jill,,"Jill, Jill",1,0,"(none), alice, jill, maria, bernice, janice, karen, june, rachel, jane, lauren, louisa, sue",0,0.1,5,21,1,JILL,JILL,Jill,,"Jill, Jill",1,0,"jill, sue, alice, lauren, june, rachel, karen, janice, maria, jane, bernice, louisa, (none)",0,0.1,11,22,1,JILL,JILL,(none),,"(none), Jill",0,0,"jane, bernice, alice, louisa, (none), sue, maria, janice, rachel, jill, karen, lauren, june",0,-0.05,8,23,2,JILL,JILL,Jill,,"Jill, Jill",1,0,"jill, sue, alice, lauren, june, rachel, karen, janice, maria, jane, bernice, louisa, (none)",0,0.1,6,24,2,JILL,JILL,Jill,,"Jill, Jill",1,0,"jane, bernice, alice, louisa, (none), sue, maria, janice, rachel, jill, karen, lauren, june",0,0.1,6,25,17,0,Thanks for the game. Always enjoy these.,0,4.58,0,1,118,mqgjdlz9,,68.232.233.56,2017-03-15 17:00:41.113179+00:00,1,A1ZRK6K5JUPJAV,3907X2AHF068V1AZCK1NPH63FUEP2Y,3O2Y2UIUCQVPYKR2XK6KOZJCED2KFX,3.3,5.3,ts44u31l,,,3J94SKDEKIQPIHS3ZR7OYAX95AR5DM,3O2Y2UIUCQVPYKR2XK6KOZJCED2KFX,337F8MIIMZEDNEN99A0JEB7CBPN04J,3KL228NDMVNVCKNX84C26KJOFS2KGW,33CY53T7YFR23AA9JZJ7YQKHNEPDHJ,36TBNKR908OQJ0J7TYB1DNN4VY1ED8,,$2.00,17,A1ZRK6K5JUPJAV,11,0.9,1,1,2,Maria,(none),Jill,barred,"Jane, Mary",0,0,"jane, jill, mary",0,0,2,1,1,Jill,Jill,jill,,"Jill, Jill",1,0,"jane, jill, mary",0,0.1,8,2,2,Jill,Jill,Jill,,"Jill, Maria",1,0,"maria, mary, jane, jill",0,0.1,4,3,2,Jill,Jill,Jill,,"Jill, Kimberly",1,0,"jill, jane, kimberly, mary, maria",0,0.1,3,4,2,Jill,Jill,Jill,,"Rachel, Maria",1,0,"maria, rachel, mary, jane, jill, kimberly",0,0.1,4,5,2,Jill,Jill,Jill,,"Jill, Maria",1,0,"jane, rachel, kimberly, maria, jill, mary",0,0.1,3,6,1,Jill,Jill,Jill,,"Jill, Jill",1,0,"jill, mary, rachel, maria, jane, kimberly",0,0.1,7,7,2,Jill,Jill,Jill,,"Jill, Maria",1,0,"jane, rachel, kimberly, maria, jill, mary",0,0.1,6,8,1,Jill,Jill,Jill,,"Jill, Jill",1,0,"mary, rachel, maria, jill, kimberly, jane",0,0.1,11,9,2,Jill,Jill,Jill,,"Karen, Jill",1,0,"mary, rachel, maria, jill, kimberly, jane, karen",0,0.1,12,10,1,Jill,Jill,Jill,,"Jill, Karen",1,0,"jill, mary, rachel, karen, maria, jane, kimberly",0,0.1,2,11,1,Jill,Jill,Jill,,"Jill, Jill",1,0,"jane, rachel, kimberly, maria, jill, karen, mary",0,0.1,9,12,2,Jill,Jill,jill,,"Jill, Jill",1,0,"jane, rachel, kimberly, maria, jill, karen, mary",0,0.1,10,13,1,Jill,Jill,Jill,,"Jill, Jill",1,0,"maria, mary, karen, rachel, jill, jane, kimberly",0,0.1,5,14,2,Jill,Jill,Jill,,"Jill, Maria",1,0,"maria, mary, karen, rachel, jill, jane, kimberly",0,0.1,1,15,2,Jill,Jill,Jill,,"Jill, Jill",1,0,"maria, rachel, karen, mary, jane, jill, kimberly",0,0.1,12,16,1,Jill,Jill,Jill,,"Jill, Jill",1,0,"jill, mary, rachel, karen, maria, jane, kimberly",0,0.1,8,17,2,Jill,Jill,Jill,,"Jill, Jill",1,0,"karen, kimberly, maria, jane, rachel, mary, jill",0,0.1,5,18,2,Jill,Jill,Jill,,"Jill, Jill",1,0,"jane, rachel, kimberly, maria, jill, karen, mary",0,0.1,10,19,1,Jill,Jill,jill,,"Jill, Jill",1,0,"maria, mary, karen, rachel, jill, jane, kimberly",0,0.1,11,20,1,Jill,Jill,Jill,,"Jill, Jill",1,0,"maria, jill, karen, rachel, kimberly, jane, mary",0,0.1,1,21,2,Jill,Jill,Jill,,"Jill, Jill",1,0,"jill, mary, rachel, karen, maria, jane, kimberly",0,0.1,8,22,1,Jill,Jill,Jill,,"Jill, Jill",1,0,"jane, mary, kimberly, maria, rachel, jill, karen",0,0.1,5,23,2,Jill,Jill,jill,,"Jill, Jill",1,0,"jill, mary, rachel, karen, maria, jane, kimberly",0,0.1,10,24,2,Jill,Jill,Jill,,"Jill, Jill",1,0,"jane, mary, kimberly, maria, rachel, jill, karen",0,0.1,4,25,18,0,,0,5.3,0,1,1