6,grvwfx6y,,99.44.143.89,2017-03-27 17:00:03.241786+00:00,1,A10LVHTF26QHQC,3U5JL4WY5KAN7ORD2PUSC9P42MI4XR,3DTJ4WT8BDGSH1QS2APOTWMP8MIEZH,1.02,3.02,1re06q0k,,,3DTJ4WT8BDGSH1QS2APOTWMP8MIEZH,3UOMW19E6D7FDPMPZVCDE4FRMBX5C8,37PGLWGSJT798BTSYSC5RWW4W6CKIA,391FPZIE4CNNFCNKMOYMX74NYKVHUB,3NMDE2OGHG0L1YTUQZWF1QB1KRTFGY,3NMDE2OGHG0L1YTUQZWF1QB1KRTFGY,,$2.00,5,A10LVHTF26QHQC,13,0.42,1,1,1,Sally,Sally,(none),,Jackie,0,0,"jackie, (none), sally",0,0,6,1,1,Sally,Sally,Sally,,Jessica,1,0,"(none), jackie, sally, jessica",0,0.1,3,2,2,Sally,Sally,jane,,Julie,0,0,"sally, jackie, julie, (none), jane, jessica",0,-0.05,9,3,1,Sally,Sally,Sally,,Jane,1,0,"julie, jackie, jessica, (none), sally, jane",0,0.1,4,4,1,Sally,Sally,jane,,Jackie,0,0,"jackie, jessica, julie, jane, (none), sally",0,-0.05,3,5,2,Sally,Sally,jane,,Jane,0,0,"jane, sally, jackie, julie, (none), jessica",0,-0.05,4,6,2,Sally,Sally,Sally,,Jackie,1,0,"jackie, jessica, julie, jane, (none), sally",0,0.1,10,7,1,Sally,Sally,Sally,,Christina,1,0,"jessica, christina, (none), julie, jane, jackie, sally",0,0.1,4,8,1,Sally,Sally,Sally,,Lily,1,0,"jane, sally, jackie, christina, lily, julie, (none), jessica",0,0.1,2,9,1,Sally,Sally,jane,,(none),0,0,"lily, julie, jackie, jessica, sally, jane, (none), christina",0,-0.05,1,10,1,Sally,Sally,Jane,,Mary,0,0,"jane, julie, sally, jessica, mary, christina, (none), lily, jackie",0,-0.05,12,11,2,Sally,Sally,Sally,,Christina,1,0,"(none), lily, julie, jessica, jane, mary, christina, sally, jackie",0,0.1,5,12,2,Sally,Sally,Sally,,Jane,1,0,"julie, jane, jessica, mary, (none), sally, lily, jackie, christina",0,0.1,11,13,1,Sally,Sally,jane,,Jane,0,0,"jackie, jane, christina, jessica, (none), mary, lily, julie, sally",0,-0.05,6,14,1,Sally,Sally,Jane,,Mary,0,0,"lily, julie, mary, jackie, jessica, sally, jane, (none), christina",0,-0.05,7,15,2,Sally,Sally,Sally,,Teresa,1,0,"christina, jackie, mary, teresa, julie, jessica, jane, (none), lily, sally",0,0.1,10,16,2,Sally,Sally,mary,,Jane,0,0,"christina, jackie, mary, teresa, jessica, julie, jane, (none), lily, sally",0,-0.05,2,17,2,Sally,Sally,mary,,Mary,0,0,"jessica, mary, lily, christina, (none), julie, jane, jackie, sally, teresa",0,-0.05,2,18,1,Sally,Sally,Sally,,Jackie,1,0,"teresa, jane, julie, sally, mary, jessica, christina, (none), lily, jackie",0,0.1,5,19,2,Sally,Sally,Sally,,Mary,1,0,"jane, jackie, mary, teresa, christina, julie, lily, (none), sally, jessica",0,0.1,9,20,1,Sally,Sally,Jane,,Maria,0,0,"maria, julie, jessica, jane, lily, mary, (none), sally, teresa, jackie, christina",0,-0.05,9,21,2,Sally,Sally,Sally,,Jane,1,0,"teresa, jane, julie, sally, mary, jessica, christina, (none), maria, lily, jackie",0,0.1,12,22,2,Sally,Sally,Sally,,Sally,1,0,"jackie, christina, mary, teresa, jessica, julie, jane, (none), lily, sally, maria",0,0.1,12,23,1,Sally,Sally,Jane,,Mary,0,0,"jessica, mary, lily, christina, maria, (none), julie, jane, jackie, sally, teresa",0,-0.05,12,24,1,Sally,Sally,mary,,Jane,0,0,"lily, julie, mary, teresa, jackie, maria, jessica, (none), jane, sally, christina",0,-0.05,3,25,6,0,,0,3.02,0,1,17,nxdsaxdc,,46.21.154.83,2017-03-27 17:00:03.323779+00:00,1,A360G7Q6RO5XRL,3DR23U6WE5FYI9FMML58WSGP2FOETO,3DTJ4WT8BDGSH1QS2APOTWMP8MIEZH,1.22,3.22,1re06q0k,,,3DTJ4WT8BDGSH1QS2APOTWMP8MIEZH,3UOMW19E6D7FDPMPZVCDE4FRMBX5C8,37PGLWGSJT798BTSYSC5RWW4W6CKIA,391FPZIE4CNNFCNKMOYMX74NYKVHUB,3NMDE2OGHG0L1YTUQZWF1QB1KRTFGY,3NMDE2OGHG0L1YTUQZWF1QB1KRTFGY,,$2.00,6,A360G7Q6RO5XRL,1,0.47,1,1,2,Maria,Maria,Susan,,Mary,0,0,"mary, maria, susan",0,0,1,1,1,Mary,Mary,Mary,,Christina,1,0,"mary, susan, maria, christina",0,0.1,5,2,2,Mary,Mary,Laura,,Sally,0,0,"sally, mary, laura, susan, christina, maria",0,-0.05,7,3,1,Mary,Mary,Mary,,Jane,1,0,"susan, laura, mary, maria, sally, jane, christina",0,0.1,2,4,1,Mary,Mary,Jane,,Jackie,0,0,"christina, jackie, mary, laura, jane, susan, sally, maria",0,-0.05,2,5,2,Mary,Mary,Mary,,Maria,1,0,"jane, mary, sally, jackie, maria, christina, susan, laura",0,0.1,8,6,1,Mary,Mary,Julie,,Mary,0,0,"christina, jackie, mary, laura, julie, jane, susan, sally, maria",0,-0.05,11,7,2,Mary,Mary,Jane,,Jane,0,0,"mary, susan, christina, laura, maria, julie, jane, jackie, sally",0,-0.05,6,8,2,Mary,Mary,Mary,,Jane,1,0,"jane, mary, sally, jackie, maria, christina, julie, susan, laura",0,0.1,7,9,2,Mary,Mary,Mary,,Lily,1,0,"lily, julie, susan, laura, mary, jackie, maria, sally, jane, christina",0,0.1,3,10,1,Mary,Mary,Lily,,Jane,0,0,"laura, jane, julie, sally, mary, christina, susan, maria, lily, jackie",0,-0.05,3,11,1,Mary,Mary,Mary,,Lily,1,0,"lily, julie, maria, jane, mary, susan, christina, laura, sally, jackie",0,0.1,2,12,1,Mary,Mary,Lily,,Mary,0,0,"maria, julie, jane, laura, mary, susan, sally, lily, jackie, christina",0,-0.05,3,13,2,Mary,Mary,Mary,,Kate,1,0,"jackie, jane, christina, kate, mary, susan, laura, maria, lily, julie, sally",0,0.1,8,14,2,Mary,Mary,Mary,,Maria,1,0,"lily, julie, susan, laura, mary, jackie, maria, sally, jane, kate, christina",0,0.1,1,15,1,Mary,Mary,Jane,,Christina,0,0,"jackie, christina, mary, laura, julie, kate, jane, susan, lily, sally, maria",0,-0.05,12,16,1,Mary,Mary,Jane,,Jackie,0,0,"jackie, christina, mary, laura, julie, kate, jane, susan, lily, sally, maria",0,-0.05,7,17,1,Mary,Mary,Mary,,Maria,1,0,"mary, lily, susan, christina, laura, maria, kate, julie, jane, jackie, sally",0,0.1,11,18,1,Mary,Mary,Mary,,Jane,1,0,"laura, jane, julie, sally, maria, mary, christina, susan, kate, lily, jackie",0,0.1,10,19,1,Mary,Mary,Mary,,Christina,1,0,"jane, jackie, mary, christina, susan, lily, julie, sally, kate, maria, laura",0,0.1,10,20,2,Mary,Mary,Mary,,Maria,1,0,"maria, julie, jane, laura, mary, susan, sally, lily, jackie, kate, christina",0,0.1,1,21,1,Mary,Mary,Jane,,Jane,0,0,"laura, jane, julie, sally, maria, mary, christina, susan, kate, lily, jackie",0,-0.05,11,22,1,Mary,Mary,mary,,Jane,1,0,"jackie, christina, mary, laura, julie, kate, jane, susan, lily, sally, maria",0,0.1,11,23,1,Mary,Mary,Jane,,Mary,0,0,"mary, lily, susan, christina, laura, maria, kate, julie, jane, jackie, sally",0,-0.05,11,24,1,Mary,Mary,Jane,,Jackie,0,0,"lily, julie, susan, laura, mary, jackie, maria, sally, jane, kate, christina",0,-0.05,12,25,7,0,,0,3.22,0,1,18,wxjb7lho,,73.53.100.228,2017-03-27 17:00:06.696112+00:00,1,A2CK0OXMPOR9LE,3JMSRU9HQIVDV1JBRG5NXA4AZ04EV4,3DTJ4WT8BDGSH1QS2APOTWMP8MIEZH,0.64,2.64,1re06q0k,,,3DTJ4WT8BDGSH1QS2APOTWMP8MIEZH,3UOMW19E6D7FDPMPZVCDE4FRMBX5C8,37PGLWGSJT798BTSYSC5RWW4W6CKIA,391FPZIE4CNNFCNKMOYMX74NYKVHUB,3NMDE2OGHG0L1YTUQZWF1QB1KRTFGY,3NMDE2OGHG0L1YTUQZWF1QB1KRTFGY,,$2.00,7,A2CK0OXMPOR9LE,23,0.44,1,1,1,Susan,Susan,Maria,,(none),0,0,"(none), maria, susan",0,0,1,1,1,Maria,Maria,laura,,Jessica,0,0,"(none), laura, susan, maria, jessica",0,0,10,2,1,Laura,Laura,Mary,,Jackie,0,0,"jackie, laura, mary, susan, (none), jessica, maria",0,0,7,3,2,Anna,Anna,Lily,,Julie,0,0,"lily, anna, julie, susan, laura, mary, jackie, maria, jessica, (none)",0,0,12,4,2,Valerie,Valerie,Julie,,Lynn,0,0,"jackie, mary, laura, julie, jessica, anna, valerie, (none), susan, lily, lynn, maria",0,0,10,5,2,Julie,Julie,Lily,,Jackie,0,0,"mary, valerie, jackie, maria, lynn, anna, lily, julie, (none), jessica, laura, susan",0,0,9,6,2,Jackie,Jackie,Sue,,Lily,0,0,"jackie, mary, laura, julie, jessica, sue, anna, lily, (none), susan, valerie, lynn, maria",0,0,1,7,1,Lily,Lily,Julie,,Jane,0,0,"jessica, mary, lily, anna, susan, laura, maria, (none), julie, sue, jane, jackie, lynn, valerie",0,0,10,8,1,Lily,Lily,Lily,,Lily,1,0,"jane, mary, valerie, jackie, maria, lynn, anna, lily, sue, (none), julie, jessica, laura, susan",0,0.1,5,9,2,Lily,Lily,Tammy,,Mary,0,0,"lily, anna, julie, susan, laura, mary, valerie, jackie, sue, tammy, maria, jessica, (none), jane, lynn",0,-0.05,10,10,2,Lily,Lily,Mary,,Alice,0,0,"anna, laura, jane, julie, lynn, valerie, mary, jessica, alice, sue, (none), susan, maria, tammy, lily, jackie",0,-0.05,3,11,2,(none),(none),Tara,,Jane,0,1,"(none), sue, julie, maria, jessica, valerie, jane, tammy, lynn, mary, lily, susan, tara, laura, alice, anna, jackie",1,0,9,12,2,Lily,Lily,Mary,,Jane,0,0,"maria, lynn, julie, jackie, jessica, valerie, jane, laura, anna, tara, lily, mary, sue, susan, (none), tammy, alice",0,0,3,13,2,Mary,Mary,Kate,,Lily,0,0,"jackie, jane, kate, jessica, anna, (none), mary, maria, susan, laura, lily, valerie, julie, sue, tara, tammy, alice, lynn",0,0,12,14,2,Mary,Mary,maria,,Maria,0,0,"anna, lily, julie, susan, laura, mary, valerie, jackie, sue, tammy, maria, jessica, (none), jane, tara, kate, lynn, alice",0,0,9,15,2,Mary,Mary,Julie,,Sally,0,0,"jackie, tammy, mary, laura, jessica, julie, kate, sue, anna, valerie, tara, (none), jane, alice, susan, lily, sally, lynn, maria",0,0,4,16,1,Mary,Mary,maria,,Jane,0,0,"jackie, tammy, mary, laura, jessica, julie, kate, sue, anna, tara, alice, (none), jane, lily, susan, valerie, sally, lynn, maria",0,0,4,17,2,Maria,Maria,maria,,Jackie,1,0,"jessica, mary, lily, tammy, anna, alice, susan, laura, maria, sally, kate, (none), tara, julie, sue, jane, jackie, lynn, valerie",0,0.1,5,18,2,Maria,Maria,maria,,Gretchen,1,0,"laura, anna, jane, julie, lynn, sally, valerie, gretchen, susan, maria, mary, jessica, alice, tara, sue, (none), kate, tammy, lily, jackie",0,0.1,8,19,2,Maria,Maria,Sue,,Lily,0,0,"jane, mary, jackie, gretchen, tammy, susan, julie, valerie, alice, (none), lily, sally, sue, kate, maria, laura, lynn, jessica, tara, anna",0,-0.05,5,20,2,Maria,Maria,Tina,,Jackie,0,0,"maria, tina, (none), lynn, gretchen, julie, jackie, jane, laura, anna, valerie, jessica, tara, lily, mary, susan, sue, sally, tammy, alice, kate",0,-0.05,5,21,2,Maria,Maria,maria,,Sally,1,0,"lynn, jane, laura, julie, anna, gretchen, valerie, sally, susan, kate, jessica, mary, alice, tina, tara, sue, (none), maria, tammy, lily, jackie",0,0.1,8,22,2,Maria,Maria,Jenny,,Karen,0,0,"laura, jessica, jane, susan, lily, maria, mary, anna, alice, valerie, jackie, tammy, tina, gretchen, sue, tara, jenny, sally, julie, kate, (none), karen, lynn",0,-0.05,8,23,2,Maria,Maria,maria,,Mary,1,0,"jessica, laura, (none), lynn, karen, sally, valerie, tammy, maria, sue, mary, anna, susan, gretchen, jane, jenny, lily, alice, kate, tara, julie, tina, jackie",0,0.1,3,24,2,Maria,Maria,Helen,,Alice,0,0,"lily, susan, gretchen, sue, sally, kate, lynn, anna, valerie, karen, tara, julie, laura, mary, jackie, helen, tammy, maria, jessica, alice, tina, (none), jane, jenny",0,-0.05,8,25,8,0,,0,2.64,0,1,19,6v7clgkd,,96.253.41.39,2017-03-27 17:00:06.794693+00:00,1,AD1ILDUXZHASF,3ATTHHXXWAPHFVQSNEWW6AZN74JIXK,37PGLWGSJT798BTSYSC5RWW4W6CKIA,0.55,2.55,1re06q0k,,,3DTJ4WT8BDGSH1QS2APOTWMP8MIEZH,3UOMW19E6D7FDPMPZVCDE4FRMBX5C8,37PGLWGSJT798BTSYSC5RWW4W6CKIA,391FPZIE4CNNFCNKMOYMX74NYKVHUB,3NMDE2OGHG0L1YTUQZWF1QB1KRTFGY,3NMDE2OGHG0L1YTUQZWF1QB1KRTFGY,,$2.00,8,AD1ILDUXZHASF,15,0.35,1,1,2,(none),(none),April,,Laura,0,1,"laura, april",1,0,9,1,2,Christina,Christina,(none),,Mary,0,0,"(none), christina, mary, april, laura",0,0,2,2,2,Christina,Christina,Jane,,Mary,0,0,"mary, laura, april, (none), christina, jane",0,0,6,3,2,Jane,Jane,Mary,,Alice,0,0,"april, laura, mary, (none), jane, christina, alice",0,0,9,4,1,Jane,Jane,christina,,Valerie,0,0,"christina, mary, laura, april, alice, jane, (none), valerie",0,0,7,5,2,Jane,Jane,Jane,,Maria,1,0,"jane, mary, valerie, april, maria, christina, alice, (none), laura",0,0.1,5,6,2,Jane,Jane,Jane,,Jane,1,0,"christina, mary, laura, april, alice, jane, (none), valerie, maria",0,0.1,2,7,1,Jane,Jane,Mary,,Mary,0,0,"mary, alice, christina, laura, maria, (none), april, jane, valerie",0,-0.05,6,8,2,Jane,Jane,christina,,Mary,0,0,"jane, mary, valerie, april, maria, christina, alice, (none), laura",0,-0.05,4,9,2,Jane,Jane,Mary,,Mary,0,0,"april, laura, valerie, mary, maria, (none), jane, christina, alice",0,-0.05,6,10,2,Jane,Jane,Mary,,Jane,0,0,"laura, jane, valerie, mary, alice, christina, april, (none), maria",0,-0.05,10,11,1,Jane,Jane,Jane,,Jane,1,0,"(none), april, maria, valerie, jane, mary, christina, laura, alice",0,0.1,1,12,2,Jane,Jane,Mary,,Tara,0,0,"maria, april, jane, valerie, laura, tara, mary, (none), alice, christina",0,-0.05,8,13,1,Jane,Jane,Jane,,Jane,1,0,"jane, christina, (none), laura, maria, mary, valerie, tara, alice, april",0,0.1,9,14,2,Jane,Jane,Jane,,Lily,1,0,"lily, april, laura, valerie, mary, maria, tara, jane, (none), christina, alice",0,0.1,4,15,2,Jane,Jane,Jane,,Lily,1,0,"christina, mary, laura, april, alice, valerie, tara, jane, (none), lily, maria",0,0.1,9,16,2,Jane,Jane,Mary,,Mary,0,0,"christina, mary, laura, april, alice, valerie, tara, jane, (none), lily, maria",0,-0.05,7,17,2,Jane,Jane,Christina,,Lily,0,0,"mary, lily, alice, christina, laura, maria, (none), tara, april, jane, valerie",0,-0.05,7,18,2,Jane,Jane,Jane,,Sally,1,0,"laura, jane, sally, valerie, mary, alice, tara, april, christina, (none), maria, lily",0,0.1,6,19,2,Jane,Jane,Mary,,Lily,0,0,"jane, mary, christina, alice, valerie, april, (none), lily, sally, maria, laura, tara",0,-0.05,12,20,1,Jane,Jane,Christina,,Lily,0,0,"maria, april, jane, laura, valerie, tara, mary, (none), sally, lily, alice, christina",0,-0.05,2,21,2,Jane,Jane,Mary,,Lily,0,0,"laura, jane, sally, valerie, mary, alice, tara, april, christina, (none), maria, lily",0,-0.05,11,22,1,Jane,Jane,Jane,,Alice,1,0,"christina, mary, laura, april, alice, tara, lily, jane, (none), valerie, sally, maria",0,0.1,10,23,2,Jane,Jane,Mary,,Mary,0,0,"mary, lily, alice, christina, laura, maria, sally, (none), tara, april, jane, valerie",0,-0.05,11,24,2,Jane,Jane,Mary,,Christina,0,0,"lily, april, laura, valerie, mary, maria, sally, jane, tara, (none), christina, alice",0,-0.05,12,25,9,0,,0,2.55,0,1,112,fta4tcpw,,159.118.118.37,2017-03-27 17:00:08.884605+00:00,1,A1SL65Z68BK1UT,3CPLWGV3MO0JS0JLHE3AVF9MM0M9N8,391FPZIE4CNNFCNKMOYMX74NYKVHUB,0.81,2.81,1re06q0k,,,3DTJ4WT8BDGSH1QS2APOTWMP8MIEZH,3UOMW19E6D7FDPMPZVCDE4FRMBX5C8,37PGLWGSJT798BTSYSC5RWW4W6CKIA,391FPZIE4CNNFCNKMOYMX74NYKVHUB,3NMDE2OGHG0L1YTUQZWF1QB1KRTFGY,3NMDE2OGHG0L1YTUQZWF1QB1KRTFGY,,$2.00,9,A1SL65Z68BK1UT,11,0.46,1,1,1,mary,mary,Julie,,Lily,0,0,"mary, julie, lily",0,0,7,1,2,Mary,Mary,Julie,,(none),0,0,"(none), mary, julie, lily",0,0,8,2,1,Julie,Julie,Sally,,Mary,0,0,"lily, julie, mary, (none), sally",0,0,10,3,2,Julie,Julie,Pam,,Maria,0,0,"lily, julie, mary, maria, sally, (none), pam",0,0,1,4,2,Julie,Julie,Mary,,Jackie,0,0,"jackie, mary, julie, (none), lily, sally, pam, maria",0,0,4,5,2,Julie,Julie,Sally,,Jackie,0,0,"mary, sally, jackie, maria, lily, julie, (none), pam",0,0,1,6,2,Julie,Julie,Mary,,Jackie,0,0,"jackie, mary, julie, (none), lily, sally, pam, maria",0,0,11,7,2,Julie,Julie,jackie,,Mary,0,0,"mary, lily, maria, (none), julie, jackie, sally, pam",0,0,12,8,2,Mary,Mary,Mary,,Jane,1,0,"jane, mary, sally, jackie, maria, lily, julie, (none), pam",0,0.1,8,9,2,Mary,Mary,Jane,,Sally,0,0,"lily, julie, mary, jackie, maria, sally, jane, (none), pam",0,-0.05,9,10,1,Mary,Mary,Lily,,Jane,0,0,"jane, julie, sally, pam, mary, (none), maria, lily, jackie",0,-0.05,4,11,2,Mary,Mary,Mary,,April,1,0,"(none), april, lily, maria, julie, jane, mary, sally, pam, jackie",0,0.1,2,12,2,Mary,Mary,Jane,,Maria,0,0,"maria, april, julie, jane, pam, mary, (none), sally, lily, jackie",0,-0.05,2,13,2,Mary,Mary,Jane,,Lily,0,0,"jackie, jane, (none), mary, maria, pam, lily, julie, sally, april",0,-0.05,7,14,1,Mary,Mary,Mary,,Jane,1,0,"lily, julie, april, mary, jackie, maria, (none), jane, sally, pam",0,0.1,1,15,1,Mary,Mary,Jane,,Sally,0,0,"jackie, mary, julie, april, jane, (none), lily, sally, pam, maria",0,-0.05,1,16,2,Mary,Mary,Mary,,Mary,1,0,"jackie, mary, julie, april, jane, (none), lily, sally, pam, maria",0,0.1,6,17,2,Mary,Mary,Mary,,Lily,1,0,"mary, lily, maria, (none), julie, april, jackie, jane, pam, sally",0,0.1,11,18,2,Mary,Mary,Mary,,Sally,1,0,"jane, julie, sally, pam, mary, april, (none), maria, lily, jackie",0,0.1,10,19,2,Mary,Mary,Jane,,Lily,0,0,"jane, mary, pam, jackie, julie, lily, (none), sally, maria, april",0,-0.05,4,20,1,Mary,Mary,Mary,,Lily,1,0,"maria, april, julie, jane, pam, mary, (none), sally, lily, jackie",0,0.1,1,21,2,Mary,Mary,Jan,,Lily,0,0,"jane, julie, sally, pam, mary, april, jan, (none), maria, lily, jackie",0,-0.05,9,22,2,Mary,Mary,Mary,,Lily,1,0,"jackie, mary, jan, julie, april, jane, (none), lily, sally, pam, maria",0,0.1,9,23,1,Mary,Mary,Jan,,Debbie,0,0,"mary, lily, jan, debbie, maria, (none), julie, april, jackie, jane, pam, sally",0,-0.05,4,24,1,Mary,Mary,Jane,,Mary,0,0,"lily, julie, april, mary, jackie, maria, jan, (none), jane, sally, debbie, pam",0,-0.05,4,25,12,0,,0,2.81,0,1,113,kkxgeg09,,174.128.230.170,2017-03-27 17:00:09.117865+00:00,1,A1EQ2HDHF2WWSY,3CN4LGXD5XPC7THN7LGUVNWD4SC4YX,391FPZIE4CNNFCNKMOYMX74NYKVHUB,1.56,3.56,1re06q0k,,,3DTJ4WT8BDGSH1QS2APOTWMP8MIEZH,3UOMW19E6D7FDPMPZVCDE4FRMBX5C8,37PGLWGSJT798BTSYSC5RWW4W6CKIA,391FPZIE4CNNFCNKMOYMX74NYKVHUB,3NMDE2OGHG0L1YTUQZWF1QB1KRTFGY,3NMDE2OGHG0L1YTUQZWF1QB1KRTFGY,,$2.00,10,A1EQ2HDHF2WWSY,18,0.46,1,1,2,(none),(none),(none),,April,0,1,"(none), april",1,0,12,1,1,Jane,(none),Lynn,barred,Jessica,0,0,"(none), lynn, jessica, april",1,0,1,2,2,Lynn,Lynn,christina,,Sally,0,0,"sally, april, (none), christina, jessica, lynn",0,0,12,3,1,Lynn,Lynn,Alice,,Christina,0,0,"april, jessica, (none), sally, lynn, christina, alice",0,0,7,4,1,Lynn,Lynn,Alice,,Sally,0,0,"christina, jessica, april, alice, (none), sally, lynn",0,0,8,5,2,Alice,Alice,christina,,Mary,0,0,"mary, sally, april, lynn, christina, (none), alice, jessica",0,0,11,6,2,Alice,Alice,christina,,Jane,0,0,"christina, mary, jessica, april, alice, (none), jane, sally, lynn",0,0,7,7,2,Alice,Alice,christina,,Maria,0,0,"mary, jessica, alice, christina, maria, (none), april, jane, lynn, sally",0,0,7,8,2,christina,christina,Lily,,Jane,0,0,"jane, mary, sally, maria, april, lynn, christina, lily, (none), alice, jessica",0,0,3,9,2,Alice,Alice,Christina,,Lily,0,0,"lily, april, mary, maria, jessica, sally, jane, (none), lynn, christina, alice",0,0,12,10,1,Christina,Christina,Mary,,Maria,0,0,"lynn, jane, sally, mary, alice, jessica, christina, april, (none), maria, lily",0,0,7,11,2,christina,christina,Christina,,Jane,1,0,"(none), april, lily, maria, jessica, jane, mary, lynn, christina, sally, alice",0,0.1,12,12,1,Christina,Christina,Christina,,Mary,1,0,"maria, april, lynn, jane, jessica, mary, (none), sally, lily, alice, christina",0,0.1,5,13,2,Christina,Christina,Christina,,Sally,1,0,"jane, lynn, christina, jessica, (none), mary, maria, lily, sally, alice, april",0,0.1,3,14,2,Christina,Christina,Christina,,Jane,1,0,"lily, april, mary, maria, jessica, sally, jane, (none), lynn, christina, alice",0,0.1,11,15,1,Christina,Christina,Christina,,Jackie,1,0,"christina, jackie, mary, jessica, april, alice, jane, (none), lily, sally, lynn, maria",0,0.1,8,16,2,Christina,Christina,Christina,,Jackie,1,0,"christina, jackie, mary, jessica, april, alice, jane, (none), lily, sally, lynn, maria",0,0.1,10,17,2,Christina,Christina,maria,,Alice,0,0,"jessica, mary, lily, alice, christina, maria, (none), april, jane, jackie, lynn, sally",0,-0.05,1,18,1,Christina,Christina,Christina,,Gretchen,1,0,"lynn, jane, sally, gretchen, alice, mary, jessica, christina, april, (none), maria, lily, jackie",0,0.1,1,19,1,Christina,Christina,Christina,,Mariah,1,0,"mariah, jane, mary, jackie, christina, alice, lily, (none), sally, jessica, april, lynn, maria, gretchen",0,0.1,8,20,1,Christina,Christina,Jane,,Jane,0,0,"maria, april, lynn, gretchen, jackie, jane, jessica, mariah, mary, (none), sally, lily, alice, christina",0,-0.05,12,21,1,Christina,Christina,Christina,,Jackie,1,0,"lynn, jane, sally, gretchen, mary, alice, jessica, mariah, christina, april, (none), maria, lily, jackie",0,0.1,4,22,1,Christina,Christina,Christina,,Jane,1,0,"jackie, christina, mariah, mary, jessica, gretchen, april, alice, jane, (none), lily, sally, lynn, maria",0,0.1,7,23,2,Christina,Christina,Christina,,Sally,1,0,"mary, jessica, lily, gretchen, alice, christina, mariah, maria, (none), april, jane, jackie, lynn, sally",0,0.1,6,24,1,Christina,Christina,Christina,,Lily,1,0,"lily, april, gretchen, mary, jackie, maria, mariah, jessica, (none), jane, sally, lynn, christina, alice",0,0.1,10,25,13,0,,0,3.56,0,1,114,pd8lrumg,,184.153.107.203,2017-03-27 17:00:10.451818+00:00,1,A1VVXZYA3TPHP0,3H7XDTSHKCSOU4F7NL07JF80JPKWGC,391FPZIE4CNNFCNKMOYMX74NYKVHUB,0.45,2.45,1re06q0k,,,3DTJ4WT8BDGSH1QS2APOTWMP8MIEZH,3UOMW19E6D7FDPMPZVCDE4FRMBX5C8,37PGLWGSJT798BTSYSC5RWW4W6CKIA,391FPZIE4CNNFCNKMOYMX74NYKVHUB,3NMDE2OGHG0L1YTUQZWF1QB1KRTFGY,3NMDE2OGHG0L1YTUQZWF1QB1KRTFGY,,$2.00,11,A1VVXZYA3TPHP0,5,0.45,1,1,1,Jessica,Jessica,(none),,Lynn,0,0,"(none), jessica, lynn",0,0,10,1,2,Mary,Mary,April,,Mary,0,0,"(none), mary, lynn, jessica, april",1,0,6,2,2,Pam,Pam,Tibna,,Lynn,0,0,"tibna, mary, pam, april, (none), jessica, lynn",0,0,2,3,2,Carol,Carol,Alice,,Maria,0,0,"april, mary, tibna, maria, jessica, (none), carol, pam, lynn, alice",0,0,8,4,2,Susan,Susan,Carol,,Jane,0,0,"mary, lynn, tibna, jessica, april, alice, (none), jane, carol, pam, maria",1,0,9,5,1,June,June,Mary,,Julie,0,0,"tibna, jane, mary, april, lynn, carol, maria, alice, (none), pam, julie, june, jessica",0,0,7,6,1,Carolyn,Carolyn,Mary,,Alice,0,0,"mary, tibna, pam, julie, jessica, april, alice, jane, (none), carolyn, carol, lynn, june, maria",0,0,9,7,2,Anne,Anne,Jane,,Alice,0,0,"mary, jessica, tibna, anne, alice, carolyn, maria, (none), carol, julie, april, jane, june, pam, lynn",0,0,9,8,1,Jane,Jane,Karen,,Mary,0,0,"tibna, jane, mary, karen, maria, april, carol, lynn, alice, (none), julie, june, pam, jessica, carolyn, anne",0,0,6,9,2,Daisy,Daisy,Jane,,Jane,0,0,"april, julie, mary, karen, daisy, maria, tibna, anne, june, jessica, (none), jane, carol, pam, carolyn, lynn, alice",0,0,5,10,2,nancy,nancy,Jane,,Alice,0,0,"karen, lynn, jane, nancy, julie, june, carol, anne, mary, daisy, jessica, pam, carolyn, alice, april, (none), maria, tibna",0,0,9,11,2,april,april,Jane,,Tara,0,0,"nancy, karen, alice, april, julie, anne, jessica, (none), jane, maria, lynn, mary, tibna, carol, tara, pam, carolyn, daisy, june",0,0,7,12,2,tara,tara,Jane,,Lily,0,0,"maria, april, lynn, karen, julie, june, jessica, jane, pam, carolyn, tara, carol, tibna, mary, daisy, (none), anne, nancy, lily, alice",0,0,7,13,2,diana,diana,Jane,,Lily,0,0,"karen, jane, anne, diana, jessica, pam, tara, june, maria, mary, carol, daisy, tibna, (none), nancy, julie, lily, alice, april, carolyn, lynn",0,0,11,14,2,jane,jane,tina,,Sally,0,0,"lily, daisy, nancy, sally, pam, lynn, april, karen, diana, tibna, tara, julie, mary, maria, june, jessica, alice, tina, anne, (none), jane, carol, carolyn",0,0,3,15,2,teresa,teresa,Jane,,Jane,0,0,"jessica, jane, lily, june, maria, mary, tibna, daisy, alice, diana, tina, teresa, april, tara, sally, pam, julie, karen, (none), anne, carolyn, carol, lynn, nancy",0,0,3,16,2,sally,sally,Mary,,Tina,0,0,"jessica, jane, lily, june, maria, mary, tibna, daisy, alice, diana, tina, teresa, april, tara, sally, pam, julie, karen, (none), anne, carolyn, carol, lynn, nancy",0,0,5,17,1,dane,dane,Kara,,Kara,0,0,"jessica, (none), carol, lynn, sally, karen, teresa, tibna, anne, nancy, diana, maria, pam, kara, mary, daisy, dane, carolyn, jane, june, lily, alice, tara, julie, april, tina",0,0,12,18,2,kara,kara,Mary,,Maria,0,0,"karen, lynn, kara, june, carol, diana, alice, maria, tibna, lily, jane, jessica, carolyn, tina, anne, teresa, nancy, julie, sally, pam, daisy, tara, april, (none), dane, mary",0,0,3,19,1,mariah,mariah,jane,,Mary,0,0,"nancy, pam, lily, tina, (none), tibna, carol, jessica, maria, lynn, mariah, jane, alice, april, tara, julie, anne, karen, carolyn, mary, dane, kara, teresa, daisy, june, sally, diana",0,0,2,20,1,july,july,Jane,,Jackie,0,0,"maria, karen, june, jessica, jane, mariah, diana, tina, carolyn, (none), anne, jackie, april, kara, lynn, julie, july, tara, carol, mary, daisy, nancy, lily, teresa, dane, tibna, pam, sally, alice",0,0,6,21,2,elly,elly,Jane,,Jackie,0,0,"karen, lynn, july, june, kara, carol, diana, alice, maria, tibna, lily, jane, jessica, carolyn, tina, anne, teresa, nancy, julie, sally, pam, daisy, tara, april, (none), jackie, dane, mary, mariah, elly",0,0,6,22,2,karen,karen,Mary,,Mary,0,0,"elly, jessica, jane, lily, june, maria, mary, tibna, daisy, kara, alice, july, jackie, diana, mariah, tina, teresa, april, tara, sally, pam, carol, julie, dane, (none), anne, carolyn, karen, lynn, nancy",0,0,1,23,1,debbie,debbie,Mary,,Mary,0,0,"jessica, (none), carol, lynn, sally, karen, teresa, tibna, anne, nancy, diana, maria, pam, kara, mary, daisy, dane, carolyn, july, jane, june, lily, alice, debbie, elly, mariah, tara, julie, april, tina, jackie",0,0,5,24,2,cher,cher,Jane,,Jane,0,0,"lily, nancy, daisy, mariah, cher, sally, debbie, pam, lynn, april, karen, diana, tibna, kara, tara, julie, mary, jackie, elly, maria, june, jessica, teresa, dane, alice, tina, july, anne, (none), jane, carol, carolyn",0,0,7,25,14,0,,0,2.45,0,1,1