15,nhcxesjz,,173.90.75.108,2017-03-27 17:00:10.631759+00:00,1,A2VE5IV9OD2SK1,3HHRAGRYX861ALJXIT3NA49RCAR9ON,37PGLWGSJT798BTSYSC5RWW4W6CKIA,0.48,2.48,1re06q0k,,,3DTJ4WT8BDGSH1QS2APOTWMP8MIEZH,3UOMW19E6D7FDPMPZVCDE4FRMBX5C8,37PGLWGSJT798BTSYSC5RWW4W6CKIA,391FPZIE4CNNFCNKMOYMX74NYKVHUB,3NMDE2OGHG0L1YTUQZWF1QB1KRTFGY,3NMDE2OGHG0L1YTUQZWF1QB1KRTFGY,,$2.00,12,A2VE5IV9OD2SK1,3,0.33,1,1,1,April,April,(none),,Jessica,0,0,"jessica, (none), april",0,0,9,1,1,April,April,Mary,,Sally,0,0,"(none), mary, sally, jessica, april",0,0,6,2,1,Mary,Mary,Mary,,Jackie,1,0,"sally, jackie, mary, april, (none), jessica",0,0.1,8,3,1,Mary,Mary,Jane,,Lynn,0,0,"april, mary, jackie, jessica, (none), sally, jane, lynn",0,-0.05,9,4,2,Jane,Jane,Mary,,Alice,0,0,"jackie, mary, jessica, april, alice, (none), jane, sally, lynn",0,-0.05,2,5,2,Mary,Mary,June,,Sally,0,0,"jane, mary, sally, jackie, april, lynn, (none), alice, june, jessica",0,0,7,6,2,Mary,Mary,Carolyn,,Mary,0,0,"jackie, mary, jessica, april, alice, jane, (none), carolyn, sally, lynn, june",0,0,9,7,2,Mary,Mary,Mary,,Sally,1,0,"jessica, mary, alice, carolyn, (none), april, jane, june, jackie, lynn, sally",0,0.1,1,8,1,Mary,Mary,Mary,,Jane,1,0,"jane, mary, sally, jackie, april, lynn, alice, (none), june, jessica, carolyn",0,0.1,7,9,1,Mary,Mary,Jane,,Daisy,0,0,"april, mary, jackie, daisy, june, jessica, (none), jane, sally, carolyn, lynn, alice",0,-0.05,6,10,1,Mary,Mary,Jane,,Jackie,0,0,"lynn, jane, june, sally, jessica, daisy, mary, alice, carolyn, april, (none), jackie",0,-0.05,10,11,1,Jane,Jane,april,,Alice,0,0,"(none), april, jessica, jane, mary, lynn, sally, carolyn, alice, daisy, june, jackie",0,-0.05,7,12,1,Mary,Mary,Jane,,Jane,0,0,"april, lynn, june, alice, jessica, jane, carolyn, mary, daisy, (none), sally, jackie",0,-0.05,8,13,2,Jane,Jane,Jane,,Mary,1,0,"jackie, jane, lynn, jessica, (none), mary, june, daisy, alice, sally, carolyn, april",0,0.1,9,14,1,Jane,Jane,Jane,,Lily,1,0,"lily, april, mary, jackie, daisy, june, jessica, (none), jane, sally, carolyn, lynn, alice",0,0.1,4,15,2,Jane,Jane,Mary,,Julie,0,0,"jackie, mary, carolyn, daisy, jessica, julie, april, alice, (none), jane, lily, sally, lynn, june",0,-0.05,12,16,1,Mary,Mary,sally,,Maria,0,0,"jackie, mary, daisy, jessica, julie, april, alice, lily, (none), jane, carolyn, sally, lynn, june, maria",0,-0.05,5,17,2,Mary,Mary,Mary,,Sally,1,0,"jessica, daisy, mary, lily, alice, carolyn, maria, (none), julie, april, jane, june, jackie, lynn, sally",0,0.1,10,18,1,Mary,Mary,kara,,Lily,0,0,"lynn, jane, julie, sally, june, kara, jessica, daisy, mary, alice, carolyn, april, (none), maria, lily, jackie",0,-0.05,3,19,1,Mary,Mary,Jane,,Sally,0,0,"jane, mary, jackie, kara, june, daisy, julie, alice, lily, (none), sally, jessica, april, lynn, maria, carolyn",0,-0.05,12,20,2,Jane,Jane,july,,Jane,0,0,"maria, april, kara, lynn, julie, jackie, june, july, jane, jessica, carolyn, daisy, mary, (none), sally, lily, alice",0,-0.05,6,21,1,Mary,Mary,Mary,,Jane,1,0,"lynn, jane, julie, july, kara, june, sally, jessica, daisy, mary, alice, carolyn, april, (none), maria, lily, jackie",0,0.1,1,22,1,Mary,Mary,karen,,Jane,0,0,"jackie, mary, daisy, julie, july, jessica, april, kara, lily, alice, jane, (none), karen, carolyn, sally, lynn, june, maria",0,-0.05,1,23,2,Mary,Mary,debbie,,Lily,0,0,"jessica, daisy, mary, lily, alice, debbie, carolyn, july, sally, maria, (none), julie, april, jane, june, jackie, kara, lynn, karen",0,-0.05,5,24,2,Mary,Mary,Mary,,Jane,1,0,"lily, julie, april, mary, july, jackie, karen, daisy, maria, june, jessica, sally, (none), jane, kara, debbie, carolyn, lynn, alice",0,0.1,11,25,15,0,worked well,0,2.48,0,1,116,07dlygkj,,64.134.163.53,2017-03-27 17:00:11.026839+00:00,1,AMPMTF5IAAMK8,3SBEHTYCWN46F0G2SAIYPO6W9ADIYQ,37PGLWGSJT798BTSYSC5RWW4W6CKIA,0.69,2.69,1re06q0k,,,3DTJ4WT8BDGSH1QS2APOTWMP8MIEZH,3UOMW19E6D7FDPMPZVCDE4FRMBX5C8,37PGLWGSJT798BTSYSC5RWW4W6CKIA,391FPZIE4CNNFCNKMOYMX74NYKVHUB,3NMDE2OGHG0L1YTUQZWF1QB1KRTFGY,3NMDE2OGHG0L1YTUQZWF1QB1KRTFGY,,$2.00,13,AMPMTF5IAAMK8,14,0.39,1,1,2,Jane,Jane,mary,,(none),0,0,"(none), jane, mary",0,0,8,1,1,Jane,Jane,jane,,Jackie,1,0,"(none), jane, mary, jackie",0,0.1,4,2,1,Jane,Jane,Christina,,Jane,0,0,"jane, jackie, mary, (none), christina",0,-0.05,6,3,1,Jane,Jane,jane,,Alice,1,0,"mary, jackie, (none), jane, christina, alice",0,0.1,3,4,2,Jane,Jane,Sally,,Christina,0,0,"jackie, christina, mary, alice, jane, (none), sally",0,-0.05,6,5,1,Jane,Jane,Jane,,Jackie,1,0,"jane, mary, sally, jackie, christina, (none), alice",0,0.1,5,6,1,Jane,Jane,Jane,,Alice,1,0,"jackie, christina, mary, alice, jane, (none), sally",0,0.1,2,7,1,Jane,Jane,jane,,Jackie,1,0,"mary, alice, christina, (none), jane, jackie, sally",0,0.1,3,8,2,(none),(none),jane,,Lily,0,1,"jane, mary, sally, jackie, christina, lily, (none), alice",1,-0.05,1,9,1,(none),(none),Sally,,Tammy,0,1,"lily, mary, jackie, tammy, sally, jane, (none), christina, alice",1,-0.05,7,10,2,Jane,Jane,Sally,,Jane,0,0,"jane, sally, mary, alice, christina, (none), tammy, lily, jackie",0,-0.05,12,11,2,Jane,Jane,Jane,,Sally,1,0,"(none), lily, tammy, jane, mary, christina, sally, alice, jackie",0,0.1,1,12,2,Jane,Jane,jane,,Jane,1,0,"alice, jane, tammy, mary, (none), sally, lily, jackie, christina",0,0.1,12,13,1,Jane,Jane,Sally,,Jane,0,0,"jackie, jane, christina, (none), mary, lily, tammy, alice, sally",0,-0.05,5,14,2,Jane,Jane,Sally,,Christina,0,0,"lily, mary, jackie, tammy, sally, jane, (none), christina, alice",0,-0.05,7,15,1,Jane,Jane,Jane,,Christina,1,0,"jackie, tammy, christina, mary, alice, jane, (none), lily, sally",0,0.1,9,16,1,Jane,Jane,Sally,,Maria,0,0,"jackie, tammy, christina, mary, alice, jane, (none), lily, sally, maria",0,-0.05,3,17,1,Jane,Jane,Sally,,Lily,0,0,"mary, lily, tammy, alice, christina, maria, (none), jane, jackie, sally",0,-0.05,8,18,1,Jane,Jane,Jane,,Lily,1,0,"jane, sally, mary, alice, christina, (none), maria, tammy, lily, jackie",0,0.1,6,19,2,Jane,Jane,mary,,Alice,0,0,"jane, jackie, mary, tammy, christina, alice, lily, (none), sally, maria",0,-0.05,11,20,2,Jane,Jane,Sally,,Alice,0,0,"maria, jackie, jane, lily, mary, (none), sally, tammy, alice, christina",0,-0.05,9,21,2,Jane,Jane,mary,,Maria,0,0,"jane, sally, mary, alice, christina, (none), maria, tammy, lily, jackie",0,-0.05,10,22,2,Jane,Jane,Jane,,Christina,1,0,"jackie, tammy, christina, mary, alice, jane, (none), lily, sally, maria",0,0.1,10,23,2,Jane,Jane,Sally,,Sally,0,0,"mary, lily, tammy, alice, christina, maria, (none), jane, jackie, sally",0,-0.05,12,24,1,Jane,Jane,Sally,,Jackie,0,0,"lily, mary, jackie, tammy, maria, (none), jane, sally, christina, alice",0,-0.05,2,25,16,0,,0,2.69,0,1,117,yxviclxf,,162.226.190.29,2017-03-27 17:00:14.499868+00:00,1,A0017268R9SKD8U2Y3F,3EICBYG644XP78Z3E0L94YTDJ1KCJO,37PGLWGSJT798BTSYSC5RWW4W6CKIA,1.32,3.32,1re06q0k,,,3DTJ4WT8BDGSH1QS2APOTWMP8MIEZH,3UOMW19E6D7FDPMPZVCDE4FRMBX5C8,37PGLWGSJT798BTSYSC5RWW4W6CKIA,391FPZIE4CNNFCNKMOYMX74NYKVHUB,3NMDE2OGHG0L1YTUQZWF1QB1KRTFGY,3NMDE2OGHG0L1YTUQZWF1QB1KRTFGY,,$2.00,14,A0017268R9SKD8U2Y3F,22,0.42,1,1,2,Lily,Lily,maria,,(none),0,0,"(none), lily, maria",0,0,2,1,2,Lily,Lily,maria,,Sally,0,0,"(none), sally, lily, maria",0,0,9,2,1,lily,lily,Lynn,,Sally,0,0,"sally, lily, lynn, (none), maria",0,0,11,3,1,Lily,Lily,Anna,,Maria,0,0,"lily, anna, maria, (none), sally, lynn",0,0,12,4,2,Lily,Lily,Lynn,,Jane,0,0,"anna, (none), jane, lily, sally, lynn, maria",0,0,11,5,1,Lily,Lily,Julie,,Maria,0,0,"jane, sally, maria, lynn, anna, lily, (none), julie",0,0,9,6,1,Julie,Julie,Lily,,Jackie,0,0,"jackie, julie, anna, jane, (none), lily, sally, lynn, maria",0,0,6,7,2,Lily,Lily,Lily,,Alice,1,0,"lily, anna, alice, maria, (none), julie, jane, jackie, lynn, sally",0,0.1,2,8,2,Lily,Lily,Lily,,Jane,1,0,"jane, sally, jackie, maria, lynn, anna, lily, julie, (none), alice",0,0.1,5,9,1,Lily,Lily,Lily,,Mary,1,0,"lily, anna, julie, mary, jackie, maria, (none), jane, sally, lynn, alice",0,0.1,11,10,1,Lily,Lily,maria,,Jane,0,0,"anna, jane, lynn, julie, sally, mary, alice, (none), maria, lily, jackie",0,-0.05,6,11,1,Lily,Lily,Lily,,Christina,1,0,"(none), lily, maria, julie, jane, mary, lynn, christina, sally, alice, anna, jackie",0,0.1,11,12,1,Lily,Lily,maria,,Jackie,0,0,"maria, lynn, julie, jackie, jane, anna, mary, (none), sally, lily, alice, christina",0,-0.05,4,13,1,Lily,Lily,maria,,Mary,0,0,"jackie, jane, christina, anna, (none), mary, maria, lily, julie, sally, alice, lynn",0,-0.05,1,14,2,Lily,Lily,maria,,Maria,0,0,"lily, anna, julie, mary, jackie, maria, (none), jane, sally, lynn, christina, alice",0,-0.05,12,15,1,Lily,Lily,Lily,,Jackie,1,0,"christina, jackie, mary, julie, alice, anna, jane, (none), lily, sally, lynn, maria",0,0.1,7,16,2,Lily,Lily,Lily,,Maria,1,0,"christina, jackie, mary, julie, alice, anna, jane, (none), lily, sally, lynn, maria",0,0.1,1,17,1,Lily,Lily,Lily,,Sally,1,0,"mary, lily, anna, alice, christina, maria, (none), julie, jane, jackie, lynn, sally",0,0.1,6,18,1,Lily,Lily,maria,,Alice,0,0,"lynn, jane, anna, julie, sally, mary, alice, christina, (none), maria, lily, jackie",0,-0.05,7,19,1,Lily,Lily,Lily,,Jane,1,0,"jane, mary, jackie, christina, julie, lily, alice, (none), sally, maria, lynn, anna",0,0.1,7,20,1,Lily,Lily,Lily,,Jane,1,0,"maria, lynn, julie, jackie, jane, anna, mary, (none), sally, lily, alice, christina",0,0.1,11,21,1,Lily,Lily,Lily,,Maria,1,0,"lynn, jane, anna, julie, sally, mary, alice, christina, (none), maria, lily, jackie",0,0.1,3,22,2,Lily,Lily,Lily,,Jane,1,0,"christina, jackie, mary, julie, alice, anna, jane, (none), lily, sally, lynn, maria",0,0.1,3,23,1,Lily,Lily,maria,,Jane,0,0,"mary, lily, anna, alice, christina, maria, (none), julie, jane, jackie, lynn, sally",0,-0.05,2,24,1,Lily,Lily,Lily,,Jane,1,0,"lily, anna, julie, mary, jackie, maria, (none), jane, sally, lynn, christina, alice",0,0.1,9,25,17,0,Fun!,0,3.32,0,1,118,mhw75ohk,,107.2.16.121,2017-03-27 17:00:15.003586+00:00,1,A610SH5RY1NG1,32Z9ZLUT1LLUPR1GG5RFNL7FVNZOHS,3UOMW19E6D7FDPMPZVCDE4FRMBX5C8,1.07,3.07,1re06q0k,,,3DTJ4WT8BDGSH1QS2APOTWMP8MIEZH,3UOMW19E6D7FDPMPZVCDE4FRMBX5C8,37PGLWGSJT798BTSYSC5RWW4W6CKIA,391FPZIE4CNNFCNKMOYMX74NYKVHUB,3NMDE2OGHG0L1YTUQZWF1QB1KRTFGY,3NMDE2OGHG0L1YTUQZWF1QB1KRTFGY,,$2.00,15,A610SH5RY1NG1,21,0.37,1,1,1,jane,jane,laura,,Jackie,0,0,"jackie, laura, jane",0,0,3,1,2,laura,laura,Maria,,Mary,0,0,"jane, jackie, maria, mary, laura",0,0,10,2,1,laura,laura,maria,,Maria,0,0,"jane, jackie, mary, laura, maria",0,0,1,3,2,maria,maria,maria,,Mary,1,0,"jackie, mary, laura, maria, jane",0,0.1,11,4,2,maria,maria,maria,,Alice,1,0,"jackie, mary, laura, alice, jane, maria",0,0.1,12,5,1,maria,maria,maria,,Jane,1,0,"jane, mary, jackie, maria, alice, laura",0,0.1,10,6,1,maria,maria,maria,,Mary,1,0,"jackie, mary, laura, alice, jane, maria",0,0.1,5,7,1,maria,maria,jane,,Mary,0,0,"mary, alice, laura, maria, jane, jackie",0,-0.05,5,8,2,maria,maria,maria,,Anne,1,0,"jane, mary, jackie, maria, alice, laura, anne",0,0.1,9,9,2,maria,maria,jane,,Tammy,0,0,"laura, mary, jackie, tammy, maria, anne, jane, alice",0,-0.05,4,10,1,maria,maria,jane,,Alice,0,0,"laura, jane, anne, mary, alice, maria, tammy, jackie",0,-0.05,8,11,1,maria,maria,maria,,Sally,1,0,"maria, anne, tammy, jane, mary, laura, sally, alice, jackie",0,0.1,10,12,1,maria,maria,jane,,Mary,0,0,"maria, jackie, jane, laura, mary, anne, sally, tammy, alice",0,-0.05,6,13,1,maria,maria,jane,,Lily,0,0,"jackie, jane, anne, laura, mary, maria, lily, tammy, alice, sally",0,-0.05,10,14,1,maria,maria,Mary,,Jackie,0,0,"lily, laura, mary, jackie, tammy, maria, anne, sally, jane, alice",0,-0.05,9,15,1,maria,maria,maria,,Lily,1,0,"jackie, tammy, mary, laura, alice, jane, anne, lily, sally, maria",0,0.1,5,16,2,maria,maria,Mary,,Mary,0,0,"jackie, tammy, mary, laura, alice, jane, anne, lily, sally, maria",0,-0.05,4,17,1,maria,maria,Maria,,Sally,1,0,"mary, lily, anne, tammy, alice, laura, maria, jane, jackie, sally",0,0.1,5,18,1,maria,maria,Maria,,Alice,1,0,"laura, jane, sally, maria, mary, alice, anne, tammy, lily, jackie",0,0.1,8,19,1,maria,maria,lily,,Sally,0,0,"jane, jackie, mary, tammy, lily, alice, anne, sally, maria, laura",0,-0.05,6,20,1,maria,maria,lily,,July,0,0,"maria, july, alice, jane, laura, tammy, mary, anne, sally, lily, jackie",0,-0.05,10,21,1,maria,maria,Maria,,Mary,1,0,"laura, jane, july, sally, anne, alice, mary, maria, tammy, lily, jackie",0,0.1,8,22,2,maria,maria,maria,,Maria,1,0,"jackie, tammy, mary, laura, alice, jane, anne, lily, sally, july, maria",0,0.1,2,23,1,maria,maria,Maria,,Mary,1,0,"mary, lily, anne, tammy, alice, laura, maria, july, jane, jackie, sally",0,0.1,3,24,1,maria,maria,jane,,Lily,0,0,"lily, laura, july, mary, jackie, tammy, maria, anne, sally, jane, alice",0,-0.05,1,25,18,0,,0,3.07,0,1,119,g0yo2lnb,,108.75.122.125,2017-03-27 17:00:21.466783+00:00,1,A2VM2EU6AHX5IC,308Q0PEVB8EREZ8UKYQIQ7D501S9IS,37PGLWGSJT798BTSYSC5RWW4W6CKIA,0.49,2.49,1re06q0k,,,3DTJ4WT8BDGSH1QS2APOTWMP8MIEZH,3UOMW19E6D7FDPMPZVCDE4FRMBX5C8,37PGLWGSJT798BTSYSC5RWW4W6CKIA,391FPZIE4CNNFCNKMOYMX74NYKVHUB,3NMDE2OGHG0L1YTUQZWF1QB1KRTFGY,3NMDE2OGHG0L1YTUQZWF1QB1KRTFGY,,$2.00,16,A2VM2EU6AHX5IC,19,0.44,1,1,1,Lynn,Lynn,(none),,Lily,0,0,"(none), lily, lynn",0,0,11,1,2,Lynn,Lynn,Jessica,,Alice,0,0,"(none), alice, lynn, lily, jessica",0,0,7,2,2,Alice,Alice,Lynn,,Alice,0,0,"lily, alice, jessica, (none), lynn",0,0,3,3,2,Alice,Alice,Lynn,,Carol,0,0,"lily, jessica, (none), carol, lynn, alice",0,0,7,4,2,Alice,Alice,Lynn,,Lynn,0,0,"jessica, alice, (none), lily, carol, lynn",0,0,8,5,2,Lynn,Lynn,Lily,,Sally,0,0,"sally, lynn, carol, lily, (none), alice, jessica",0,0,12,6,1,Lynn,Lynn,Jane,,Mary,0,0,"mary, jessica, alice, (none), jane, lily, sally, lynn, carol",0,0,8,7,2,Jane,Jane,maria,,Mary,0,0,"mary, jessica, lily, alice, maria, (none), carol, jane, lynn, sally",0,0,8,8,2,Jane,Jane,Anne,,Mary,0,0,"jane, mary, sally, maria, lynn, carol, lily, (none), alice, jessica, anne",0,0,12,9,2,Anne,Anne,maria,,Mary,0,0,"lily, mary, maria, anne, jessica, sally, jane, (none), carol, lynn, alice",0,0,2,10,2,Mary,Mary,Christina,,Maria,0,0,"lynn, jane, sally, carol, anne, mary, alice, jessica, christina, (none), maria, lily",0,0,7,11,2,Maria,Maria,Jane,,Maria,0,0,"(none), lily, maria, anne, jessica, jane, lynn, mary, christina, carol, sally, alice",0,0,8,12,1,Maria,Maria,Lily,,Jackie,0,0,"maria, lynn, jackie, jane, jessica, carol, mary, (none), anne, sally, lily, alice, christina",0,0,1,13,2,Lily,Lily,Lily,,Jane,1,0,"jackie, jane, anne, christina, jessica, (none), mary, maria, carol, lily, sally, alice, lynn",0,0.1,4,14,1,Lily,Lily,Lily,,Maria,1,0,"lily, mary, jackie, maria, anne, jessica, (none), jane, sally, carol, lynn, christina, alice",0,0.1,10,15,2,Lily,Lily,jane,,Lily,0,0,"jackie, christina, mary, sally, jessica, alice, jane, (none), anne, lily, carol, lynn, maria",0,-0.05,6,16,2,Lily,Lily,maria,,Sally,0,0,"jackie, christina, mary, sally, jessica, alice, jane, (none), anne, lily, carol, lynn, maria",0,-0.05,11,17,1,Lily,Lily,Jane,,Maria,0,0,"jessica, mary, lily, anne, alice, christina, maria, (none), carol, jane, jackie, lynn, sally",0,-0.05,9,18,1,Lily,Lily,Lily,,Maria,1,0,"lynn, jane, sally, carol, anne, jessica, mary, alice, christina, (none), maria, lily, jackie",0,0.1,2,19,2,Lily,Lily,Jane,,Jane,0,0,"jane, jackie, mary, christina, lily, alice, (none), anne, carol, sally, jessica, maria, lynn",0,-0.05,3,20,2,Jane,Jane,Christina,,Jane,0,0,"maria, lynn, alice, jane, jessica, carol, mary, (none), anne, sally, lily, jackie, christina",0,-0.05,12,21,2,Jane,Jane,lily,,Jackie,0,0,"lynn, jane, sally, carol, anne, jessica, mary, alice, christina, (none), maria, lily, jackie",0,-0.05,2,22,2,Lily,Lily,Jane,,Maria,0,0,"jackie, christina, mary, sally, jessica, alice, jane, (none), anne, lily, carol, lynn, maria",0,0,4,23,2,Lily,Lily,Lily,,Jane,1,0,"jessica, mary, lily, anne, alice, christina, maria, (none), carol, jane, jackie, lynn, sally",0,0.1,7,24,2,Lily,Lily,maria,,Sally,0,0,"lily, mary, jackie, maria, anne, jessica, (none), jane, sally, carol, lynn, christina, alice",0,-0.05,6,25,19,0,,0,2.49,0,1,120,jqtpxxlb,,47.33.201.241,2017-03-27 17:00:22.040119+00:00,1,A1QA5EWFMNKGTA,3SNVL38CI4TKIS5LWLLL5DTQYQKCKN,37PGLWGSJT798BTSYSC5RWW4W6CKIA,1.24,3.24,1re06q0k,,,3DTJ4WT8BDGSH1QS2APOTWMP8MIEZH,3UOMW19E6D7FDPMPZVCDE4FRMBX5C8,37PGLWGSJT798BTSYSC5RWW4W6CKIA,391FPZIE4CNNFCNKMOYMX74NYKVHUB,3NMDE2OGHG0L1YTUQZWF1QB1KRTFGY,3NMDE2OGHG0L1YTUQZWF1QB1KRTFGY,,$2.00,17,A1QA5EWFMNKGTA,8,0.44,1,1,1,Jackie,Jackie,Linda,,Jane,0,0,"jackie, linda, jane",0,0,5,1,1,Jackie,Jackie,jessica,,Maria,0,0,"jane, jackie, jessica, linda, maria",0,0,12,2,1,Jackie,Jackie,jackie,,Sally,1,0,"sally, jackie, linda, jane, jessica, maria",0,0.1,5,3,1,Jackie,Jackie,maria,,Sally,0,0,"jackie, maria, jessica, sally, jane, linda",0,-0.05,6,4,2,Jackie,Jackie,jackie,,Jane,1,0,"jackie, linda, jessica, jane, sally, maria",0,0.1,1,5,2,Jackie,Jackie,Jane,,Maria,0,0,"jane, sally, jackie, maria, linda, jessica",0,-0.05,2,6,1,Jackie,Jackie,jackie,,Mary,1,0,"jackie, linda, mary, jessica, jane, sally, maria",0,0.1,4,7,1,Jackie,Jackie,Jane,,Mary,0,0,"jessica, mary, linda, maria, jane, jackie, sally",0,-0.05,11,8,2,Jackie,Jackie,jackie,,Jane,1,0,"jane, mary, sally, jackie, maria, linda, jessica",0,0.1,10,9,1,Jackie,Jackie,jackie,,Lily,1,0,"lily, mary, jackie, maria, jessica, sally, jane, linda",0,0.1,8,10,1,Jackie,Jackie,Jane,,Jane,0,0,"jane, sally, jessica, mary, maria, linda, lily, jackie",0,-0.05,2,11,1,Jackie,Jackie,jackie,,Christina,1,0,"lily, maria, linda, jessica, jane, mary, christina, sally, jackie",0,0.1,3,12,1,Jackie,Jackie,Jane,,Mary,0,0,"maria, jackie, jessica, jane, mary, sally, lily, linda, christina",0,-0.05,10,13,1,Jackie,Jackie,jackie,,Jane,1,0,"jackie, linda, jane, christina, jessica, mary, maria, lily, sally",0,0.1,2,14,2,Jackie,Jackie,Jane,,Mary,0,0,"lily, mary, jackie, maria, jessica, sally, jane, christina, linda",0,-0.05,5,15,1,Jackie,Jackie,jackie,,Jane,1,0,"christina, jackie, mary, jessica, jane, maria, lily, sally, linda",0,0.1,2,16,1,Jackie,Jackie,Jane,,Mary,0,0,"christina, jackie, mary, jessica, jane, maria, lily, sally, linda",0,-0.05,9,17,1,Jackie,Jackie,jackie,,Maria,1,0,"jessica, mary, lily, christina, maria, linda, jane, jackie, sally",0,0.1,4,18,1,Jackie,Jackie,Jane,,Mary,0,0,"jane, sally, mary, jessica, christina, maria, linda, lily, jackie",0,-0.05,12,19,1,Jackie,Jackie,jackie,,Sally,1,0,"jane, mary, jackie, christina, linda, lily, sally, jessica, maria",0,0.1,1,20,2,Jackie,Jackie,Jane,,Sally,0,0,"maria, jackie, jessica, jane, mary, sally, lily, linda, christina",0,-0.05,3,21,1,Jackie,Jackie,jackie,,Mary,1,0,"jane, sally, mary, jessica, christina, maria, linda, lily, jackie",0,0.1,7,22,1,Jackie,Jackie,jackie,,Karen,1,0,"christina, jackie, mary, jessica, karen, jane, maria, lily, sally, linda",0,0.1,6,23,1,Jackie,Jackie,Jane,,Sally,0,0,"jessica, mary, lily, christina, maria, sally, linda, jane, jackie, karen",0,-0.05,9,24,1,Jackie,Jackie,jackie,,Helen,1,0,"lily, mary, karen, jackie, helen, maria, jessica, sally, jane, christina, linda",0,0.1,5,25,20,0,Thank you for letting me participate! ,0,3.24,0,1,121,5zu4rgij,,174.63.83.0,2017-03-27 17:00:28.109173+00:00,1,A13VIJ7G997ZCY,3018Q3ZVOIRICHLI2RYR0UPGTFTRAT,3UOMW19E6D7FDPMPZVCDE4FRMBX5C8,0.6,2.6,1re06q0k,,,3DTJ4WT8BDGSH1QS2APOTWMP8MIEZH,3UOMW19E6D7FDPMPZVCDE4FRMBX5C8,37PGLWGSJT798BTSYSC5RWW4W6CKIA,391FPZIE4CNNFCNKMOYMX74NYKVHUB,3NMDE2OGHG0L1YTUQZWF1QB1KRTFGY,3NMDE2OGHG0L1YTUQZWF1QB1KRTFGY,,$2.00,18,A13VIJ7G997ZCY,0,0.35,1,1,1,mary,mary,Jane,,April,0,0,"mary, april, jane",0,0,8,1,2,jane,jane,Jane,,Lynn,1,0,"lynn, jane, mary, april",0,0.1,4,2,1,jane,jane,Sally,,Mary,0,0,"sally, jane, april, mary, lynn",0,-0.05,9,3,2,jane,jane,Jane,,Sally,1,0,"mary, april, lynn, sally, jane",0,0.1,3,4,2,jane,jane,Sally,,Jane,0,0,"april, lynn, sally, mary, jane",0,-0.05,3,5,1,jane,jane,Sally,,Alice,0,0,"jane, mary, sally, april, lynn, alice",0,-0.05,4,6,1,jane,jane,Mary,,Alice,0,0,"mary, april, alice, jane, sally, lynn",0,-0.05,12,7,2,jane,jane,Jane,,Sally,1,0,"mary, alice, april, jane, lynn, sally",0,0.1,3,8,1,jane,jane,(none),,Maria,0,0,"jane, mary, sally, april, lynn, maria, alice, (none)",0,-0.05,1,9,2,jane,jane,Sally,,Alice,0,0,"april, mary, maria, sally, jane, (none), lynn, alice",0,-0.05,1,10,2,jane,jane,Mary,,Jane,0,0,"lynn, jane, sally, mary, alice, april, (none), maria",0,0,11,11,1,jane,jane,Mary,,Lily,0,0,"(none), april, lily, maria, jane, mary, lynn, sally, alice",0,0,6,12,1,jane,jane,Jane,,Jackie,1,0,"maria, april, lynn, jackie, jane, mary, (none), sally, lily, alice",0,0.1,12,13,2,jane,jane,Sally,,Jane,0,0,"jackie, jane, (none), mary, maria, lily, april, sally, alice, lynn",0,-0.05,6,14,1,jane,jane,Mary,,Mary,0,0,"lily, april, mary, jackie, maria, (none), jane, sally, lynn, alice",0,-0.05,2,15,1,mary,mary,Mary,,Alice,1,0,"jackie, mary, april, alice, jane, (none), lily, sally, lynn, maria",0,0.1,11,16,1,mary,mary,Sally,,Christina,0,0,"jackie, christina, mary, april, alice, jane, (none), lily, sally, lynn, maria",0,-0.05,2,17,1,mary,mary,Sally,,Lily,0,0,"mary, lily, alice, christina, maria, (none), april, jane, jackie, lynn, sally",0,-0.05,2,18,1,mary,mary,Mary,,Jackie,1,0,"lynn, jane, sally, alice, mary, christina, april, (none), maria, lily, jackie",0,0.1,9,19,1,mary,mary,Jane,,Jackie,0,0,"jane, jackie, mary, christina, alice, lily, (none), sally, maria, april, lynn",0,-0.05,11,20,2,mary,mary,Mary,,Jane,1,0,"maria, april, lynn, alice, jane, mary, (none), sally, lily, jackie, christina",0,0.1,7,21,1,mary,mary,Jane,,Alice,0,0,"lynn, jane, sally, alice, mary, christina, april, (none), maria, lily, jackie",0,-0.05,10,22,2,mary,mary,Mary,,Maria,1,0,"jackie, christina, mary, april, alice, jane, (none), lily, sally, lynn, maria",0,0.1,11,23,1,mary,mary,Mary,,Jan,1,0,"mary, lily, jan, alice, christina, maria, (none), april, jane, jackie, lynn, sally",0,0.1,10,24,2,mary,mary,Sally,,Jane,0,0,"lily, april, mary, jackie, maria, jan, (none), jane, sally, lynn, christina, alice",0,-0.05,3,25,21,0,,0,2.6,0,1,122,mf5eerj0,,73.178.106.206,2017-03-27 17:00:31.967882+00:00,1,ABMX8XUNPR3LP,3HFNH7HEMHFJA7JLBC11RQQEVO4GQT,3DTJ4WT8BDGSH1QS2APOTWMP8MIEZH,0.53,2.53,1re06q0k,,,3DTJ4WT8BDGSH1QS2APOTWMP8MIEZH,3UOMW19E6D7FDPMPZVCDE4FRMBX5C8,37PGLWGSJT798BTSYSC5RWW4W6CKIA,391FPZIE4CNNFCNKMOYMX74NYKVHUB,3NMDE2OGHG0L1YTUQZWF1QB1KRTFGY,3NMDE2OGHG0L1YTUQZWF1QB1KRTFGY,,$2.00,19,ABMX8XUNPR3LP,4,0.33,1,1,2,(none),(none),Jessica,,Maria,0,1,"jessica, maria",1,0,10,1,1,Jessica,Jessica,Lynn,,Mary,0,0,"lynn, mary, maria, jessica",0,0,7,2,1,Lynn,Lynn,Alice,,Jane,0,0,"mary, jane, alice, jessica, lynn, maria",0,0,3,3,1,Alice,Alice,Carol,,Alice,0,0,"mary, maria, jessica, jane, carol, lynn, alice",0,0,8,4,1,Carol,Carol,Susan,,Mary,0,0,"mary, jessica, alice, jane, susan, carol, lynn, maria",0,0,9,5,2,Susan,Susan,jane,,Maria,0,0,"jane, mary, maria, lynn, carol, alice, jessica, susan",0,0,6,6,2,Jane,Jane,Lynn,,Sally,0,0,"mary, sally, jessica, alice, jane, susan, carol, lynn, maria",0,0,8,7,1,Jane,Jane,Anne,,Jane,0,0,"mary, jessica, anne, alice, susan, maria, carol, jane, lynn, sally",0,0,9,8,1,Anne,Anne,Jane,,Mary,0,0,"jessica, jane, mary, sally, maria, lynn, carol, alice, susan, anne",0,0,12,9,1,Jane,Jane,Daisy,,Mary,0,0,"susan, mary, daisy, maria, anne, jessica, sally, jane, carol, lynn, alice",0,0,5,10,1,Jane,Jane,nancy,,Lily,0,0,"lynn, jane, nancy, sally, carol, anne, jessica, daisy, mary, alice, susan, maria, lily",0,0,9,11,1,Jane,Jane,Maria,,Lily,0,0,"nancy, lily, maria, anne, jessica, jane, lynn, mary, susan, carol, sally, alice, daisy",0,0,8,12,1,Jane,Jane,tara,,Jane,0,0,"maria, lynn, jane, jessica, tara, carol, daisy, mary, sally, susan, anne, nancy, lily, alice",0,0,7,13,1,Jane,Jane,diana,,Maria,0,0,"jane, anne, diana, jessica, mary, maria, daisy, susan, carol, nancy, lily, tara, sally, alice, lynn",0,0,11,14,1,Jane,Jane,jane,,Sally,1,0,"lily, susan, mary, daisy, diana, nancy, maria, anne, jessica, tara, jane, sally, carol, lynn, alice",0,0.1,8,15,1,Jane,Jane,teresa,,Jane,0,0,"diana, mary, sally, daisy, teresa, jessica, alice, tara, jane, anne, susan, lily, carol, lynn, nancy, maria",0,-0.05,3,16,1,Jane,Jane,jane,,Sally,1,0,"diana, maria, mary, daisy, teresa, jessica, alice, tara, jane, anne, susan, lily, sally, lynn, nancy, carol",0,0.1,12,17,2,Jane,Jane,Lily,,Mary,0,0,"mary, jessica, daisy, lily, anne, nancy, alice, susan, diana, maria, tara, carol, jane, lynn, sally, teresa",0,-0.05,9,18,1,Jane,Jane,jane,,Jane,1,0,"teresa, jane, lynn, nancy, sally, carol, maria, mary, jessica, daisy, diana, alice, tara, susan, anne, lily",0,0.1,4,19,1,Jane,Jane,Lily,,Mary,0,0,"jane, mary, nancy, teresa, daisy, susan, alice, lily, anne, carol, sally, jessica, maria, lynn, diana, tara",0,-0.05,3,20,1,Jane,Jane,jane,,Mary,1,0,"maria, lynn, jessica, jane, nancy, tara, carol, lily, mary, daisy, susan, anne, diana, sally, teresa, alice",0,0.1,4,21,1,Jane,Jane,elly,,Mary,0,0,"teresa, jane, lynn, nancy, sally, carol, maria, mary, jessica, daisy, diana, alice, tara, elly, susan, anne, lily",0,-0.05,6,22,1,Jane,Jane,Lily,,Lily,0,0,"diana, mary, anne, daisy, teresa, elly, jessica, alice, tara, jane, maria, susan, lily, sally, lynn, nancy, carol",0,-0.05,4,23,1,Jane,Jane,jane,,Christina,1,0,"mary, jessica, daisy, nancy, anne, lily, alice, susan, elly, diana, christina, maria, carol, tara, jane, lynn, sally, teresa",0,0.1,1,24,1,Jane,Jane,cher,,Mary,0,0,"lily, susan, mary, teresa, daisy, nancy, elly, diana, maria, anne, jessica, tara, jane, sally, cher, carol, lynn, christina, alice",0,-0.05,7,25,22,0,,0,2.53,0,1,1