participant.id_in_session,participant.code,participant.label,participant.ip_address,participant.time_started,participant.visited,participant.mturk_worker_id,participant.mturk_assignment_id,participant.mturk_hit_id,participant.payoff,participant.payoff_plus_participation_fee,session.code,session.label,session.time_started,session.mturk_HITId1,session.mturk_HITId2,session.mturk_HITId3,session.mturk_HITId4,session.mturk_HITGroupId1,session.mturk_HITGroupId2,session.comment,session.config.participation_fee,instructions.1.player.id_in_group,instructions.1.player.mturk_id,instructions.1.player.index_trans,instructions.1.player.payoff,instructions.1.group.id_in_subsession,instructions.1.subsession.round_number,coordinate.1.player.id_in_group,coordinate.1.player.name_played,coordinate.1.player.display_name,coordinate.1.player.alter,coordinate.1.player.message,coordinate.1.player.stigmergy,coordinate.1.player.success,coordinate.1.player.eject_count,coordinate.1.player.exposed_string,coordinate.1.player.flagged,coordinate.1.player.payoff,coordinate.1.group.id_in_subsession,coordinate.1.subsession.round_number,coordinate.2.player.id_in_group,coordinate.2.player.name_played,coordinate.2.player.display_name,coordinate.2.player.alter,coordinate.2.player.message,coordinate.2.player.stigmergy,coordinate.2.player.success,coordinate.2.player.eject_count,coordinate.2.player.exposed_string,coordinate.2.player.flagged,coordinate.2.player.payoff,coordinate.2.group.id_in_subsession,coordinate.2.subsession.round_number,coordinate.3.player.id_in_group,coordinate.3.player.name_played,coordinate.3.player.display_name,coordinate.3.player.alter,coordinate.3.player.message,coordinate.3.player.stigmergy,coordinate.3.player.success,coordinate.3.player.eject_count,coordinate.3.player.exposed_string,coordinate.3.player.flagged,coordinate.3.player.payoff,coordinate.3.group.id_in_subsession,coordinate.3.subsession.round_number,coordinate.4.player.id_in_group,coordinate.4.player.name_played,coordinate.4.player.display_name,coordinate.4.player.alter,coordinate.4.player.message,coordinate.4.player.stigmergy,coordinate.4.player.success,coordinate.4.player.eject_count,coordinate.4.player.exposed_string,coordinate.4.player.flagged,coordinate.4.player.payoff,coordinate.4.group.id_in_subsession,coordinate.4.subsession.round_number,coordinate.5.player.id_in_group,coordinate.5.player.name_played,coordinate.5.player.display_name,coordinate.5.player.alter,coordinate.5.player.message,coordinate.5.player.stigmergy,coordinate.5.player.success,coordinate.5.player.eject_count,coordinate.5.player.exposed_string,coordinate.5.player.flagged,coordinate.5.player.payoff,coordinate.5.group.id_in_subsession,coordinate.5.subsession.round_number,coordinate.6.player.id_in_group,coordinate.6.player.name_played,coordinate.6.player.display_name,coordinate.6.player.alter,coordinate.6.player.message,coordinate.6.player.stigmergy,coordinate.6.player.success,coordinate.6.player.eject_count,coordinate.6.player.exposed_string,coordinate.6.player.flagged,coordinate.6.player.payoff,coordinate.6.group.id_in_subsession,coordinate.6.subsession.round_number,coordinate.7.player.id_in_group,coordinate.7.player.name_played,coordinate.7.player.display_name,coordinate.7.player.alter,coordinate.7.player.message,coordinate.7.player.stigmergy,coordinate.7.player.success,coordinate.7.player.eject_count,coordinate.7.player.exposed_string,coordinate.7.player.flagged,coordinate.7.player.payoff,coordinate.7.group.id_in_subsession,coordinate.7.subsession.round_number,coordinate.8.player.id_in_group,coordinate.8.player.name_played,coordinate.8.player.display_name,coordinate.8.player.alter,coordinate.8.player.message,coordinate.8.player.stigmergy,coordinate.8.player.success,coordinate.8.player.eject_count,coordinate.8.player.exposed_string,coordinate.8.player.flagged,coordinate.8.player.payoff,coordinate.8.group.id_in_subsession,coordinate.8.subsession.round_number,coordinate.9.player.id_in_group,coordinate.9.player.name_played,coordinate.9.player.display_name,coordinate.9.player.alter,coordinate.9.player.message,coordinate.9.player.stigmergy,coordinate.9.player.success,coordinate.9.player.eject_count,coordinate.9.player.exposed_string,coordinate.9.player.flagged,coordinate.9.player.payoff,coordinate.9.group.id_in_subsession,coordinate.9.subsession.round_number,coordinate.10.player.id_in_group,coordinate.10.player.name_played,coordinate.10.player.display_name,coordinate.10.player.alter,coordinate.10.player.message,coordinate.10.player.stigmergy,coordinate.10.player.success,coordinate.10.player.eject_count,coordinate.10.player.exposed_string,coordinate.10.player.flagged,coordinate.10.player.payoff,coordinate.10.group.id_in_subsession,coordinate.10.subsession.round_number,coordinate.11.player.id_in_group,coordinate.11.player.name_played,coordinate.11.player.display_name,coordinate.11.player.alter,coordinate.11.player.message,coordinate.11.player.stigmergy,coordinate.11.player.success,coordinate.11.player.eject_count,coordinate.11.player.exposed_string,coordinate.11.player.flagged,coordinate.11.player.payoff,coordinate.11.group.id_in_subsession,coordinate.11.subsession.round_number,coordinate.12.player.id_in_group,coordinate.12.player.name_played,coordinate.12.player.display_name,coordinate.12.player.alter,coordinate.12.player.message,coordinate.12.player.stigmergy,coordinate.12.player.success,coordinate.12.player.eject_count,coordinate.12.player.exposed_string,coordinate.12.player.flagged,coordinate.12.player.payoff,coordinate.12.group.id_in_subsession,coordinate.12.subsession.round_number,coordinate.13.player.id_in_group,coordinate.13.player.name_played,coordinate.13.player.display_name,coordinate.13.player.alter,coordinate.13.player.message,coordinate.13.player.stigmergy,coordinate.13.player.success,coordinate.13.player.eject_count,coordinate.13.player.exposed_string,coordinate.13.player.flagged,coordinate.13.player.payoff,coordinate.13.group.id_in_subsession,coordinate.13.subsession.round_number,coordinate.14.player.id_in_group,coordinate.14.player.name_played,coordinate.14.player.display_name,coordinate.14.player.alter,coordinate.14.player.message,coordinate.14.player.stigmergy,coordinate.14.player.success,coordinate.14.player.eject_count,coordinate.14.player.exposed_string,coordinate.14.player.flagged,coordinate.14.player.payoff,coordinate.14.group.id_in_subsession,coordinate.14.subsession.round_number,coordinate.15.player.id_in_group,coordinate.15.player.name_played,coordinate.15.player.display_name,coordinate.15.player.alter,coordinate.15.player.message,coordinate.15.player.stigmergy,coordinate.15.player.success,coordinate.15.player.eject_count,coordinate.15.player.exposed_string,coordinate.15.player.flagged,coordinate.15.player.payoff,coordinate.15.group.id_in_subsession,coordinate.15.subsession.round_number,coordinate.16.player.id_in_group,coordinate.16.player.name_played,coordinate.16.player.display_name,coordinate.16.player.alter,coordinate.16.player.message,coordinate.16.player.stigmergy,coordinate.16.player.success,coordinate.16.player.eject_count,coordinate.16.player.exposed_string,coordinate.16.player.flagged,coordinate.16.player.payoff,coordinate.16.group.id_in_subsession,coordinate.16.subsession.round_number,coordinate.17.player.id_in_group,coordinate.17.player.name_played,coordinate.17.player.display_name,coordinate.17.player.alter,coordinate.17.player.message,coordinate.17.player.stigmergy,coordinate.17.player.success,coordinate.17.player.eject_count,coordinate.17.player.exposed_string,coordinate.17.player.flagged,coordinate.17.player.payoff,coordinate.17.group.id_in_subsession,coordinate.17.subsession.round_number,coordinate.18.player.id_in_group,coordinate.18.player.name_played,coordinate.18.player.display_name,coordinate.18.player.alter,coordinate.18.player.message,coordinate.18.player.stigmergy,coordinate.18.player.success,coordinate.18.player.eject_count,coordinate.18.player.exposed_string,coordinate.18.player.flagged,coordinate.18.player.payoff,coordinate.18.group.id_in_subsession,coordinate.18.subsession.round_number,coordinate.19.player.id_in_group,coordinate.19.player.name_played,coordinate.19.player.display_name,coordinate.19.player.alter,coordinate.19.player.message,coordinate.19.player.stigmergy,coordinate.19.player.success,coordinate.19.player.eject_count,coordinate.19.player.exposed_string,coordinate.19.player.flagged,coordinate.19.player.payoff,coordinate.19.group.id_in_subsession,coordinate.19.subsession.round_number,coordinate.20.player.id_in_group,coordinate.20.player.name_played,coordinate.20.player.display_name,coordinate.20.player.alter,coordinate.20.player.message,coordinate.20.player.stigmergy,coordinate.20.player.success,coordinate.20.player.eject_count,coordinate.20.player.exposed_string,coordinate.20.player.flagged,coordinate.20.player.payoff,coordinate.20.group.id_in_subsession,coordinate.20.subsession.round_number,coordinate.21.player.id_in_group,coordinate.21.player.name_played,coordinate.21.player.display_name,coordinate.21.player.alter,coordinate.21.player.message,coordinate.21.player.stigmergy,coordinate.21.player.success,coordinate.21.player.eject_count,coordinate.21.player.exposed_string,coordinate.21.player.flagged,coordinate.21.player.payoff,coordinate.21.group.id_in_subsession,coordinate.21.subsession.round_number,coordinate.22.player.id_in_group,coordinate.22.player.name_played,coordinate.22.player.display_name,coordinate.22.player.alter,coordinate.22.player.message,coordinate.22.player.stigmergy,coordinate.22.player.success,coordinate.22.player.eject_count,coordinate.22.player.exposed_string,coordinate.22.player.flagged,coordinate.22.player.payoff,coordinate.22.group.id_in_subsession,coordinate.22.subsession.round_number,coordinate.23.player.id_in_group,coordinate.23.player.name_played,coordinate.23.player.display_name,coordinate.23.player.alter,coordinate.23.player.message,coordinate.23.player.stigmergy,coordinate.23.player.success,coordinate.23.player.eject_count,coordinate.23.player.exposed_string,coordinate.23.player.flagged,coordinate.23.player.payoff,coordinate.23.group.id_in_subsession,coordinate.23.subsession.round_number,coordinate.24.player.id_in_group,coordinate.24.player.name_played,coordinate.24.player.display_name,coordinate.24.player.alter,coordinate.24.player.message,coordinate.24.player.stigmergy,coordinate.24.player.success,coordinate.24.player.eject_count,coordinate.24.player.exposed_string,coordinate.24.player.flagged,coordinate.24.player.payoff,coordinate.24.group.id_in_subsession,coordinate.24.subsession.round_number,coordinate.25.player.id_in_group,coordinate.25.player.name_played,coordinate.25.player.display_name,coordinate.25.player.alter,coordinate.25.player.message,coordinate.25.player.stigmergy,coordinate.25.player.success,coordinate.25.player.eject_count,coordinate.25.player.exposed_string,coordinate.25.player.flagged,coordinate.25.player.payoff,coordinate.25.group.id_in_subsession,coordinate.25.subsession.round_number,payment_info.1.player.id_in_group,payment_info.1.player.eject,payment_info.1.player.feedback_text,payment_info.1.player.save_ID,payment_info.1.player.total_payment,payment_info.1.player.payoff,payment_info.1.group.id_in_subsession,payment_info.1.subsession.round_number1,krzscafo,,24.15.171.133,2017-03-15 17:00:20.944881+00:00,1,A1R6ZLM9V362F7,3GM6G9ZBKNYWUX7Z3JTR90LYA2GTMY,3J94SKDEKIQPIHS3ZR7OYAX95AR5DM,2.94,4.94,ts44u31l,,,3J94SKDEKIQPIHS3ZR7OYAX95AR5DM,3O2Y2UIUCQVPYKR2XK6KOZJCED2KFX,337F8MIIMZEDNEN99A0JEB7CBPN04J,3KL228NDMVNVCKNX84C26KJOFS2KGW,33CY53T7YFR23AA9JZJ7YQKHNEPDHJ,36TBNKR908OQJ0J7TYB1DNN4VY1ED8,,$2.00,1,A1R6ZLM9V362F7,0,0.94,1,1,1,maria,(none),Amy,barred,"Jill, (none)",0,0,"amy, (none), jill",0,0,5,1,2,Jill,Jill,Amber,,"(none), Anna",0,0,"amber, anna, amy, jill, (none)",0,0,7,2,2,Jill,Jill,Jill,,"Jill, Jill",1,0,"jill, amber, (none), amy, anna",0,0.1,10,3,1,Jill,Jill,Jill,,"Jill, Jane",1,0,"(none), amy, anna, jane, amber, jill",0,0.1,3,4,2,Jill,Jill,Rachel,,"Maria, Becky",0,0,"maria, (none), rachel, jane, becky, jill, anna, amy, amber",0,-0.05,11,5,1,Jill,Jill,Sue,,"Maria, Mary",0,0,"amber, amy, anna, jane, rachel, sue, maria, (none), jill, mary, becky",0,-0.05,8,6,2,Jill,Jill,Jill,,"Sue, June",1,0,"sue, jill, becky, mary, amy, amber, rachel, june, anna, maria, jane, (none)",0,0.1,7,7,1,Jill,Jill,Jill,,"Jill, Jill",1,0,"amber, amy, june, anna, jane, rachel, sue, maria, (none), jill, mary, becky",0,0.1,6,8,2,Jill,Jill,Jill,,"June, Mary",1,0,"mary, rachel, maria, jill, june, jane, amy, anna, becky, amber, (none), sue",0,0.1,10,9,1,Jill,Jill,Jill,,"Jill, Jill",1,0,"mary, rachel, maria, jill, june, jane, amy, anna, becky, amber, (none), sue",0,0.1,12,10,1,Jill,Jill,Jill,,"Jill, Karen",1,0,"sue, jill, becky, mary, amy, (none), amber, rachel, karen, anna, maria, jane, june",0,0.1,4,11,1,Jill,Jill,Jill,,"Jill, Jill",1,0,"amber, amy, anna, jane, june, rachel, sue, maria, (none), jill, karen, mary, becky",0,0.1,8,12,1,Jill,Jill,Jill,,"Jill, Jill",1,0,"amber, amy, anna, jane, june, rachel, sue, maria, (none), jill, karen, mary, becky",0,0.1,11,13,1,Jill,Jill,Jill,,"Jill, Jill",1,0,"sue, (none), maria, mary, june, karen, rachel, jill, amy, jane, amber, anna, becky",0,0.1,11,14,1,Jill,Jill,Jill,,"Jill, Jill",1,0,"sue, (none), maria, mary, june, karen, rachel, jill, amy, jane, amber, anna, becky",0,0.1,1,15,1,Jill,Jill,Jill,,"Jill, Jill",1,0,"june, rachel, (none), karen, mary, maria, becky, jane, jill, anna, sue, amy, amber",0,0.1,11,16,2,Jill,Jill,Jill,,"Jill, Jill",1,0,"sue, jill, becky, mary, amy, amber, rachel, karen, june, anna, maria, jane, (none)",0,0.1,8,17,1,Jill,Jill,Jill,,"Jill, Jill",1,0,"karen, (none), maria, sue, becky, anna, jane, amber, rachel, mary, june, jill, amy",0,0.1,5,18,1,Jill,Jill,Jill,,"Jill, Jill",1,0,"amber, amy, anna, jane, june, rachel, sue, maria, (none), jill, karen, mary, becky",0,0.1,11,19,1,Jill,Jill,Jill,,"Jill, Jill",1,0,"sue, (none), maria, mary, june, karen, rachel, jill, amy, jane, amber, anna, becky",0,0.1,4,20,2,Jill,Jill,Jill,,"Jill, Jill",1,0,"(none), jill, amy, amber, maria, anna, karen, june, rachel, becky, jane, mary, sue",0,0.1,1,21,1,Jill,Jill,Jill,,"Jill, Jill",1,0,"sue, jill, becky, mary, amy, amber, rachel, karen, june, anna, maria, jane, (none)",0,0.1,8,22,1,Jill,Jill,Jill,,"Jill, Jill",1,0,"jane, sue, (none), mary, maria, rachel, jill, karen, becky, amber, amy, june, anna",0,0.1,11,23,1,Jill,Jill,Jill,,"Jill, Jill",1,0,"sue, jill, becky, mary, amy, amber, rachel, karen, june, anna, maria, jane, (none)",0,0.1,12,24,1,Jill,Jill,Jill,,"Jill, Jill",1,0,"jane, sue, (none), mary, maria, rachel, jill, karen, becky, amber, amy, june, anna",0,0.1,4,25,1,0,Thanks!,0,4.94,0,1,12,5s9yjtc8,,198.24.30.133,2017-03-15 17:00:26.024906+00:00,1,A4J4GGMKJ68L0,32VNZTT0A753AS51TQO0NR3G0QYR4O,3KL228NDMVNVCKNX84C26KJOFS2KGW,2.52,4.52,ts44u31l,,,3J94SKDEKIQPIHS3ZR7OYAX95AR5DM,3O2Y2UIUCQVPYKR2XK6KOZJCED2KFX,337F8MIIMZEDNEN99A0JEB7CBPN04J,3KL228NDMVNVCKNX84C26KJOFS2KGW,33CY53T7YFR23AA9JZJ7YQKHNEPDHJ,36TBNKR908OQJ0J7TYB1DNN4VY1ED8,,$2.00,2,A4J4GGMKJ68L0,19,0.92,1,1,2,MARY,MARY,Karen,,"(none), (none)",0,0,"(none), karen, mary",0,0,8,1,1,KAREN,KAREN,Jen,,"Maria, Jen",0,0,"jen, maria, (none), karen, mary",0,0,3,2,1,Maria,Maria,Karen,,"Jane, Louisa",0,0,"mary, maria, jane, louisa, karen, (none), jen",0,0,3,3,2,Maria,Maria,Maria,,"Alice, Jill",1,0,"karen, (none), alice, maria, jane, mary, louisa, jill, jen",0,0.1,1,4,2,Maria,Maria,maria,,"Sue, Becky",1,0,"alice, maria, (none), karen, mary, louisa, jane, becky, jill, jen, sue",0,0.1,7,5,1,Maria,Maria,Jen,,"Jill, Sue",0,0,"louisa, alice, jane, sue, maria, (none), karen, jill, mary, becky, jen",0,-0.05,12,6,2,Maria,Maria,Karen,,"Jill, Jill",0,0,"jill, becky, sue, mary, alice, karen, jen, maria, jane, louisa, (none)",0,-0.05,12,7,1,Maria,Maria,Jill,,"Jill, Jill",0,0,"louisa, alice, jane, sue, maria, (none), karen, jill, mary, becky, jen",0,-0.05,1,8,1,Jill,Jill,Jill,,"Jill, Maria",1,0,"mary, maria, jill, jane, louisa, alice, becky, karen, (none), sue, jen",0,0.1,5,9,2,Jill,Jill,Jill,,"Jill, Jill",1,0,"mary, maria, jill, jane, louisa, alice, becky, karen, (none), sue, jen",0,0.1,5,10,1,Jill,Jill,Jill,,"Jill, Jill",1,0,"jill, becky, sue, mary, alice, karen, jen, maria, jane, louisa, (none)",0,0.1,6,11,2,JILL,JILL,Jill,,"Karen, Jill",1,0,"louisa, alice, jane, sue, maria, (none), karen, jill, mary, becky, jen",0,0.1,1,12,2,Jill,Jill,Jill,,"Karen, Karen",1,0,"louisa, alice, jane, sue, maria, (none), karen, jill, mary, becky, jen",0,0.1,4,13,1,Jill,Jill,Jill,,"Maria, Jill",1,0,"sue, (none), maria, louisa, mary, karen, jill, jane, alice, jen, becky",0,0.1,4,14,1,JILL,JILL,Jill,,"Jill, Jill",1,0,"sue, (none), maria, louisa, mary, karen, jill, jane, alice, jen, becky",0,0.1,8,15,1,JILL,JILL,Jill,,"Jill, Jill",1,0,"alice, louisa, (none), karen, mary, maria, jane, becky, jill, jen, sue",0,0.1,6,16,2,JILL,JILL,Jill,,"Jill, Jill",1,0,"jill, becky, sue, mary, alice, karen, jen, maria, jane, louisa, (none)",0,0.1,11,17,2,JILL,JILL,Jill,,"Jill, Jill",1,0,"karen, (none), alice, maria, sue, becky, jane, mary, louisa, jen, jill",0,0.1,1,18,2,JILL,JILL,Jill,,"Jill, Jill",1,0,"louisa, alice, jane, sue, maria, (none), karen, jill, mary, becky, jen",0,0.1,6,19,1,JILL,JILL,Jill,,"Jill, Jill",1,0,"sue, (none), maria, louisa, mary, karen, jill, jane, alice, jen, becky",0,0.1,9,20,1,JILL,JILL,Jill,,"Jill, Jill",1,0,"alice, (none), jen, maria, jill, karen, jane, becky, mary, louisa, sue",0,0.1,10,21,1,JILL,JILL,Jill,,"Jill, Jill",1,0,"jill, becky, sue, mary, alice, karen, jen, maria, jane, louisa, (none)",0,0.1,1,22,1,JILL,JILL,Jill',,"Jill, Jill",0,0,"jane, alice, louisa, (none), sue, mary, jill', maria, jill, karen, becky, jen",0,-0.05,9,23,1,JILL,JILL,Jill,,"Jill, Jill",1,0,"sue, jill, becky, mary, alice, jill', karen, jen, maria, jane, louisa, (none)",0,0.1,4,24,2,JILL,JILL,Jill,,"Jill, Jill",1,0,"jane, alice, louisa, (none), sue, mary, jill', maria, jill, karen, becky, jen",0,0.1,12,25,2,0,"AYY NICE, THANK YOU",0,4.52,0,1,13,u0mp79el,,73.171.223.52,2017-03-15 17:00:26.499950+00:00,1,A1JV64BL3WCK0G,3EFVCAY5L3ANV59QXO542CXUSV0J8V,3O2Y2UIUCQVPYKR2XK6KOZJCED2KFX,2.34,4.34,ts44u31l,,,3J94SKDEKIQPIHS3ZR7OYAX95AR5DM,3O2Y2UIUCQVPYKR2XK6KOZJCED2KFX,337F8MIIMZEDNEN99A0JEB7CBPN04J,3KL228NDMVNVCKNX84C26KJOFS2KGW,33CY53T7YFR23AA9JZJ7YQKHNEPDHJ,36TBNKR908OQJ0J7TYB1DNN4VY1ED8,,$2.00,3,A1JV64BL3WCK0G,9,0.64,1,1,1,Karen,Karen,MARY,,"Jill, Amy",0,0,"amy, jill, karen, mary",0,0,8,1,1,Karen,Karen,becky,,"Sue, Karen",0,0,"amy, mary, jill, karen, sue, becky",0,0,1,2,2,Karen,Karen,Rachel,,"Jill, Sue",0,0,"mary, rachel, jill, amy, becky, karen, sue",0,0,12,3,2,Karen,Karen,Sue,,"Kimberly, Karen",0,0,"karen, kimberly, sue, becky, rachel, mary, jill, amy",0,0,8,4,1,Karen,Karen,Rachel,,"Karen, Karen",0,0,"rachel, karen, mary, becky, jill, sue, amy, kimberly",0,0,8,5,2,Karen,Karen,Karen,,"Karen, Karen",1,0,"amy, rachel, sue, kimberly, karen, jill, mary, becky",0,0.1,6,6,1,Karen,Karen,Maria,,"Jill, Jill",0,0,"sue, becky, jill, mary, amy, rachel, karen, maria, kimberly",0,-0.05,12,7,2,Jill,Jill,Maria,,"Karen, Jill",0,0,"amy, rachel, sue, kimberly, maria, jill, karen, mary, becky",0,-0.05,1,8,2,Jill,Jill,Jill,,"Karen, Maria",1,0,"mary, rachel, maria, jill, kimberly, amy, becky, karen, sue",0,0.1,5,9,1,Jill,Jill,Jill,,"Jill, Jill",1,0,"mary, rachel, maria, jill, kimberly, amy, becky, karen, sue",0,0.1,10,10,2,Jill,Jill,Jill,,"Laura, Jill",1,0,"jill, sue, becky, mary, amy, laura, rachel, karen, maria, kimberly",0,0.1,12,11,1,Jill,Jill,JILL,,"Jill, Jill",1,0,"laura, amy, rachel, sue, kimberly, maria, jill, karen, mary, becky",0,0.1,1,12,1,Jill,Jill,Jill,,"Jill, Jill",1,0,"laura, amy, rachel, sue, kimberly, maria, jill, karen, mary, becky",0,0.1,4,13,2,Jill,Jill,Jill,,"Jill, Jill",1,0,"sue, maria, mary, karen, rachel, jill, laura, amy, kimberly, becky",0,0.1,2,14,2,Jill,Jill,Jill,,"Maria, Jill",1,0,"sue, maria, mary, karen, rachel, jill, laura, amy, kimberly, becky",0,0.1,3,15,2,Jill,Jill,JILL,,"Jill, Jill",1,0,"rachel, maria, laura, mary, karen, becky, jill, sue, amy, kimberly",0,0.1,6,16,1,Jill,Jill,JILL,,"Jill, Jill",1,0,"jill, sue, becky, mary, amy, laura, rachel, karen, maria, kimberly",0,0.1,11,17,2,Jill,Jill,Jill,,"Jill, Jill",1,0,"karen, kimberly, maria, sue, becky, rachel, laura, mary, jill, amy",0,0.1,6,18,1,Jill,Jill,Jill,,"Jill, Jill",1,0,"laura, amy, rachel, sue, kimberly, maria, jill, karen, mary, becky",0,0.1,1,19,1,Jill,Jill,Jill,,"Jill, Jill",1,0,"sue, maria, mary, karen, rachel, jill, laura, amy, kimberly, becky",0,0.1,7,20,2,Jill,Jill,JILL,,"Jill, Jill",1,0,"laura, jill, amy, maria, karen, rachel, kimberly, becky, mary, sue",0,0.1,10,21,1,Jill,Jill,Jill,,"Jil, Jill",1,0,"jill, sue, becky, mary, amy, laura, rachel, karen, jil, maria, kimberly",0,0.1,6,22,2,Jill,Jill,Jill,,"Jill, Jill",1,0,"sue, laura, mary, kimberly, maria, rachel, jill, karen, becky, jil, amy",0,0.1,4,23,2,Jill,Jill,JILL,,"Jill, Jill",1,0,"jill, sue, becky, mary, amy, laura, maria, rachel, karen, jil, kimberly",0,0.1,4,24,2,Jill,Jill,Jill,,"Jill, Jill",1,0,"sue, laura, mary, kimberly, maria, rachel, jill, karen, becky, jil, amy",0,0.1,11,25,3,0,,0,4.34,0,1,14,gdxbeogj,,96.41.186.199,2017-03-15 17:00:26.808212+00:00,1,A1LRJ4U04532TM,34BBWHLWHAC2QVL2D90A4RLGXNEWIB,3KL228NDMVNVCKNX84C26KJOFS2KGW,2.18,4.18,ts44u31l,,,3J94SKDEKIQPIHS3ZR7OYAX95AR5DM,3O2Y2UIUCQVPYKR2XK6KOZJCED2KFX,337F8MIIMZEDNEN99A0JEB7CBPN04J,3KL228NDMVNVCKNX84C26KJOFS2KGW,33CY53T7YFR23AA9JZJ7YQKHNEPDHJ,36TBNKR908OQJ0J7TYB1DNN4VY1ED8,,$2.00,4,A1LRJ4U04532TM,10,0.93,1,1,1,amber,amber,Kate,,"Becky, Alice",0,0,"becky, kate, amber, alice",0,0,4,1,2,becky,becky,Karen,,"Mary, Sue",0,0,"amber, alice, mary, karen, sue, becky, kate",0,0,1,2,2,Becky,Becky,Sue,,"June, Sue",0,0,"kate, mary, june, alice, becky, karen, amber, sue",0,0,9,3,1,Sue,Sue,Karen,,"Kimberly, Jill",0,0,"karen, kimberly, alice, sue, becky, kate, amber, june, mary, jill",0,0,8,4,2,Karen,Karen,Alice,,"Jen, Rachel",0,0,"june, alice, rachel, kate, karen, mary, becky, amber, jill, jen, sue, kimberly",0,0,2,5,1,Karen,Karen,Karen,,"Maria, Bernice",1,0,"amber, bernice, alice, june, rachel, sue, kimberly, maria, karen, jill, mary, becky, kate, jen",0,0.1,6,6,2,(none),(none),Rachel,,"Becky, Jill",0,1,"sue, jill, becky, mary, alice, kate, amber, rachel, karen, kimberly, maria, jen, bernice, june",1,-0.05,11,7,1,Karen,Karen,Rachel,,"Jill, Jill",0,0,"amber, bernice, alice, june, mary, rachel, kimberly, maria, karen, jill, sue, becky, kate, jen",0,-0.05,3,8,2,Karen,Karen,June,,"Jill, Jill",0,0,"kate, rachel, maria, mary, jill, amber, bernice, kimberly, alice, becky, karen, june, sue, jen",0,0,9,9,2,Karen,Karen,June,,"Jill, Misha",0,0,"misha, kate, rachel, maria, mary, jill, amber, bernice, kimberly, alice, becky, karen, june, sue, jen",0,0,9,10,2,Karen,Karen,Jill,,"Jill, Jill",0,0,"jill, misha, becky, mary, sue, alice, kate, amber, rachel, karen, june, maria, jen, bernice, kimberly",0,0,1,11,2,Jill,Jill,Jill,,"Jill, Jill",1,0,"amber, bernice, misha, alice, june, rachel, sue, kimberly, maria, jill, karen, mary, becky, kate, jen",0,0.1,3,12,2,Jill,Jill,karen,,"Jill, Jill",0,0,"amber, bernice, misha, alice, june, rachel, sue, kimberly, maria, jill, karen, mary, becky, kate, jen",0,-0.05,8,13,1,Jill,Jill,Jill,,"Jill, Jill",1,0,"kate, sue, maria, becky, mary, june, karen, rachel, jill, jen, amber, misha, bernice, kimberly, alice",0,0.1,12,14,2,Jill,Jill,Jill,,"Jill, Jill",1,0,"kate, sue, maria, becky, mary, june, karen, rachel, jill, jen, amber, misha, bernice, kimberly, alice",0,0.1,2,15,2,Jill,Jill,JILL,,"Jill, Jill",1,0,"june, misha, alice, maria, kate, rachel, mary, karen, becky, jill, jen, sue, bernice, kimberly, amber",0,0.1,8,16,2,Jill,Jill,Jill,,"Jill, Jill",1,0,"jill, misha, becky, mary, sue, alice, kate, amber, rachel, karen, june, maria, jen, bernice, kimberly",0,0.1,10,17,1,Jill,Jill,Jill,,"Jill, Jill",1,0,"karen, misha, kimberly, alice, maria, sue, becky, kate, rachel, amber, mary, bernice, june, jen, jill",0,0.1,12,18,2,Jill,Jill,jill,,"Jill, Jill",1,0,"amber, bernice, misha, alice, june, rachel, sue, kimberly, maria, jill, karen, mary, becky, kate, jen",0,0.1,3,19,2,Jill,Jill,Jill,,"Jill, Jill",1,0,"kate, sue, maria, becky, mary, june, karen, rachel, jill, jen, amber, misha, bernice, kimberly, alice",0,0.1,6,20,1,Jill,Jill,Jill,,"Jill, Jill",1,0,"alice, jen, jill, maria, amber, bernice, karen, june, rachel, kimberly, misha, kate, becky, mary, sue",0,0.1,12,21,2,Jill,Jill,Jill,,"Jill, Jill",1,0,"jill, misha, becky, mary, sue, alice, kate, amber, rachel, karen, june, maria, jen, bernice, kimberly",0,0.1,6,22,1,Jill,Jill,Jill,,"Jill, Jill",1,0,"bernice, alice, sue, mary, kimberly, maria, rachel, jill, karen, becky, kate, amber, jen, misha, june",0,0.1,4,23,1,Jill,Jill,Jill,,"Jill, Jill",1,0,"jill, misha, becky, mary, sue, alice, kate, amber, rachel, karen, june, maria, jen, bernice, kimberly",0,0.1,5,24,2,Jill,Jill,Jill,,"Jill, Jill",1,0,"bernice, alice, sue, mary, kimberly, maria, rachel, jill, karen, becky, kate, amber, jen, misha, june",0,0.1,9,25,4,0,,0,4.18,0,1,1