11,ww2rqfo9,,184.152.187.156,2017-02-16 18:00:50.734076+00:00,1,A3MJ47AD05HGC,3PIWWX1FJJ7CFM59OS2VR2685DZJJV,3XWUWJ18TLRSKYT4MN5LGMTDNYYUUX,1.14,3.14,fz05183z,,,3IZPORCT1FAVZKV3IU3HSWH3MRSHRF,3XWUWJ18TLRSKYT4MN5LGMTDNYYUUX,3IVKZBIBJ0A70ZVGXJ3MI6MZ8TBHS3,38G0E1M85M6SXDI4RDFQC8VW157UVM,3OR6S1RAB4JQ57CMFJANNP0AM9IAGD,3IE1FJZR9CZH2AY0D4H2PMHJN8K9K3,,$2.00,11,A3MJ47AD05HGC,2,0.54,1,1,2,Brandon,Brandon,(none given),,Joe,0,0,"(none given), brandon, joe",0,0.00,5,1,2,Joe,Joe,joe,,Stern,1,0,"joe, (none given), stern, brandon",0,0.10,7,2,2,Joe,Joe,joe,,Matt,1,0,"joe, (none given), stern, matt, brandon",0,0.10,1,3,2,Joe,Joe,bob,,David,0,0,"bob, matt, joe, stern, david, (none given), brandon",0,-0.05,1,4,1,Bob,Bob,bob,,Jim,1,0,"jim, stern, matt, (none given), david, joe, bob, brandon",0,0.10,7,5,2,bob,bob,bob,,Matt,1,0,"bob, matt, joe, stern, jim, david, (none given), brandon",0,0.10,1,6,2,bob,bob,Bob,,Mike,1,0,"david, brandon, mike, matt, jim, stern, joe, bob, (none given)",0,0.10,4,7,1,bob,bob,Matt,,Bob,0,0,"mike, stern, matt, (none given), jim, joe, bob, brandon, david",0,-0.05,6,8,2,matt,matt,bob,,Bob,0,0,"brandon, david, mike, matt, jim, stern, joe, bob, (none given)",0,-0.05,9,9,2,bob,bob,bob,,David,1,0,"mike, stern, matt, (none given), jim, joe, bob, brandon, david",0,0.10,4,10,1,bob,bob,bill,,Jason,0,0,"david, mike, bill, (none given), jason, joe, matt, bob, jim, stern, brandon",0,-0.05,12,11,1,bill,bill,Bob,,Joe,0,0,"(none given), bill, bob, jim, brandon, matt, jason, stern, mike, joe, david",0,-0.05,8,12,1,bob,bob,Bill,,Matt,0,0,"jim, mike, stern, matt, bill, (none given), david, joe, jason, bob, brandon",0,-0.05,2,13,2,bob,bob,bob,,Steven,1,0,"david, mike, bill, (none given), jason, joe, matt, bob, jim, stern, steven, brandon",0,0.10,5,14,1,bob,bob,bob,,Bob,1,0,"jim, mike, steven, stern, matt, bill, (none given), david, joe, jason, bob, brandon",0,0.10,2,15,1,bob,bob,bob,,Joe,1,0,"david, mike, bill, (none given), jason, joe, matt, bob, jim, stern, steven, brandon",0,0.10,2,16,2,bob,bob,Joe,,David,0,0,"david, mike, bill, (none given), jason, joe, matt, bob, jim, stern, steven, brandon",0,-0.05,8,17,2,bob,bob,joe,,Bill,0,0,"mike, stern, (none given), jason, matt, jim, bill, joe, bob, brandon, david, steven",0,-0.05,11,18,2,joe,joe,bob,,David,0,0,"(none given), bill, bob, jim, brandon, matt, jason, steven, stern, mike, joe, david",0,-0.05,8,19,2,bob,bob,Joe,,Danny,0,0,"(none given), bill, bob, danny, jim, brandon, matt, jason, steven, stern, mike, joe, david",0,-0.05,4,20,2,joe,joe,Joe,,Matt,1,0,"david, mike, bill, (none given), jason, joe, matt, bob, jim, stern, steven, danny, brandon",0,0.10,7,21,2,joe,joe,Joe,,Joe,1,0,"brandon, steven, david, mike, matt, jim, jason, stern, danny, bill, joe, bob, (none given)",0,0.10,2,22,1,joe,joe,bob,,David,0,0,"(none given), bill, bob, danny, jim, brandon, jason, steven, stern, mike, david, joe, matt",0,-0.05,10,23,1,bob,bob,joe,,Matt,0,0,"david, mike, bill, (none given), jason, joe, matt, bob, jim, stern, steven, danny, brandon",0,-0.05,6,24,2,bob,bob,bob,,Donald,1,0,"jim, mike, steven, stern, matt, bill, danny, (none given), donald, david, joe, jason, bob, brandon",0,0.10,8,25,11,0,No,,0.00,1,1,11,0,,1,3.14,0.00,1,1
12,o6v0hwut,Inactive,24.238.100.246,2017-02-16 18:00:52.253497+00:00,1,A2AG45K4ULNBHF,3EICBYG644XP78Z3E0L94YTDFTQJCH,3XWUWJ18TLRSKYT4MN5LGMTDNYYUUX,0.10,2.10,fz05183z,,,3IZPORCT1FAVZKV3IU3HSWH3MRSHRF,3XWUWJ18TLRSKYT4MN5LGMTDNYYUUX,3IVKZBIBJ0A70ZVGXJ3MI6MZ8TBHS3,38G0E1M85M6SXDI4RDFQC8VW157UVM,3OR6S1RAB4JQ57CMFJANNP0AM9IAGD,3IE1FJZR9CZH2AY0D4H2PMHJN8K9K3,,$2.00,12,A2AG45K4ULNBHF,25,0.10,1,1,2,(none given),George,Dan,,Mathew,0,1,"dan, mathew",1,0.00,13,1,2,(none given),Dan,George,,James,0,1,"george, mathew, dan, james",1,0.00,13,2,2,(none given),Dan,Mike,,Joe,0,1,"mathew, george, dan, mike, joe, james",1,0.00,13,3,2,(none given),George,Dan,,Mark,0,1,"mike, james, joe, dan, mark, mathew, george",1,0.00,13,4,2,(none given),Dan,James,,Chris,0,1,"mike, chris, james, mathew, dan, mark, george, joe",1,0.00,13,5,2,(none given),Dan,Dan,,Matt,0,1,"matt, mike, james, joe, dan, chris, mark, mathew, george",1,0.00,13,6,2,(none given),Dan,Jim,,Bill,0,1,"mike, dan, matt, george, jim, mark, mathew, bill, joe, chris, james",1,0.00,13,7,2,(none given),Jim,Jim,,Joe,0,1,"mike, james, matt, george, dan, jim, bill, joe, chris, mark, mathew",1,0.00,13,8,2,(none given),Joe,Jim,,Bill,0,1,"mike, dan, matt, george, jim, chris, mathew, bill, joe, mark, james",1,0.00,13,9,2,(none given),Jim,Jim,,Joe,0,1,"mike, james, matt, george, dan, jim, bill, joe, chris, mark, mathew",1,0.00,13,10,2,(none given),Jim,Brian,,Bob,0,1,"mike, chris, bill, dan, george, joe, mark, matt, james, bob, brian, mathew, jim",1,0.00,13,11,2,(none given),Brian,Dan,,David,0,1,"mathew, bill, bob, jim, george, matt, brian, dan, mike, david, joe, mark, james, chris",1,0.00,13,12,2,(none given),Dan,Jim,,Bill,0,1,"jim, mike, chris, james, mathew, dan, mark, matt, bill, george, david, joe, brian, bob",1,0.00,13,13,2,(none given),Jim,David,,Matt,0,1,"david, mike, chris, bill, dan, george, brian, matt, bob, joe, mark, james, mathew, jim",1,0.00,13,14,2,(none given),Jim,Matt,,James,0,1,"jim, mike, chris, james, mathew, dan, mark, matt, bill, george, david, joe, brian, bob",1,0.00,13,15,2,(none given),James,David,,John,0,1,"david, mike, chris, bill, dan, george, brian, matt, bob, joe, mark, james, mathew, jim, john",1,0.00,13,16,2,(none given),John,James,,John,0,1,"david, mike, chris, bill, dan, george, brian, matt, bob, joe, mark, james, mathew, jim, john",1,0.00,13,17,2,(none given),James,Bob,,Bob,0,1,"mike, james, matt, dan, george, brian, jim, bill, bob, joe, john, chris, david, mark, mathew",1,0.00,13,18,2,(none given),John,Joe,,John,0,1,"mathew, bill, bob, jim, george, john, joe, brian, dan, mike, david, matt, mark, james, chris",1,0.00,13,19,2,(none given),Joe,James,,David,0,1,"mathew, bill, bob, jim, george, john, joe, brian, dan, mike, david, matt, mark, james, chris",1,0.00,13,20,2,(none given),James,James,,Bob,0,1,"david, mike, chris, bill, dan, george, brian, matt, bob, joe, mark, james, mathew, jim, john",1,0.00,13,21,2,(none given),James,Bob,,Joe,0,1,"david, mike, dan, matt, george, jim, john, mark, bill, mathew, joe, chris, bob, james, brian",1,0.00,13,22,2,(none given),Bob,Bob,,Tim,0,1,"mathew, bill, bob, jim, george, john, tim, joe, brian, dan, mike, david, matt, mark, james, chris",1,0.00,13,23,2,(none given),Bob,James,,Bob,0,1,"david, mike, chris, bill, joe, george, brian, dan, bob, matt, john, mark, mathew, jim, james, tim",1,0.00,13,24,2,(none given),Bob,Bob,,Jack,0,1,"jim, mike, chris, james, mathew, dan, mark, matt, bill, george, john, david, joe, jack, brian, tim, bob",1,0.00,13,25,12,0,,,0.00,1,1,12,0,,,2.1,0.00,1,1
13,bdaup1vi,,71.128.246.129,2017-02-16 18:02:23.720606+00:00,1,A3N0QZ9ZKUCTCQ,374TNBHA8BWJWY4L5IN7YQXIWC0QYN,38G0E1M85M6SXDI4RDFQC8VW157UVM,0.48,2.48,fz05183z,,,3IZPORCT1FAVZKV3IU3HSWH3MRSHRF,3XWUWJ18TLRSKYT4MN5LGMTDNYYUUX,3IVKZBIBJ0A70ZVGXJ3MI6MZ8TBHS3,38G0E1M85M6SXDI4RDFQC8VW157UVM,3OR6S1RAB4JQ57CMFJANNP0AM9IAGD,3IE1FJZR9CZH2AY0D4H2PMHJN8K9K3,,$2.00,13,A3N0QZ9ZKUCTCQ,23,0.48,1,1,2,Tim,Tim,Matt,,Joe,0,0,"tim, joe, matt",0,0.00,7,1,1,Tim,Tim,Matt,,Mike,0,0,"joe, mike, tim, matt",0,0.00,2,2,2,Tim,Tim,Bill,,Dick,0,0,"bill, dick, tim, mike, joe, matt",0,0.00,7,3,1,Bill,Bill,Bob,,John,0,0,"tim, john, bob, matt, mike, bill, joe, dick",0,0.00,9,4,1,Bill,Bill,Jim,,David,0,0,"jim, mike, matt, bill, john, david, joe, tim, bob, dick",0,0.00,4,5,2,David,David,Mike,,John,0,0,"tim, john, bob, matt, mike, bill, joe, jim, david, dick",0,0.00,9,6,1,Mike,Mike,Joe,,Mike,0,0,"david, dick, mike, matt, jim, john, tim, bill, joe, bob",0,0.00,3,7,2,Mike,Mike,Matt,,David,0,0,"mike, dick, matt, jim, bill, joe, bob, tim, david, john",0,0.00,4,8,1,Matt,Matt,Brian,,David,0,0,"david, dick, mike, matt, jim, john, tim, bill, joe, bob, brian",0,0.00,7,9,1,Brian,Brian,David,,David,0,0,"mike, dick, matt, jim, brian, bill, joe, bob, tim, david, john",0,0.00,1,10,1,Matt,Matt,Joe,,Matt,0,0,"david, mike, dick, bill, joe, brian, matt, bob, john, jim, tim",0,0.00,10,11,1,Matt,Matt,Dan,,David,0,0,"bill, bob, jim, dick, tim, brian, dan, mike, david, joe, john, matt",0,0.00,3,12,2,Matt,Matt,John,,David,0,0,"jim, mike, dan, matt, bill, john, david, joe, brian, tim, bob, dick",0,0.00,1,13,2,Matt,Matt,John,,Brian,0,0,"david, mike, dick, bill, dan, brian, joe, matt, bob, john, jim, tim",0,0.00,12,14,2,Matt,Matt,Matt,,James,1,0,"jim, mike, james, dan, matt, bill, john, david, joe, brian, tim, bob, dick",0,0.10,10,15,1,David,David,Bob,,David,0,0,"david, mike, dick, bill, dan, james, joe, matt, brian, bob, john, jim, tim",0,-0.05,7,16,2,David,David,Bob,,Bob,0,0,"david, mike, dick, bill, dan, james, joe, matt, brian, bob, john, jim, tim",0,-0.05,12,17,1,Bob,Bob,Bob,,John,1,0,"mike, james, matt, dick, dan, jim, brian, bill, joe, bob, tim, david, john",0,0.10,8,18,2,Zex,Zex,Bob,,Fred,0,0,"bill, bob, jim, dick, tim, brian, fred, dan, mike, david, joe, zex, john, james, matt",0,-0.05,12,19,2,Bobby,Bobby,Tom,,Joe,0,0,"bill, bob, jim, matt, dick, tim, brian, fred, dan, mike, tom, joe, zex, john, bobby, james, david",0,-0.05,7,20,2,Bobby,Bobby,Bob,,Joe,0,0,"david, mike, bobby, zex, dick, bill, fred, dan, brian, tom, matt, bob, joe, john, james, jim, tim",0,0.00,5,21,1,Bobby,Bobby,Bob,,George,0,0,"david, dick, mike, tom, fred, matt, dan, jim, zex, tim, john, george, bobby, bill, joe, bob, james, brian",0,0.00,10,22,2,Tyson,Tyson,Joe,,Bob,0,0,"bill, bob, jim, george, dick, tim, joe, brian, tyson, fred, tom, mike, david, dan, zex, john, bobby, james, matt",0,0.00,5,23,2,Mathy,Mathy,Tim,,David,0,0,"david, mike, mathy, bobby, zex, dick, tyson, bill, fred, joe, george, brian, tom, bob, dan, john, james, matt, jim, tim",0,0.00,7,24,2,Donald,Donald,Bob,,Joe,0,0,"jim, fred, mike, mathy, zex, bobby, james, tyson, dan, tom, matt, bill, george, donald, john, david, joe, brian, tim, bob, dick",0,0.00,12,25,13,0,No,,0.00,1,1,13,0,,1,2.48,0.00,1,1
14,qt9a8amf,,100.12.178.62,2017-02-16 18:00:54.488318+00:00,1,AKSJ3C5O3V9RB,3T3IWE1XG6ONFC5RVC08Q953HAITQ1,3IZPORCT1FAVZKV3IU3HSWH3MRSHRF,1.30,3.30,fz05183z,,,3IZPORCT1FAVZKV3IU3HSWH3MRSHRF,3XWUWJ18TLRSKYT4MN5LGMTDNYYUUX,3IVKZBIBJ0A70ZVGXJ3MI6MZ8TBHS3,38G0E1M85M6SXDI4RDFQC8VW157UVM,3OR6S1RAB4JQ57CMFJANNP0AM9IAGD,3IE1FJZR9CZH2AY0D4H2PMHJN8K9K3,,$2.00,14,AKSJ3C5O3V9RB,0,0.70,1,1,1,John,(none given),Brandon,barred,(none given),0,0,"(none given), brandon",0,0.00,5,1,2,Brandon,Brandon,Mike,,Mike,0,0,"(none given), mike, brandon",0,0.00,8,2,2,Mike,Mike,Joe,,David,0,0,"david, (none given), joe, mike, brandon",0,0.00,8,3,2,Joe,Joe,Joe,,David,1,0,"joe, brandon, david, (none given), mike",0,0.10,10,4,2,Joe,Joe,Chris,,Mike,0,0,"mike, chris, (none given), david, joe, brandon",0,-0.05,5,5,2,Chris,Chris,Bob,,Matt,0,0,"bob, matt, mike, joe, david, (none given), brandon, chris",0,-0.05,11,6,1,Bob,Bob,bob,,Bob,1,0,"david, brandon, mike, matt, joe, chris, bob, (none given)",0,0.10,4,7,2,(none given),Bob,Joe,,Bob,0,1,"mike, (none given), matt, joe, bob, brandon, chris, david",1,-0.05,2,8,1,(none given),bob,Bob,,David,0,1,"david, brandon, mike, matt, joe, chris, bob, (none given)",1,-0.05,10,9,1,Bob,Bob,Joe,,Bob,0,0,"mike, (none given), matt, joe, bob, brandon, chris, david",0,0.00,12,10,2,Joe,Joe,Bill,,Bob,0,0,"david, mike, chris, bill, (none given), joe, matt, bob, brandon",0,0.00,9,11,2,Bob,Bob,bill,,David,0,0,"(none given), bill, bob, brandon, matt, mike, david, joe, chris",0,0.00,8,12,2,Bill,Bill,bob,,Matt,0,0,"mike, chris, matt, bill, (none given), david, joe, bob, brandon",0,0.00,2,13,1,Bill,Bill,Joe,,Bob,0,0,"david, mike, chris, bill, (none given), joe, matt, bob, brandon",0,0.00,8,14,1,Bob,Bob,Joe,,John,0,0,"mike, chris, matt, bill, (none given), john, david, joe, bob, brandon",0,0.00,12,15,1,Joe,Joe,Joe,,Joe,1,0,"david, mike, chris, bill, (none given), joe, matt, bob, john, brandon",0,0.10,3,16,1,Joe,Joe,bob,,Bob,0,0,"david, mike, chris, bill, (none given), joe, matt, bob, john, brandon",0,-0.05,8,17,1,Joe,Joe,Bob,,Bob,0,0,"mike, (none given), matt, bill, joe, bob, brandon, chris, david, john",0,-0.05,12,18,1,Bob,Bob,Joe,,Joe,0,0,"(none given), bill, bob, chris, brandon, mike, david, joe, john, matt",0,0.00,10,19,1,Joe,Joe,Joe,,David,1,0,"(none given), bill, bob, chris, brandon, mike, david, joe, john, matt",0,0.10,1,20,1,Joe,Joe,joe,,John,1,0,"david, mike, chris, bill, (none given), joe, matt, bob, john, brandon",0,0.10,7,21,1,Joe,Joe,joe,,John,1,0,"david, brandon, mike, matt, john, bill, joe, chris, bob, (none given)",0,0.10,2,22,2,Joe,Joe,Joe,,Bob,1,0,"(none given), bill, bob, chris, brandon, mike, david, joe, john, matt",0,0.10,9,23,1,Joe,Joe,Joe,,David,1,0,"david, mike, chris, bill, (none given), joe, matt, bob, john, brandon",0,0.10,5,24,1,Joe,Joe,Joe,,Joe,1,0,"mike, chris, matt, bill, (none given), john, david, joe, bob, brandon",0,0.10,10,25,14,0,No,,0.00,1,1,14,0,"There were a few technical glitches/issues.  1. It caused Chrome to crash a few times, but worked well in Vivaldi browser.   2. Despite entering a name, it incorrectly stated that a response was not entered. This may be secondary to mild-moderate server overload.     Just FYI.     Thanks!",1,3.3,0.00,1,1
15,qlelh77h,,47.152.251.26,2017-02-16 18:00:56.025761+00:00,1,A2DPKKEEW2I6QK,33FOTY3KEMMICRJZOBF30YXRLCR1CW,3XWUWJ18TLRSKYT4MN5LGMTDNYYUUX,0.17,2.17,fz05183z,,,3IZPORCT1FAVZKV3IU3HSWH3MRSHRF,3XWUWJ18TLRSKYT4MN5LGMTDNYYUUX,3IVKZBIBJ0A70ZVGXJ3MI6MZ8TBHS3,38G0E1M85M6SXDI4RDFQC8VW157UVM,3OR6S1RAB4JQ57CMFJANNP0AM9IAGD,3IE1FJZR9CZH2AY0D4H2PMHJN8K9K3,,$2.00,15,A2DPKKEEW2I6QK,21,0.17,1,1,2,mathew,mathew,Mark,,(none given),0,0,"(none given), mathew, mark",0,0.00,12,1,1,matt,matt,Billy,,James,0,0,"billy, (none given), mark, mathew, james",1,0.00,4,2,1,matt,matt,Mike,,James,0,0,"(none given), mathew, billy, mike, mark, james",1,0.00,6,3,1,mark,mark,(none given),,Matt,0,0,"matt, mike, james, (none given), mark, mathew, billy",0,0.00,8,4,1,mark,mark,John,,Matt,0,0,"mike, james, mathew, mark, matt, (none given), john, billy",0,0.00,9,5,2,matt,matt,John,,Chris,0,0,"john, matt, mike, james, (none given), chris, mark, mathew, billy",0,0.00,2,6,1,matt,matt,matt,,Bob,1,0,"mike, matt, john, mark, (none given), mathew, chris, bob, james, billy",0,0.10,11,7,2,(none given),John,John,,Bob,0,1,"mike, james, (none given), matt, billy, bob, mark, chris, john, mathew",1,-0.05,10,8,1,(none given),Bob,John,,Bill,0,1,"mike, matt, john, james, chris, mathew, bill, mark, bob, (none given), billy",1,-0.05,11,9,2,matt,matt,John,,Bob,0,0,"mike, james, matt, (none given), billy, bill, bob, mark, chris, john, mathew",0,0.00,10,10,2,matt,matt,Bill,,Bob,0,0,"mike, chris, bill, (none given), billy, james, matt, mark, bob, john, mathew",0,0.00,7,11,2,matt,matt,John,,Brian,0,0,"mathew, (none given), bill, bob, chris, billy, brian, mike, mark, john, james, matt",0,0.00,11,12,2,matt,matt,Aaron,,David,0,0,"mike, chris, james, mathew, mark, matt, bill, (none given), john, david, billy, brian, bob, aaron",0,0.00,8,13,2,matt,matt,Steven,,David,0,0,"david, mike, chris, bill, (none given), billy, james, brian, mark, matt, bob, john, mathew, aaron, steven",0,0.00,1,14,1,matt,matt,George,,James,0,0,"mike, chris, james, steven, mathew, mark, matt, bill, (none given), george, john, david, billy, brian, bob, aaron",0,0.00,3,15,2,matt,matt,Aaron,,Bob,0,0,"david, mike, chris, bill, (none given), billy, james, george, mark, matt, brian, john, bob, mathew, aaron, steven",0,0.00,12,16,2,matt,matt,jAMES,,David,0,0,"david, mike, chris, bill, (none given), billy, james, george, mark, matt, brian, john, bob, mathew, aaron, steven",0,0.00,1,17,2,matt,matt,matt,,Joe,1,0,"mike, james, matt, (none given), george, billy, brian, bill, bob, joe, john, chris, david, aaron, mark, mathew, steven",0,0.10,1,18,1,matt,matt,Edward,,Bob,0,0,"(none given), mathew, bill, bob, chris, edward, george, steven, billy, brian, aaron, mike, david, joe, mark, john, james, matt",0,-0.05,7,19,2,matt,matt,matt,,Joe,1,0,"(none given), mathew, bill, bob, george, matt, james, john, steven, billy, brian, aaron, mike, david, joe, mark, edward, chris",0,0.10,9,20,1,matt,matt,Charlie,,Bob,0,0,"david, mike, chris, bill, (none given), billy, joe, george, brian, mark, bob, james, john, matt, mathew, aaron, edward, steven, charlie",0,-0.05,4,21,1,matt,matt,Alan,,David,0,0,"edward, david, aaron, steven, mike, charlie, matt, george, james, john, mark, alan, bill, mathew, joe, chris, bob, (none given), billy, brian",0,-0.05,4,22,1,matt,matt,Derek,,Joe,0,0,"mathew, (none given), bill, bob, chris, derek, george, james, steven, charlie, billy, joe, brian, aaron, mike, alan, matt, mark, john, edward, david",0,-0.05,4,23,2,matt,matt,John,,David,0,0,"alan, david, mike, edward, chris, bill, (none given), billy, derek, george, james, charlie, bob, joe, brian, matt, mathew, aaron, mark, steven, john",0,0.00,11,24,1,matt,matt,Jack,,David,0,0,"mathew, (none given), david, billy, edward, charlie, chris, steven, derek, mark, john, jack, bob, alan, aaron, mike, james, george, matt, bill, joe, brian",0,0.00,7,25,15,0,No,,0.00,1,1,15,0,,1,2.17,0.00,1,1
16,51lnb09a,,206.123.141.163,2017-02-16 18:00:56.638622+00:00,1,A2KLJKDG90K1PP,3ZDAD0O1T1E7O963HQV0KH1WED5TXY,38G0E1M85M6SXDI4RDFQC8VW157UVM,0.77,2.77,fz05183z,,,3IZPORCT1FAVZKV3IU3HSWH3MRSHRF,3XWUWJ18TLRSKYT4MN5LGMTDNYYUUX,3IVKZBIBJ0A70ZVGXJ3MI6MZ8TBHS3,38G0E1M85M6SXDI4RDFQC8VW157UVM,3OR6S1RAB4JQ57CMFJANNP0AM9IAGD,3IE1FJZR9CZH2AY0D4H2PMHJN8K9K3,,$2.00,16,A2KLJKDG90K1PP,38,0.57,1,1,1,John,(none given),bob,barred,(none given),0,0,"(none given), bob",0,0.00,20,1,1,Bob,Bob,mark,,Mark,0,0,"(none given), mark, bob",0,0.00,20,2,1,Bob,Bob,dan,,David,0,0,"(none given), mark, bob, dan, david",0,0.00,20,3,1,Mark,Mark,(none given),,(none given),0,0,"mark, dan, bob, (none given), david",0,0.00,20,4,1,Dan,Dan,ted,,Matt,0,0,"ted, dan, mark, matt, (none given), david, bob",0,0.00,20,5,1,Dan,Dan,rick,,David,0,0,"bob, matt, david, (none given), rick, ted, dan, mark",0,0.00,20,6,1,David,David,bill,,Brian,0,0,"david, rick, ted, dan, matt, bill, mark, bob, (none given), brian",0,0.00,20,7,1,David,David,don,,John,0,0,"matt, (none given), dan, ted, rick, brian, don, bill, bob, john, david, mark",0,0.00,20,8,1,(none given),bill,David,,David,0,1,"rick, david, ted, dan, matt, don, john, bill, mark, bob, (none given), brian",1,0.00,20,9,1,David,David,tom,,David,0,0,"(none given), matt, dan, ted, brian, rick, don, bill, bob, mark, david, tom, john",0,0.00,20,10,1,David,David,matt,,Joe,0,0,"david, ted, bill, (none given), dan, brian, rick, matt, bob, mark, tom, don, john, joe",0,0.00,20,11,1,David,David,rob,,Bill,0,0,"(none given), bill, bob, rob, john, rick, don, brian, joe, dan, tom, ted, matt, mark, david",0,0.00,20,12,1,David,David,mike,,Bob,0,0,"rick, mike, ted, dan, mark, tom, don, bill, matt, (none given), john, david, joe, brian, bob, rob",0,0.00,20,13,1,David,David,charlie,,Bob,0,0,"david, mike, rob, ted, bill, (none given), rick, dan, tom, mark, matt, joe, john, don, brian, bob, charlie",0,0.00,20,14,1,Bill,Bill,jim,,Matt,0,0,"jim, rick, mike, ted, dan, mark, tom, matt, bill, don, (none given), john, david, joe, brian, bob, rob, charlie",0,0.00,20,15,1,Bill,Bill,aaron,,Aaron,0,0,"david, mike, rob, ted, bill, (none given), aaron, rick, dan, tom, mark, matt, joe, john, don, brian, jim, bob, charlie",0,0.00,20,16,1,Aaron,Aaron,ed,,Joe,0,0,"david, mike, rob, jim, ed, ted, bill, (none given), rick, dan, tom, mark, matt, joe, john, don, brian, aaron, bob, charlie",0,0.00,20,17,1,David,David,jake,,John,0,0,"mike, ed, (none given), matt, dan, ted, jim, rick, don, brian, bill, joe, rob, bob, charlie, john, jake, aaron, david, tom, mark",0,0.00,20,18,1,David,David,fred,,David,0,0,"fred, ted, rob, don, aaron, tom, john, matt, bill, jim, charlie, rick, jake, mark, ed, (none given), bob, brian, dan, mike, joe, david",0,0.00,20,19,1,David,David,chris,,John,0,0,"fred, ted, rob, don, aaron, tom, john, matt, bill, jim, charlie, rick, jake, mark, chris, ed, (none given), bob, brian, dan, mike, joe, david",0,0.00,20,20,1,David,David,george,,Joe,0,0,"(none given), mark, david, mike, bill, joe, rick, bob, aaron, ed, chris, jake, fred, brian, tom, charlie, george, john, don, rob, ted, dan, matt, jim",0,0.00,20,21,1,David,David,luke,,Joe,0,0,"aaron, charlie, ted, matt, john, jim, joe, mark, (none given), jake, rick, mike, dan, george, luke, david, tom, rob, bill, chris, brian, ed, don, fred, bob",0,0.00,20,22,1,David,David,tim,,Bob,0,0,"george, luke, fred, ted, rob, tim, don, aaron, tom, john, matt, bill, jim, charlie, rick, jake, mark, chris, ed, (none given), bob, brian, dan, mike, joe, david",0,0.00,20,23,1,David,David,david,,Joe,1,0,"(none given), mark, tim, david, mike, bill, rick, joe, bob, aaron, ed, chris, jake, fred, george, tom, charlie, brian, john, don, luke, rob, ted, dan, matt, jim",0,0.10,20,24,1,David,David,david,,Micheal,1,0,"rick, (none given), david, micheal, tim, charlie, chris, mark, john, bob, aaron, fred, mike, george, jake, luke, jim, ted, dan, tom, don, matt, bill, ed, joe, brian, rob",0,0.10,20,25,16,0,Yes,,0.00,1,1,16,0,,1,2.77,0.00,1,1
17,n223vri1,Inactive,47.152.251.26,2017-02-16 18:00:57.161413+00:00,1,A2DPKKEEW2I6QK,33NF62TLXJ37Q6BR6D27SH6LK2ZJKU,3IVKZBIBJ0A70ZVGXJ3MI6MZ8TBHS3,0.10,2.10,fz05183z,,,3IZPORCT1FAVZKV3IU3HSWH3MRSHRF,3XWUWJ18TLRSKYT4MN5LGMTDNYYUUX,3IVKZBIBJ0A70ZVGXJ3MI6MZ8TBHS3,38G0E1M85M6SXDI4RDFQC8VW157UVM,3OR6S1RAB4JQ57CMFJANNP0AM9IAGD,3IE1FJZR9CZH2AY0D4H2PMHJN8K9K3,,$2.00,17,A2DPKKEEW2I6QK,26,0.10,1,1,1,(none given),Carl,Keith,,(none given),0,1,"(none given), keith",1,0.00,14,1,1,(none given),Keith,Carl,,Bill,0,1,"(none given), bill, carl, keith",1,0.00,14,2,1,(none given),(none given),Matt,,Tim,0,1,"(none given), bill, tim, keith, carl, matt",1,0.00,14,3,1,(none given),Bill,Dan,,Joe,0,1,"tim, carl, matt, bill, keith, joe, (none given), dan",1,0.00,14,4,1,(none given),Dan,George,,David,0,1,"dan, matt, bill, carl, keith, (none given), george, david, joe, tim",1,0.00,14,5,1,(none given),David,Bill,,Jim,0,1,"tim, matt, carl, bill, keith, joe, david, jim, (none given), dan, george",1,0.00,14,6,1,(none given),Jim,Dan,,Bob,0,1,"david, bob, dan, matt, keith, jim, tim, george, bill, joe, carl, (none given)",1,0.00,14,7,1,(none given),Bill,Bill,,Bill,0,1,"matt, (none given), dan, george, jim, carl, bill, keith, bob, joe, tim, david",1,0.00,14,8,1,(none given),Dan,Dan,,Bill,0,1,"carl, david, dan, matt, jim, keith, tim, george, bill, joe, bob, (none given)",1,0.00,14,9,1,(none given),Bill,Bill,,Bob,0,1,"matt, (none given), dan, george, jim, carl, bill, keith, bob, joe, tim, david",1,0.00,14,10,1,(none given),Dan,Joe,,Bill,0,1,"david, bill, carl, keith, (none given), dan, george, joe, matt, bob, jim, tim",1,0.00,14,11,1,(none given),Bill,Jim,,Joe,0,1,"(none given), bob, bill, jim, george, tim, keith, dan, david, joe, carl, matt",1,0.00,14,12,1,(none given),Bill,Dan,,James,0,1,"jim, james, dan, matt, bill, keith, carl, george, (none given), david, joe, tim, bob",1,0.00,14,13,1,(none given),Dan,Dan,,Bill,0,1,"david, bill, carl, keith, (none given), dan, james, george, matt, joe, bob, jim, tim",1,0.00,16,14,1,(none given),James,Bob,,David,0,1,"jim, james, dan, matt, bill, keith, carl, george, (none given), david, joe, tim, bob",1,0.00,16,15,1,(none given),Bob,Joe,,Bill,0,1,"david, bill, carl, keith, (none given), dan, james, george, matt, joe, bob, jim, tim",1,0.00,16,16,1,(none given),Joe,Jim,,Bob,0,1,"david, bill, carl, keith, (none given), dan, james, george, matt, joe, bob, jim, tim",1,0.00,16,17,1,(none given),Joe,James,,Joe,0,1,"james, matt, (none given), dan, carl, jim, george, bill, keith, joe, bob, tim, david",1,0.00,16,18,1,(none given),James,John,,Joe,0,1,"(none given), bill, bob, jim, george, tim, keith, dan, david, joe, john, carl, james, matt",1,0.00,16,19,1,(none given),Joe,James,,Danny,0,1,"(none given), bill, bob, danny, jim, george, matt, tim, keith, dan, joe, john, carl, james, david",1,0.00,16,20,1,(none given),Joe,John,,Charlie,0,1,"david, tim, bill, (none given), keith, carl, dan, george, joe, matt, bob, james, john, charlie, jim, danny",1,0.00,16,21,1,(none given),John,Bob,,George,0,1,"david, bob, charlie, dan, matt, keith, george, tim, james, john, jim, danny, bill, joe, carl, (none given)",1,0.00,16,22,1,(none given),John,John,,Bob,0,1,"(none given), bill, bob, danny, jim, george, matt, tim, charlie, keith, dan, joe, john, carl, james, david",1,0.00,16,23,1,(none given),Bob,Joe,,Joe,0,1,"david, bill, carl, (none given), keith, danny, dan, george, joe, matt, bob, james, john, charlie, jim, tim",1,0.00,16,24,1,(none given),Joe,Bob,,David,0,1,"jim, james, dan, matt, bill, danny, keith, (none given), carl, george, john, david, joe, tim, bob, charlie",1,0.00,16,25,17,0,,,0.00,1,1,17,0,,,2.1,0.00,1,1
