19,a5naq57c,,68.119.71.212,2017-03-15 17:00:46.114395+00:00,1,A3L2UB07EZJAMD,3JZQSN0I3QBMJITCXWQ7FRM0N7WGF5,3KL228NDMVNVCKNX84C26KJOFS2KGW,2.56,4.56,ts44u31l,,,3J94SKDEKIQPIHS3ZR7OYAX95AR5DM,3O2Y2UIUCQVPYKR2XK6KOZJCED2KFX,337F8MIIMZEDNEN99A0JEB7CBPN04J,3KL228NDMVNVCKNX84C26KJOFS2KGW,33CY53T7YFR23AA9JZJ7YQKHNEPDHJ,36TBNKR908OQJ0J7TYB1DNN4VY1ED8,,$2.00,18,A3L2UB07EZJAMD,20,0.91,1,1,2,ann,ann,(none),,"Jen, Lauren",0,0,"ann, jen, lauren, (none)",0,0,11,1,1,mary,mary,lauren,,"June, Jane",0,0,"lauren, june, jane, (none), ann, jen",1,0,5,2,1,kimberly,kimberly,(none),,"Karen, Becky",0,0,"kimberly, lauren, jane, becky, karen, june, (none), ann, jen",0,0,5,3,2,karen,karen,Jane,,"Maria, Rachel",0,0,"karen, kimberly, (none), maria, becky, jane, ann, rachel, june, lauren, jen",0,0,12,4,1,karen,karen,Karen,,"Jill, Sue",1,0,"june, maria, (none), karen, ann, rachel, lauren, jane, becky, jill, jen, sue, kimberly",0,0.1,5,5,1,mary,mary,Karen,,"Sue, Karen",0,0,"lauren, june, jane, rachel, kimberly, maria, (none), karen, jill, sue, becky, ann, jen",1,-0.05,11,6,2,karen,karen,Karen,,"Jill, Karen",1,0,"jill, becky, sue, lauren, june, rachel, karen, jen, kimberly, maria, jane, ann, (none)",0,0.1,6,7,1,mary,mary,Jill,,"Jill, Jill",0,0,"lauren, june, jane, rachel, kimberly, maria, (none), karen, jill, sue, becky, ann, jen",1,-0.05,10,8,1,jill,jill,Jill,,"Laura, Jill",1,0,"rachel, maria, jill, laura, sue, kimberly, lauren, jane, becky, karen, june, (none), ann, jen",0,0.1,2,9,2,laura,laura,Jill,,"Jill, Karen",0,0,"ann, rachel, maria, jill, laura, kimberly, lauren, jane, becky, karen, june, (none), sue, jen",0,-0.05,1,10,1,jill,jill,Jill,,"Jill, Karen",1,0,"sue, jill, becky, (none), laura, lauren, june, rachel, karen, jen, maria, jane, ann, kimberly",0,0.1,5,11,2,jill,jill,Jill,,"Jill, Jill",1,0,"laura, lauren, june, jane, rachel, kimberly, maria, (none), jill, karen, sue, becky, ann, jen",0,0.1,5,12,1,jill,jill,Jill,,"Jill, Jill",1,0,"laura, lauren, june, jane, rachel, kimberly, maria, (none), jill, karen, sue, becky, ann, jen",0,0.1,10,13,1,jill,jill,jill,,"Jill, Jill",1,0,"ann, sue, maria, (none), june, karen, rachel, jill, laura, lauren, jane, jen, kimberly, becky",0,0.1,8,14,1,jill,jill,Jill,,"Jill, Jill",1,0,"ann, sue, maria, (none), june, karen, rachel, jill, laura, lauren, jane, jen, kimberly, becky",0,0.1,10,15,1,jill,jill,jill,,"Jill, Jill",1,0,"june, maria, rachel, laura, karen, (none), lauren, ann, jane, becky, jill, jen, sue, kimberly",0,0.1,1,16,1,jill,jill,Jill,,"Jill, Jill",1,0,"sue, jill, becky, (none), laura, lauren, june, rachel, karen, jen, maria, jane, ann, kimberly",0,0.1,3,17,1,jill,jill,Jill,,"Jill, Jill",1,0,"karen, kimberly, (none), maria, sue, becky, jane, ann, rachel, laura, june, jen, lauren, jill",0,0.1,8,18,2,jill,jill,Jill,,"Jill, Jill",1,0,"laura, lauren, june, jane, rachel, kimberly, maria, (none), jill, karen, sue, becky, ann, jen",0,0.1,12,19,2,jill,jill,Jill,,"Jill, Jill",1,0,"ann, sue, maria, (none), june, karen, rachel, jill, laura, lauren, jane, jen, kimberly, becky",0,0.1,11,20,1,jill,jill,Jill,,"Jill, Jill",1,0,"(none), ann, laura, jen, jill, maria, karen, june, rachel, kimberly, jane, becky, lauren, sue",0,0.1,9,21,2,jill,jill,Jill,,"Jill, Jill",1,0,"sue, jill, becky, (none), laura, lauren, june, rachel, karen, jen, maria, jane, ann, kimberly",0,0.1,3,22,1,jill,jill,Jill,,"Jill, Jill",1,0,"jane, sue, laura, kimberly, (none), maria, rachel, jill, karen, becky, ann, jen, lauren, june",0,0.1,6,23,1,jill,jill,Jill,,"Jill, Jill",1,0,"sue, jill, becky, (none), laura, lauren, june, rachel, karen, jen, maria, jane, ann, kimberly",0,0.1,10,24,2,jill,jill,Jill,,"Jill, Jill",1,0,"jane, sue, laura, kimberly, (none), maria, rachel, jill, karen, becky, ann, jen, lauren, june",0,0.1,10,25,19,0,Thank you.,0,4.56,0,1,120,ms8keeuy,,108.75.122.125,2017-03-15 17:00:51.480223+00:00,1,A2VM2EU6AHX5IC,3TR2532VIPV0RRQ24986IY13M0AJ69,3J94SKDEKIQPIHS3ZR7OYAX95AR5DM,2.76,4.76,ts44u31l,,,3J94SKDEKIQPIHS3ZR7OYAX95AR5DM,3O2Y2UIUCQVPYKR2XK6KOZJCED2KFX,337F8MIIMZEDNEN99A0JEB7CBPN04J,3KL228NDMVNVCKNX84C26KJOFS2KGW,33CY53T7YFR23AA9JZJ7YQKHNEPDHJ,36TBNKR908OQJ0J7TYB1DNN4VY1ED8,,$2.00,19,A2VM2EU6AHX5IC,8,0.81,1,1,2,Rachel,Rachel,becky,,"Sue, Mary",0,0,"becky, mary, rachel, sue",0,0,6,1,1,Rachel,Rachel,michelle,,"Jane, Jill",0,0,"michelle, jane, mary, rachel, jill, sue, becky",0,0,4,2,1,Rachel,Rachel,Karen,,"June, Jen",0,0,"rachel, mary, jill, michelle, jane, becky, karen, june, sue, jen",0,0,12,3,1,Rachel,Rachel,JILL,,"Jill, Sue",0,0,"karen, sue, becky, jane, rachel, mary, michelle, june, jen, jill",0,0,9,4,1,Jill,Jill,JILL,,"Karen, Maria",1,0,"june, michelle, rachel, karen, mary, maria, becky, jane, jill, jen, sue",0,0.1,3,5,1,Jill,Jill,JILL,,"Jill, (none)",1,0,"michelle, june, jane, rachel, sue, maria, (none), karen, jill, mary, becky, jen",0,0.1,1,6,1,Jill,Jill,Jill,,"Jill, Maria",1,0,"sue, (none), jill, mary, becky, rachel, karen, michelle, jen, maria, jane, june",0,0.1,2,7,1,Jill,Jill,JILL,,"Jill, Jill",1,0,"michelle, june, jane, mary, rachel, maria, (none), karen, jill, sue, becky, jen",0,0.1,4,8,1,Jill,Jill,Jill,,"June, Karen",1,0,"rachel, maria, mary, jill, michelle, jane, becky, karen, june, (none), sue, jen",0,0.1,8,9,2,Jill,Jill,Jill,,"Laura, Jill",1,0,"rachel, maria, mary, jill, laura, michelle, jane, becky, karen, june, (none), sue, jen",0,0.1,6,10,2,Jill,Jill,JILL,,"Jill, Jill",1,0,"jill, becky, (none), mary, sue, laura, rachel, karen, michelle, jen, maria, jane, june",0,0.1,11,11,2,Jill,Jill,Jill,,"Jill, Jill",1,0,"laura, michelle, june, jane, rachel, sue, maria, (none), jill, karen, mary, becky, jen",0,0.1,6,12,2,Jill,Jill,Jill,,"Jill, Jill",1,0,"laura, michelle, june, jane, rachel, sue, maria, (none), jill, karen, mary, becky, jen",0,0.1,9,13,1,Jill,Jill,Jill,,"Jill, Jill",1,0,"sue, maria, (none), mary, june, karen, rachel, jill, laura, jane, jen, michelle, becky",0,0.1,3,14,1,Jill,Jill,JILL,,"Maria, Jill",1,0,"sue, maria, (none), mary, june, karen, rachel, jill, laura, jane, jen, michelle, becky",0,0.1,9,15,1,Jill,Jill,Jill,,"Jill, Jill",1,0,"june, michelle, maria, laura, mary, rachel, karen, (none), jane, becky, jill, jen, sue",0,0.1,7,16,2,Jill,Jill,Jill,,"Jill, Jill",1,0,"jill, becky, (none), mary, sue, laura, rachel, karen, michelle, jen, maria, jane, june",0,0.1,12,17,1,Jill,Jill,JILL,,"Jill, Jill",1,0,"karen, (none), maria, sue, becky, jane, rachel, laura, mary, michelle, june, jen, jill",0,0.1,2,18,2,Jill,Jill,Jill,,"Jill, Jill",1,0,"laura, michelle, june, jane, rachel, sue, maria, (none), jill, karen, mary, becky, jen",0,0.1,1,19,2,Jill,Jill,JILL,,"Jill, Jill",1,0,"sue, maria, (none), mary, june, karen, rachel, jill, laura, jane, jen, michelle, becky",0,0.1,2,20,1,Jill,Jill,Jill,,"Jill, Jill",1,0,"(none), laura, jen, jill, maria, karen, june, rachel, jane, becky, mary, michelle, sue",0,0.1,11,21,2,Jill,Jill,jil,,"Jill, Jill",0,0,"jill, becky, (none), mary, sue, laura, rachel, karen, michelle, jen, jil, maria, jane, june",0,-0.05,4,22,1,Jill,Jill,Jill,,"Jill, Jill",1,0,"jane, sue, (none), mary, laura, michelle, maria, rachel, jill, karen, becky, jil, june, jen",0,0.1,2,23,1,Jill,Jill,Jill,,"Jill, Jill",1,0,"jill, becky, sue, mary, maria, laura, june, rachel, karen, michelle, jane, jil, jen, (none)",0,0.1,7,24,1,Jill,Jill,Jill,,"Jill, Jill",1,0,"jane, sue, (none), mary, laura, michelle, maria, rachel, jill, karen, becky, jil, june, jen",0,0.1,11,25,20,0,,0,4.76,0,1,121,u237x68m,,99.89.88.15,2017-03-15 17:01:08.362391+00:00,1,A2VO6AGSLIK072,3KB8R4ZV1E8W61HWSU4BW1VF894GBN,3KL228NDMVNVCKNX84C26KJOFS2KGW,3.25,5.25,ts44u31l,,,3J94SKDEKIQPIHS3ZR7OYAX95AR5DM,3O2Y2UIUCQVPYKR2XK6KOZJCED2KFX,337F8MIIMZEDNEN99A0JEB7CBPN04J,3KL228NDMVNVCKNX84C26KJOFS2KGW,33CY53T7YFR23AA9JZJ7YQKHNEPDHJ,36TBNKR908OQJ0J7TYB1DNN4VY1ED8,,$2.00,20,A2VO6AGSLIK072,2,0.85,1,1,1,(none),(none),Jill,,"(none), Laura",0,1,"laura, (none), jill",1,0,3,1,2,jill,jill,Jill,,"Karen, Becky",1,0,"laura, becky, (none), jill, karen",0,0.1,8,2,1,jill,jill,Jill,,"Jill, Jane",1,0,"jill, laura, jane, becky, karen, (none)",0,0.1,6,3,2,jill,jill,Jill,,"Maria, Jill",1,0,"karen, (none), maria, becky, jane, laura, jill",0,0.1,10,4,1,jill,jill,Jill,,"Rachel, Karen",1,0,"maria, (none), karen, laura, rachel, becky, jane, jill",0,0.1,1,5,1,jill,jill,Jill,,"Jill, Sue",1,0,"laura, jane, rachel, maria, (none), karen, jill, sue, becky",0,0.1,9,6,1,Jill,Jill,Jill,,"Jill, Jill",1,0,"jill, sue, becky, laura, rachel, karen, maria, jane, (none)",0,0.1,3,7,1,Jill,Jill,Jill,,"Jill, Jill",1,0,"laura, jane, rachel, maria, (none), karen, jill, sue, becky",0,0.1,9,8,2,Jill,Jill,Jill,,"Jill, Jill",1,0,"rachel, maria, jill, laura, jane, becky, karen, (none), sue",0,0.1,11,9,1,Jill,Jill,Jill,,"Jill, Jill",1,0,"rachel, maria, jill, laura, jane, becky, karen, (none), sue",0,0.1,11,10,2,Jill,Jill,Jill,,"Jill, Jill",1,0,"jill, sue, becky, laura, rachel, karen, maria, jane, (none)",0,0.1,2,11,2,Jill,Jill,Jill,,"Jill, Jill",1,0,"laura, jane, rachel, maria, (none), karen, jill, sue, becky",0,0.1,9,12,1,Jill,Jill,Jill,,"Jill, Jill",1,0,"laura, jane, rachel, maria, (none), karen, jill, sue, becky",0,0.1,5,13,2,Jill,Jill,Jill,,"Maria, Jill",1,0,"sue, (none), maria, karen, rachel, jill, laura, jane, becky",0,0.1,5,14,1,Jill,Jill,Jill,,"Jill, Jill",1,0,"sue, (none), maria, karen, rachel, jill, laura, jane, becky",0,0.1,4,15,1,Jill,Jill,Jill,,"Jill, Jill",1,0,"rachel, (none), laura, karen, maria, jane, becky, jill, sue",0,0.1,12,16,2,Jill,Jill,Jill,,"Jill, Jill",1,0,"jill, sue, becky, laura, rachel, karen, maria, jane, (none)",0,0.1,7,17,1,Jill,Jill,Jill,,"Jill, Jill",1,0,"karen, (none), maria, sue, becky, jane, rachel, laura, jill",0,0.1,9,18,2,Jill,Jill,Jill,,"Jill, Jill",1,0,"laura, jane, rachel, maria, (none), karen, jill, sue, becky",0,0.1,5,19,2,Jill,Jill,Jill,,"Jill, Jill",1,0,"sue, (none), maria, karen, rachel, jill, laura, jane, becky",0,0.1,8,20,1,jill,jill,Jill,,"Jill, Jill",1,0,"(none), laura, maria, jill, karen, rachel, jane, becky, sue",0,0.1,7,21,2,Jill,Jill,Jill,,"Jill, Jill",1,0,"jill, sue, becky, laura, rachel, karen, maria, jane, (none)",0,0.1,9,22,2,Jill,Jill,Jill,,"Jill, Jill",1,0,"jane, (none), laura, sue, maria, rachel, jill, karen, becky",0,0.1,5,23,1,Jill,Jill,Jill,,"Jill, Jill",1,0,"jill, sue, becky, laura, rachel, karen, maria, jane, (none)",0,0.1,11,24,1,Jill,Jill,Jill,,"Jill, Jill",1,0,"jane, (none), laura, sue, maria, rachel, jill, karen, becky",0,0.1,5,25,21,0,Thanks!!,0,5.25,0,1,124,sz9jfz29,,144.216.126.105,2017-03-15 17:02:40.444367+00:00,1,A21EZISIJ3JPSW,39N5ACM9HEOJVLVYXTG2Z4EHL0P9PB,337F8MIIMZEDNEN99A0JEB7CBPN04J,2.07,4.07,ts44u31l,,,3J94SKDEKIQPIHS3ZR7OYAX95AR5DM,3O2Y2UIUCQVPYKR2XK6KOZJCED2KFX,337F8MIIMZEDNEN99A0JEB7CBPN04J,3KL228NDMVNVCKNX84C26KJOFS2KGW,33CY53T7YFR23AA9JZJ7YQKHNEPDHJ,36TBNKR908OQJ0J7TYB1DNN4VY1ED8,,$2.00,21,A21EZISIJ3JPSW,14,0.72,1,1,1,(none),(none),Jen,,"Alice, (none)",0,1,"alice, (none), jen",1,0,12,1,2,Anna,Anna,Jen,,"Jane, Amy",0,0,"amy, alice, anna, jane, (none), jen",0,0,6,2,2,Jen,Jen,Jane,,"Rachel, Karen",0,0,"rachel, jane, amy, anna, alice, karen, (none), jen",0,0,1,3,1,Jane,Jane,karen,,"Rachel, Karen",0,0,"karen, (none), alice, anna, jane, rachel, jen, amy",0,0,12,4,2,Karen,Karen,karen,,"Jill, Jill",1,0,"alice, rachel, (none), karen, jane, anna, jen, jill, amy",0,0.1,5,5,2,Karen,Karen,mary,,"Mary, Becky",0,0,"amy, alice, anna, jane, rachel, (none), karen, jill, mary, becky, jen",0,-0.05,11,6,2,Jill,Jill,Maria,,"Jill, Becky",0,0,"jill, becky, mary, amy, alice, rachel, karen, anna, jen, maria, jane, (none)",0,-0.05,1,7,2,Jill,Jill,Jill,,"Jill, Jill",1,0,"amy, alice, anna, jane, rachel, maria, (none), jill, karen, mary, becky, jen",0,0.1,7,8,2,Jill,Jill,Jill,,"Jill, Jill",1,0,"rachel, mary, maria, jill, jane, amy, anna, alice, becky, karen, (none), jen",0,0.1,4,9,1,Jill,Jill,laura,,"Jill, Jill",0,0,"rachel, mary, maria, jill, laura, jane, amy, anna, alice, becky, karen, (none), jen",0,-0.05,1,10,2,Jill,Jill,Jill,,"Jill, Jill",1,0,"jill, becky, mary, amy, laura, alice, rachel, karen, anna, jen, maria, jane, (none)",0,0.1,6,11,2,Jill,Jill,Jill,,"Jill, Karen",1,0,"laura, amy, alice, anna, jane, rachel, maria, (none), jill, karen, mary, becky, jen",0,0.1,7,12,1,Jill,Jill,Jill,,"Jill, Jill",1,0,"laura, amy, alice, anna, jane, rachel, maria, (none), jill, karen, mary, becky, jen",0,0.1,2,13,2,Jill,Jill,Jill,,"Jill, Maria",1,0,"maria, (none), mary, karen, rachel, jill, laura, amy, jane, alice, jen, anna, becky",0,0.1,4,14,1,Jill,Jill,Maria,,"Jill, Jill",0,0,"maria, (none), mary, karen, rachel, jill, laura, amy, jane, alice, jen, anna, becky",0,-0.05,7,15,1,Jill,Jill,Jill,,"Jill, Jill",1,0,"alice, maria, rachel, laura, mary, karen, (none), jane, becky, jill, anna, jen, amy",0,0.1,2,16,2,Jill,Jill,jill,,"Jill, Jill",1,0,"jill, becky, mary, amy, laura, alice, rachel, karen, anna, jen, maria, jane, (none)",0,0.1,3,17,2,Jill,Jill,Jill,,"Jill, Jill",1,0,"karen, (none), amy, alice, maria, becky, anna, jane, rachel, laura, mary, jen, jill",0,0.1,7,18,1,Jill,Jill,jill,,"Jill, Jill",1,0,"laura, amy, alice, anna, jane, rachel, maria, (none), jill, karen, mary, becky, jen",0,0.1,12,19,1,Jill,Jill,Jill,,"Jill, Jill",1,0,"maria, (none), mary, karen, rachel, jill, laura, amy, jane, alice, jen, anna, becky",0,0.1,3,20,2,Jill,Jill,Jill,,"Jill, Jill",1,0,"alice, (none), laura, jen, maria, jill, amy, anna, karen, rachel, jane, becky, mary",0,0.1,8,21,1,Jill,Jill,jill,,"Jill, Jill",1,0,"jill, becky, mary, amy, laura, alice, rachel, karen, anna, jen, maria, jane, (none)",0,0.1,3,22,2,Jill',Jill',JILL,,"Jill, Jill",0,0,"jane, alice, (none), laura, mary, jill', maria, rachel, jill, karen, becky, jen, amy, anna",0,-0.05,9,23,1,Jill,Jill,Jill,,"Jill, Jill",1,0,"jill, becky, mary, amy, laura, alice, jill', rachel, karen, anna, jen, maria, jane, (none)",0,0.1,2,24,1,Jill,Jill,jill,,"Jill, Jill",1,0,"jane, alice, (none), laura, jill', mary, maria, rachel, jill, karen, becky, amy, anna, jen",0,0.1,10,25,24,0,Thanks! ,0,4.07,0,1,125,opgyki3h,,162.226.190.29,2017-03-15 17:02:41.965155+00:00,1,A0017268R9SKD8U2Y3F,3570Y55XZPKSJ9A72MIV4CTGTIMYGK,337F8MIIMZEDNEN99A0JEB7CBPN04J,1.71,3.71,ts44u31l,,,3J94SKDEKIQPIHS3ZR7OYAX95AR5DM,3O2Y2UIUCQVPYKR2XK6KOZJCED2KFX,337F8MIIMZEDNEN99A0JEB7CBPN04J,3KL228NDMVNVCKNX84C26KJOFS2KGW,33CY53T7YFR23AA9JZJ7YQKHNEPDHJ,36TBNKR908OQJ0J7TYB1DNN4VY1ED8,,$2.00,22,A0017268R9SKD8U2Y3F,5,0.71,1,1,1,Laura,Laura,(none),,"(none), (none)",0,0,"laura, (none)",0,0,10,1,1,Maria,Maria,Becky,,"Jen, Jane",0,0,"laura, jane, maria, (none), becky, jen",0,0,10,2,1,Rebecca,Rebecca,jill,,"Karen, Karen",0,0,"maria, rebecca, jill, laura, jane, becky, karen, (none), jen",0,0,2,3,1,Karen,Karen,Maria,,"Sue, Sasha",0,0,"karen, (none), maria, sue, becky, rebecca, jane, sasha, laura, jen, jill",0,0,5,4,1,Maria,Maria,Sue,,"Jen, Jen",0,0,"maria, (none), karen, laura, becky, jane, sasha, rebecca, jen, sue, jill",0,0,10,5,1,Maria,Maria,(none),,"Sue, (none)",0,0,"laura, jane, sasha, maria, (none), karen, jill, sue, becky, rebecca, jen",0,0,2,6,1,Maria,Maria,Jill,,"Jill, Jill",0,0,"sue, becky, jill, sasha, laura, karen, rebecca, jen, maria, jane, (none)",0,0,10,7,2,maria,maria,becky,,"Jill, Jill",0,0,"laura, jane, sasha, maria, (none), karen, jill, sue, becky, rebecca, jen",0,0,11,8,1,Maria,Maria,laura,,"Jill, Jill",0,0,"rebecca, maria, jill, laura, jane, sasha, becky, karen, (none), sue, jen",0,0,7,9,1,Maria,Maria,misha,,"Jill, Jill",0,0,"misha, rebecca, maria, jill, laura, jane, sasha, becky, karen, (none), sue, jen",0,0,4,10,2,Laura,Laura,Jill,,"Kristin, Jill",0,0,"jill, misha, becky, sue, laura, sasha, karen, rebecca, jen, kristin, maria, jane, (none)",0,0,7,11,1,Maria,Maria,Jill,,"Jill, Jill",0,0,"laura, kristin, misha, sasha, jane, maria, (none), jill, karen, sue, becky, rebecca, jen",0,0,12,12,1,Jill,Jill,Maria,,"Jill, Maria",0,0,"laura, kristin, misha, sasha, jane, maria, (none), jill, karen, sue, becky, rebecca, jen",0,0,7,13,2,Maria,Maria,Jill,,"Jill, Jill",0,0,"sue, kristin, maria, (none), sasha, karen, jill, laura, rebecca, jen, jane, misha, becky",0,0,6,14,1,Maria,Maria,Jill,,"Jill, Karen",0,0,"sue, kristin, maria, (none), sasha, karen, jill, laura, rebecca, jen, jane, misha, becky",0,0,12,15,1,Jill,Jill,Jill,,"Jill, Jill",1,0,"misha, maria, (none), laura, karen, becky, jane, sasha, jill, rebecca, sue, jen, kristin",0,0.1,10,16,1,jill,jill,Jill,,"Maria, Jill",1,0,"jill, misha, sue, becky, laura, sasha, karen, rebecca, jane, kristin, maria, jen, (none)",0,0.1,6,17,2,jill,jill,Jill,,"Jill, Jill",1,0,"karen, misha, (none), maria, sue, becky, rebecca, jane, sasha, laura, jen, kristin, jill",0,0.1,10,18,2,jill,jill,Jill,,"Jill, Jill",1,0,"laura, kristin, misha, sasha, jane, maria, (none), jill, karen, sue, becky, rebecca, jen",0,0.1,9,19,1,jill,jill,Jill,,"Jill, Jill",1,0,"sue, kristin, maria, (none), sasha, karen, jill, laura, rebecca, jen, jane, misha, becky",0,0.1,10,20,1,jill,jill,Jill,,"Jill, Jill",1,0,"(none), sasha, laura, rebecca, jill, jen, kristin, maria, karen, misha, becky, jane, sue",0,0.1,3,21,1,jill,jill,Jill,,"Jill, Jill",1,0,"jill, misha, sue, becky, laura, sasha, karen, rebecca, jane, kristin, maria, jen, (none)",0,0.1,12,22,2,jill,jill,Jill,,"Jill, Jill",1,0,"jane, sue, laura, kristin, rebecca, maria, (none), jill, sasha, becky, karen, misha, jen",0,0.1,3,23,1,jill,jill,Jill,,"Jill, Jill",1,0,"jill, misha, sue, becky, laura, sasha, karen, rebecca, jane, kristin, maria, jen, (none)",0,0.1,9,24,1,jill,jill,jill,,"Jill, Jill",1,0,"jane, sue, laura, kristin, rebecca, maria, (none), jill, sasha, becky, karen, misha, jen",0,0.1,8,25,25,0,FUN!!!!!!!!!!!!!!!!!!!!!!!!!!!!!!!!!!!! :),0,3.71,0,1,126,w97zt3p0,,128.154.224.118,2017-03-15 17:03:05.936251+00:00,1,A3UVW94KB9UBAJ,30LSNF239UWGEFNVZPB3GK5RTGKI2G,3J94SKDEKIQPIHS3ZR7OYAX95AR5DM,1.43,3.43,ts44u31l,,,3J94SKDEKIQPIHS3ZR7OYAX95AR5DM,3O2Y2UIUCQVPYKR2XK6KOZJCED2KFX,337F8MIIMZEDNEN99A0JEB7CBPN04J,3KL228NDMVNVCKNX84C26KJOFS2KGW,33CY53T7YFR23AA9JZJ7YQKHNEPDHJ,36TBNKR908OQJ0J7TYB1DNN4VY1ED8,,$2.00,23,A3UVW94KB9UBAJ,23,0.53,1,1,1,Lauren,Lauren,Lauren,,"Becky, (none)",1,0,"becky, (none), lauren",0,0.1,1,1,2,Becky,Becky,Maria,,"Jane, Sue",0,0,"lauren, jane, maria, (none), sue, becky",0,-0.05,10,2,1,Louisa,Louisa,Sue,,"Karen, Rachel",0,0,"rachel, maria, lauren, jane, louisa, becky, karen, (none), sue",0,-0.05,8,3,2,Maria,Maria,Karen,,"Kimberly, Rachel",0,0,"karen, (none), kimberly, maria, sue, becky, jane, rachel, louisa, lauren",0,0,5,4,2,Jessica,Jessica,Jen,,"Karen, Jill",0,0,"maria, (none), karen, rachel, louisa, lauren, jessica, becky, jane, jill, jen, sue, kimberly",0,0,9,5,2,(none),(none),Maria,,"Maria, Becky",0,1,"louisa, lauren, jane, rachel, kimberly, maria, (none), karen, jill, sue, becky, jen, jessica",1,0,2,6,2,Janice,Janice,JILL,,"Maria, Karen",0,0,"jill, becky, sue, jessica, lauren, rachel, karen, jen, janice, kimberly, maria, jane, louisa, (none)",0,0,5,7,2,Jill,Jill,Jill,,"Mary, Jill",1,0,"lauren, louisa, jane, mary, rachel, kimberly, janice, maria, jill, karen, sue, becky, (none), jen, jessica",0,0.1,12,8,1,Mary,Mary,karen,,"Jill, Jill",0,0,"mary, rachel, maria, jill, janice, kimberly, lauren, jessica, jane, louisa, becky, karen, (none), sue, jen",0,-0.05,3,9,2,Karen,Karen,Mary,,"Jill, Maria",0,0,"mary, rachel, maria, jill, janice, kimberly, lauren, jessica, jane, louisa, becky, karen, (none), sue, jen",0,-0.05,2,10,2,Kristin,Kristin,Jill,,"Jill, Jill",0,0,"jill, sue, becky, mary, (none), jessica, lauren, rachel, karen, jen, kristin, janice, maria, jane, louisa, kimberly",0,0,8,11,2,Jill,Jill,Maria,,"Jill, Jill",0,0,"kristin, lauren, louisa, jane, rachel, sue, kimberly, janice, (none), jill, karen, mary, becky, maria, jen, jessica",0,0,12,12,2,Maria,Maria,Jill,,"Jill, Jill",0,0,"kristin, lauren, louisa, jane, rachel, sue, kimberly, janice, (none), jill, karen, mary, becky, maria, jen, jessica",0,0,7,13,1,Jill,Jill,Jill,,"Jill, Jill",1,0,"sue, kristin, (none), maria, jessica, louisa, mary, karen, rachel, jill, lauren, jen, jane, janice, kimberly, becky",0,0.1,9,14,2,Jill,Jill,Maria,,"Maria, Jill",0,0,"sue, kristin, (none), maria, jessica, louisa, mary, karen, rachel, jill, lauren, jen, jane, janice, kimberly, becky",0,-0.05,12,15,1,Jill,Jill,JILL,,"Jill, Jill",1,0,"rachel, (none), jessica, mary, karen, lauren, maria, louisa, becky, jane, jill, jen, sue, kristin, kimberly, janice",0,0.1,3,16,1,Maria,Maria,JILL,,"Jill, Jill",0,0,"jill, sue, becky, mary, jessica, lauren, rachel, karen, jane, kristin, kimberly, janice, maria, jen, louisa, (none)",0,-0.05,4,17,1,Jill,Jill,jill,,"Jill, Jill",1,0,"karen, (none), kimberly, maria, jessica, sue, becky, jen, janice, rachel, jane, mary, louisa, lauren, kristin, jill",0,0.1,10,18,2,Jill,Jill,JILL,,"Jill, Jill",1,0,"kristin, lauren, louisa, jane, rachel, sue, kimberly, janice, (none), jill, karen, mary, becky, maria, jen, jessica",0,0.1,7,19,2,Jill,Jill,Jill,,"Jill, Jill",1,0,"sue, kristin, (none), maria, jessica, louisa, mary, karen, rachel, jill, lauren, jen, jane, janice, kimberly, becky",0,0.1,12,20,1,Jill,Jill,Jill,,"Jill, Jill",1,0,"(none), jessica, jen, kristin, jill, maria, janice, karen, rachel, kimberly, becky, jane, mary, lauren, louisa, sue",0,0.1,6,21,2,Jill,Jill,Jill,,"Jill, Jill",1,0,"jill, sue, becky, mary, jessica, lauren, rachel, karen, jane, kristin, kimberly, janice, maria, jen, louisa, (none)",0,0.1,10,22,2,Jill,Jill,Jill,,"Jill, Jill",1,0,"jane, jessica, louisa, sue, (none), mary, kristin, maria, kimberly, janice, rachel, jill, karen, becky, lauren, jen",0,0.1,7,23,2,Jill,Jill,Jill,,"Jill, Jill",1,0,"jill, sue, becky, mary, jessica, lauren, rachel, karen, jane, kristin, kimberly, janice, maria, jen, louisa, (none)",0,0.1,8,24,1,Jill,Jill,JILL,,"Jill, Jill",1,0,"jane, jessica, louisa, sue, (none), mary, kristin, maria, kimberly, janice, rachel, jill, karen, becky, lauren, jen",0,0.1,6,25,26,0,Thanks for letting me participate! ,0,3.43,0,1,128,h77xex53,,67.1.119.229,2017-03-15 17:03:49.474917+00:00,1,ACDX50KGPE97I,3EA3QWIZ4IWAYEH8I4VZH7EHTTXIT8,337F8MIIMZEDNEN99A0JEB7CBPN04J,2.08,4.08,ts44u31l,,,3J94SKDEKIQPIHS3ZR7OYAX95AR5DM,3O2Y2UIUCQVPYKR2XK6KOZJCED2KFX,337F8MIIMZEDNEN99A0JEB7CBPN04J,3KL228NDMVNVCKNX84C26KJOFS2KGW,33CY53T7YFR23AA9JZJ7YQKHNEPDHJ,36TBNKR908OQJ0J7TYB1DNN4VY1ED8,,$2.00,24,ACDX50KGPE97I,17,0.53,1,1,1,(none),(none),sue,,"(none), Karen",0,1,"(none), karen, sue",1,0,9,1,2,sue,sue,Sue,,"Rachel, Jen",1,0,"jen, (none), karen, rachel, sue",0,0.1,12,2,1,Sue,Sue,Becky,,"Jill, Louisa",0,0,"rachel, jill, louisa, becky, karen, (none), sue, jen",0,-0.05,9,3,2,Becky,Becky,Jill,,"Karen, Jill",0,0,"karen, (none), sue, becky, rachel, louisa, jen, jill",0,-0.05,6,4,1,Sue,Sue,Becky,,"Jen, Jill",0,0,"louisa, (none), karen, rachel, becky, jill, jen, sue",0,0,12,5,2,Becky,Becky,Karen,,"Jill, Karen",0,0,"louisa, rachel, (none), karen, jill, sue, becky, jen",0,0,4,6,2,Becky,Becky,June,,"Janice, Jill",0,0,"jill, becky, sue, rachel, karen, janice, june, jen, louisa, (none)",0,0,4,7,1,June,June,Jill,,"Jill, Jill",0,0,"louisa, june, rachel, janice, (none), karen, jill, sue, becky, jen",0,0,2,8,1,Jill,Jill,Jill,,"Karen, Jill",1,0,"rachel, jill, janice, louisa, becky, karen, june, (none), sue, jen",0,0.1,1,9,2,Jill,Jill,Jill,,"Jill, Karen",1,0,"rachel, jill, janice, louisa, becky, karen, june, (none), sue, jen",0,0.1,7,10,1,Jill,Jill,Karen,,"Jill, Mary",0,0,"jill, becky, sue, (none), mary, rachel, karen, janice, jen, louisa, june",0,-0.05,1,11,1,Jill,Jill,Jill,,"Jill, Jill",1,0,"louisa, june, rachel, sue, janice, (none), jill, karen, mary, becky, jen",0,0.1,3,12,2,Jill,Jill,Jill,,"Jill, Jill",1,0,"louisa, june, rachel, sue, janice, (none), jill, karen, mary, becky, jen",0,0.1,3,13,2,Jill,Jill,Jill,,"Jill, Jill",1,0,"sue, (none), louisa, mary, june, karen, rachel, jill, jen, janice, becky",0,0.1,12,14,1,Jill,Jill,Jill,,"Karen, Jill",1,0,"sue, (none), louisa, mary, june, karen, rachel, jill, jen, janice, becky",0,0.1,6,15,2,Jill,Jill,Jill,,"Jill, Jill",1,0,"june, rachel, (none), karen, mary, louisa, becky, jill, jen, sue, janice",0,0.1,4,16,2,Jill,Jill,Jill,,"Jill, Jill",1,0,"jill, becky, sue, mary, rachel, karen, janice, june, jen, louisa, (none)",0,0.1,2,17,2,Jill,Jill,Jill,,"Jill, Jill",1,0,"karen, (none), sue, becky, janice, rachel, mary, louisa, june, jen, jill",0,0.1,12,18,2,Jill,Jill,Jill,,"Jill, Jill",1,0,"louisa, june, rachel, sue, janice, (none), jill, karen, mary, becky, jen",0,0.1,8,19,1,Jill,Jill,Jill,,"Jill, Jill",1,0,"sue, (none), louisa, mary, june, karen, rachel, jill, jen, janice, becky",0,0.1,6,20,2,Jill,Jill,Jill,,"Jill, Jill",1,0,"(none), jen, jill, janice, karen, june, rachel, becky, mary, louisa, sue",0,0.1,4,21,2,Jill,Jill,Jill,,"Jill, Jill",1,0,"jill, becky, sue, mary, rachel, karen, janice, june, jen, louisa, (none)",0,0.1,2,22,2,Jill,Jill,Jill,,"Jill, Jill",1,0,"louisa, sue, (none), mary, janice, rachel, jill, karen, becky, june, jen",0,0.1,12,23,1,Jill,Jill,Jill,,"Jill, Jill",1,0,"jill, becky, sue, mary, rachel, karen, janice, june, jen, louisa, (none)",0,0.1,1,24,2,Jill,Jill,Jill,,"Jill, Jill",1,0,"louisa, sue, (none), mary, janice, rachel, jill, karen, becky, june, jen",0,0.1,7,25,28,0,,0,4.08,0,1,1